D2: Saturday | E2: Sunday | F2: Total
A3: T | B3: ASP | C3: MIKE JOHNSON | D3: 47.200 | E3: 45.581000000000003 | F3: =SUM(D3:E3) -> 92.781000000000006
A4: T | B4: ASP | C4: ROD MCGEORGE | D4: 47.780 | E4: 45.220 | F4: =SUM(D4:E4) -> 93.000
B5: ASP | C5: SAM STRANO | D5: 47.247999999999998 | E5: 46.195 | F5: =SUM(D5:E5) -> 93.442999999999998
B6: ASP | C6: JOEL ANDRIOLA | D6: 57.293999999999997 | E6: 56.247 | F6: =SUM(D6:E6) -> 113.541
A10: T | B10: BSP | C10: JIM ROBINSON | D10: 50.072000000000003 | E10: 50.170 | F10: =SUM(D10:E10) -> 100.242
A11: T | B11: BSP | C11: TODD WAGNER | D11: 51.190 | E11: 49.960999999999999 | F11: =SUM(D11:E11) -> 101.151
B12: BSP | C12: TONY ACKER | D12: 55.058 | E12: 53.932000000000002 | F12: =SUM(D12:E12) -> 108.990
B13: BSP | C13: DONALD STRIFLER | D13: 55.027999999999999 | E13: 54.228999999999999 | F13: =SUM(D13:E13) -> 109.25700000000001
A15: T | B15: CM | C15: DAVE CUTCHINS | D15: 46.701999999999998 | E15: 46.396999999999998 | F15: =SUM(D15:E15) -> 93.09899999999999
B16: CM | C16: RICK MARIANI | D16: 50.256999999999998 | E16: 50.250999999999998 | F16: =SUM(D16:E16) -> 100.508
A18: T | B18: CP | C18: ERIC BONNETT | D18: 54.870 | E18: 49.756999999999998 | F18: =SUM(D18:E18) -> 104.627
B19: CP | C19: BRUCE TURLINGTON | D19: 59.701000000000001 | E19: 57.160 | F19: =SUM(D19:E19) -> 116.86099999999999
A21: T | B21: CS | C21: LES BANYAS | D21: 50.948999999999998 | E21: 50.692 | F21: =SUM(D21:E21) -> 101.64099999999999
A23: T | B23: CSP | C23: AJ BELLEVILLE | D23: 50.067 | E23: 49.682000000000002 | F23: =SUM(D23:E23) -> 99.748999999999995
B24: CSP | C24: JAY CUMMING | D24: 50.082999999999998 | E24: 50.084000000000003 | F24: =SUM(D24:E24) -> 100.167
A26: T | B26: DS | C26: WES MICHAELS | D26: 54.116999999999997 | E26: 52.728000000000002 | F26: =SUM(D26:E26) -> 106.845
B27: DS | C27: MICHAEL GAINTNER | D27: 57.624000000000002 | E27: 56.777999999999999 | F27: =SUM(D27:E27) -> 114.402
A29: T | B29: DSP | C29: ALEX SHCHIPKOV | D29: 48.210999999999999 | E29: 47.634 | F29: =SUM(D29:E29) -> 95.844999999999999
A30: T | B30: DSP | C30: THOMAS BLEH | D30: 48.728999999999999 | E30: 47.476999999999997 | F30: =SUM(D30:E30) -> 96.205999999999989
A31: T | B31: DSP | C31: TERRY BAKER | D31: 48.823 | E31: 48.335999999999999 | F31: =SUM(D31:E31) -> 97.158999999999992
B32: DSP | C32: DAVID BROCHU | D32: 49.223999999999997 | E32: 48.715000000000003 | F32: =SUM(D32:E32) -> 97.938999999999993
B33: DSP | C33: DOUG KEILER | D33: 50.994999999999997 | E33: 50.073 | F33: =SUM(D33:E33) -> 101.068
B34: DSP | C34: CURTIS STAPLES | D34: 52.730 | E34: 51.613 | F34: =SUM(D34:E34) -> 104.34299999999999
B35: DSP | C35: BRYAN TRIPLETT | D35: 54.869 | E35: 53.811 | F35: =SUM(D35:E35) -> 108.680
B36: DSP | C36: DOUGLAS ARCIDINO | D36: 55.125999999999998 | E36: 55.503999999999998 | F36: =SUM(D36:E36) -> 110.630
A38: T | B38: EP | C38: JOE CECELIC | D38: 55.359000000000002 | E38: 55.860 | F38: =SUM(D38:E38) -> 111.21899999999999
A40: T | B40: ES | C40: ROBB DAVIS | D40: 51.542000000000002 | E40: 51.039000000000001 | F40: =SUM(D40:E40) -> 102.581
B41: ES | C41: FRANK INSLEY | D41: 52.558 | E41: 51.968000000000004 | F41: =SUM(D41:E41) -> 104.52600000000001
A43: T | B43: ESP | C43: BILL BROCHU | D43: 50.180999999999997 | E43: 49.411000000000001 | F43: =SUM(D43:E43) -> 99.591999999999999
A44: T | B44: ESP | C44: DALE BLANKENSHIP | D44: 51.235999999999997 | E44: 51.658000000000001 | F44: =SUM(D44:E44) -> 102.89400000000001
B45: ESP | C45: BOBBY DUNCAN | D45: 53.720999999999997 | E45: 52.357999999999997 | F45: =SUM(D45:E45) -> 106.07899999999999
B46: ESP | C46: PETER FLORANCE | D46: 55.200 | E46: 55.817 | F46: =SUM(D46:E46) -> 111.017
B47: ESP | C47: JOHN SETTLE | D47: 61.259 | E47: 56.896000000000001 | F47: =SUM(D47:E47) -> 118.155
A49: T | B49: FP | C49: MARC LISNER | D49: 50.830 | E49: 50.097000000000001 | F49: =SUM(D49:E49) -> 100.92699999999999
A51: T | B51: FS | C51: BRANDON HEY | D51: 57.328000000000003 | E51: 59.603000000000002 | F51: =SUM(D51:E51) -> 116.93100000000001
A53: T | B53: FSP | C53: ROY ARMSTRONG | D53: 51.350999999999999 | E53: 51.811 | F53: =SUM(D53:E53) -> 103.16200000000001
B54: FSP | C54: STEVE SHELL | D54: 52.667999999999999 | E54: 52.360999999999997 | F54: =SUM(D54:E54) -> 105.029
B55: FSP | C55: SCOTT FARRELL | D55: 56.076999999999998 | E55: 56.807000000000002 | F55: =SUM(D55:E55) -> 112.884
A57: T | B57: GS | C57: JIM HERLEY | D57: 55.073999999999998 | E57: 53.499000000000002 | F57: =SUM(D57:E57) -> 108.57300000000001
B58: GS | C58: JAVIER ROSA | D58: 57.436 | E58: 55.822000000000003 | F58: =SUM(D58:E58) -> 113.25800000000001
A60: T | B60: HS | C60: BOB BROCHU | D60: 53.808 | E60: 52.698 | F60: =SUM(D60:E60) -> 106.506
A62: T | B62: LAD | C62: MARIBETH CUPPS | D62: 45.996000000000002 | E62: 45.350 | F62: =SUM(D62:E62) -> 91.346000000000004
A63: T | B63: LAD | C63: LELANE ARNESON | D63: 46.093000000000004 | E63: 45.372999999999998 | F63: =SUM(D63:E63) -> 91.466000000000008
A64: T | B64: LAD | C64: MERRIE MALPASS | D64: 46.398000000000003 | E64: 46.154000000000003 | F64: =SUM(D64:E64) -> 92.552000000000007
B65: LAD | C65: KAREN ANDRIOLA | D65: 47.368000000000002 | E65: 45.360 | F65: =SUM(D65:E65) -> 92.728000000000009
B66: LAD | C66: SHERRI STRIFLER | D66: 50.116 | E66: 48.893000000000001 | F66: =SUM(D66:E66) -> 99.009
B67: LAD | C67: CANDACE CROWDER | D67: 50.643000000000001 | E67: 48.673000000000002 | F67: =SUM(D67:E67) -> 99.316000000000003
B68: LAD | C68: BARBARA ROBINSON | D68: 50.945999999999998 | E68: 48.595999999999997 | F68: =SUM(D68:E68) -> 99.542000000000002
A70: T | B70: NOV | C70: ERNIE TORRES | D70: 47.695999999999998 | E70: 46.366 | F70: =SUM(D70:E70) -> 94.061999999999998
A71: T | B71: NOV | C71: LEE WILLIAMS | D71: 48.330 | E71: 47.061 | F71: =SUM(D71:E71) -> 95.390999999999991
A72: T | B72: NOV | C72: RICHARD NELSON | D72: 48.414000000000001 | E72: 47.368000000000002 | F72: =SUM(D72:E72) -> 95.782000000000011
B73: NOV | C73: JEREMIAH MILO | D73: 47.566000000000003 | E73: 50.066000000000003 | F73: =SUM(D73:E73) -> 97.632000000000005
B74: NOV | C74: JONATHAN DIZON | D74: 49.612000000000002 | E74: 49.033000000000001 | F74: =SUM(D74:E74) -> 98.644999999999996
B75: NOV | C75: ROBERT MCBRIDE | D75: 53.537999999999997 | E75: 50.131999999999998 | F75: =SUM(D75:E75) -> 103.670
B76: NOV | C76: DAN SCIOLINO | D76: 54.826000000000001 | E76: 51.277000000000001 | F76: =SUM(D76:E76) -> 106.10300000000001
B77: NOV | C77: ART HEY | D77: 59.006 | E77: 227.65899999999999 | F77: =SUM(D77:E77) -> 286.66500000000002
A79: T | B79: SM | C79: JAMES MCIVER | D79: 50.723999999999997 | E79: 49.643000000000001 | F79: =SUM(D79:E79) -> 100.36699999999999
B80: SM | C80: GRAY MILTER | D80: 55.036000000000001 | E80: 52.910 | F80: =SUM(D80:E80) -> 107.946
B81: SM | C81: TERRY ZACH | D81: 56.627000000000002 | E81: 55.628 | F81: =SUM(D81:E81) -> 112.255
A83: T | B83: SM2 | C83: DAVE MCLAUGHLIN | D83: 53.283000000000001 | E83: 50.695999999999998 | F83: =SUM(D83:E83) -> 103.979
B84: SM2 | C84: BRUCE AUSINK | D84: 55.594000000000001 | E84: 53.030999999999999 | F84: =SUM(D84:E84) -> 108.625
A86: T | B86: SS | C86: GIL SMITH | D86: 50.052999999999997 | E86: 48.606999999999999 | F86: =SUM(D86:E86) -> 98.660
A88: T | B88: STR | C88: ALAN STRATTON | D88: 42.182000000000002 | E88: 42.103000000000002 | F88: =SUM(D88:E88) -> 84.284999999999997
A89: T | B89: STR | C89: XAVIER CALDERON | D89: 43.819000000000003 | E89: 43.491 | F89: =SUM(D89:E89) -> 87.310
A90: T | B90: STR | C90: SEAN MCCONNELL | D90: 44.37 | E90: 43.447000000000003 | F90: =SUM(D90:E90) -> 87.817000000000007
A91: T | B91: STR | C91: BERNARD CHMIELEWSKI | D91: 45.401000000000003 | E91: 44.356999999999999 | F91: =SUM(D91:E91) -> 89.75800000000001
A92: T | B92: STR | C92: JEFF JASMER | D92: 45.755000000000003 | E92: 44.826999999999998 | F92: =SUM(D92:E92) -> 90.581999999999994
B93: STR | C93: SCOTT GARDNER | D93: 45.290 | E93: 45.298999999999999 | F93: =SUM(D93:E93) -> 90.588999999999999
B94: STR | C94: ROBERT KIRKPATRICK | D94: 46.320 | E94: 44.279000000000003 | F94: =SUM(D94:E94) -> 90.599000000000004
B95: STR | C95: CLAY JOHNSON | D95: 46.103999999999999 | E95: 46.043999999999997 | F95: =SUM(D95:E95) -> 92.147999999999996
B96: STR | C96: CHRISTOPHER SAMULSKI | D96: 46.896000000000001 | E96: 45.710 | F96: =SUM(D96:E96) -> 92.605999999999995
B97: STR | C97: LAWRENCE CHAPPE | D97: 47.561 | E97: 45.841999999999999 | F97: =SUM(D97:E97) -> 93.402999999999992
B98: STR | C98: JOMMEL DEGUZMAN | D98: 48.384999999999998 | E98: 45.103000000000002 | F98: =SUM(D98:E98) -> 93.488
B99: STR | C99: SCOT MCALOON | D99: 47.760 | E99: 46.863 | F99: =SUM(D99:E99) -> 94.62299999999999
B100: STR | C100: NOAL YARNES | D100: 48.362000000000002 | E100: 46.902999999999999 | F100: =SUM(D100:E100) -> 95.265000000000001
A102: T | B102: STS | C102: JOHN CROWDER | D102: 55.790999999999997 | E102: 55.796999999999997 | F102: =SUM(D102:E102) -> 111.58799999999999
A103: T | B103: STS | C103: COREY MAPLES | D103: 56.902999999999999 | E103: 55.160 | F103: =SUM(D103:E103) -> 112.06299999999999
A104: T | B104: STS | C104: MATTHEW KNIPPLE | D104: 56.468000000000004 | E104: 56.770 | F104: =SUM(D104:E104) -> 113.238
B105: STS | C105: CARL JUNEAU | D105: 57.451999999999998 | E105: 55.991 | F105: =SUM(D105:E105) -> 113.443
B106: STS | C106: KEITH KASMIRE | D106: 57.499000000000002 | E106: 56.341000000000001 | F106: =SUM(D106:E106) -> 113.840
B107: STS | C107: KEITH MAPLES | D107: 57.993000000000002 | E107: 58.959000000000003 | F107: =SUM(D107:E107) -> 116.952
B108: STS | C108: JASPER DE GUZMAN | D108: 60.270 | E108: 60.585000000000001 | F108: =SUM(D108:E108) -> 120.855
A110: T | B110: STS2 | C110: JIM HARRIS | D110: 54.317 | E110: 54.484000000000002 | F110: =SUM(D110:E110) -> 108.801
B111: STS2 | C111: BILL EAKER | D111: 58.198999999999998 | E111: 57.609000000000002 | F111: =SUM(D111:E111) -> 115.80799999999999
A113: T | B113: STX | C113: TARIQ KHAN | D113: 60.216000000000001 | E113: 57.359000000000002 | F113: =SUM(D113:E113) -> 117.575