A1: Tidewater Sports Car Club
A2: 2010
A3: Overall Pax Points
C5: MAR | E5: APR | G5: MAY | I5: JUNE | K5: JULY | M5: SEPT | O5: OCT | Q5: NOV
A6: Pos. | B6: Driver | C6: Points | D6: Class | E6: Points | F6: Class | G6: Points | H6: Class | I6: Points | J6: Class | K6: Points | L6: Class | M6: Points | N6: Class | O6: Points | P6: Class | Q6: Points | R6: Class | T6: Total Points | U6: Best 6 of 8
A7: 1T | B7: Shawn Lambert | C7: 155 | D7: DSP | E7: 175 | F7: DSP | G7: 170 | H7: DSP | K7: 175 | L7: DSP | M7: 160 | N7: BS | O7: 150 | P7: STX | T7: =SUM(C7,E7,G7,I7,K7,M7,O7,Q7) -> 985 | U7: =IF(ISERROR(SUM(LARGE(C7:R7,{1,2,3,4,5,6}))),SUM(C7:R7),SUM(LARGE(C7:R7,{1,2,3,4,5,6}))) -> 985
A8: 2T | B8: Tom Bleh | C8: 160 | D8: DSP | E8: 115 | F8: CSP | G8: 175 | H8: DSP | K8: 170 | L8: DSP | M8: 175 | N8: DSP | O8: 175 | P8: DSP | T8: =SUM(C8,E8,G8,I8,K8,M8,O8,Q8) -> 970 | U8: =IF(ISERROR(SUM(LARGE(C8:R8,{1,2,3,4,5,6}))),SUM(C8:R8),SUM(LARGE(C8:R8,{1,2,3,4,5,6}))) -> 970
A9: 3T | B9: Terry Baker | C9: 175 | D9: FS | E9: 160 | F9: FS | G9: 155 | H9: FS | K9: 140 | L9: FS | M9: 170 | N9: FS | O9: 155 | P9: FS | T9: =SUM(C9,E9,G9,I9,K9,M9,O9,Q9) -> 955 | U9: =IF(ISERROR(SUM(LARGE(C9:R9,{1,2,3,4,5,6}))),SUM(C9:R9),SUM(LARGE(C9:R9,{1,2,3,4,5,6}))) -> 955
A10: 4T | B10: Jason Lisner | C10: 130 | D10: BP | E10: 155 | F10: BP | G10: 165 | H10: BP | I10: 175 | J10: BP | K10: 150 | L10: BP | M10: 150 | N10: BP | T10: =SUM(C10,E10,G10,I10,K10,M10,O10,Q10) -> 925 | U10: =IF(ISERROR(SUM(LARGE(C10:R10,{1,2,3,4,5,6}))),SUM(C10:R10),SUM(LARGE(C10:R10,{1,2,3,4,5,6}))) -> 925
A11: 5T | B11: Jeff Rooney | E11: 150 | F11: BS | G11: 145 | H11: BS | I11: 165 | J11: BS | K11: 155 | L11: BS | M11: 140 | N11: BS | O11: 170 | P11: BS | T11: =SUM(C11,E11,G11,I11,K11,M11,O11,Q11) -> 925 | U11: =IF(ISERROR(SUM(LARGE(C11:R11,{1,2,3,4,5,6}))),SUM(C11:R11),SUM(LARGE(C11:R11,{1,2,3,4,5,6}))) -> 925
A12: 6T | B12: Keath Marx | C12: 165 | D12: SS | E12: 170 | F12: SS | G12: 50 | H12: SS | K12: 130 | L12: SS | M12: 155 | N12: SS | O12: 165 | P12: SS | T12: =SUM(C12,E12,G12,I12,K12,M12,O12,Q12) -> 835 | U12: =IF(ISERROR(SUM(LARGE(C12:R12,{1,2,3,4,5,6}))),SUM(C12:R12),SUM(LARGE(C12:R12,{1,2,3,4,5,6}))) -> 835
A13: 7T | B13: Marc Portanova | C13: 150 | D13: SS | E13: 135 | F13: SS | G13: 90 | H13: SS | K13: 115 | L13: SS | M13: 165 | N13: SS | O13: 140 | P13: SS | T13: =SUM(C13,E13,G13,I13,K13,M13,O13,Q13) -> 795 | U13: =IF(ISERROR(SUM(LARGE(C13:R13,{1,2,3,4,5,6}))),SUM(C13:R13),SUM(LARGE(C13:R13,{1,2,3,4,5,6}))) -> 795
A14: 8T | B14: Doug Keiler | C14: 170 | D14: DSP | E14: 60 | F14: DSP | G14: 80 | H14: DSP | K14: 165 | L14: DSP | M14: 145 | N14: FS | O14: 145 | P14: FS | T14: =SUM(C14,E14,G14,I14,K14,M14,O14,Q14) -> 765 | U14: =IF(ISERROR(SUM(LARGE(C14:R14,{1,2,3,4,5,6}))),SUM(C14:R14),SUM(LARGE(C14:R14,{1,2,3,4,5,6}))) -> 765
A15: 9T | B15: Dave Brochu | C15: 100 | D15: SM | E15: 90 | F15: SM | G15: 150 | H15: DS | K15: 135 | L15: SM | M15: 130 | N15: SM | O15: 135 | P15: SM | T15: =SUM(C15,E15,G15,I15,K15,M15,O15,Q15) -> 740 | U15: =IF(ISERROR(SUM(LARGE(C15:R15,{1,2,3,4,5,6}))),SUM(C15:R15),SUM(LARGE(C15:R15,{1,2,3,4,5,6}))) -> 740
A16: 10T | B16: Neal Davis | C16: 110 | D16: SMF | E16: 120 | F16: SMF | G16: 55 | H16: STS | I16: 140 | J16: SMF | K16: 100 | L16: SMF | M16: 135 | N16: SMF | O16: 130 | P16: SMF | T16: =SUM(C16,E16,G16,I16,K16,M16,O16,Q16) -> 790 | U16: =IF(ISERROR(SUM(LARGE(C16:R16,{1,2,3,4,5,6}))),SUM(C16:R16),SUM(LARGE(C16:R16,{1,2,3,4,5,6}))) -> 735
A17: 11 | B17: Jeff Schmidt | C17: 60 | D17: CSP | E17: 100 | F17: CSP | G17: 135 | H17: CSP | I17: 155 | J17: CSP | K17: 95 | L17: CSP | M17: 105 | N17: CSP | O17: 120 | P17: CSP | T17: =SUM(C17,E17,G17,I17,K17,M17,O17,Q17) -> 770 | U17: =IF(ISERROR(SUM(LARGE(C17:R17,{1,2,3,4,5,6}))),SUM(C17:R17),SUM(LARGE(C17:R17,{1,2,3,4,5,6}))) -> 710
A18: 12 | B18: Jim Ewing | C18: 105 | D18: CSP | E18: 85 | F18: CSP | G18: 95 | H18: CSP | K18: 105 | L18: CSP | M18: 120 | N18: CSP | O18: 160 | P18: CSP | T18: =SUM(C18,E18,G18,I18,K18,M18,O18,Q18) -> 670 | U18: =IF(ISERROR(SUM(LARGE(C18:R18,{1,2,3,4,5,6}))),SUM(C18:R18),SUM(LARGE(C18:R18,{1,2,3,4,5,6}))) -> 670
A19: 13 | B19: Sebastian Strauss | C19: 140 | D19: F125 | E19: 140 | F19: F125 | G19: 160 | H19: F125 | I19: 170 | J19: F125 | T19: =SUM(C19,E19,G19,I19,K19,M19,O19,Q19) -> 610 | U19: =IF(ISERROR(SUM(LARGE(C19:R19,{1,2,3,4,5,6}))),SUM(C19:R19),SUM(LARGE(C19:R19,{1,2,3,4,5,6}))) -> 610
A20: 14 | B20: Curtis Staples | C20: 120 | D20: FS | E20: 95 | F20: FS | G20: 70 | H20: FS | K20: 80 | L20: FS | M20: 115 | N20: FS | O20: 125 | P20: FS | T20: =SUM(C20,E20,G20,I20,K20,M20,O20,Q20) -> 605 | U20: =IF(ISERROR(SUM(LARGE(C20:R20,{1,2,3,4,5,6}))),SUM(C20:R20),SUM(LARGE(C20:R20,{1,2,3,4,5,6}))) -> 605
A21: 15 | B21: James Robinson | C21: 75 | D21: CSP | E21: 65 | F21: CSP | G21: 75 | H21: CSP | I21: 145 | J21: CSP | K21: 110 | L21: CSP | M21: 110 | N21: CSP | O21: 70 | P21: CSP | T21: =SUM(C21,E21,G21,I21,K21,M21,O21,Q21) -> 650 | U21: =IF(ISERROR(SUM(LARGE(C21:R21,{1,2,3,4,5,6}))),SUM(C21:R21),SUM(LARGE(C21:R21,{1,2,3,4,5,6}))) -> 585
A22: 16 | B22: Corey Maples | E22: 125 | F22: FSP | G22: 140 | H22: FSP | I22: 135 | J22: FSP | K22: 120 | L22: FSP | T22: =SUM(C22,E22,G22,I22,K22,M22,O22,Q22) -> 520 | U22: =IF(ISERROR(SUM(LARGE(C22:R22,{1,2,3,4,5,6}))),SUM(C22:R22),SUM(LARGE(C22:R22,{1,2,3,4,5,6}))) -> 520
A23: 17 | B23: Donna Marx | E23: 105 | F23: LSS | G23: 100 | H23: LSS | K23: 85 | L23: LSS | M23: 100 | N23: LSS | O23: 115 | P23: LSS | T23: =SUM(C23,E23,G23,I23,K23,M23,O23,Q23) -> 505 | U23: =IF(ISERROR(SUM(LARGE(C23:R23,{1,2,3,4,5,6}))),SUM(C23:R23),SUM(LARGE(C23:R23,{1,2,3,4,5,6}))) -> 505
A24: 18 | B24: Jeff Chenery | E24: 145 | F24: ST | G24: 120 | H24: ST | K24: 125 | L24: ST | O24: 105 | P24: ST | T24: =SUM(C24,E24,G24,I24,K24,M24,O24,Q24) -> 495 | U24: =IF(ISERROR(SUM(LARGE(C24:R24,{1,2,3,4,5,6}))),SUM(C24:R24),SUM(LARGE(C24:R24,{1,2,3,4,5,6}))) -> 495
A25: 19 | B25: Keith Kasmire | C25: 85 | D25: STX | E25: 40 | F25: STX | I25: 95 | J25: STX | K25: 65 | L25: STX | M25: 85 | N25: STX | O25: 90 | P25: STX | T25: =SUM(C25,E25,G25,I25,K25,M25,O25,Q25) -> 460 | U25: =IF(ISERROR(SUM(LARGE(C25:R25,{1,2,3,4,5,6}))),SUM(C25:R25),SUM(LARGE(C25:R25,{1,2,3,4,5,6}))) -> 460
A26: 20 | B26: Jim Herley | C26: 80 | D26: STX | E26: 80 | F26: STX | G26: 65 | H26: STX | I26: 105 | J26: STX | M26: 50 | N26: STX | O26: 65 | P26: STX | T26: =SUM(C26,E26,G26,I26,K26,M26,O26,Q26) -> 445 | U26: =IF(ISERROR(SUM(LARGE(C26:R26,{1,2,3,4,5,6}))),SUM(C26:R26),SUM(LARGE(C26:R26,{1,2,3,4,5,6}))) -> 445
A27: 21 | B27: bILL BROCHU | E27: 130 | F27: ESP | I27: 125 | J27: ESP | K27: 45 | L27: ESP | M27: 55 | N27: ESP | O27: 85 | P27: ESP | T27: =SUM(C27,E27,G27,I27,K27,M27,O27,Q27) -> 440 | U27: =IF(ISERROR(SUM(LARGE(C27:R27,{1,2,3,4,5,6}))),SUM(C27:R27),SUM(LARGE(C27:R27,{1,2,3,4,5,6}))) -> 440
A28: 22 | B28: Ed Raymundo | C28: 145 | D28: ES | E28: 165 | F28: ES | O28: 110 | P28: ASP | T28: =SUM(C28,E28,G28,I28,K28,M28,O28,Q28) -> 420 | U28: =IF(ISERROR(SUM(LARGE(C28:R28,{1,2,3,4,5,6}))),SUM(C28:R28),SUM(LARGE(C28:R28,{1,2,3,4,5,6}))) -> 420
A29: 23 | B29: Jim Setzer | C29: 45 | D29: CSP | E29: 70 | F29: CSP | G29: 110 | H29: CSP | I29: 150 | J29: CSP | K29: 40 | L29: CSP | M29: 5 | N29: BSP | T29: =SUM(C29,E29,G29,I29,K29,M29,O29,Q29) -> 420 | U29: =IF(ISERROR(SUM(LARGE(C29:R29,{1,2,3,4,5,6}))),SUM(C29:R29),SUM(LARGE(C29:R29,{1,2,3,4,5,6}))) -> 420
A30: 24 | B30: Michael Schnekser | C30: 70 | D30: STX | E30: 75 | F30: STX | G30: 60 | H30: STX | I30: 100 | J30: STX | K30: 60 | L30: STX | M30: 45 | N30: STX | O30: 55 | P30: STX | T30: =SUM(C30,E30,G30,I30,K30,M30,O30,Q30) -> 465 | U30: =IF(ISERROR(SUM(LARGE(C30:R30,{1,2,3,4,5,6}))),SUM(C30:R30),SUM(LARGE(C30:R30,{1,2,3,4,5,6}))) -> 420
A31: 25 | B31: Keith Maples | C31: 50 | D31: FSP | E31: 5 | F31: FSP | G31: 25 | H31: FSP | I31: 130 | J31: FSP | K31: 75 | L31: FSP | M31: 40 | N31: FSP | O31: 95 | P31: FSP | T31: =SUM(C31,E31,G31,I31,K31,M31,O31,Q31) -> 420 | U31: =IF(ISERROR(SUM(LARGE(C31:R31,{1,2,3,4,5,6}))),SUM(C31:R31),SUM(LARGE(C31:R31,{1,2,3,4,5,6}))) -> 415
A32: 26 | B32: Bobby Smith | C32: 95 | D32: SSM | E32: 5 | F32: SSM | G32: 15 | H32: SSM | I32: 115 | J32: SSM | K32: 50 | L32: SSM | M32: 80 | N32: SSM | O32: 15 | P32: SSM | T32: =SUM(C32,E32,G32,I32,K32,M32,O32,Q32) -> 375 | U32: =IF(ISERROR(SUM(LARGE(C32:R32,{1,2,3,4,5,6}))),SUM(C32:R32),SUM(LARGE(C32:R32,{1,2,3,4,5,6}))) -> 370
A33: 27 | B33: Andy Turnbull | E33: 110 | F33: STU | G33: 85 | H33: STU | I33: 160 | J33: STU | T33: =SUM(C33,E33,G33,I33,K33,M33,O33,Q33) -> 355 | U33: =IF(ISERROR(SUM(LARGE(C33:R33,{1,2,3,4,5,6}))),SUM(C33:R33),SUM(LARGE(C33:R33,{1,2,3,4,5,6}))) -> 355
A34: 28 | B34: David Martin | C34: 115 | D34: STX | M34: 95 | N34: STX | O34: 100 | P34: STX | T34: =SUM(C34,E34,G34,I34,K34,M34,O34,Q34) -> 310 | U34: =IF(ISERROR(SUM(LARGE(C34:R34,{1,2,3,4,5,6}))),SUM(C34:R34),SUM(LARGE(C34:R34,{1,2,3,4,5,6}))) -> 310
A35: 29 | B35: Mills Robinson | C35: 90 | D35: ESP | E35: 45 | F35: ESP | G35: 45 | H35: ESP | I35: 90 | J35: ESP | K35: 35 | L35: ESP | M35: 5 | N35: ESP | T35: =SUM(C35,E35,G35,I35,K35,M35,O35,Q35) -> 310 | U35: =IF(ISERROR(SUM(LARGE(C35:R35,{1,2,3,4,5,6}))),SUM(C35:R35),SUM(LARGE(C35:R35,{1,2,3,4,5,6}))) -> 310
A36: 30 | B36: David Skittlethorp | I36: 85 | J36: F125 | K36: 70 | L36: F125 | M36: 90 | N36: F125 | O36: 60 | P36: F125 | T36: =SUM(C36,E36,G36,I36,K36,M36,O36,Q36) -> 305 | U36: =IF(ISERROR(SUM(LARGE(C36:R36,{1,2,3,4,5,6}))),SUM(C36:R36),SUM(LARGE(C36:R36,{1,2,3,4,5,6}))) -> 305
A37: 31 | B37: Steve Shell | C37: 65 | D37: FSP | E37: 55 | F37: FSP | G37: 105 | H37: FSP | I37: 5 | J37: FSP | M37: 35 | N37: FSP | T37: =SUM(C37,E37,G37,I37,K37,M37,O37,Q37) -> 265 | U37: =IF(ISERROR(SUM(LARGE(C37:R37,{1,2,3,4,5,6}))),SUM(C37:R37),SUM(LARGE(C37:R37,{1,2,3,4,5,6}))) -> 265
A38: 32 | B38: Stan Vann | C38: 135 | D38: CM | G38: 125 | H38: CM | T38: =SUM(C38,E38,G38,I38,K38,M38,O38,Q38) -> 260 | U38: =IF(ISERROR(SUM(LARGE(C38:R38,{1,2,3,4,5,6}))),SUM(C38:R38),SUM(LARGE(C38:R38,{1,2,3,4,5,6}))) -> 260
A39: 33 | B39: Angela Wood | C39: 25 | D39: LSMF | E39: 30 | F39: LSMF | I39: 80 | J39: LSMF | K39: 15 | L39: LSMF | M39: 75 | N39: LSMF | O39: 5 | P39: LSMF | T39: =SUM(C39,E39,G39,I39,K39,M39,O39,Q39) -> 230 | U39: =IF(ISERROR(SUM(LARGE(C39:R39,{1,2,3,4,5,6}))),SUM(C39:R39),SUM(LARGE(C39:R39,{1,2,3,4,5,6}))) -> 230
A40: 34 | B40: Dan Adams | G40: 5 | H40: NBSP | I40: 120 | J40: NBSP | K40: 30 | L40: NBSP | M40: 60 | N40: NBSP | T40: =SUM(C40,E40,G40,I40,K40,M40,O40,Q40) -> 215 | U40: =IF(ISERROR(SUM(LARGE(C40:R40,{1,2,3,4,5,6}))),SUM(C40:R40),SUM(LARGE(C40:R40,{1,2,3,4,5,6}))) -> 215
A41: 35 | B41: Russ Parham | C41: 35 | D41: STS | E41: 5 | F41: ST | G41: 5 | H41: STS | I41: 110 | J41: STS | K41: 25 | L41: STS | M41: 30 | N41: STS | T41: =SUM(C41,E41,G41,I41,K41,M41,O41,Q41) -> 210 | U41: =IF(ISERROR(SUM(LARGE(C41:R41,{1,2,3,4,5,6}))),SUM(C41:R41),SUM(LARGE(C41:R41,{1,2,3,4,5,6}))) -> 210
A42: 36 | B42: Cameron Mccormick | C42: 40 | D42: GS | E42: 50 | F42: GS | I42: 5 | J42: GS | M42: 70 | N42: GS | O42: 20 | P42: GS | T42: =SUM(C42,E42,G42,I42,K42,M42,O42,Q42) -> 185 | U42: =IF(ISERROR(SUM(LARGE(C42:R42,{1,2,3,4,5,6}))),SUM(C42:R42),SUM(LARGE(C42:R42,{1,2,3,4,5,6}))) -> 185
A43: 37 | B43: Jadrice Toussiant | K43: 160 | L43: BS | T43: =SUM(C43,E43,G43,I43,K43,M43,O43,Q43) -> 160 | U43: =IF(ISERROR(SUM(LARGE(C43:R43,{1,2,3,4,5,6}))),SUM(C43:R43),SUM(LARGE(C43:R43,{1,2,3,4,5,6}))) -> 160
A44: 38 | B44: Andrew Monn | C44: 5 | D44: ST | E44: 5 | F44: ST | G44: 5 | H44: ST | I44: 5 | J44: ESP | K44: 5 | L44: CSP | M44: 125 | N44: STX | O44: 5 | P44: ST | T44: =SUM(C44,E44,G44,I44,K44,M44,O44,Q44) -> 155 | U44: =IF(ISERROR(SUM(LARGE(C44:R44,{1,2,3,4,5,6}))),SUM(C44:R44),SUM(LARGE(C44:R44,{1,2,3,4,5,6}))) -> 150
A45: 39 | B45: John Nwangu | K45: 145 | L45: BS | T45: =SUM(C45,E45,G45,I45,K45,M45,O45,Q45) -> 145 | U45: =IF(ISERROR(SUM(LARGE(C45:R45,{1,2,3,4,5,6}))),SUM(C45:R45),SUM(LARGE(C45:R45,{1,2,3,4,5,6}))) -> 145
A46: 40 | B46: Peter Florance | C46: 20 | D46: ESP | E46: 5 | F46: ESP | G46: 5 | H46: ESP | I46: 45 | J46: ESP | K46: 5 | L46: ESP | M46: 65 | N46: DSP | O46: 5 | P46: ESP | T46: =SUM(C46,E46,G46,I46,K46,M46,O46,Q46) -> 150 | U46: =IF(ISERROR(SUM(LARGE(C46:R46,{1,2,3,4,5,6}))),SUM(C46:R46),SUM(LARGE(C46:R46,{1,2,3,4,5,6}))) -> 145
A47: 41 | B47: Andrew Richard | C47: 15 | D47: CSP | E47: 5 | F47: CSP | G47: 5 | H47: STR | I47: 55 | J47: STR | M47: 15 | N47: STR | O47: 40 | P47: STR | T47: =SUM(C47,E47,G47,I47,K47,M47,O47,Q47) -> 135 | U47: =IF(ISERROR(SUM(LARGE(C47:R47,{1,2,3,4,5,6}))),SUM(C47:R47),SUM(LARGE(C47:R47,{1,2,3,4,5,6}))) -> 135
A48: 42 | B48: Rick Carson | G48: 130 | H48: ST | T48: =SUM(C48,E48,G48,I48,K48,M48,O48,Q48) -> 130 | U48: =IF(ISERROR(SUM(LARGE(C48:R48,{1,2,3,4,5,6}))),SUM(C48:R48),SUM(LARGE(C48:R48,{1,2,3,4,5,6}))) -> 130
A49: 43 | B49: Stephen Fehr | C49: 5 | D49: XBS | G49: 30 | H49: XBS | I49: 70 | J49: XBS | K49: 20 | L49: XBS | O49: 5 | P49: XBS | T49: =SUM(C49,E49,G49,I49,K49,M49,O49,Q49) -> 130 | U49: =IF(ISERROR(SUM(LARGE(C49:R49,{1,2,3,4,5,6}))),SUM(C49:R49),SUM(LARGE(C49:R49,{1,2,3,4,5,6}))) -> 130
A50: 44 | B50: Audie Chenery | E50: 35 | F50: LST | G50: 10 | H50: LST | K50: 55 | L50: LST | O50: 25 | P50: LST | T50: =SUM(C50,E50,G50,I50,K50,M50,O50,Q50) -> 125 | U50: =IF(ISERROR(SUM(LARGE(C50:R50,{1,2,3,4,5,6}))),SUM(C50:R50),SUM(LARGE(C50:R50,{1,2,3,4,5,6}))) -> 125
A51: 45 | B51: Robb Davis | C51: 125 | D51: CS | T51: =SUM(C51,E51,G51,I51,K51,M51,O51,Q51) -> 125 | U51: =IF(ISERROR(SUM(LARGE(C51:R51,{1,2,3,4,5,6}))),SUM(C51:R51),SUM(LARGE(C51:R51,{1,2,3,4,5,6}))) -> 125
A52: 46 | B52: Marc Lisner | C52: 30 | D52: FP | G52: 5 | H52: FP | I52: 75 | J52: FP | M52: 5 | N52: FP | O52: 5 | P52: FP | T52: =SUM(C52,E52,G52,I52,K52,M52,O52,Q52) -> 120 | U52: =IF(ISERROR(SUM(LARGE(C52:R52,{1,2,3,4,5,6}))),SUM(C52:R52),SUM(LARGE(C52:R52,{1,2,3,4,5,6}))) -> 120
A53: 47 | B53: Joe Cecelic | C53: 5 | D53: DP | E53: 5 | F53: DP | G53: 5 | H53: DP | I53: 65 | J53: DP | K53: 5 | L53: DP | M53: 5 | N53: DP | T53: =SUM(C53,E53,G53,I53,K53,M53,O53,Q53) -> 90 | U53: =IF(ISERROR(SUM(LARGE(C53:R53,{1,2,3,4,5,6}))),SUM(C53:R53),SUM(LARGE(C53:R53,{1,2,3,4,5,6}))) -> 90
A54: 48 | B54: Roger Garrett | K54: 90 | L54: ASP | T54: =SUM(C54,E54,G54,I54,K54,M54,O54,Q54) -> 90 | U54: =IF(ISERROR(SUM(LARGE(C54:R54,{1,2,3,4,5,6}))),SUM(C54:R54),SUM(LARGE(C54:R54,{1,2,3,4,5,6}))) -> 90
A55: 49 | B55: Wes Michaels | C55: 55 | D55: DS | E55: 5 | F55: DS | G55: 5 | H55: DS | M55: 25 | N55: DS | T55: =SUM(C55,E55,G55,I55,K55,M55,O55,Q55) -> 90 | U55: =IF(ISERROR(SUM(LARGE(C55:R55,{1,2,3,4,5,6}))),SUM(C55:R55),SUM(LARGE(C55:R55,{1,2,3,4,5,6}))) -> 90
A56: 50 | B56: Becky Schnekser | C56: 5 | D56: LSTX | E56: 20 | F56: LSTX | G56: 5 | H56: LSTX | I56: 40 | J56: LSTX | K56: 5 | L56: LSTX | M56: 5 | N56: LSTX | O56: 10 | P56: LSTX | T56: =SUM(C56,E56,G56,I56,K56,M56,O56,Q56) -> 90 | U56: =IF(ISERROR(SUM(LARGE(C56:R56,{1,2,3,4,5,6}))),SUM(C56:R56),SUM(LARGE(C56:R56,{1,2,3,4,5,6}))) -> 85
A57: 51 | B57: David Cooke | C57: 10 | D57: STX | E57: 5 | F57: STX | G57: 5 | H57: STX | I57: 60 | J57: STX | M57: 5 | N57: STX | T57: =SUM(C57,E57,G57,I57,K57,M57,O57,Q57) -> 85 | U57: =IF(ISERROR(SUM(LARGE(C57:R57,{1,2,3,4,5,6}))),SUM(C57:R57),SUM(LARGE(C57:R57,{1,2,3,4,5,6}))) -> 85
A58: 52 | B58: John Willemin | O58: 80 | P58: STX | T58: =SUM(C58,E58,G58,I58,K58,M58,O58,Q58) -> 80 | U58: =IF(ISERROR(SUM(LARGE(C58:R58,{1,2,3,4,5,6}))),SUM(C58:R58),SUM(LARGE(C58:R58,{1,2,3,4,5,6}))) -> 80
A59: 53 | B59: Travis Finlay | O59: 75 | P59: STX | T59: =SUM(C59,E59,G59,I59,K59,M59,O59,Q59) -> 75 | U59: =IF(ISERROR(SUM(LARGE(C59:R59,{1,2,3,4,5,6}))),SUM(C59:R59),SUM(LARGE(C59:R59,{1,2,3,4,5,6}))) -> 75
A60: 54 | B60: Michael Gaintner | E60: 10 | F60: STX | G60: 5 | H60: STX | I60: 50 | J60: STX | T60: =SUM(C60,E60,G60,I60,K60,M60,O60,Q60) -> 65 | U60: =IF(ISERROR(SUM(LARGE(C60:R60,{1,2,3,4,5,6}))),SUM(C60:R60),SUM(LARGE(C60:R60,{1,2,3,4,5,6}))) -> 65
A61: 55 | B61: Michael Stryer | E61: 25 | F61: STX | G61: 5 | H61: STX | I61: 30 | J61: STX | T61: =SUM(C61,E61,G61,I61,K61,M61,O61,Q61) -> 60 | U61: =IF(ISERROR(SUM(LARGE(C61:R61,{1,2,3,4,5,6}))),SUM(C61:R61),SUM(LARGE(C61:R61,{1,2,3,4,5,6}))) -> 60
A62: 56 | B62: David Sowers | C62: 5 | D62: BS | E62: 5 | F62: BS | G62: 5 | H62: BS | I62: 25 | J62: BS | K62: 5 | L62: BS | M62: 5 | N62: BS | O62: 5 | P62: BS | T62: =SUM(C62,E62,G62,I62,K62,M62,O62,Q62) -> 55 | U62: =IF(ISERROR(SUM(LARGE(C62:R62,{1,2,3,4,5,6}))),SUM(C62:R62),SUM(LARGE(C62:R62,{1,2,3,4,5,6}))) -> 50
A63: 57 | B63: Larry Allamong | E63: 5 | F63: CM | K63: 10 | L63: CM | O63: 35 | P63: CM | T63: =SUM(C63,E63,G63,I63,K63,M63,O63,Q63) -> 50 | U63: =IF(ISERROR(SUM(LARGE(C63:R63,{1,2,3,4,5,6}))),SUM(C63:R63),SUM(LARGE(C63:R63,{1,2,3,4,5,6}))) -> 50
A64: 58 | B64: Lynn Combs | O64: 50 | P64: CSP | T64: =SUM(C64,E64,G64,I64,K64,M64,O64,Q64) -> 50 | U64: =IF(ISERROR(SUM(LARGE(C64:R64,{1,2,3,4,5,6}))),SUM(C64:R64),SUM(LARGE(C64:R64,{1,2,3,4,5,6}))) -> 50
A65: 59 | B65: STEVE DASHER | E65: 15 | F65: DS | G65: 35 | H65: DS | T65: =SUM(C65,E65,G65,I65,K65,M65,O65,Q65) -> 50 | U65: =IF(ISERROR(SUM(LARGE(C65:R65,{1,2,3,4,5,6}))),SUM(C65:R65),SUM(LARGE(C65:R65,{1,2,3,4,5,6}))) -> 50
A66: 60 | B66: Andrew Kristensen | I66: 35 | J66: NSTU | K66: 5 | L66: BS | O66: 5 | P66: NSTU | T66: =SUM(C66,E66,G66,I66,K66,M66,O66,Q66) -> 45 | U66: =IF(ISERROR(SUM(LARGE(C66:R66,{1,2,3,4,5,6}))),SUM(C66:R66),SUM(LARGE(C66:R66,{1,2,3,4,5,6}))) -> 45
A67: 61 | B67: Dave Cutchins | C67: 5 | D67: BM | G67: 40 | H67: BM | T67: =SUM(C67,E67,G67,I67,K67,M67,O67,Q67) -> 45 | U67: =IF(ISERROR(SUM(LARGE(C67:R67,{1,2,3,4,5,6}))),SUM(C67:R67),SUM(LARGE(C67:R67,{1,2,3,4,5,6}))) -> 45
A68: 62 | B68: Robert Harrison | O68: 45 | P68: SS | T68: =SUM(C68,E68,G68,I68,K68,M68,O68,Q68) -> 45 | U68: =IF(ISERROR(SUM(LARGE(C68:R68,{1,2,3,4,5,6}))),SUM(C68:R68),SUM(LARGE(C68:R68,{1,2,3,4,5,6}))) -> 45
A69: 63 | B69: David Mclaughlin | C69: 5 | D69: SSM | E69: 5 | F69: SSM | G69: 5 | H69: SSM | I69: 15 | J69: SSM | M69: 5 | N69: SSM | T69: =SUM(C69,E69,G69,I69,K69,M69,O69,Q69) -> 35 | U69: =IF(ISERROR(SUM(LARGE(C69:R69,{1,2,3,4,5,6}))),SUM(C69:R69),SUM(LARGE(C69:R69,{1,2,3,4,5,6}))) -> 35
A70: 64 | B70: Clayton Johnson | C70: 5 | D70: CSP | G70: 5 | H70: CSP | I70: 5 | J70: CSP | K70: 5 | L70: CSP | M70: 5 | N70: CSP | O70: 5 | P70: CSP | T70: =SUM(C70,E70,G70,I70,K70,M70,O70,Q70) -> 30 | U70: =IF(ISERROR(SUM(LARGE(C70:R70,{1,2,3,4,5,6}))),SUM(C70:R70),SUM(LARGE(C70:R70,{1,2,3,4,5,6}))) -> 30
A71: 65 | B71: Doug Schmidt | C71: 5 | D71: CSP | E71: 5 | F71: CSP | G71: 5 | H71: CSP | I71: 5 | J71: CSP | K71: 5 | L71: CSP | M71: 5 | N71: CSP | O71: 5 | P71: CSP | T71: =SUM(C71,E71,G71,I71,K71,M71,O71,Q71) -> 35 | U71: =IF(ISERROR(SUM(LARGE(C71:R71,{1,2,3,4,5,6}))),SUM(C71:R71),SUM(LARGE(C71:R71,{1,2,3,4,5,6}))) -> 30
A72: 66 | B72: Greg Worcester | C72: 5 | D72: XFSP | E72: 5 | F72: XFSP | G72: 5 | H72: XFSP | I72: 5 | J72: XFSP | K72: 5 | L72: XFSP | M72: 5 | N72: XFSP | O72: 5 | P72: XFSP | T72: =SUM(C72,E72,G72,I72,K72,M72,O72,Q72) -> 35 | U72: =IF(ISERROR(SUM(LARGE(C72:R72,{1,2,3,4,5,6}))),SUM(C72:R72),SUM(LARGE(C72:R72,{1,2,3,4,5,6}))) -> 30
A73: 67 | B73: Gregory Smith | E73: 5 | F73: BSP | G73: 5 | H73: BSP | I73: 5 | J73: BSP | K73: 5 | L73: BSP | M73: 5 | N73: BSP | O73: 5 | P73: BSP | T73: =SUM(C73,E73,G73,I73,K73,M73,O73,Q73) -> 30 | U73: =IF(ISERROR(SUM(LARGE(C73:R73,{1,2,3,4,5,6}))),SUM(C73:R73),SUM(LARGE(C73:R73,{1,2,3,4,5,6}))) -> 30
A74: 68 | B74: Melissa Fehr | C74: 5 | D74: LBS | E74: 5 | F74: LBS | G74: 5 | H74: LBS | I74: 5 | J74: LBS | K74: 5 | L74: LBS | O74: 5 | P74: LBS | T74: =SUM(C74,E74,G74,I74,K74,M74,O74,Q74) -> 30 | U74: =IF(ISERROR(SUM(LARGE(C74:R74,{1,2,3,4,5,6}))),SUM(C74:R74),SUM(LARGE(C74:R74,{1,2,3,4,5,6}))) -> 30
A75: 69 | B75: Ray Schumin | O75: 30 | P75: CSP | T75: =SUM(C75,E75,G75,I75,K75,M75,O75,Q75) -> 30 | U75: =IF(ISERROR(SUM(LARGE(C75:R75,{1,2,3,4,5,6}))),SUM(C75:R75),SUM(LARGE(C75:R75,{1,2,3,4,5,6}))) -> 30
A76: 70 | B76: Andria Wood | C76: 5 | D76: FJA | E76: 5 | F76: FJA | I76: 5 | J76: FJA | M76: 5 | N76: FJA | O76: 5 | P76: FJA | T76: =SUM(C76,E76,G76,I76,K76,M76,O76,Q76) -> 25 | U76: =IF(ISERROR(SUM(LARGE(C76:R76,{1,2,3,4,5,6}))),SUM(C76:R76),SUM(LARGE(C76:R76,{1,2,3,4,5,6}))) -> 25
A77: 71 | B77: Brian Conway | C77: 5 | D77: NSS | E77: 5 | F77: NSS | G77: 5 | H77: NSS | I77: 5 | J77: NSS | O77: 5 | P77: NSS | T77: =SUM(C77,E77,G77,I77,K77,M77,O77,Q77) -> 25 | U77: =IF(ISERROR(SUM(LARGE(C77:R77,{1,2,3,4,5,6}))),SUM(C77:R77),SUM(LARGE(C77:R77,{1,2,3,4,5,6}))) -> 25
A78: 72 | B78: Ernest Forni | G78: 5 | H78: XESP | I78: 5 | J78: NCS | K78: 5 | L78: NCS | M78: 5 | N78: NCS | O78: 5 | P78: NCS | T78: =SUM(C78,E78,G78,I78,K78,M78,O78,Q78) -> 25 | U78: =IF(ISERROR(SUM(LARGE(C78:R78,{1,2,3,4,5,6}))),SUM(C78:R78),SUM(LARGE(C78:R78,{1,2,3,4,5,6}))) -> 25
A79: 73 | B79: James Rodatus | E79: 5 | F79: XBS | G79: 5 | H79: XBS | K79: 5 | L79: XBS | M79: 5 | N79: XBS | O79: 5 | P79: XBS | T79: =SUM(C79,E79,G79,I79,K79,M79,O79,Q79) -> 25 | U79: =IF(ISERROR(SUM(LARGE(C79:R79,{1,2,3,4,5,6}))),SUM(C79:R79),SUM(LARGE(C79:R79,{1,2,3,4,5,6}))) -> 25
A80: 74 | B80: John Meyer | C80: 5 | D80: NSM | E80: 5 | F80: NXP | K80: 5 | L80: NXP | M80: 5 | N80: NXP | O80: 5 | P80: NXP | T80: =SUM(C80,E80,G80,I80,K80,M80,O80,Q80) -> 25 | U80: =IF(ISERROR(SUM(LARGE(C80:R80,{1,2,3,4,5,6}))),SUM(C80:R80),SUM(LARGE(C80:R80,{1,2,3,4,5,6}))) -> 25
A81: 75 | B81: John Settle | C81: 5 | D81: CP | E81: 5 | F81: CP | G81: 5 | H81: CP | I81: 5 | J81: CP | O81: 5 | P81: CP | T81: =SUM(C81,E81,G81,I81,K81,M81,O81,Q81) -> 25 | U81: =IF(ISERROR(SUM(LARGE(C81:R81,{1,2,3,4,5,6}))),SUM(C81:R81),SUM(LARGE(C81:R81,{1,2,3,4,5,6}))) -> 25
A82: 76 | B82: Johnny Nowell | E82: 5 | F82: NSTR | G82: 5 | H82: NSTR | I82: 5 | J82: NSTR | M82: 5 | N82: NSTR | O82: 5 | P82: NSTR | T82: =SUM(C82,E82,G82,I82,K82,M82,O82,Q82) -> 25 | U82: =IF(ISERROR(SUM(LARGE(C82:R82,{1,2,3,4,5,6}))),SUM(C82:R82),SUM(LARGE(C82:R82,{1,2,3,4,5,6}))) -> 25
A83: 77 | B83: Kali Parham | C83: 5 | D83: FJA | E83: 5 | F83: FJA | G83: 5 | H83: FJA | I83: 5 | J83: FJA | M83: 5 | N83: FJA | T83: =SUM(C83,E83,G83,I83,K83,M83,O83,Q83) -> 25 | U83: =IF(ISERROR(SUM(LARGE(C83:R83,{1,2,3,4,5,6}))),SUM(C83:R83),SUM(LARGE(C83:R83,{1,2,3,4,5,6}))) -> 25
A84: 78 | B84: Kathy Demarco | C84: 5 | D84: LES | E84: 5 | F84: LES | G84: 5 | H84: NES | I84: 5 | J84: NESP | M84: 5 | N84: LES | T84: =SUM(C84,E84,G84,I84,K84,M84,O84,Q84) -> 25 | U84: =IF(ISERROR(SUM(LARGE(C84:R84,{1,2,3,4,5,6}))),SUM(C84:R84),SUM(LARGE(C84:R84,{1,2,3,4,5,6}))) -> 25
A85: 79 | B85: Mark Haag | I85: 20 | J85: XP | K85: 5 | L85: XP | T85: =SUM(C85,E85,G85,I85,K85,M85,O85,Q85) -> 25 | U85: =IF(ISERROR(SUM(LARGE(C85:R85,{1,2,3,4,5,6}))),SUM(C85:R85),SUM(LARGE(C85:R85,{1,2,3,4,5,6}))) -> 25
A86: 80 | B86: Neil Lumagui | C86: 5 | D86: XCS | E86: 5 | F86: XCS | G86: 5 | H86: XBS | K86: 5 | L86: XBS | M86: 5 | N86: XBS | T86: =SUM(C86,E86,G86,I86,K86,M86,O86,Q86) -> 25 | U86: =IF(ISERROR(SUM(LARGE(C86:R86,{1,2,3,4,5,6}))),SUM(C86:R86),SUM(LARGE(C86:R86,{1,2,3,4,5,6}))) -> 25
A87: 81 | B87: Scott McGuirt | C87: 5 | D87: NSTX | E87: 5 | F87: NSTX | G87: 5 | H87: NSTX | I87: 5 | J87: NSTX | O87: 5 | P87: STX | T87: =SUM(C87,E87,G87,I87,K87,M87,O87,Q87) -> 25 | U87: =IF(ISERROR(SUM(LARGE(C87:R87,{1,2,3,4,5,6}))),SUM(C87:R87),SUM(LARGE(C87:R87,{1,2,3,4,5,6}))) -> 25
A88: 82 | B88: Timothy Gould | C88: 5 | D88: XBSP | E88: 5 | F88: XBSP | G88: 5 | H88: XBSP | K88: 5 | L88: XBSP | M88: 5 | N88: XBSP | T88: =SUM(C88,E88,G88,I88,K88,M88,O88,Q88) -> 25 | U88: =IF(ISERROR(SUM(LARGE(C88:R88,{1,2,3,4,5,6}))),SUM(C88:R88),SUM(LARGE(C88:R88,{1,2,3,4,5,6}))) -> 25
A89: 83 | B89: Andrew Chisholm | C89: 5 | D89: BSP | E89: 5 | F89: BSP | G89: 5 | H89: BSP | O89: 5 | P89: BSP | T89: =SUM(C89,E89,G89,I89,K89,M89,O89,Q89) -> 20 | U89: =IF(ISERROR(SUM(LARGE(C89:R89,{1,2,3,4,5,6}))),SUM(C89:R89),SUM(LARGE(C89:R89,{1,2,3,4,5,6}))) -> 20
A90: 84 | B90: Brad Anderson | E90: 5 | F90: NDS | G90: 5 | H90: NDS | K90: 5 | L90: NDSP | O90: 5 | P90: DSP | T90: =SUM(C90,E90,G90,I90,K90,M90,O90,Q90) -> 20 | U90: =IF(ISERROR(SUM(LARGE(C90:R90,{1,2,3,4,5,6}))),SUM(C90:R90),SUM(LARGE(C90:R90,{1,2,3,4,5,6}))) -> 20
A91: 85 | B91: Bryant Cambronero | G91: 20 | H91: XBS | T91: =SUM(C91,E91,G91,I91,K91,M91,O91,Q91) -> 20 | U91: =IF(ISERROR(SUM(LARGE(C91:R91,{1,2,3,4,5,6}))),SUM(C91:R91),SUM(LARGE(C91:R91,{1,2,3,4,5,6}))) -> 20
A92: 86 | B92: Calvin Jilek | C92: 5 | D92: ESP | E92: 5 | F92: BS | G92: 5 | H92: BS | M92: 5 | N92: ESP | T92: =SUM(C92,E92,G92,I92,K92,M92,O92,Q92) -> 20 | U92: =IF(ISERROR(SUM(LARGE(C92:R92,{1,2,3,4,5,6}))),SUM(C92:R92),SUM(LARGE(C92:R92,{1,2,3,4,5,6}))) -> 20
A93: 87 | B93: Christopher Bracey | E93: 5 | F93: XESP | I93: 5 | J93: ESP | M93: 5 | N93: XESP | O93: 5 | P93: CSP | T93: =SUM(C93,E93,G93,I93,K93,M93,O93,Q93) -> 20 | U93: =IF(ISERROR(SUM(LARGE(C93:R93,{1,2,3,4,5,6}))),SUM(C93:R93),SUM(LARGE(C93:R93,{1,2,3,4,5,6}))) -> 20
A94: 88 | B94: Hansford Ramsey | C94: 5 | D94: NCSP | E94: 5 | F94: NCSP | G94: 5 | H94: BS | K94: 5 | L94: CSP | T94: =SUM(C94,E94,G94,I94,K94,M94,O94,Q94) -> 20 | U94: =IF(ISERROR(SUM(LARGE(C94:R94,{1,2,3,4,5,6}))),SUM(C94:R94),SUM(LARGE(C94:R94,{1,2,3,4,5,6}))) -> 20
A95: 89 | B95: Keith Edwards | C95: 5 | D95: GP | G95: 5 | H95: GP | K95: 5 | L95: GP | M95: 5 | N95: GP | T95: =SUM(C95,E95,G95,I95,K95,M95,O95,Q95) -> 20 | U95: =IF(ISERROR(SUM(LARGE(C95:R95,{1,2,3,4,5,6}))),SUM(C95:R95),SUM(LARGE(C95:R95,{1,2,3,4,5,6}))) -> 20
A96: 90 | B96: Kevin Chaplin | I96: 5 | J96: NBSP | K96: 5 | L96: NCS | M96: 5 | N96: CS | O96: 5 | P96: CS | T96: =SUM(C96,E96,G96,I96,K96,M96,O96,Q96) -> 20 | U96: =IF(ISERROR(SUM(LARGE(C96:R96,{1,2,3,4,5,6}))),SUM(C96:R96),SUM(LARGE(C96:R96,{1,2,3,4,5,6}))) -> 20
A97: 91 | B97: Kyle Mccormick | E97: 5 | F97: NGS | I97: 5 | J97: NGS | M97: 5 | N97: NGS | O97: 5 | P97: NGS | T97: =SUM(C97,E97,G97,I97,K97,M97,O97,Q97) -> 20 | U97: =IF(ISERROR(SUM(LARGE(C97:R97,{1,2,3,4,5,6}))),SUM(C97:R97),SUM(LARGE(C97:R97,{1,2,3,4,5,6}))) -> 20
A98: 92 | B98: Lee Hassig | E98: 5 | F98: CSP | I98: 10 | J98: CSP | M98: 5 | N98: CSP | T98: =SUM(C98,E98,G98,I98,K98,M98,O98,Q98) -> 20 | U98: =IF(ISERROR(SUM(LARGE(C98:R98,{1,2,3,4,5,6}))),SUM(C98:R98),SUM(LARGE(C98:R98,{1,2,3,4,5,6}))) -> 20
A99: 93 | B99: Matthew Knipple | M99: 20 | N99: GS | T99: =SUM(C99,E99,G99,I99,K99,M99,O99,Q99) -> 20 | U99: =IF(ISERROR(SUM(LARGE(C99:R99,{1,2,3,4,5,6}))),SUM(C99:R99),SUM(LARGE(C99:R99,{1,2,3,4,5,6}))) -> 20
A100: 94 | B100: Robert Obermeyer | E100: 5 | F100: NASP | I100: 5 | J100: NASP | K100: 5 | L100: NASP | M100: 5 | N100: NASP | T100: =SUM(C100,E100,G100,I100,K100,M100,O100,Q100) -> 20 | U100: =IF(ISERROR(SUM(LARGE(C100:R100,{1,2,3,4,5,6}))),SUM(C100:R100),SUM(LARGE(C100:R100,{1,2,3,4,5,6}))) -> 20
A101: 95 | B101: Tom Tye | C101: 5 | D101: XASP | E101: 5 | F101: XASP | I101: 5 | J101: XASP | M101: 5 | N101: XASP | T101: =SUM(C101,E101,G101,I101,K101,M101,O101,Q101) -> 20 | U101: =IF(ISERROR(SUM(LARGE(C101:R101,{1,2,3,4,5,6}))),SUM(C101:R101),SUM(LARGE(C101:R101,{1,2,3,4,5,6}))) -> 20
A102: 96 | B102: Tripp Robinson | C102: 5 | D102: NFS | K102: 5 | L102: NESP | M102: 10 | N102: NESP | T102: =SUM(C102,E102,G102,I102,K102,M102,O102,Q102) -> 20 | U102: =IF(ISERROR(SUM(LARGE(C102:R102,{1,2,3,4,5,6}))),SUM(C102:R102),SUM(LARGE(C102:R102,{1,2,3,4,5,6}))) -> 20
A103: 97 | B103: William Jarrell | C103: 5 | D103: NES | E103: 5 | F103: NES | G103: 5 | H103: NES | K103: 5 | L103: BSP | T103: =SUM(C103,E103,G103,I103,K103,M103,O103,Q103) -> 20 | U103: =IF(ISERROR(SUM(LARGE(C103:R103,{1,2,3,4,5,6}))),SUM(C103:R103),SUM(LARGE(C103:R103,{1,2,3,4,5,6}))) -> 20
A104: 98 | B104: Aaron Crowder | G104: 5 | H104: ST | M104: 5 | N104: ST | O104: 5 | P104: ST | T104: =SUM(C104,E104,G104,I104,K104,M104,O104,Q104) -> 15 | U104: =IF(ISERROR(SUM(LARGE(C104:R104,{1,2,3,4,5,6}))),SUM(C104:R104),SUM(LARGE(C104:R104,{1,2,3,4,5,6}))) -> 15
A105: 99 | B105: Alexander Dorsey | K105: 5 | L105: NCS | M105: 5 | N105: NSTU | O105: 5 | P105: CS | T105: =SUM(C105,E105,G105,I105,K105,M105,O105,Q105) -> 15 | U105: =IF(ISERROR(SUM(LARGE(C105:R105,{1,2,3,4,5,6}))),SUM(C105:R105),SUM(LARGE(C105:R105,{1,2,3,4,5,6}))) -> 15
A106: 100 | B106: Angel Arauz | G106: 5 | H106: NSM | I106: 5 | J106: NSTX | K106: 5 | L106: NSM | T106: =SUM(C106,E106,G106,I106,K106,M106,O106,Q106) -> 15 | U106: =IF(ISERROR(SUM(LARGE(C106:R106,{1,2,3,4,5,6}))),SUM(C106:R106),SUM(LARGE(C106:R106,{1,2,3,4,5,6}))) -> 15
A107: 101 | B107: Anthony Parlati | G107: 5 | H107: NCSP | I107: 5 | J107: NCSP | K107: 5 | L107: NCSP | T107: =SUM(C107,E107,G107,I107,K107,M107,O107,Q107) -> 15 | U107: =IF(ISERROR(SUM(LARGE(C107:R107,{1,2,3,4,5,6}))),SUM(C107:R107),SUM(LARGE(C107:R107,{1,2,3,4,5,6}))) -> 15
A108: 102 | B108: Ben Smith | I108: 5 | J108: NSM | M108: 5 | N108: NSM | O108: 5 | P108: NSM | T108: =SUM(C108,E108,G108,I108,K108,M108,O108,Q108) -> 15 | U108: =IF(ISERROR(SUM(LARGE(C108:R108,{1,2,3,4,5,6}))),SUM(C108:R108),SUM(LARGE(C108:R108,{1,2,3,4,5,6}))) -> 15
A109: 103 | B109: BOB DEMANCHE | E109: 5 | F109: NSTS | I109: 5 | J109: NCSP | K109: 5 | L109: NCSP | T109: =SUM(C109,E109,G109,I109,K109,M109,O109,Q109) -> 15 | U109: =IF(ISERROR(SUM(LARGE(C109:R109,{1,2,3,4,5,6}))),SUM(C109:R109),SUM(LARGE(C109:R109,{1,2,3,4,5,6}))) -> 15
A110: 104 | B110: Christopher Horne | G110: 5 | H110: NSM | I110: 5 | J110: SM | K110: 5 | L110: SM | T110: =SUM(C110,E110,G110,I110,K110,M110,O110,Q110) -> 15 | U110: =IF(ISERROR(SUM(LARGE(C110:R110,{1,2,3,4,5,6}))),SUM(C110:R110),SUM(LARGE(C110:R110,{1,2,3,4,5,6}))) -> 15
A111: 105 | B111: Elaine Shell | C111: 5 | D111: LDS | E111: 5 | F111: LDS | I111: 5 | J111: LDS | T111: =SUM(C111,E111,G111,I111,K111,M111,O111,Q111) -> 15 | U111: =IF(ISERROR(SUM(LARGE(C111:R111,{1,2,3,4,5,6}))),SUM(C111:R111),SUM(LARGE(C111:R111,{1,2,3,4,5,6}))) -> 15
A112: 106 | B112: Eric Bonnett | C112: 5 | D112: XFS | E112: 5 | F112: XFS | G112: 5 | H112: XFS | T112: =SUM(C112,E112,G112,I112,K112,M112,O112,Q112) -> 15 | U112: =IF(ISERROR(SUM(LARGE(C112:R112,{1,2,3,4,5,6}))),SUM(C112:R112),SUM(LARGE(C112:R112,{1,2,3,4,5,6}))) -> 15
A113: 107 | B113: Eric Holland | C113: 5 | D113: SSM | G113: 5 | H113: ESP | O113: 5 | P113: HS | T113: =SUM(C113,E113,G113,I113,K113,M113,O113,Q113) -> 15 | U113: =IF(ISERROR(SUM(LARGE(C113:R113,{1,2,3,4,5,6}))),SUM(C113:R113),SUM(LARGE(C113:R113,{1,2,3,4,5,6}))) -> 15
A114: 108 | B114: James Clarke | E114: 5 | F114: NCS | G114: 5 | H114: NCS | I114: 5 | J114: NCS | T114: =SUM(C114,E114,G114,I114,K114,M114,O114,Q114) -> 15 | U114: =IF(ISERROR(SUM(LARGE(C114:R114,{1,2,3,4,5,6}))),SUM(C114:R114),SUM(LARGE(C114:R114,{1,2,3,4,5,6}))) -> 15
A115: 109 | B115: Jenny Anderson | G115: 5 | H115: NES | K115: 5 | L115: LCS | O115: 5 | P115: NCSP | T115: =SUM(C115,E115,G115,I115,K115,M115,O115,Q115) -> 15 | U115: =IF(ISERROR(SUM(LARGE(C115:R115,{1,2,3,4,5,6}))),SUM(C115:R115),SUM(LARGE(C115:R115,{1,2,3,4,5,6}))) -> 15
A116: 110 | B116: Lee Williams | C116: 5 | D116: ES | E116: 5 | F116: ES | I116: 5 | J116: ESP | T116: =SUM(C116,E116,G116,I116,K116,M116,O116,Q116) -> 15 | U116: =IF(ISERROR(SUM(LARGE(C116:R116,{1,2,3,4,5,6}))),SUM(C116:R116),SUM(LARGE(C116:R116,{1,2,3,4,5,6}))) -> 15
A117: 111 | B117: Loren Scott | C117: 5 | D117: ST | E117: 5 | F117: ST | G117: 5 | H117: ST | T117: =SUM(C117,E117,G117,I117,K117,M117,O117,Q117) -> 15 | U117: =IF(ISERROR(SUM(LARGE(C117:R117,{1,2,3,4,5,6}))),SUM(C117:R117),SUM(LARGE(C117:R117,{1,2,3,4,5,6}))) -> 15
A118: 112 | B118: Mike Mcgraw | C118: 5 | D118: NCS | G118: 5 | H118: NAS | I118: 5 | J118: NBS | T118: =SUM(C118,E118,G118,I118,K118,M118,O118,Q118) -> 15 | U118: =IF(ISERROR(SUM(LARGE(C118:R118,{1,2,3,4,5,6}))),SUM(C118:R118),SUM(LARGE(C118:R118,{1,2,3,4,5,6}))) -> 15
A119: 113 | B119: Patrick Aromin | G119: 5 | H119: NASP | K119: 5 | L119: NAS | M119: 5 | N119: NSS | T119: =SUM(C119,E119,G119,I119,K119,M119,O119,Q119) -> 15 | U119: =IF(ISERROR(SUM(LARGE(C119:R119,{1,2,3,4,5,6}))),SUM(C119:R119),SUM(LARGE(C119:R119,{1,2,3,4,5,6}))) -> 15
A120: 114 | B120: Patrick Gerbus | C120: 5 | D120: STX | M120: 5 | N120: STX | O120: 5 | P120: STX | T120: =SUM(C120,E120,G120,I120,K120,M120,O120,Q120) -> 15 | U120: =IF(ISERROR(SUM(LARGE(C120:R120,{1,2,3,4,5,6}))),SUM(C120:R120),SUM(LARGE(C120:R120,{1,2,3,4,5,6}))) -> 15
A121: 115 | B121: Richard Nelson | E121: 5 | F121: STU | G121: 5 | H121: STU | O121: 5 | P121: STU | T121: =SUM(C121,E121,G121,I121,K121,M121,O121,Q121) -> 15 | U121: =IF(ISERROR(SUM(LARGE(C121:R121,{1,2,3,4,5,6}))),SUM(C121:R121),SUM(LARGE(C121:R121,{1,2,3,4,5,6}))) -> 15
A122: 116 | B122: Robert Bauer | C122: 5 | D122: EP | G122: 5 | H122: ST | O122: 5 | P122: STR | T122: =SUM(C122,E122,G122,I122,K122,M122,O122,Q122) -> 15 | U122: =IF(ISERROR(SUM(LARGE(C122:R122,{1,2,3,4,5,6}))),SUM(C122:R122),SUM(LARGE(C122:R122,{1,2,3,4,5,6}))) -> 15
A123: 117 | B123: Scott Brubaker jr. | E123: 5 | F123: ST | G123: 5 | H123: NST | I123: 5 | J123: NST | T123: =SUM(C123,E123,G123,I123,K123,M123,O123,Q123) -> 15 | U123: =IF(ISERROR(SUM(LARGE(C123:R123,{1,2,3,4,5,6}))),SUM(C123:R123),SUM(LARGE(C123:R123,{1,2,3,4,5,6}))) -> 15
A124: 118 | B124: Scott Farrell | C124: 5 | D124: FSP | E124: 5 | F124: FSP | G124: 5 | H124: FSP | T124: =SUM(C124,E124,G124,I124,K124,M124,O124,Q124) -> 15 | U124: =IF(ISERROR(SUM(LARGE(C124:R124,{1,2,3,4,5,6}))),SUM(C124:R124),SUM(LARGE(C124:R124,{1,2,3,4,5,6}))) -> 15
A125: 119 | B125: Thomas Vincent | G125: 5 | H125: CP | I125: 5 | J125: CP | K125: 5 | L125: CP | T125: =SUM(C125,E125,G125,I125,K125,M125,O125,Q125) -> 15 | U125: =IF(ISERROR(SUM(LARGE(C125:R125,{1,2,3,4,5,6}))),SUM(C125:R125),SUM(LARGE(C125:R125,{1,2,3,4,5,6}))) -> 15
A126: 120 | B126: Bill Spruill | I126: 5 | J126: XHS | M126: 5 | N126: XHS | T126: =SUM(C126,E126,G126,I126,K126,M126,O126,Q126) -> 10 | U126: =IF(ISERROR(SUM(LARGE(C126:R126,{1,2,3,4,5,6}))),SUM(C126:R126),SUM(LARGE(C126:R126,{1,2,3,4,5,6}))) -> 10
A127: 121 | B127: Brian Barclay | C127: 5 | D127: XBS | M127: 5 | N127: XBS | T127: =SUM(C127,E127,G127,I127,K127,M127,O127,Q127) -> 10 | U127: =IF(ISERROR(SUM(LARGE(C127:R127,{1,2,3,4,5,6}))),SUM(C127:R127),SUM(LARGE(C127:R127,{1,2,3,4,5,6}))) -> 10
A128: 122 | B128: Cande Crowder | M128: 5 | N128: LST | O128: 5 | P128: LST | T128: =SUM(C128,E128,G128,I128,K128,M128,O128,Q128) -> 10 | U128: =IF(ISERROR(SUM(LARGE(C128:R128,{1,2,3,4,5,6}))),SUM(C128:R128),SUM(LARGE(C128:R128,{1,2,3,4,5,6}))) -> 10
A129: 123 | B129: Daryl Beasley | C129: 5 | D129: SS | E129: 5 | F129: SS | T129: =SUM(C129,E129,G129,I129,K129,M129,O129,Q129) -> 10 | U129: =IF(ISERROR(SUM(LARGE(C129:R129,{1,2,3,4,5,6}))),SUM(C129:R129),SUM(LARGE(C129:R129,{1,2,3,4,5,6}))) -> 10
A130: 124 | B130: Fred Phillips | M130: 5 | N130: NCS | O130: 5 | P130: NCS | T130: =SUM(C130,E130,G130,I130,K130,M130,O130,Q130) -> 10 | U130: =IF(ISERROR(SUM(LARGE(C130:R130,{1,2,3,4,5,6}))),SUM(C130:R130),SUM(LARGE(C130:R130,{1,2,3,4,5,6}))) -> 10
A131: 125 | B131: George Valentin | E131: 5 | F131: NSTX | G131: 5 | H131: NST | T131: =SUM(C131,E131,G131,I131,K131,M131,O131,Q131) -> 10 | U131: =IF(ISERROR(SUM(LARGE(C131:R131,{1,2,3,4,5,6}))),SUM(C131:R131),SUM(LARGE(C131:R131,{1,2,3,4,5,6}))) -> 10
A132: 126 | B132: Jackie Kassen | E132: 5 | F132: NSM | G132: 5 | H132: NSM | T132: =SUM(C132,E132,G132,I132,K132,M132,O132,Q132) -> 10 | U132: =IF(ISERROR(SUM(LARGE(C132:R132,{1,2,3,4,5,6}))),SUM(C132:R132),SUM(LARGE(C132:R132,{1,2,3,4,5,6}))) -> 10
A133: 127 | B133: Jason Levine | C133: 5 | D133: XBS | I133: 5 | J133: XBS | T133: =SUM(C133,E133,G133,I133,K133,M133,O133,Q133) -> 10 | U133: =IF(ISERROR(SUM(LARGE(C133:R133,{1,2,3,4,5,6}))),SUM(C133:R133),SUM(LARGE(C133:R133,{1,2,3,4,5,6}))) -> 10
A134: 128 | B134: Jeffrey Bell | K134: 5 | L134: CP | O134: 5 | P134: CP | T134: =SUM(C134,E134,G134,I134,K134,M134,O134,Q134) -> 10 | U134: =IF(ISERROR(SUM(LARGE(C134:R134,{1,2,3,4,5,6}))),SUM(C134:R134),SUM(LARGE(C134:R134,{1,2,3,4,5,6}))) -> 10
A135: 129 | B135: Jesse Newcomer | G135: 5 | H135: NSTU | I135: 5 | J135: NSTU | T135: =SUM(C135,E135,G135,I135,K135,M135,O135,Q135) -> 10 | U135: =IF(ISERROR(SUM(LARGE(C135:R135,{1,2,3,4,5,6}))),SUM(C135:R135),SUM(LARGE(C135:R135,{1,2,3,4,5,6}))) -> 10
A136: 130 | B136: Jimbo Ewing | C136: 5 | D136: XCSP | E136: 5 | F136: XCSP | T136: =SUM(C136,E136,G136,I136,K136,M136,O136,Q136) -> 10 | U136: =IF(ISERROR(SUM(LARGE(C136:R136,{1,2,3,4,5,6}))),SUM(C136:R136),SUM(LARGE(C136:R136,{1,2,3,4,5,6}))) -> 10
A137: 131 | B137: Joey Butler | G137: 5 | H137: NESP | I137: 5 | J137: NESP | T137: =SUM(C137,E137,G137,I137,K137,M137,O137,Q137) -> 10 | U137: =IF(ISERROR(SUM(LARGE(C137:R137,{1,2,3,4,5,6}))),SUM(C137:R137),SUM(LARGE(C137:R137,{1,2,3,4,5,6}))) -> 10
A138: 132 | B138: John Hamilton | K138: 5 | L138: CP | M138: 5 | N138: NSM | T138: =SUM(C138,E138,G138,I138,K138,M138,O138,Q138) -> 10 | U138: =IF(ISERROR(SUM(LARGE(C138:R138,{1,2,3,4,5,6}))),SUM(C138:R138),SUM(LARGE(C138:R138,{1,2,3,4,5,6}))) -> 10
A139: 133 | B139: Jonathan Earnest | M139: 5 | N139: XESP | O139: 5 | P139: ESP | T139: =SUM(C139,E139,G139,I139,K139,M139,O139,Q139) -> 10 | U139: =IF(ISERROR(SUM(LARGE(C139:R139,{1,2,3,4,5,6}))),SUM(C139:R139),SUM(LARGE(C139:R139,{1,2,3,4,5,6}))) -> 10
A140: 134 | B140: Jonathan Williams | G140: 5 | H140: NDS | K140: 5 | L140: STU | T140: =SUM(C140,E140,G140,I140,K140,M140,O140,Q140) -> 10 | U140: =IF(ISERROR(SUM(LARGE(C140:R140,{1,2,3,4,5,6}))),SUM(C140:R140),SUM(LARGE(C140:R140,{1,2,3,4,5,6}))) -> 10
A141: 135 | B141: Kevin Sullivant | M141: 5 | N141: NSMF | O141: 5 | P141: NSMF | T141: =SUM(C141,E141,G141,I141,K141,M141,O141,Q141) -> 10 | U141: =IF(ISERROR(SUM(LARGE(C141:R141,{1,2,3,4,5,6}))),SUM(C141:R141),SUM(LARGE(C141:R141,{1,2,3,4,5,6}))) -> 10
A142: 136 | B142: Kitty Phillips | M142: 5 | N142: NCS | O142: 5 | P142: NCS | T142: =SUM(C142,E142,G142,I142,K142,M142,O142,Q142) -> 10 | U142: =IF(ISERROR(SUM(LARGE(C142:R142,{1,2,3,4,5,6}))),SUM(C142:R142),SUM(LARGE(C142:R142,{1,2,3,4,5,6}))) -> 10
A143: 137 | B143: Natalie Churchill | G143: 5 | H143: LSM | K143: 5 | L143: LSM | T143: =SUM(C143,E143,G143,I143,K143,M143,O143,Q143) -> 10 | U143: =IF(ISERROR(SUM(LARGE(C143:R143,{1,2,3,4,5,6}))),SUM(C143:R143),SUM(LARGE(C143:R143,{1,2,3,4,5,6}))) -> 10
A144: 138 | B144: Paulreinner Dela cruz | I144: 5 | J144: NSTX | K144: 5 | L144: NSTX | T144: =SUM(C144,E144,G144,I144,K144,M144,O144,Q144) -> 10 | U144: =IF(ISERROR(SUM(LARGE(C144:R144,{1,2,3,4,5,6}))),SUM(C144:R144),SUM(LARGE(C144:R144,{1,2,3,4,5,6}))) -> 10
A145: 139 | B145: Peter Toth | I145: 5 | J145: NBS | K145: 5 | L145: NSTU | T145: =SUM(C145,E145,G145,I145,K145,M145,O145,Q145) -> 10 | U145: =IF(ISERROR(SUM(LARGE(C145:R145,{1,2,3,4,5,6}))),SUM(C145:R145),SUM(LARGE(C145:R145,{1,2,3,4,5,6}))) -> 10
A146: 140 | B146: RAFAEL MOSIMANN | E146: 5 | F146: NSM | G146: 5 | H146: NASP | T146: =SUM(C146,E146,G146,I146,K146,M146,O146,Q146) -> 10 | U146: =IF(ISERROR(SUM(LARGE(C146:R146,{1,2,3,4,5,6}))),SUM(C146:R146),SUM(LARGE(C146:R146,{1,2,3,4,5,6}))) -> 10
A147: 141 | B147: Rex Harris | C147: 5 | D147: ASP | E147: 5 | F147: ASP | T147: =SUM(C147,E147,G147,I147,K147,M147,O147,Q147) -> 10 | U147: =IF(ISERROR(SUM(LARGE(C147:R147,{1,2,3,4,5,6}))),SUM(C147:R147),SUM(LARGE(C147:R147,{1,2,3,4,5,6}))) -> 10
A148: 142 | B148: Robert Degges | E148: 5 | F148: NDS | G148: 5 | H148: NDS | T148: =SUM(C148,E148,G148,I148,K148,M148,O148,Q148) -> 10 | U148: =IF(ISERROR(SUM(LARGE(C148:R148,{1,2,3,4,5,6}))),SUM(C148:R148),SUM(LARGE(C148:R148,{1,2,3,4,5,6}))) -> 10
A149: 143 | B149: Steven Dasher | C149: 5 | D149: DS | O149: 5 | P149: DS | T149: =SUM(C149,E149,G149,I149,K149,M149,O149,Q149) -> 10 | U149: =IF(ISERROR(SUM(LARGE(C149:R149,{1,2,3,4,5,6}))),SUM(C149:R149),SUM(LARGE(C149:R149,{1,2,3,4,5,6}))) -> 10
A150: 144 | B150: Thomas Barnickel | E150: 5 | F150: NFS | G150: 5 | H150: FS | T150: =SUM(C150,E150,G150,I150,K150,M150,O150,Q150) -> 10 | U150: =IF(ISERROR(SUM(LARGE(C150:R150,{1,2,3,4,5,6}))),SUM(C150:R150),SUM(LARGE(C150:R150,{1,2,3,4,5,6}))) -> 10
A151: 145 | B151: William Howard | E151: 5 | F151: DSP | O151: 5 | P151: XDSP | T151: =SUM(C151,E151,G151,I151,K151,M151,O151,Q151) -> 10 | U151: =IF(ISERROR(SUM(LARGE(C151:R151,{1,2,3,4,5,6}))),SUM(C151:R151),SUM(LARGE(C151:R151,{1,2,3,4,5,6}))) -> 10
A152: 146 | B152: Zack Brickner | I152: 5 | J152: NGS | K152: 5 | L152: NESP | T152: =SUM(C152,E152,G152,I152,K152,M152,O152,Q152) -> 10 | U152: =IF(ISERROR(SUM(LARGE(C152:R152,{1,2,3,4,5,6}))),SUM(C152:R152),SUM(LARGE(C152:R152,{1,2,3,4,5,6}))) -> 10
A153: 147 | B153: Allyn Malventano | C153: 5 | D153: NSTX | T153: =SUM(C153,E153,G153,I153,K153,M153,O153,Q153) -> 5 | U153: =IF(ISERROR(SUM(LARGE(C153:R153,{1,2,3,4,5,6}))),SUM(C153:R153),SUM(LARGE(C153:R153,{1,2,3,4,5,6}))) -> 5
A154: 148 | B154: Austin Clay | O154: 5 | P154: NHS | T154: =SUM(C154,E154,G154,I154,K154,M154,O154,Q154) -> 5 | U154: =IF(ISERROR(SUM(LARGE(C154:R154,{1,2,3,4,5,6}))),SUM(C154:R154),SUM(LARGE(C154:R154,{1,2,3,4,5,6}))) -> 5
A155: 149 | B155: Boyce Townsend | K155: 5 | L155: NFSP | T155: =SUM(C155,E155,G155,I155,K155,M155,O155,Q155) -> 5 | U155: =IF(ISERROR(SUM(LARGE(C155:R155,{1,2,3,4,5,6}))),SUM(C155:R155),SUM(LARGE(C155:R155,{1,2,3,4,5,6}))) -> 5
A156: 150 | B156: Brian Bowers | C156: 5 | D156: XAS | T156: =SUM(C156,E156,G156,I156,K156,M156,O156,Q156) -> 5 | U156: =IF(ISERROR(SUM(LARGE(C156:R156,{1,2,3,4,5,6}))),SUM(C156:R156),SUM(LARGE(C156:R156,{1,2,3,4,5,6}))) -> 5
A157: 151 | B157: Calvin Law | K157: 5 | L157: SM | T157: =SUM(C157,E157,G157,I157,K157,M157,O157,Q157) -> 5 | U157: =IF(ISERROR(SUM(LARGE(C157:R157,{1,2,3,4,5,6}))),SUM(C157:R157),SUM(LARGE(C157:R157,{1,2,3,4,5,6}))) -> 5
A158: 152 | B158: Carl Stone | K158: 5 | L158: CSP | T158: =SUM(C158,E158,G158,I158,K158,M158,O158,Q158) -> 5 | U158: =IF(ISERROR(SUM(LARGE(C158:R158,{1,2,3,4,5,6}))),SUM(C158:R158),SUM(LARGE(C158:R158,{1,2,3,4,5,6}))) -> 5
A159: 153 | B159: Cesar Huerta | O159: 5 | P159: NBSP | T159: =SUM(C159,E159,G159,I159,K159,M159,O159,Q159) -> 5 | U159: =IF(ISERROR(SUM(LARGE(C159:R159,{1,2,3,4,5,6}))),SUM(C159:R159),SUM(LARGE(C159:R159,{1,2,3,4,5,6}))) -> 5
A160: 154 | B160: Charlie Johnson | O160: 5 | P160: NST | T160: =SUM(C160,E160,G160,I160,K160,M160,O160,Q160) -> 5 | U160: =IF(ISERROR(SUM(LARGE(C160:R160,{1,2,3,4,5,6}))),SUM(C160:R160),SUM(LARGE(C160:R160,{1,2,3,4,5,6}))) -> 5
A161: 155 | B161: Clay Patterson | O161: 5 | P161: NDSP | T161: =SUM(C161,E161,G161,I161,K161,M161,O161,Q161) -> 5 | U161: =IF(ISERROR(SUM(LARGE(C161:R161,{1,2,3,4,5,6}))),SUM(C161:R161),SUM(LARGE(C161:R161,{1,2,3,4,5,6}))) -> 5
A162: 156 | B162: Dan Palumbo | O162: 5 | P162: NSTS | T162: =SUM(C162,E162,G162,I162,K162,M162,O162,Q162) -> 5 | U162: =IF(ISERROR(SUM(LARGE(C162:R162,{1,2,3,4,5,6}))),SUM(C162:R162),SUM(LARGE(C162:R162,{1,2,3,4,5,6}))) -> 5
A163: 157 | B163: Daniel Hedner | C163: 5 | D163: NESP | T163: =SUM(C163,E163,G163,I163,K163,M163,O163,Q163) -> 5 | U163: =IF(ISERROR(SUM(LARGE(C163:R163,{1,2,3,4,5,6}))),SUM(C163:R163),SUM(LARGE(C163:R163,{1,2,3,4,5,6}))) -> 5
A164: 158 | B164: David Huntington | E164: 5 | F164: XDSP | T164: =SUM(C164,E164,G164,I164,K164,M164,O164,Q164) -> 5 | U164: =IF(ISERROR(SUM(LARGE(C164:R164,{1,2,3,4,5,6}))),SUM(C164:R164),SUM(LARGE(C164:R164,{1,2,3,4,5,6}))) -> 5
A165: 159 | B165: David Lonnquest | E165: 5 | F165: STX | T165: =SUM(C165,E165,G165,I165,K165,M165,O165,Q165) -> 5 | U165: =IF(ISERROR(SUM(LARGE(C165:R165,{1,2,3,4,5,6}))),SUM(C165:R165),SUM(LARGE(C165:R165,{1,2,3,4,5,6}))) -> 5
A166: 160 | B166: David Merritts | O166: 5 | P166: NESP | T166: =SUM(C166,E166,G166,I166,K166,M166,O166,Q166) -> 5 | U166: =IF(ISERROR(SUM(LARGE(C166:R166,{1,2,3,4,5,6}))),SUM(C166:R166),SUM(LARGE(C166:R166,{1,2,3,4,5,6}))) -> 5
A167: 161 | B167: Don Morse | K167: 5 | L167: XASP | T167: =SUM(C167,E167,G167,I167,K167,M167,O167,Q167) -> 5 | U167: =IF(ISERROR(SUM(LARGE(C167:R167,{1,2,3,4,5,6}))),SUM(C167:R167),SUM(LARGE(C167:R167,{1,2,3,4,5,6}))) -> 5
A168: 162 | B168: Dustin Foster | K168: 5 | L168: SMF | T168: =SUM(C168,E168,G168,I168,K168,M168,O168,Q168) -> 5 | U168: =IF(ISERROR(SUM(LARGE(C168:R168,{1,2,3,4,5,6}))),SUM(C168:R168),SUM(LARGE(C168:R168,{1,2,3,4,5,6}))) -> 5
A169: 163 | B169: Elric Claudio | C169: 5 | D169: SSM | T169: =SUM(C169,E169,G169,I169,K169,M169,O169,Q169) -> 5 | U169: =IF(ISERROR(SUM(LARGE(C169:R169,{1,2,3,4,5,6}))),SUM(C169:R169),SUM(LARGE(C169:R169,{1,2,3,4,5,6}))) -> 5
A170: 164 | B170: Engelbert Muelhaupt | O170: 5 | P170: FP | T170: =SUM(C170,E170,G170,I170,K170,M170,O170,Q170) -> 5 | U170: =IF(ISERROR(SUM(LARGE(C170:R170,{1,2,3,4,5,6}))),SUM(C170:R170),SUM(LARGE(C170:R170,{1,2,3,4,5,6}))) -> 5
A171: 165 | B171: Eric Mcdonald | G171: 5 | H171: NBS | T171: =SUM(C171,E171,G171,I171,K171,M171,O171,Q171) -> 5 | U171: =IF(ISERROR(SUM(LARGE(C171:R171,{1,2,3,4,5,6}))),SUM(C171:R171),SUM(LARGE(C171:R171,{1,2,3,4,5,6}))) -> 5
A172: 166 | B172: Garry Lewis | C172: 5 | D172: NBSP | T172: =SUM(C172,E172,G172,I172,K172,M172,O172,Q172) -> 5 | U172: =IF(ISERROR(SUM(LARGE(C172:R172,{1,2,3,4,5,6}))),SUM(C172:R172),SUM(LARGE(C172:R172,{1,2,3,4,5,6}))) -> 5
A173: 167 | B173: Gary Newsome | M173: 5 | N173: NST | T173: =SUM(C173,E173,G173,I173,K173,M173,O173,Q173) -> 5 | U173: =IF(ISERROR(SUM(LARGE(C173:R173,{1,2,3,4,5,6}))),SUM(C173:R173),SUM(LARGE(C173:R173,{1,2,3,4,5,6}))) -> 5
A174: 168 | B174: Gordon Peele | M174: 5 | N174: XBS | T174: =SUM(C174,E174,G174,I174,K174,M174,O174,Q174) -> 5 | U174: =IF(ISERROR(SUM(LARGE(C174:R174,{1,2,3,4,5,6}))),SUM(C174:R174),SUM(LARGE(C174:R174,{1,2,3,4,5,6}))) -> 5
A175: 169 | B175: Hank Ramsey | O175: 5 | P175: CSP | T175: =SUM(C175,E175,G175,I175,K175,M175,O175,Q175) -> 5 | U175: =IF(ISERROR(SUM(LARGE(C175:R175,{1,2,3,4,5,6}))),SUM(C175:R175),SUM(LARGE(C175:R175,{1,2,3,4,5,6}))) -> 5
A176: 170 | B176: Henrik Hellstroem | K176: 5 | L176: NCSP | T176: =SUM(C176,E176,G176,I176,K176,M176,O176,Q176) -> 5 | U176: =IF(ISERROR(SUM(LARGE(C176:R176,{1,2,3,4,5,6}))),SUM(C176:R176),SUM(LARGE(C176:R176,{1,2,3,4,5,6}))) -> 5
A177: 171 | B177: Ivana Nedeljkovich | C177: 5 | D177: ST | T177: =SUM(C177,E177,G177,I177,K177,M177,O177,Q177) -> 5 | U177: =IF(ISERROR(SUM(LARGE(C177:R177,{1,2,3,4,5,6}))),SUM(C177:R177),SUM(LARGE(C177:R177,{1,2,3,4,5,6}))) -> 5
A178: 172 | B178: Jake Thiewes | E178: 5 | F178: CSP | T178: =SUM(C178,E178,G178,I178,K178,M178,O178,Q178) -> 5 | U178: =IF(ISERROR(SUM(LARGE(C178:R178,{1,2,3,4,5,6}))),SUM(C178:R178),SUM(LARGE(C178:R178,{1,2,3,4,5,6}))) -> 5
A179: 173 | B179: James Belknap | C179: 5 | D179: STX | T179: =SUM(C179,E179,G179,I179,K179,M179,O179,Q179) -> 5 | U179: =IF(ISERROR(SUM(LARGE(C179:R179,{1,2,3,4,5,6}))),SUM(C179:R179),SUM(LARGE(C179:R179,{1,2,3,4,5,6}))) -> 5
A180: 174 | B180: James Churchill | K180: 5 | L180: STS | T180: =SUM(C180,E180,G180,I180,K180,M180,O180,Q180) -> 5 | U180: =IF(ISERROR(SUM(LARGE(C180:R180,{1,2,3,4,5,6}))),SUM(C180:R180),SUM(LARGE(C180:R180,{1,2,3,4,5,6}))) -> 5
A181: 175 | B181: James Thompson | K181: 5 | L181: XBSP | T181: =SUM(C181,E181,G181,I181,K181,M181,O181,Q181) -> 5 | U181: =IF(ISERROR(SUM(LARGE(C181:R181,{1,2,3,4,5,6}))),SUM(C181:R181),SUM(LARGE(C181:R181,{1,2,3,4,5,6}))) -> 5
A182: 176 | B182: Jason Chebetar | O182: 5 | P182: STU | T182: =SUM(C182,E182,G182,I182,K182,M182,O182,Q182) -> 5 | U182: =IF(ISERROR(SUM(LARGE(C182:R182,{1,2,3,4,5,6}))),SUM(C182:R182),SUM(LARGE(C182:R182,{1,2,3,4,5,6}))) -> 5
A183: 177 | B183: Jason Combs | O183: 5 | P183: CSP | T183: =SUM(C183,E183,G183,I183,K183,M183,O183,Q183) -> 5 | U183: =IF(ISERROR(SUM(LARGE(C183:R183,{1,2,3,4,5,6}))),SUM(C183:R183),SUM(LARGE(C183:R183,{1,2,3,4,5,6}))) -> 5
A184: 178 | B184: Jeff Jasmer | G184: 5 | H184: XGS | T184: =SUM(C184,E184,G184,I184,K184,M184,O184,Q184) -> 5 | U184: =IF(ISERROR(SUM(LARGE(C184:R184,{1,2,3,4,5,6}))),SUM(C184:R184),SUM(LARGE(C184:R184,{1,2,3,4,5,6}))) -> 5
A185: 179 | B185: John Krevonick | O185: 5 | P185: NST | T185: =SUM(C185,E185,G185,I185,K185,M185,O185,Q185) -> 5 | U185: =IF(ISERROR(SUM(LARGE(C185:R185,{1,2,3,4,5,6}))),SUM(C185:R185),SUM(LARGE(C185:R185,{1,2,3,4,5,6}))) -> 5
A186: 180 | B186: Johnnie Lackey | O186: 5 | P186: XEP | T186: =SUM(C186,E186,G186,I186,K186,M186,O186,Q186) -> 5 | U186: =IF(ISERROR(SUM(LARGE(C186:R186,{1,2,3,4,5,6}))),SUM(C186:R186),SUM(LARGE(C186:R186,{1,2,3,4,5,6}))) -> 5
A187: 181 | B187: Jonell Price | K187: 5 | L187: NDS | T187: =SUM(C187,E187,G187,I187,K187,M187,O187,Q187) -> 5 | U187: =IF(ISERROR(SUM(LARGE(C187:R187,{1,2,3,4,5,6}))),SUM(C187:R187),SUM(LARGE(C187:R187,{1,2,3,4,5,6}))) -> 5
A188: 182 | B188: Ju Billy | O188: 5 | P188: SM | T188: =SUM(C188,E188,G188,I188,K188,M188,O188,Q188) -> 5 | U188: =IF(ISERROR(SUM(LARGE(C188:R188,{1,2,3,4,5,6}))),SUM(C188:R188),SUM(LARGE(C188:R188,{1,2,3,4,5,6}))) -> 5
A189: 183 | B189: Julia Bunch | K189: 5 | L189: AM | T189: =SUM(C189,E189,G189,I189,K189,M189,O189,Q189) -> 5 | U189: =IF(ISERROR(SUM(LARGE(C189:R189,{1,2,3,4,5,6}))),SUM(C189:R189),SUM(LARGE(C189:R189,{1,2,3,4,5,6}))) -> 5
A190: 184 | B190: Kent Ferriss | O190: 5 | P190: NSSM | T190: =SUM(C190,E190,G190,I190,K190,M190,O190,Q190) -> 5 | U190: =IF(ISERROR(SUM(LARGE(C190:R190,{1,2,3,4,5,6}))),SUM(C190:R190),SUM(LARGE(C190:R190,{1,2,3,4,5,6}))) -> 5
A191: 185 | B191: Kyle Crozier | K191: 5 | L191: NST | T191: =SUM(C191,E191,G191,I191,K191,M191,O191,Q191) -> 5 | U191: =IF(ISERROR(SUM(LARGE(C191:R191,{1,2,3,4,5,6}))),SUM(C191:R191),SUM(LARGE(C191:R191,{1,2,3,4,5,6}))) -> 5
A192: 186 | B192: Lelane Lemond | C192: 5 | D192: LSTX | T192: =SUM(C192,E192,G192,I192,K192,M192,O192,Q192) -> 5 | U192: =IF(ISERROR(SUM(LARGE(C192:R192,{1,2,3,4,5,6}))),SUM(C192:R192),SUM(LARGE(C192:R192,{1,2,3,4,5,6}))) -> 5
A193: 187 | B193: Loren Fischer | E193: 5 | F193: NCS | T193: =SUM(C193,E193,G193,I193,K193,M193,O193,Q193) -> 5 | U193: =IF(ISERROR(SUM(LARGE(C193:R193,{1,2,3,4,5,6}))),SUM(C193:R193),SUM(LARGE(C193:R193,{1,2,3,4,5,6}))) -> 5
A194: 188 | B194: Mariyan Todorov | G194: 5 | H194: NSTU | T194: =SUM(C194,E194,G194,I194,K194,M194,O194,Q194) -> 5 | U194: =IF(ISERROR(SUM(LARGE(C194:R194,{1,2,3,4,5,6}))),SUM(C194:R194),SUM(LARGE(C194:R194,{1,2,3,4,5,6}))) -> 5
A195: 189 | B195: Mark Houchins | C195: 5 | D195: NXP | T195: =SUM(C195,E195,G195,I195,K195,M195,O195,Q195) -> 5 | U195: =IF(ISERROR(SUM(LARGE(C195:R195,{1,2,3,4,5,6}))),SUM(C195:R195),SUM(LARGE(C195:R195,{1,2,3,4,5,6}))) -> 5
A196: 190 | B196: Matt Hulse | M196: 5 | N196: NSM | T196: =SUM(C196,E196,G196,I196,K196,M196,O196,Q196) -> 5 | U196: =IF(ISERROR(SUM(LARGE(C196:R196,{1,2,3,4,5,6}))),SUM(C196:R196),SUM(LARGE(C196:R196,{1,2,3,4,5,6}))) -> 5
A197: 191 | B197: Michael Whitney | O197: 5 | P197: NSTX | T197: =SUM(C197,E197,G197,I197,K197,M197,O197,Q197) -> 5 | U197: =IF(ISERROR(SUM(LARGE(C197:R197,{1,2,3,4,5,6}))),SUM(C197:R197),SUM(LARGE(C197:R197,{1,2,3,4,5,6}))) -> 5
A198: 192 | B198: Mike Coulling | C198: 5 | D198: XES | T198: =SUM(C198,E198,G198,I198,K198,M198,O198,Q198) -> 5 | U198: =IF(ISERROR(SUM(LARGE(C198:R198,{1,2,3,4,5,6}))),SUM(C198:R198),SUM(LARGE(C198:R198,{1,2,3,4,5,6}))) -> 5
A199: 193 | B199: Mike Finkbeiner | G199: 5 | H199: NSTX | T199: =SUM(C199,E199,G199,I199,K199,M199,O199,Q199) -> 5 | U199: =IF(ISERROR(SUM(LARGE(C199:R199,{1,2,3,4,5,6}))),SUM(C199:R199),SUM(LARGE(C199:R199,{1,2,3,4,5,6}))) -> 5
A200: 194 | B200: Mike Newcomb | C200: 5 | D200: NCP | T200: =SUM(C200,E200,G200,I200,K200,M200,O200,Q200) -> 5 | U200: =IF(ISERROR(SUM(LARGE(C200:R200,{1,2,3,4,5,6}))),SUM(C200:R200),SUM(LARGE(C200:R200,{1,2,3,4,5,6}))) -> 5
A201: 195 | B201: Mike Schnesker | G201: 5 | H201: XAM | T201: =SUM(C201,E201,G201,I201,K201,M201,O201,Q201) -> 5 | U201: =IF(ISERROR(SUM(LARGE(C201:R201,{1,2,3,4,5,6}))),SUM(C201:R201),SUM(LARGE(C201:R201,{1,2,3,4,5,6}))) -> 5
A202: 196 | B202: Moe Mondal | G202: 5 | H202: STX | T202: =SUM(C202,E202,G202,I202,K202,M202,O202,Q202) -> 5 | U202: =IF(ISERROR(SUM(LARGE(C202:R202,{1,2,3,4,5,6}))),SUM(C202:R202),SUM(LARGE(C202:R202,{1,2,3,4,5,6}))) -> 5
A203: 197 | B203: Patrick Nolan | E203: 5 | F203: NAS | T203: =SUM(C203,E203,G203,I203,K203,M203,O203,Q203) -> 5 | U203: =IF(ISERROR(SUM(LARGE(C203:R203,{1,2,3,4,5,6}))),SUM(C203:R203),SUM(LARGE(C203:R203,{1,2,3,4,5,6}))) -> 5
A204: 198 | B204: Per Bjore dahl | K204: 5 | L204: NCSP | T204: =SUM(C204,E204,G204,I204,K204,M204,O204,Q204) -> 5 | U204: =IF(ISERROR(SUM(LARGE(C204:R204,{1,2,3,4,5,6}))),SUM(C204:R204),SUM(LARGE(C204:R204,{1,2,3,4,5,6}))) -> 5
A205: 199 | B205: Peter French | O205: 5 | P205: STU | T205: =SUM(C205,E205,G205,I205,K205,M205,O205,Q205) -> 5 | U205: =IF(ISERROR(SUM(LARGE(C205:R205,{1,2,3,4,5,6}))),SUM(C205:R205),SUM(LARGE(C205:R205,{1,2,3,4,5,6}))) -> 5
A206: 200 | B206: Phillip Moore | O206: 5 | P206: FSP | T206: =SUM(C206,E206,G206,I206,K206,M206,O206,Q206) -> 5 | U206: =IF(ISERROR(SUM(LARGE(C206:R206,{1,2,3,4,5,6}))),SUM(C206:R206),SUM(LARGE(C206:R206,{1,2,3,4,5,6}))) -> 5
A207: 201 | B207: Raymond Hopkins | C207: 5 | D207: DS | T207: =SUM(C207,E207,G207,I207,K207,M207,O207,Q207) -> 5 | U207: =IF(ISERROR(SUM(LARGE(C207:R207,{1,2,3,4,5,6}))),SUM(C207:R207),SUM(LARGE(C207:R207,{1,2,3,4,5,6}))) -> 5
A208: 202 | B208: Rebecca Folsom | C208: 5 | D208: LES | T208: =SUM(C208,E208,G208,I208,K208,M208,O208,Q208) -> 5 | U208: =IF(ISERROR(SUM(LARGE(C208:R208,{1,2,3,4,5,6}))),SUM(C208:R208),SUM(LARGE(C208:R208,{1,2,3,4,5,6}))) -> 5
A209: 203 | B209: Rein Delacruz | C209: 5 | D209: NCSP | T209: =SUM(C209,E209,G209,I209,K209,M209,O209,Q209) -> 5 | U209: =IF(ISERROR(SUM(LARGE(C209:R209,{1,2,3,4,5,6}))),SUM(C209:R209),SUM(LARGE(C209:R209,{1,2,3,4,5,6}))) -> 5
A210: 204 | B210: Rob Bauer | E210: 5 | F210: SMF | T210: =SUM(C210,E210,G210,I210,K210,M210,O210,Q210) -> 5 | U210: =IF(ISERROR(SUM(LARGE(C210:R210,{1,2,3,4,5,6}))),SUM(C210:R210),SUM(LARGE(C210:R210,{1,2,3,4,5,6}))) -> 5
A211: 205 | B211: Robert Drennan | C211: 5 | D211: XHS | T211: =SUM(C211,E211,G211,I211,K211,M211,O211,Q211) -> 5 | U211: =IF(ISERROR(SUM(LARGE(C211:R211,{1,2,3,4,5,6}))),SUM(C211:R211),SUM(LARGE(C211:R211,{1,2,3,4,5,6}))) -> 5
A212: 206 | B212: Robert McCann | O212: 5 | P212: NFS | T212: =SUM(C212,E212,G212,I212,K212,M212,O212,Q212) -> 5 | U212: =IF(ISERROR(SUM(LARGE(C212:R212,{1,2,3,4,5,6}))),SUM(C212:R212),SUM(LARGE(C212:R212,{1,2,3,4,5,6}))) -> 5
A213: 207 | B213: Ronald Stimbert | C213: 5 | D213: BS | T213: =SUM(C213,E213,G213,I213,K213,M213,O213,Q213) -> 5 | U213: =IF(ISERROR(SUM(LARGE(C213:R213,{1,2,3,4,5,6}))),SUM(C213:R213),SUM(LARGE(C213:R213,{1,2,3,4,5,6}))) -> 5
A214: 208 | B214: Russel Tye | K214: 5 | L214: XASP | T214: =SUM(C214,E214,G214,I214,K214,M214,O214,Q214) -> 5 | U214: =IF(ISERROR(SUM(LARGE(C214:R214,{1,2,3,4,5,6}))),SUM(C214:R214),SUM(LARGE(C214:R214,{1,2,3,4,5,6}))) -> 5
A215: 209 | B215: Russell McGill | G215: 5 | H215: NES | T215: =SUM(C215,E215,G215,I215,K215,M215,O215,Q215) -> 5 | U215: =IF(ISERROR(SUM(LARGE(C215:R215,{1,2,3,4,5,6}))),SUM(C215:R215),SUM(LARGE(C215:R215,{1,2,3,4,5,6}))) -> 5
A216: 210 | B216: Russell Tye | E216: 5 | F216: XASP | T216: =SUM(C216,E216,G216,I216,K216,M216,O216,Q216) -> 5 | U216: =IF(ISERROR(SUM(LARGE(C216:R216,{1,2,3,4,5,6}))),SUM(C216:R216),SUM(LARGE(C216:R216,{1,2,3,4,5,6}))) -> 5
A217: 211 | B217: Rusty Etheridge | O217: 5 | P217: NSTX | T217: =SUM(C217,E217,G217,I217,K217,M217,O217,Q217) -> 5 | U217: =IF(ISERROR(SUM(LARGE(C217:R217,{1,2,3,4,5,6}))),SUM(C217:R217),SUM(LARGE(C217:R217,{1,2,3,4,5,6}))) -> 5
A218: 212 | B218: Sam Robinson | E218: 5 | F218: NAS | T218: =SUM(C218,E218,G218,I218,K218,M218,O218,Q218) -> 5 | U218: =IF(ISERROR(SUM(LARGE(C218:R218,{1,2,3,4,5,6}))),SUM(C218:R218),SUM(LARGE(C218:R218,{1,2,3,4,5,6}))) -> 5
A219: 213 | B219: Sean Ford | O219: 5 | P219: CP | T219: =SUM(C219,E219,G219,I219,K219,M219,O219,Q219) -> 5 | U219: =IF(ISERROR(SUM(LARGE(C219:R219,{1,2,3,4,5,6}))),SUM(C219:R219),SUM(LARGE(C219:R219,{1,2,3,4,5,6}))) -> 5
A220: 214 | B220: Shaun Cordes | K220: 5 | L220: NSM | T220: =SUM(C220,E220,G220,I220,K220,M220,O220,Q220) -> 5 | U220: =IF(ISERROR(SUM(LARGE(C220:R220,{1,2,3,4,5,6}))),SUM(C220:R220),SUM(LARGE(C220:R220,{1,2,3,4,5,6}))) -> 5
A221: 215 | B221: Steve Craddock | C221: 5 | D221: NEP | T221: =SUM(C221,E221,G221,I221,K221,M221,O221,Q221) -> 5 | U221: =IF(ISERROR(SUM(LARGE(C221:R221,{1,2,3,4,5,6}))),SUM(C221:R221),SUM(LARGE(C221:R221,{1,2,3,4,5,6}))) -> 5
A222: 216 | B222: Steve Silakowski | K222: 5 | L222: NBSP | T222: =SUM(C222,E222,G222,I222,K222,M222,O222,Q222) -> 5 | U222: =IF(ISERROR(SUM(LARGE(C222:R222,{1,2,3,4,5,6}))),SUM(C222:R222),SUM(LARGE(C222:R222,{1,2,3,4,5,6}))) -> 5
A223: 217 | B223: Steven Cutcher | C223: 5 | D223: NST | T223: =SUM(C223,E223,G223,I223,K223,M223,O223,Q223) -> 5 | U223: =IF(ISERROR(SUM(LARGE(C223:R223,{1,2,3,4,5,6}))),SUM(C223:R223),SUM(LARGE(C223:R223,{1,2,3,4,5,6}))) -> 5
A224: 218 | B224: Stevie Riker | O224: 5 | P224: NSTS | T224: =SUM(C224,E224,G224,I224,K224,M224,O224,Q224) -> 5 | U224: =IF(ISERROR(SUM(LARGE(C224:R224,{1,2,3,4,5,6}))),SUM(C224:R224),SUM(LARGE(C224:R224,{1,2,3,4,5,6}))) -> 5
A225: 219 | B225: Terry Bulaski | M225: 5 | N225: NCSP | T225: =SUM(C225,E225,G225,I225,K225,M225,O225,Q225) -> 5 | U225: =IF(ISERROR(SUM(LARGE(C225:R225,{1,2,3,4,5,6}))),SUM(C225:R225),SUM(LARGE(C225:R225,{1,2,3,4,5,6}))) -> 5
A226: 220 | B226: Tony Palumbo | O226: 5 | P226: STS | T226: =SUM(C226,E226,G226,I226,K226,M226,O226,Q226) -> 5 | U226: =IF(ISERROR(SUM(LARGE(C226:R226,{1,2,3,4,5,6}))),SUM(C226:R226),SUM(LARGE(C226:R226,{1,2,3,4,5,6}))) -> 5
A227: 221 | B227: Tyler Pepin | C227: 5 | D227: BS | T227: =SUM(C227,E227,G227,I227,K227,M227,O227,Q227) -> 5 | U227: =IF(ISERROR(SUM(LARGE(C227:R227,{1,2,3,4,5,6}))),SUM(C227:R227),SUM(LARGE(C227:R227,{1,2,3,4,5,6}))) -> 5
A228: 222 | B228: Vanessa Foster | K228: 5 | L228: SMF | T228: =SUM(C228,E228,G228,I228,K228,M228,O228,Q228) -> 5 | U228: =IF(ISERROR(SUM(LARGE(C228:R228,{1,2,3,4,5,6}))),SUM(C228:R228),SUM(LARGE(C228:R228,{1,2,3,4,5,6}))) -> 5
A229: 223 | B229: William Cochran | E229: 5 | F229: NDS | T229: =SUM(C229,E229,G229,I229,K229,M229,O229,Q229) -> 5 | U229: =IF(ISERROR(SUM(LARGE(C229:R229,{1,2,3,4,5,6}))),SUM(C229:R229),SUM(LARGE(C229:R229,{1,2,3,4,5,6}))) -> 5
A230: 224 | B230: William Townsend | K230: 5 | L230: ESP | T230: =SUM(C230,E230,G230,I230,K230,M230,O230,Q230) -> 5 | U230: =IF(ISERROR(SUM(LARGE(C230:R230,{1,2,3,4,5,6}))),SUM(C230:R230),SUM(LARGE(C230:R230,{1,2,3,4,5,6}))) -> 5