D1: 2008 Events
A2: CLASS | B2: POS | C2: DRIVER | D2: March | E2: April | F2: May | G2: June | H2: July | I2: Aug | J2: Sept | K2: Nov | L2: TOTAL | M2: Best 6 of 8
M3: 5 to qualify for award
A5: SM | B5: 1 | C5: DAVE BROCHU | D5: 12 | E5: 12 | F5: 12 | G5: 12 | H5: 12 | I5: 12 | J5: 9 | K5: 12 | L5: =SUM(D5:K5) -> 93 | M5: =IF(COUNTIF(D5:K5,">0")>=5,(SUM(LARGE(D5:K5,{1,2,3,4,5,6}))),"Not Qualified") -> 72
B6: 2 | C6: NEAL DAVIS | D6: 7 | E6: 9 | F6: 9 | G6: 6 | H6: 7 | I6: 9 | J6: 7 | K6: 9 | L6: =SUM(D6:K6) -> 63 | M6: =IF(COUNTIF(D6:K6,">0")>=5,(SUM(LARGE(D6:K6,{1,2,3,4,5,6}))),"Not Qualified") -> 50
B7: 3 | C7: RUSS PARHAM | E7: 5 | G7: 2 | H7: 4 | J7: 5 | K7: 7 | L7: =SUM(D7:K7) -> 23 | M7: 23
B8: 4 | C8: SEAN MCCONNELL | D8: 3 | E8: 6 | G8: 3 | H8: 6 | K8: 5 | L8: =SUM(D8:K8) -> 23 | M8: =IF(COUNTIF(D8:K8,">0")>=5,(SUM(LARGE(D8:K8,{1,2,3,4,5}))),"Not Qualified") -> 23
B9: 5 | C9: SCOTT FARRELL | E9: 2 | F9: 2 | G9: 1 | H9: 2 | I9: 5 | J9: 4 | L9: =SUM(D9:K9) -> 16 | M9: =IF(COUNTIF(D9:K9,">0")>=5,(SUM(LARGE(D9:K9,{1,2,3,4,5,6}))),"Not Qualified") -> 16
B10: 6 | C10: GRAY MILTEER | D10: 9 | G10: 5 | H10: 5 | I10: 6 | L10: =SUM(D10:K10) -> 25 | M10: -
B11: 7 | C11: BRANDON CHARLSTON | G11: 7 | H11: 9 | I11: 7 | L11: =SUM(D11:K11) -> 23 | M11: -
B12: 8 | C12: TERRY ZACH | E12: 7 | F12: 7 | L12: =SUM(D12:K12) -> 14 | M12: -
B13: 9 | C13: DUSTIN FOSTER | F13: 6 | K13: 6 | L13: =SUM(D13:K13) -> 12 | M13: -
B14: 10 | C14: MICHAEL TWIFORD | J14: 12 | L14: =SUM(D14:K14) -> 12 | M14: -
B15: 11 | C15: BENJAMIN SMITH | D15: 4 | E15: 3 | F15: 3 | L15: =SUM(D15:K15) -> 10 | M15: -
B16: 12 | C16: BOB BROCHU | G16: 9 | L16: =SUM(D16:K16) -> 9 | M16: -
B17: 13 | C17: PETER AQUINO | E17: 4 | H17: 1 | J17: 3 | L17: =SUM(D17:K17) -> 8 | M17: -
B18: 14 | C18: JEFF ROONEY | D18: 6 | L18: =SUM(D18:K18) -> 6 | M18: -
B19: 15 | C19: FREDERICK FIELDS | I19: 4 | J19: 2 | L19: =SUM(D19:K19) -> 6 | M19: -
B20: 16 | C20: DUNCAN ELLIS | D20: 5 | L20: =SUM(D20:K20) -> 5 | M20: -
B21: 17 | C21: JEFF CHENERY | F21: 5 | L21: =SUM(D21:K21) -> 5 | M21: -
B22: 18 | C22: AUDIE CHENERY | F22: 4 | L22: =SUM(D22:K22) -> 4 | M22: -
B23: 19 | C23: CESAR DELGADILLO | G23: 4 | L23: =SUM(D23:K23) -> 4 | M23: -
B24: 20 | C24: SHAWN GAMBILL | D24: 2 | F24: 1 | L24: =SUM(D24:K24) -> 3 | M24: -
B25: 21 | C25: COREY MAPLES | H25: 3 | L25: =SUM(D25:K25) -> 3 | M25: -
A28: SM2 | B28: 1 | C28: SHAWN LAMBERT | D28: 12 | E28: 9 | G28: 12 | H28: 12 | I28: 12 | J28: 12 | K28: 12 | L28: =SUM(D28:K28) -> 81 | M28: =IF(COUNTIF(D28:K28,">0")>=5,(SUM(LARGE(D28:K28,{1,2,3,4,5,6}))),"Not Qualified") -> 72
B29: 2 | C29: DAVE MCLAUGHLIN | D29: 9 | E29: 12 | F29: 12 | H29: 9 | I29: 7 | L29: =SUM(D29:K29) -> 49 | M29: =IF(COUNTIF(D29:K29,">0")>=5,(SUM(LARGE(D29:K29,{1,2,3,4,5}))),"Not Qualified") -> 49
B30: 3 | C30: MICHAEL ARRIGO | D30: 7 | I30: 9 | J30: 6 | L30: =SUM(D30:K30) -> 22 | M30: =IF(COUNTIF(D30:K30,">0")>=5,(SUM(LARGE(D30:K30,{1,2,3,4,5}))),"Not Qualified") -> Not Qualified
B31: 4 | C31: CHRIS SWEARINGEN | J31: 9 | L31: =SUM(D31:K31) -> 9 | M31: =IF(COUNTIF(D31:K31,">0")>=5,(SUM(LARGE(D31:K31,{1,2,3,4,5}))),"Not Qualified") -> Not Qualified
B32: 5 | C32: MARK HAAG | J32: 7 | K32: 9 | L32: =SUM(D32:K32) -> 16 | M32: =IF(COUNTIF(D32:K32,">0")>=5,(SUM(LARGE(D32:K32,{1,2,3,4,5}))),"Not Qualified") -> Not Qualified
B33: 6 | C33: KEITH HOLLIS | J33: 5 | L33: =SUM(D33:K33) -> 5 | M33: =IF(COUNTIF(D33:K33,">0")>=5,(SUM(LARGE(D33:K33,{1,2,3,4,5}))),"Not Qualified") -> Not Qualified
A36: STR | B36: 1 | C36: STEVE DASHER | D36: 12 | E36: 9 | F36: 12 | G36: 12 | H36: 12 | I36: 12 | L36: =SUM(D36:K36) -> 69 | M36: =IF(COUNTIF(D36:K36,">0")>=5,(SUM(LARGE(D36:K36,{1,2,3,4,5,6}))),"Not Qualified") -> 69
B37: 2 | C37: CARL JUNEAU | E37: 12 | F37: 9 | G37: 9 | H37: 9 | I37: 9 | L37: =SUM(D37:K37) -> 48 | M37: =IF(COUNTIF(D37:K37,">0")>=5,(SUM(LARGE(D37:K37,{1,2,3,4,5}))),"Not Qualified") -> 48
B38: 3 | C38: TOM TYE | D38: 3 | E38: 6 | F38: 6 | G38: 5 | H38: 6 | I38: 7 | J38: 9 | K38: 7 | L38: =SUM(D38:K38) -> 49 | M38: =IF(COUNTIF(D38:K38,">0")>=5,(SUM(LARGE(D38:K38,{1,2,3,4,5,6}))),"Not Qualified") -> 41
B39: 4 | C39: RUSSELL TYE | D39: 1 | H39: 3 | I39: 4 | J39: 12 | K39: 9 | L39: =SUM(D39:K39) -> 29 | M39: =IF(COUNTIF(D39:K39,">0")>=5,(SUM(LARGE(D39:K39,{1,2,3,4,5}))),"Not Qualified") -> 29
B40: 5 | C40: PHILLIP JUNEAU | E40: 5 | F40: 1 | G40: 3 | H40: 5 | I40: 3 | L40: =SUM(D40:K40) -> 17 | M40: =IF(COUNTIF(D40:K40,">0")>=5,(SUM(LARGE(D40:K40,{1,2,3,4,5}))),"Not Qualified") -> 17
B41: 6 | C41: MICHAEL CACASE | D41: 1 | E41: 4 | F41: 2 | G41: 4 | I41: 5 | L41: =SUM(D41:K41) -> 16 | M41: =IF(COUNTIF(D41:K41,">0")>=5,(SUM(LARGE(D41:K41,{1,2,3,4,5}))),"Not Qualified") -> 16
B42: 7 | C42: JEFF JASMER | D42: 4 | E42: 7 | F42: 4 | L42: =SUM(D42:K42) -> 15 | M42: -
B43: 8 | C43: ERIC BONNETT | D43: 6 | G43: 7 | L43: =SUM(D43:K43) -> 13 | M43: -
B44: 9 | C44: SETH DOZIER | D44: 5 | H44: 7 | L44: =SUM(D44:K44) -> 12 | M44: -
B45: 10 | C45: AARON CROWDER | K45: 12 | L45: =SUM(D45:K45) -> 12 | M45: -
B46: 11 | C46: DAVE REISCH | F46: 5 | G46: 6 | L46: =SUM(D46:K46) -> 11 | M46: -
B47: 12 | C47: TONY ACKER | D47: 9 | E47: 1 | L47: =SUM(D47:K47) -> 10 | M47: -
B48: 13 | C48: JAMES CAUDILL | E48: 3 | F48: 3 | H48: 2 | I48: 2 | L48: =SUM(D48:K48) -> 10 | M48: -
B49: 14 | C49: MICHAEL GAINTNER | D49: 7 | L49: =SUM(D49:K49) -> 7 | M49: -
B50: 15 | C50: MICHAEL ARRIGO | F50: 7 | L50: =SUM(D50:K50) -> 7 | M50: -
B51: 15 | C51: CURTIS BURNETTE | J51: 7 | L51: =SUM(D51:K51) -> 7 | M51: -
B52: 16 | C52: RONALD STIMBERT | J52: 6 | L52: =SUM(D52:K52) -> 6 | M52: -
B53: 17 | C53: BENO RUBIN | J53: 5 | L53: =SUM(D53:K53) -> 5 | M53: -
B54: 18 | C54: BILL SPRUILL | J54: 4 | L54: =SUM(D54:K54) -> 4 | M54: -
A57: STS | B57: 1 | C57: AARON CROWDER | D57: 12 | E57: 6 | F57: 12 | G57: 9 | H57: 12 | I57: 12 | J57: 9 | L57: =SUM(D57:K57) -> 72 | M57: =IF(COUNTIF(D57:K57,">0")>=5,(SUM(LARGE(D57:K57,{1,2,3,4,5,6}))),"Not Qualified") -> 66
B58: 2 | C58: KEITH KASMIRE | D58: 6 | E58: 9 | F58: 9 | G58: 6 | H58: 9 | I58: 7 | J58: 6 | K58: 6 | L58: =SUM(D58:K58) -> 58 | M58: =IF(COUNTIF(D58:K58,">0")>=5,(SUM(LARGE(D58:K58,{1,2,3,4,5,6}))),"Not Qualified") -> 46
B59: 3 | C59: BRAD POCOCK | D59: 9 | E59: 7 | F59: 6 | G59: 5 | H59: 7 | I59: 6 | L59: =SUM(D59:K59) -> 40 | M59: =IF(COUNTIF(D59:K59,">0")>=5,(SUM(LARGE(D59:K59,{1,2,3,4,5}))),"Not Qualified") -> 35
B60: 4 | C60: JEFF CHENERY | G60: 12 | J60: 12 | L60: =SUM(D60:K60) -> 24 | M60: -
B61: 5 | C61: AUDIE CHENERY | G61: 7 | J61: 7 | L61: =SUM(D61:K61) -> 14 | M61: -
B62: 6 | C62: KEITH MAPLES | E62: 12 | L62: =SUM(D62:K62) -> 12 | M62: -
B63: 7 | C63: TRAVIS FINLAY | K63: 12 | L63: 12 | M63: -
B64: 8 | C64: JACOB POCOCK | I64: 9 | L64: =SUM(D64:K64) -> 9 | M64: -
B65: 9 | C65: ED ODONNELL | K65: 9 | L65: 9 | M65: -
B66: 10 | C66: SZE HUI | D66: 7 | L66: =SUM(D66:K66) -> 7 | M66: -
B67: 11 | C67: THOMAS RAINES | F67: 7 | L67: =SUM(D67:K67) -> 7 | M67: -
B68: 12 | C68: JOE RILEY | K68: 7 | L68: 7 | M68: -
B69: 13 | C69: CODY SEFFENS | H69: 6 | L69: =SUM(D69:K69) -> 6 | M69: -
B70: 14 | C70: PAUL VANGORDER | D70: 5 | L70: =SUM(D70:K70) -> 5 | M70: -
B71: 15 | C71: MIKE NICHOLS | E71: 5 | L71: =SUM(D71:K71) -> 5 | M71: -
B72: 16 | C72: JASPER DE GUZMAN | F72: 5 | L72: =SUM(D72:K72) -> 5 | M72: -
A75: STU | B75: 1 | C75: DAVID MARTIN | D75: 12 | F75: 12 | G75: 12 | J75: 12 | K75: 12 | L75: =SUM(D75:K75) -> 60 | M75: =IF(COUNTIF(D75:K75,">0")>=5,(SUM(LARGE(D75:K75,{1,2,3,4,5}))),"Not Qualified") -> 60
B76: 2 | C76: RICHARD NELSON | D76: 6 | E76: 12 | F76: 7 | G76: 6 | I76: 12 | J76: 7 | K76: 5 | L76: =SUM(D76:K76) -> 55 | M76: =IF(COUNTIF(D76:K76,">0")>=5,(SUM(LARGE(D76:K76,{1,2,3,4,5,6}))),"Not Qualified") -> 50
B77: 3 | C77: ANDY TURNBULL | D77: 9 | F77: 9 | G77: 9 | J77: 9 | K77: 9 | L77: =SUM(D77:K77) -> 45 | M77: =IF(COUNTIF(D77:K77,">0")>=5,(SUM(LARGE(D77:K77,{1,2,3,4,5}))),"Not Qualified") -> 45
B78: 4 | C78: JASON NEUHAUS | F78: 5 | G78: 5 | H78: 12 | I78: 9 | K78: 7 | L78: =SUM(D78:K78) -> 38 | M78: =IF(COUNTIF(D78:K78,">0")>=5,(SUM(LARGE(D78:K78,{1,2,3,4,5}))),"Not Qualified") -> 38
B79: 5 | C79: CECILE TURNBULL | D79: 7 | F79: 6 | G79: 7 | L79: =SUM(D79:K79) -> 20 | M79: -
B80: 6 | C80: JAMES CAUDILL | D80: 5 | L80: =SUM(D80:K80) -> 5 | M80: -
A83: STX | B83: 1 | C83: MICHAEL SCHNEKSER | D83: 12 | E83: 12 | F83: 12 | G83: 9 | H83: 9 | K83: 6 | L83: =SUM(D83:K83) -> 60 | M83: =IF(COUNTIF(D83:K83,">0")>=5,(SUM(LARGE(D83:K83,{1,2,3,4,5,6}))),"Not Qualified") -> 60
B84: 2 | C84: MICHAEL GAINTNER | F84: 9 | G84: 6 | H84: 7 | I84: 12 | J84: 12 | L84: =SUM(D84:K84) -> 46 | M84: =IF(COUNTIF(D84:K84,">0")>=5,(SUM(LARGE(D84:K84,{1,2,3,4,5}))),"Not Qualified") -> 46
B85: 3 | C85: JIM HERLEY | F85: 7 | G85: 4 | H85: 5 | J85: 9 | K85: 5 | L85: =SUM(D85:K85) -> 30 | M85: =IF(COUNTIF(D85:K85,">0")>=5,(SUM(LARGE(D85:K85,{1,2,3,4,5}))),"Not Qualified") -> 30
B86: 4 | C86: DAVID COOKE | D86: 9 | E86: 6 | I86: 7 | L86: =SUM(D86:K86) -> 22 | M86: -
B87: 5 | C87: DAVID MARTIN | E87: 9 | H87: 12 | L87: =SUM(D87:K87) -> 21 | M87: -
B88: 6 | C88: MICHAEL MOUNTAIN | G88: 7 | I88: 9 | L88: =SUM(D88:K88) -> 16 | M88: -
B89: 7 | C89: DEREK MAYNARD | F89: 6 | G89: 3 | J89: 4 | K89: 3 | L89: =SUM(D89:K89) -> 16 | M89: -
B90: 8 | C90: JOHN WILLEMIN | G90: 12 | K90: 9 | L90: =SUM(D90:K90) -> 21 | M90: -
B91: 9 | C91: DUNCAN ELLIS | K91: 12 | L91: 12 | M91: -
B92: 10 | C92: YAROSLAV BURMAKA | K92: 7 | L92: 7 | M92: -