D1: 2008 Events
A2: CLASS | B2: POS | C2: DRIVER | D2: March | E2: April | F2: May | G2: June | H2: July | I2: Aug | J2: Sept | K2: Nov | L2: TOTAL | M2: Best 6 of 8
M3: 5 to qualify for award
A5: BP | B5: 1 | C5: JASON LISNER | D5: 12 | G5: 12 | H5: 12 | I5: 12 | J5: 12 | K5: 12 | L5: =SUM(D5:K5) -> 72 | M5: =IF(COUNTIF(D5:K5,">0")>=5,(SUM(LARGE(D5:K5,{1,2,3,4,5,6}))),"Not Qualified") -> 72
A8: CP | B8: 1 | C8: KIENEN WEBER | H8: 12 | I8: 12 | L8: =SUM(D8:K8) -> 24 | M8: -
B9: 2 | C9: TODD HOWES | F9: 12 | I9: 7 | L9: =SUM(D9:K9) -> 19 | M9: -
B10: 3 | C10: CALVIN SANDERS | K10: 12 | L10: 12 | M10: -
B11: 4 | C11: JOYCE SANDERS | K11: 9 | L11: 9 | M11: -
B12: 5 | C12: DUNCAN ELLIS | I12: 9 | L12: =SUM(D12:K12) -> 9 | M12: -
A15: DP | B15: 1 | C15: JOE CECELIC | D15: 12 | E15: 12 | F15: 12 | H15: 12 | I15: 12 | J15: 12 | L15: =SUM(D15:K15) -> 72 | M15: =IF(COUNTIF(D15:K15,">0")>=5,(SUM(LARGE(D15:K15,{1,2,3,4,5,6}))),"Not Qualified") -> 72
A18: FP | B18: 1 | C18: MARC LISNER | F18: 12 | G18: 12 | H18: 12 | I18: 12 | J18: 12 | L18: =SUM(D18:K18) -> 60 | M18: =IF(COUNTIF(D18:K18,">0")>=5,(SUM(LARGE(D18:K18,{1,2,3,4,5}))),"Not Qualified") -> 60
A21: GP | B21: 1 | C21: TJ FITZGERALD | D21: 12 | E21: 12 | F21: 12 | G21: 12 | H21: 12 | I21: 12 | J21: 12 | K21: 12 | L21: =SUM(D21:K21) -> 96 | M21: =IF(COUNTIF(D21:K21,">0")>=5,(SUM(LARGE(D21:K21,{1,2,3,4,5,6}))),"Not Qualified") -> 72
A24: XP | B24: 1 | C24: TRAVIS BOYER | E24: 12 | F24: 7 | H24: 12 | L24: =SUM(D24:K24) -> 31 | M24: -
B25: 2 | C25: TERRY BAKER | F25: 12 | L25: =SUM(D25:K25) -> 12 | M25: -
B26: 3 | C26: JASON LISNER | F26: 9 | L26: =SUM(D26:K26) -> 9 | M26: -
B27: 4 | C27: LARRY TRANTHAM | F27: 6 | L27: =SUM(D27:K27) -> 6 | M27: -
B28: 5 | C28: NATHAN TRANTHAM | F28: 5 | L28: =SUM(D28:K28) -> 5 | M28: -
A34: CM | B34: 1 | C34: DAVE CUTCHINS | D34: 9 | G34: 12 | I34: 12 | J34: 12 | L34: =SUM(D34:K34) -> 45 | M34: -
B35: 2 | C35: STAN VANN | D35: 12 | F35: 12 | J35: 9 | L35: =SUM(D35:K35) -> 33 | M35: -
A38: DM | B38: 1 | C38: LARRY ALLAMONG | F38: 12 | J38: 12 | L38: =SUM(D38:K38) -> 24 | M38: -
A41: EM | B41: 1 | C41: BOBBY SMITH | F41: 12 | K41: 12 | L41: =SUM(D41:K41) -> 24 | M41: -
B42: 2 | C42: GLENN BUNCH | J42: 12 | L42: =SUM(D42:K42) -> 12 | M42: -