C1: 2008 Events - Top 35 PAX times for each event
A2: POS | B2: DRIVER | C2: March | D2: April | E2: May | F2: June | G2: July | H2: Aug | I2: Sept | J2: Nov | K2: TOTAL | L2: Best 6 of 8
L3: 5 to qualify for award
A4: 1 | B4: TOM BLEH | C4: 175 | D4: 175 | E4: 175 | F4: 175 | G4: 175 | H4: 170 | I4: 170 | J4: 140 | K4: =SUM(C4:J4) -> 1355 | L4: =IF(COUNTIF(C4:J4,">0")>=5,(SUM(LARGE(C4:J4,{1,2,3,4,5,6}))),"Not Qualified") -> 1045
A5: 2 | B5: GIL SMITH | C5: 155 | E5: 165 | F5: 150 | G5: 170 | H5: 175 | I5: 140 | J5: 175 | K5: =SUM(C5:J5) -> 1130 | L5: =IF(COUNTIF(C5:J5,">0")>=5,(SUM(LARGE(C5:J5,{1,2,3,4,5,6}))),"Not Qualified") -> 990
A6: 3 | B6: DOUG KEILER | C6: 150 | D6: 170 | E6: 170 | F6: 165 | H6: 165 | I6: 130 | J6: 150 | K6: =SUM(C6:J6) -> 1100 | L6: =IF(COUNTIF(C6:J6,">0")>=5,(SUM(LARGE(C6:J6,{1,2,3,4,5,6}))),"Not Qualified") -> 970
A7: 4 | B7: ED RAYMUNDO | C7: 135 | E7: 140 | G7: 145 | H7: 150 | I7: 160 | J7: 155 | K7: =SUM(C7:J7) -> 885 | L7: =IF(COUNTIF(C7:J7,">0")>=5,(SUM(LARGE(C7:J7,{1,2,3,4,5,6}))),"Not Qualified") -> 885
A8: 5 | B8: JASON LISNER | C8: 140 | D8: 145 | E8: 50 | F8: 170 | G8: 70 | H8: 140 | I8: 175 | J8: 95 | K8: =SUM(C8:J8) -> 985 | L8: =IF(COUNTIF(C8:J8,">0")>=5,(SUM(LARGE(C8:J8,{1,2,3,4,5,6}))),"Not Qualified") -> 865
A9: 6 | B9: DAVID MARTIN | C9: 165 | D9: 65 | E9: 130 | F9: 140 | G9: 105 | I9: 145 | J9: 165 | K9: =SUM(C9:J9) -> 915 | L9: =IF(COUNTIF(C9:J9,">0")>=5,(SUM(LARGE(C9:J9,{1,2,3,4,5,6}))),"Not Qualified") -> 850
A10: 7 | B10: JIM HALTOM | E10: 150 | F10: 130 | G10: 90 | H10: 120 | I10: 150 | J10: 160 | K10: =SUM(C10:J10) -> 800 | L10: =IF(COUNTIF(C10:J10,">0")>=5,(SUM(LARGE(C10:J10,{1,2,3,4,5,6}))),"Not Qualified") -> 800
A11: 8 | B11: MICHAEL TWIFORD | C11: 105 | D11: 100 | E11: 115 | F11: 145 | G11: 165 | H11: 130 | I11: 100 | J11: 130 | K11: =SUM(C11:J11) -> 990 | L11: =IF(COUNTIF(C11:J11,">0")>=5,(SUM(LARGE(C11:J11,{1,2,3,4,5,6}))),"Not Qualified") -> 790
A12: 9 | B12: GREG KOTESKI | C12: 115 | E12: 90 | F12: 120 | G12: 150 | H12: 160 | I12: 120 | J12: 120 | K12: =SUM(C12:J12) -> 875 | L12: =IF(COUNTIF(C12:J12,">0")>=5,(SUM(LARGE(C12:J12,{1,2,3,4,5,6}))),"Not Qualified") -> 785
A13: 10 | B13: SHAWN LAMBERT | C13: 25 | F13: 155 | G13: 160 | H13: 100 | I13: 165 | J13: 145 | K13: =SUM(C13:J13) -> 750 | L13: =IF(COUNTIF(C13:J13,">0")>=5,(SUM(LARGE(C13:J13,{1,2,3,4,5,6}))),"Not Qualified") -> 750
A14: 11 | B14: DAVE BROCHU | C14: 95 | D14: 155 | E14: 125 | F14: 125 | G14: 120 | H14: 105 | I14: 95 | J14: 110 | K14: =SUM(C14:J14) -> 930 | L14: =IF(COUNTIF(C14:J14,">0")>=5,(SUM(LARGE(C14:J14,{1,2,3,4,5,6}))),"Not Qualified") -> 740
A15: 12 | B15: MARC PORTANOVA | C15: 160 | E15: 160 | G15: 140 | H15: 145 | J15: 135 | K15: =SUM(C15:J15) -> 740 | L15: =IF(COUNTIF(C15:J15,">0")>=5,(SUM(LARGE(C15:J15,{1,2,3,4,5}))),"Not Qualified") -> 740
A16: 13 | B16: DAVID SKITTLETHORP | C16: 90 | D16: 165 | E16: 110 | F16: 115 | G16: 125 | H16: 115 | I16: 20 | J16: 35 | K16: =SUM(C16:J16) -> 775 | L16: =IF(COUNTIF(C16:J16,">0")>=5,(SUM(LARGE(C16:J16,{1,2,3,4,5,6}))),"Not Qualified") -> 720
A17: 14 | B17: TERRY BAKER | C17: 170 | E17: 55 | F17: 160 | I17: 135 | J17: 170 | K17: =SUM(C17:J17) -> 690 | L17: =IF(COUNTIF(C17:J17,">0")>=5,(SUM(LARGE(C17:J17,{1,2,3,4,5}))),"Not Qualified") -> 690
A18: 15 | B18: BILL BROCHU | C18: 130 | D18: 160 | E18: 100 | F18: 100 | G18: 115 | I18: 85 | K18: =SUM(C18:J18) -> 690 | L18: =IF(COUNTIF(C18:J18,">0")>=5,(SUM(LARGE(C18:J18,{1,2,3,4,5,6}))),"Not Qualified") -> 690
A19: 16 | B19: BOBBY SMITH | C19: 110 | E19: 145 | G19: 95 | H19: 55 | I19: 65 | J19: 125 | K19: =SUM(C19:J19) -> 595 | L19: =IF(COUNTIF(C19:J19,">0")>=5,(SUM(LARGE(C19:J19,{1,2,3,4,5,6}))),"Not Qualified") -> 595
A20: 17 | B20: ROGER GARRET | E20: 95 | G20: 130 | H20: 155 | I20: 105 | J20: 100 | K20: =SUM(C20:J20) -> 585 | L20: =IF(COUNTIF(C20:J20,">0")>=5,(SUM(LARGE(C20:J20,{1,2,3,4,5}))),"Not Qualified") -> 585
A21: 18 | B21: ROBB DAVIS | C21: 120 | F21: 75 | G21: 135 | H21: 90 | J21: 105 | K21: =SUM(C21:J21) -> 525 | L21: =IF(COUNTIF(C21:J21,">0")>=5,(SUM(LARGE(C21:J21,{1,2,3,4,5}))),"Not Qualified") -> 525
A22: 19 | B22: ANDY TURNBULL | C22: 125 | E22: 105 | F22: 55 | I22: 110 | J22: 115 | K22: =SUM(C22:J22) -> 510 | L22: 510
A23: 20 | B23: JIM EWING | E23: 120 | F23: 85 | H23: 135 | I23: 90 | J23: 80 | K23: =SUM(C23:J23) -> 510 | L23: =IF(COUNTIF(C23:J23,">0")>=5,(SUM(LARGE(C23:J23,{1,2,3,4,5}))),"Not Qualified") -> 510
A24: 21 | B24: MICHAEL HARRIS | C24: 70 | E24: 135 | F24: 95 | H24: 110 | I24: 60 | K24: =SUM(C24:J24) -> 470 | L24: =IF(COUNTIF(C24:J24,">0")>=5,(SUM(LARGE(C24:J24,{1,2,3,4,5}))),"Not Qualified") -> 470
A25: 22 | B25: JEFF ROONEY | D25: 55 | E25: 80 | F25: 50 | G25: 110 | H25: 70 | J25: 75 | K25: =SUM(C25:J25) -> 440 | L25: =IF(COUNTIF(C25:J25,">0")>=5,(SUM(LARGE(C25:J25,{1,2,3,4,5,6}))),"Not Qualified") -> 440
A26: 23 | B26: TODD WAGNER | C26: 65 | E26: 75 | F26: 45 | G26: 100 | H26: 80 | I26: 50 | K26: =SUM(C26:J26) -> 415 | L26: =IF(COUNTIF(C26:J26,">0")>=5,(SUM(LARGE(C26:J26,{1,2,3,4,5,6}))),"Not Qualified") -> 415
A27: 24 | B27: ERIC ANDUZE | C27: 75 | D27: 150 | E27: 30 | G27: 75 | H27: 45 | J27: 30 | K27: =SUM(C27:J27) -> 405 | L27: =IF(COUNTIF(C27:J27,">0")>=5,(SUM(LARGE(C27:J27,{1,2,3,4,5,6}))),"Not Qualified") -> 405
A28: 25 | B28: MICHAEL SCHNEKSER | C28: 100 | D28: 140 | E28: 20 | F28: 40 | G28: 55 | J28: 5 | K28: =SUM(C28:J28) -> 360 | L28: =IF(COUNTIF(C28:J28,">0")>=5,(SUM(LARGE(C28:J28,{1,2,3,4,5,6}))),"Not Qualified") -> 360
A29: 26 | B29: JAMES ROBINSON | E29: 70 | F29: 35 | G29: 85 | H29: 60 | I29: 80 | K29: =SUM(C29:J29) -> 330 | L29: =IF(COUNTIF(C29:J29,">0")>=5,(SUM(LARGE(C29:J29,{1,2,3,4,5}))),"Not Qualified") -> 330
A30: 27 | B30: NEAL DAVIS | C30: 5 | D30: 135 | G30: 20 | H30: 75 | I30: 35 | J30: 60 | K30: =SUM(C30:J30) -> 330 | L30: =IF(COUNTIF(C30:J30,">0")>=5,(SUM(LARGE(C30:J30,{1,2,3,4,5,6}))),"Not Qualified") -> 330
A31: 28 | B31: DAVE MCLAUGHLIN | C31: 10 | D31: 115 | E31: 60 | G31: 35 | H31: 5 | K31: =SUM(C31:J31) -> 225 | L31: =IF(COUNTIF(C31:J31,">0")>=5,(SUM(LARGE(C31:J31,{1,2,3,4,5}))),"Not Qualified") -> 225
A32: 29 | B32: ROY ARMSTRONG | C32: 40 | E32: 5 | H32: 50 | I32: 70 | J32: 15 | K32: =SUM(C32:J32) -> 180 | L32: =IF(COUNTIF(C32:J32,">0")>=5,(SUM(LARGE(C32:J32,{1,2,3,4,5}))),"Not Qualified") -> 180
A33: 30 | B33: STAN VANN | C33: 145 | E33: 155 | I33: 155 | K33: =SUM(C33:J33) -> 455 | L33: -
A34: 31 | B34: DAVE CUTCHINS | C34: 55 | F34: 105 | H34: 125 | I34: 125 | K34: =SUM(C34:J34) -> 410 | L34: -
A35: 32 | B35: STEVE DASHER | C35: 60 | D35: 80 | I35: 115 | J35: 70 | K35: =SUM(C35:J35) -> 325 | L35: -
A36: 33 | B36: STEVE SHELL | C36: 85 | D36: 130 | G36: 15 | J36: 45 | K36: =SUM(C36:J36) -> 275 | L36: -
A37: 34 | B37: DONNA MARX | D37: 15 | F37: 90 | G37: 155 | K37: =SUM(C37:J37) -> 260 | L37: -
A38: 35 | B38: REX HARRIS | D38: 110 | G38: 40 | H38: 95 | K38: =SUM(C38:J38) -> 245 | L38: -
A39: 36 | B39: CAMERON MCCORMICK | D39: 85 | G39: 65 | J39: 65 | K39: =SUM(C39:J39) -> 215 | L39: -
A40: 37 | B40: CURTIS STAPLES | E40: 65 | F40: 60 | I40: 75 | K40: =SUM(C40:J40) -> 200 | L40: -
A41: 38 | B41: JAMES HARRIS | E41: 40 | F41: 70 | H41: 85 | K41: =SUM(C41:J41) -> 195 | L41: -
A42: 39 | B42: KEATH MARX | F42: 135 | G42: 50 | K42: =SUM(C42:J42) -> 185 | L42: -
A43: 40 | B43: JOHN SETTLE | D43: 125 | F43: 15 | K43: =SUM(C43:J43) -> 140 | L43: -
A44: 41 | B44: TERRY ZACH | D44: 120 | K44: =SUM(C44:J44) -> 120 | L44: -
A45: 42 | B45: JEFF CHENERY | F45: 80 | I45: 40 | K45: =SUM(C45:J45) -> 120 | L45: -
A46: 43 | B46: DUSTIN MERGI | C46: 50 | E46: 35 | G46: 30 | K46: =SUM(C46:J46) -> 115 | L46: -
A47: 44 | B47: BOB BROCHU | F47: 110 | K47: =SUM(C47:J47) -> 110 | L47: -
A48: 45 | B48: JIM SETZER | E48: 85 | F48: 25 | K48: =SUM(C48:J48) -> 110 | L48: -
A49: 46 | B49: BIFF JENNINGS | F49: 20 | G49: 25 | H49: 20 | I49: 45 | K49: =SUM(C49:J49) -> 110 | L49: -
A50: 47 | B50: TRAVIS BOYER | D50: 105 | K50: =SUM(C50:J50) -> 105 | L50: -
A51: 48 | B51: ROLAND WALLNER | E51: 45 | G51: 60 | K51: =SUM(C51:J51) -> 105 | L51: -
A52: 49 | B52: CARL JUNEAU | D52: 95 | K52: =SUM(C52:J52) -> 95 | L52: -
A53: 50 | B53: SEAN MCCONNELL | D53: 90 | K53: =SUM(C53:J53) -> 90 | L53: -
A54: 51 | B54: DUNCAN ELLIS | J54: 90 | K54: 90 | L54: -
A55: 52 | B55: JOHN WILLEMIN | J55: 85 | K55: 85 | L55: -
A56: 53 | B56: JIM HERLEY | C56: 80 | K56: =SUM(C56:J56) -> 80 | L56: -
A57: 54 | B57: SCOTT HOPKINS | G57: 80 | K57: =SUM(C57:J57) -> 80 | L57: -
A58: 55 | B58: COREY MAPLES | E58: 15 | H58: 65 | K58: =SUM(C58:J58) -> 80 | L58: -
A59: 56 | B59: RUSS PARHAM | D59: 75 | K59: =SUM(C59:J59) -> 75 | L59: -
A60: 57 | B60: BRANDON CHARLSTON | F60: 30 | G60: 45 | K60: =SUM(C60:J60) -> 75 | L60: -
A61: 58 | B61: AARON JENNINGS | G61: 10 | H61: 40 | I61: 25 | K61: =SUM(C61:J61) -> 75 | L61: -
A62: 59 | B62: PETER AQUINO | D62: 70 | K62: =SUM(C62:J62) -> 70 | L62: -
A63: 60 | B63: JOHN WILLEMIN | F63: 65 | K63: =SUM(C63:J63) -> 65 | L63: -
A64: 61 | B64: KEITH MAPLES | D64: 35 | H64: 30 | K64: =SUM(C64:J64) -> 65 | L64: -
A65: 62 | B65: MARC LISNER | C65: 45 | E65: 10 | I65: 10 | K65: =SUM(C65:J65) -> 65 | L65: -
A66: 63 | B66: JOE CECELIC | D66: 60 | K66: =SUM(C66:J66) -> 60 | L66: -
A67: 64 | B67: CHRISTOPHER SAMULSKI | C67: 35 | E67: 25 | K67: =SUM(C67:J67) -> 60 | L67: -
A68: 65 | B68: CHRIS SWEARINGEN | I68: 55 | K68: =SUM(C68:J68) -> 55 | L68: -
A69: 66 | B69: YAROSLAV BURMAKA | J69: 55 | K69: 55 | L69: -
A70: 67 | B70: MILLS ROBINSON | J70: 50 | K70: 50 | L70: -
A71: 68 | B71: JEFF JASMER | D71: 50 | K71: =SUM(C71:J71) -> 50 | L71: -
A72: 69 | B72: KEITH EDWARDS | D72: 45 | K72: =SUM(C72:J72) -> 45 | L72: -
A73: 70 | B73: TOM TYE | D73: 40 | K73: =SUM(C73:J73) -> 40 | L73: -
A74: 71 | B74: TRAVIS FINLAY | J74: 40 | K74: 40 | L74: -
A75: 72 | B75: MICHAEL ARRIGO | H75: 35 | K75: =SUM(C75:J75) -> 35 | L75: -
A76: 73 | B76: KEITH KASMIRE | D76: 30 | K76: =SUM(C76:J76) -> 30 | L76: -
A77: 74 | B77: GRAY MILTEER | C77: 30 | K77: =SUM(C77:J77) -> 30 | L77: -
A78: 75 | B78: MIKE POWERS | I78: 30 | K78: =SUM(C78:J78) -> 30 | L78: -
A79: 76 | B79: BENJAMIN SMITH | D79: 25 | K79: =SUM(C79:J79) -> 25 | L79: -
A80: 77 | B80: VINCENT CONTE | H80: 25 | K80: =SUM(C80:J80) -> 25 | L80: -
A81: 78 | B81: ADAM GRABOWSKI | J81: 25 | K81: 25 | L81: -
A82: 79 | B82: AARON CROWDER | H82: 10 | I82: 15 | K82: 25 | L82: -
A83: 80 | B83: SCOTT FARRELL | D83: 20 | K83: =SUM(C83:J83) -> 20 | L83: -
A84: 81 | B84: WES MICHAELS | C84: 20 | K84: =SUM(C84:J84) -> 20 | L84: -
A85: 82 | B85: ED ODONNELL | J85: 20 | K85: 20 | L85: -
A86: 83 | B86: ANGELA WOOD | J86: 10 | K86: 10 | L86: -