D1: 2008 Events
A2: CLASS | B2: POS | C2: DRIVER | D2: March | E2: April | F2: May | G2: June | H2: July | I2: Aug | J2: Sept | K2: Nov | L2: TOTAL | M2: Best 6 of 8
M3: 5 to qualify for award
A5: ASP | B5: 1 | C5: MICHAEL TWIFORD | D5: 9 | E5: 7 | F5: 12 | G5: 12 | H5: 12 | I5: 7 | K5: 12 | L5: =SUM(D5:K5) -> 71 | M5: =IF(COUNTIF(D5:K5,">0")>=5,(SUM(LARGE(D5:K5,{1,2,3,4,5,6}))),"Not Qualified") -> 64
B6: 2 | C6: GREG KOTESKI | D6: 12 | F6: 6 | G6: 9 | H6: 9 | I6: 12 | J6: 12 | K6: 9 | L6: =SUM(D6:K6) -> 69 | M6: =IF(COUNTIF(D6:K6,">0")>=5,(SUM(LARGE(D6:K6,{1,2,3,4,5,6}))),"Not Qualified") -> 63
B7: 3 | C7: DAVID SKITTLETHORP | D7: 7 | E7: 12 | F7: 9 | G7: 7 | H7: 6 | I7: 6 | J7: 7 | K7: 6 | L7: =SUM(D7:K7) -> 60 | M7: =IF(COUNTIF(D7:K7,">0")>=5,(SUM(LARGE(D7:K7,{1,2,3,4,5,6}))),"Not Qualified") -> 48
B8: 4 | C8: ROGER GARRETT | F8: 7 | H8: 7 | I8: 9 | J8: 9 | K8: 7 | L8: =SUM(D8:K8) -> 39 | M8: =IF(COUNTIF(D8:K8,">0")>=5,(SUM(LARGE(D8:K8,{1,2,3,4,5}))),"Not Qualified") -> 39
B9: 5 | C9: REX HARRIS | D9: 5 | E9: 9 | F9: 5 | H9: 5 | I9: 5 | J9: 6 | L9: =SUM(D9:K9) -> 35 | M9: =IF(COUNTIF(D9:K9,">0")>=5,(SUM(LARGE(D9:K9,{1,2,3,4,5,6}))),"Not Qualified") -> 35
B10: 6 | C10: CLAYTON JOHNSON | D10: 4 | E10: 6 | G10: 5 | I10: 4 | L10: =SUM(D10:K10) -> 19 | M10: -
B11: 7 | C11: HARRY WATSON | I11: 3 | J11: 5 | L11: =SUM(D11:K11) -> 8 | M11: -
B12: 8 | C12: DANIEL HILL | D12: 6 | L12: =SUM(D12:K12) -> 6 | M12: -
B13: 9 | C13: DOUG WINKLER | G13: 6 | L13: =SUM(D13:K13) -> 6 | M13: -
B14: 10 | C14: JOSH CANADA | F14: 4 | L14: =SUM(D14:K14) -> 4 | M14: -
B15: 11 | C15: BRET WEBER | G15: 4 | L15: =SUM(D15:K15) -> 4 | M15: -
A18: BSP | B18: 1 | C18: TODD WAGNER | D18: 9 | F18: 9 | G18: 12 | H18: 12 | I18: 12 | J18: 9 | L18: =SUM(D18:K18) -> 63 | M18: =IF(COUNTIF(D18:K18,">0")>=5,(SUM(LARGE(D18:K18,{1,2,3,4,5,6}))),"Not Qualified") -> 63
B19: 2 | C19: GREGORY SMITH | G19: 6 | H19: 6 | I19: 4 | J19: 5 | K19: 9 | L19: =SUM(D19:K19) -> 30 | M19: =IF(COUNTIF(D19:K19,">0")>=5,(SUM(LARGE(D19:K19,{1,2,3,4,5}))),"Not Qualified") -> 30
B20: 3 | C20: BOBBY SMITH | D20: 12 | H20: 9 | I20: 9 | J20: 12 | L20: =SUM(D20:K20) -> 42 | M20: -
B21: 4 | C21: ANDREW CHISHOLM | G21: 7 | I21: 7 | J21: 6 | K21: 12 | L21: =SUM(D21:K21) -> 32 | M21: -
B22: 5 | C22: JIM SETZER | F22: 12 | G22: 9 | L22: =SUM(D22:K22) -> 21 | M22: -
B23: 6 | C23: DEREK OBI | G23: 5 | J23: 7 | L23: =SUM(D23:K23) -> 12 | M23: -
B24: 7 | C24: BRETT BAKER | D24: 7 | L24: =SUM(D24:K24) -> 7 | M24: -
B25: 8 | C25: DONALD STRIFLER | H25: 7 | L25: =SUM(D25:K25) -> 7 | M25: -
B26: 9 | C26: ROB ANDERSON | D26: 6 | L26: =SUM(D26:K26) -> 6 | M26: -
B27: 10 | C27: BILL LAKIN | I27: 6 | L27: =SUM(D27:K27) -> 6 | M27: -
B28: 11 | C28: JAMES WATSON | I28: 5 | L28: =SUM(D28:K28) -> 5 | M28: -
A31: CSP | B31: 1 | C31: JIM HALTOM | F31: 12 | G31: 12 | H31: 9 | I31: 12 | J31: 12 | K31: 12 | L31: =SUM(D31:K31) -> 69 | M31: =IF(COUNTIF(D31:K31,">0")>=5,(SUM(LARGE(D31:K31,{1,2,3,4,5,6}))),"Not Qualified") -> 69
B32: 2 | C32: MICHAEL HARRIS | D32: 12 | F32: 9 | G32: 9 | I32: 9 | J32: 7 | L32: =SUM(D32:K32) -> 46 | M32: =IF(COUNTIF(D32:K32,">0")>=5,(SUM(LARGE(D32:K32,{1,2,3,4,5}))),"Not Qualified") -> 46
B33: 3 | C33: JAMES ROBINSON | D33: 7 | F33: 7 | G33: 6 | H33: 7 | I33: 6 | J33: 9 | L33: =SUM(D33:K33) -> 42 | M33: =IF(COUNTIF(D33:K33,">0")>=5,(SUM(LARGE(D33:K33,{1,2,3,4,5,6}))),"Not Qualified") -> 42
B34: 4 | C34: KEITH EDWARDS | D34: 4 | E34: 12 | F34: 2 | G34: 3 | H34: 4 | J34: 1 | K34: 7 | L34: =SUM(D34:K34) -> 33 | M34: =IF(COUNTIF(D34:K34,">0")>=5,(SUM(LARGE(D34:K34,{1,2,3,4,5,6}))),"Not Qualified") -> 32
B35: 5 | C35: BERNIE CHMIELEWSKI | E35: 7 | F35: 4 | G35: 5 | I35: 3 | J35: 4 | K35: 9 | L35: =SUM(D35:K35) -> 32 | M35: =IF(COUNTIF(D35:K35,">0")>=5,(SUM(LARGE(D35:K35,{1,2,3,4,5,6}))),"Not Qualified") -> 32
B36: 6 | C36: VINCENT CONTE | E36: 4 | F36: 3 | G36: 4 | H36: 6 | I36: 5 | J36: 5 | L36: =SUM(D36:K36) -> 27 | M36: =IF(COUNTIF(D36:K36,">0")>=5,(SUM(LARGE(D36:K36,{1,2,3,4,5,6}))),"Not Qualified") -> 27
B37: 7 | C37: LEE HASSIG | E37: 5 | F37: 1 | G37: 2 | H37: 3 | J37: 2 | L37: =SUM(D37:K37) -> 13 | M37: =IF(COUNTIF(D37:K37,">0")>=5,(SUM(LARGE(D37:K37,{1,2,3,4,5}))),"Not Qualified") -> 13
B38: 8 | C38: JAMES HARRIS | D38: 6 | F38: 6 | G38: 7 | I38: 7 | L38: =SUM(D38:K38) -> 26 | M38: -
B39: 9 | C39: CHRISTOPHER SAMULSKI | D39: 9 | E39: 6 | F39: 5 | I39: 4 | L39: =SUM(D39:K39) -> 24 | M39: -
B40: 10 | C40: JOHN DAWSON | E40: 9 | F40: 1 | H40: 5 | J40: 3 | L40: =SUM(D40:K40) -> 18 | M40: -
B41: 11 | C41: ED RAYMUNDO | H41: 12 | L41: =SUM(D41:K41) -> 12 | M41: -
B42: 12 | C42: MIKE POWERS | J42: 6 | L42: =SUM(D42:K42) -> 6 | M42: -
A45: DSP | B45: 1 | C45: TOM BLEH | D45: 12 | E45: 12 | F45: 12 | G45: 12 | H45: 12 | I45: 12 | J45: 12 | K45: 9 | L45: =SUM(D45:K45) -> 93 | M45: =IF(COUNTIF(D45:K45,">0")>=5,(SUM(LARGE(D45:K45,{1,2,3,4,5,6}))),"Not Qualified") -> 72
B46: 2 | C46: DOUG KEILER | D46: 9 | E46: 9 | F46: 9 | G46: 9 | I46: 9 | J46: 9 | K46: 12 | L46: =SUM(D46:K46) -> 66 | M46: =IF(COUNTIF(D46:K46,">0")>=5,(SUM(LARGE(D46:K46,{1,2,3,4,5,6}))),"Not Qualified") -> 57
B47: 3 | C47: ROLAND WALLNER | F47: 7 | H47: 9 | L47: =SUM(D47:K47) -> 16 | M47: =IF(COUNTIF(D47:K47,">0")>=5,(SUM(LARGE(D47:K47,{1,2,3,4,5}))),"Not Qualified") -> Not Qualified
B48: 5 | C48: SCOTT HAYNES | D48: 7 | H48: 7 | L48: =SUM(D48:K48) -> 14 | M48: =IF(COUNTIF(D48:K48,">0")>=5,(SUM(LARGE(D48:K48,{1,2,3,4,5}))),"Not Qualified") -> Not Qualified
B49: 6 | C49: JAMES PFEIFFER | D49: 6 | L49: =SUM(D49:K49) -> 6 | M49: =IF(COUNTIF(D49:K49,">0")>=5,(SUM(LARGE(D49:K49,{1,2,3,4,5}))),"Not Qualified") -> Not Qualified
A52: ESP | B52: 1 | C52: BILL BROCHU | D52: 12 | E52: 12 | F52: 9 | G52: 12 | H52: 12 | J52: 9 | L52: =SUM(D52:K52) -> 66 | M52: =IF(COUNTIF(D52:K52,">0")>=5,(SUM(LARGE(D52:K52,{1,2,3,4,5,6}))),"Not Qualified") -> 66
B53: 2 | C53: JIM EWING | F53: 12 | G53: 9 | I53: 12 | J53: 12 | K53: 12 | L53: =SUM(D53:K53) -> 57 | M53: =IF(COUNTIF(D53:K53,">0")>=5,(SUM(LARGE(D53:K53,{1,2,3,4,5}))),"Not Qualified") -> 57
B54: 3 | C54: JOHN SETTLE | D54: 7 | E54: 9 | F54: 5 | G54: 7 | I54: 7 | J54: 5 | K54: 7 | L54: =SUM(D54:K54) -> 47 | M54: =IF(COUNTIF(D54:K54,">0")>=5,(SUM(LARGE(D54:K54,{1,2,3,4,5,6}))),"Not Qualified") -> 42
B55: 4 | C55: PETER FLORANCE | D55: 6 | G55: 5 | H55: 7 | I55: 6 | J55: 7 | K55: 9 | L55: =SUM(D55:K55) -> 40 | M55: =IF(COUNTIF(D55:K55,">0")>=5,(SUM(LARGE(D55:K55,{1,2,3,4,5,6}))),"Not Qualified") -> 40
B56: 5 | C56: TOM VINCENT | E56: 6 | F56: 4 | G56: 4 | J56: 6 | K56: 5 | L56: =SUM(D56:K56) -> 25 | M56: =IF(COUNTIF(D56:K56,">0")>=5,(SUM(LARGE(D56:K56,{1,2,3,4,5}))),"Not Qualified") -> 25
B57: 6 | C57: MANUEL DESANTOS | D57: 5 | E57: 5 | F57: 3 | G57: 3 | I57: 4 | J57: 4 | L57: =SUM(D57:K57) -> 24 | M57: =IF(COUNTIF(D57:K57,">0")>=5,(SUM(LARGE(D57:K57,{1,2,3,4,5}))),"Not Qualified") -> 21
B58: 7 | C58: ANTHONY GORGONE | E58: 7 | F58: 6 | I58: 9 | K58: 6 | L58: =SUM(D58:K58) -> 28 | M58: -
B59: 8 | C59: DUSTIN MERGI | D59: 9 | F59: 7 | H59: 9 | L59: =SUM(D59:K59) -> 25 | M59: -
B60: 9 | C60: CURTIS BURNETTE | D60: 4 | H60: 6 | I60: 3 | L60: =SUM(D60:K60) -> 13 | M60: -
B61: 10 | C61: STEVE POOLE | G61: 6 | L61: =SUM(D61:K61) -> 6 | M61: -
B62: 11 | C62: MICHAEL STRYER | I62: 5 | L62: =SUM(D62:K62) -> 5 | M62: -
A65: FSP | B65: 1 | C65: STEVE SHELL | D65: 12 | F65: 9 | H65: 12 | K65: 12 | L65: =SUM(D65:K65) -> 45 | M65: -
B66: 2 | C66: KEITH MAPLES | F66: 7 | I66: 9 | J66: 12 | K66: 9 | L66: =SUM(D66:K66) -> 37 | M66: -
B67: 3 | C67: COREY MAPLES | F67: 12 | I67: 12 | L67: =SUM(D67:K67) -> 24 | M67: -
B68: 4 | C68: FRANK LACOSTA | H68: 9 | L68: =SUM(D68:K68) -> 9 | M68: -
B69: 5 | C69: SCOTT FARRELL | K69: 7 | L69: 7 | M69: -