C1: 2008 Events - Top 10 Novice times for each event
A2: POS | B2: DRIVER | C2: March | D2: April | E2: May | F2: June | G2: July | H2: Aug | I2: Sept | J2: Nov | K2: TOTAL | L2: Best 6 of 8
L3: 5 to qualify for award
A4: 1 | B4: STEVE FEHR | D4: 9 | E4: 9 | G4: 9 | H4: 12 | I4: 9 | K4: =SUM(C4:J4) -> 48 | L4: =IF(COUNTIF(C4:J4,">0")>=5,(SUM(LARGE(C4:J4,{1,2,3,4,5}))),"Not Qualified") -> 48
A5: 2 | B5: RICK LOCKE | C5: 9 | E5: 12 | G5: 12 | K5: =SUM(C5:J5) -> 33 | L5: =IF(COUNTIF(C5:J5,">0")>=5,(SUM(LARGE(C5:J5,{1,2,3,4,5}))),"Not Qualified") -> Not Qualified
A6: 3 | B6: ERIC ANDERSON | C6: 6 | D6: 4 | E6: 6 | G6: 7 | K6: =SUM(C6:J6) -> 23 | L6: =IF(COUNTIF(C6:J6,">0")>=5,(SUM(LARGE(C6:J6,{1,2,3,4,5}))),"Not Qualified") -> Not Qualified
A7: 4 | B7: EVERETTE BEATLEY | C7: 5 | D7: 6 | F7: 9 | H7: 3 | K7: =SUM(C7:J7) -> 23 | L7: =IF(COUNTIF(C7:J7,">0")>=5,(SUM(LARGE(C7:J7,{1,2,3,4,5}))),"Not Qualified") -> Not Qualified
A8: 5 | B8: SEAN SULLIVAN | D8: 12 | E8: 7 | K8: =SUM(C8:J8) -> 19 | L8: =IF(COUNTIF(C8:J8,">0")>=5,(SUM(LARGE(C8:J8,{1,2,3,4,5}))),"Not Qualified") -> Not Qualified
A9: 6 | B9: BRIAN BARCLAY | E9: 5 | I9: 12 | K9: =SUM(C9:J9) -> 17 | L9: =IF(COUNTIF(C9:J9,">0")>=5,(SUM(LARGE(C9:J9,{1,2,3,4,5}))),"Not Qualified") -> Not Qualified
A10: 7 | B10: PATRICK GERBUS | D10: 3 | G10: 4 | I10: 6 | K10: =SUM(C10:J10) -> 13 | L10: =IF(COUNTIF(C10:J10,">0")>=5,(SUM(LARGE(C10:J10,{1,2,3,4,5}))),"Not Qualified") -> Not Qualified
A11: 8 | B11: DEREK MAYNARD | C11: 12 | K11: =SUM(C11:J11) -> 12 | L11: =IF(COUNTIF(C11:J11,">0")>=5,(SUM(LARGE(C11:J11,{1,2,3,4,5}))),"Not Qualified") -> Not Qualified
A12: 9 | B12: SCOTT HAYNES | F12: 12 | K12: =SUM(C12:J12) -> 12 | L12: =IF(COUNTIF(C12:J12,">0")>=5,(SUM(LARGE(C12:J12,{1,2,3,4,5}))),"Not Qualified") -> Not Qualified
A13: 10 | B13: SEAN WHITAKER | C13: 3 | F13: 7 | K13: =SUM(C13:J13) -> 10 | L13: =IF(COUNTIF(C13:J13,">0")>=5,(SUM(LARGE(C13:J13,{1,2,3,4,5}))),"Not Qualified") -> Not Qualified
A14: 11 | B14: STEVE DODSON | H14: 9 | K14: =SUM(C14:J14) -> 9 | L14: =IF(COUNTIF(C14:J14,">0")>=5,(SUM(LARGE(C14:J14,{1,2,3,4,5}))),"Not Qualified") -> Not Qualified
A15: 12 | B15: ANDREW MONN | D15: 1 | I15: 7 | K15: =SUM(C15:J15) -> 8 | L15: =IF(COUNTIF(C15:J15,">0")>=5,(SUM(LARGE(C15:J15,{1,2,3,4,5}))),"Not Qualified") -> Not Qualified
A16: 13 | B16: RICHARD CLAGETT | C16: 7 | K16: =SUM(C16:J16) -> 7 | L16: =IF(COUNTIF(C16:J16,">0")>=5,(SUM(LARGE(C16:J16,{1,2,3,4,5}))),"Not Qualified") -> Not Qualified
A17: 14 | B17: ADAM HAYNES | D17: 7 | K17: =SUM(C17:J17) -> 7 | L17: =IF(COUNTIF(C17:J17,">0")>=5,(SUM(LARGE(C17:J17,{1,2,3,4,5}))),"Not Qualified") -> Not Qualified
A18: 15 | B18: DAVID TYLER | H18: 7 | K18: =SUM(C18:J18) -> 7 | L18: =IF(COUNTIF(C18:J18,">0")>=5,(SUM(LARGE(C18:J18,{1,2,3,4,5}))),"Not Qualified") -> Not Qualified
A19: 16 | B19: PAUL BERDOULAY | D19: 2 | E19: 4 | K19: =SUM(C19:J19) -> 6 | L19: =IF(COUNTIF(C19:J19,">0")>=5,(SUM(LARGE(C19:J19,{1,2,3,4,5}))),"Not Qualified") -> Not Qualified
A20: 17 | B20: MIKE VITHA | F20: 6 | K20: =SUM(C20:J20) -> 6 | L20: =IF(COUNTIF(C20:J20,">0")>=5,(SUM(LARGE(C20:J20,{1,2,3,4,5}))),"Not Qualified") -> Not Qualified
A21: 18 | B21: TYLER DAVIDSON | G21: 6 | K21: =SUM(C21:J21) -> 6 | L21: =IF(COUNTIF(C21:J21,">0")>=5,(SUM(LARGE(C21:J21,{1,2,3,4,5}))),"Not Qualified") -> Not Qualified
A22: 19 | B22: CORY CALE | F22: 3 | G22: 2 | H22: 1 | K22: =SUM(C22:J22) -> 6 | L22: =IF(COUNTIF(C22:J22,">0")>=5,(SUM(LARGE(C22:J22,{1,2,3,4,5}))),"Not Qualified") -> Not Qualified
A23: 20 | B23: CHARLES PHILLIPS | H23: 6 | K23: =SUM(C23:J23) -> 6 | L23: =IF(COUNTIF(C23:J23,">0")>=5,(SUM(LARGE(C23:J23,{1,2,3,4,5}))),"Not Qualified") -> Not Qualified
A24: 21 | B24: MATTHEW FOSS | D24: 5 | K24: =SUM(C24:J24) -> 5 | L24: =IF(COUNTIF(C24:J24,">0")>=5,(SUM(LARGE(C24:J24,{1,2,3,4,5}))),"Not Qualified") -> Not Qualified
A25: 22 | B25: ALEX CARLSON | F25: 5 | K25: =SUM(C25:J25) -> 5 | L25: =IF(COUNTIF(C25:J25,">0")>=5,(SUM(LARGE(C25:J25,{1,2,3,4,5}))),"Not Qualified") -> Not Qualified
A26: 23 | B26: DAVID HUNTINGTON | G26: 5 | K26: =SUM(C26:J26) -> 5 | L26: =IF(COUNTIF(C26:J26,">0")>=5,(SUM(LARGE(C26:J26,{1,2,3,4,5}))),"Not Qualified") -> Not Qualified
A27: 24 | B27: JOSEPH GUERRA | G27: 3 | H27: 2 | K27: =SUM(C27:J27) -> 5 | L27: =IF(COUNTIF(C27:J27,">0")>=5,(SUM(LARGE(C27:J27,{1,2,3,4,5}))),"Not Qualified") -> Not Qualified
A28: 25 | B28: STEPHEN NEWTON | H28: 5 | K28: =SUM(C28:J28) -> 5 | L28: =IF(COUNTIF(C28:J28,">0")>=5,(SUM(LARGE(C28:J28,{1,2,3,4,5}))),"Not Qualified") -> Not Qualified
A29: 26 | B29: CHRISTOPHER SHAHSIAH | C29: 4 | K29: =SUM(C29:J29) -> 4 | L29: =IF(COUNTIF(C29:J29,">0")>=5,(SUM(LARGE(C29:J29,{1,2,3,4,5}))),"Not Qualified") -> Not Qualified
A30: 27 | B30: TYLER RAGNOW | F30: 4 | K30: =SUM(C30:J30) -> 4 | L30: =IF(COUNTIF(C30:J30,">0")>=5,(SUM(LARGE(C30:J30,{1,2,3,4,5}))),"Not Qualified") -> Not Qualified
A31: 28 | B31: APRIL ROONEY | H31: 4 | K31: =SUM(C31:J31) -> 4 | L31: =IF(COUNTIF(C31:J31,">0")>=5,(SUM(LARGE(C31:J31,{1,2,3,4,5}))),"Not Qualified") -> Not Qualified
A32: 29 | B32: PHILLIP WILSON | E32: 3 | K32: =SUM(C32:J32) -> 3 | L32: =IF(COUNTIF(C32:J32,">0")>=5,(SUM(LARGE(C32:J32,{1,2,3,4,5}))),"Not Qualified") -> Not Qualified
A33: 30 | B33: ROBERT RINAS | E33: 2 | F33: 1 | K33: =SUM(C33:J33) -> 3 | L33: =IF(COUNTIF(C33:J33,">0")>=5,(SUM(LARGE(C33:J33,{1,2,3,4,5}))),"Not Qualified") -> Not Qualified