D1: 2008 Events
A2: CLASS | B2: POS | C2: DRIVER | D2: March | E2: April | F2: May | G2: June | H2: July | I2: Aug | J2: Sept | K2: Nov | L2: TOTAL | M2: Best 6 of 8
M3: 5 to qualify for award
A5: SS | B5: 1 | C5: GIL SMITH | D5: 9 | G5: 12 | H5: 12 | I5: 12 | J5: 12 | K5: 12 | L5: =SUM(D5:K5) -> 69 | M5: =IF(COUNTIF(D5:K5,">0")>=5,(SUM(LARGE(D5:K5,{1,2,3,4,5,6}))),"Not Qualified") -> 69
B6: 2 | C6: MARC PORTANOVA | D6: 12 | H6: 9 | I6: 9 | K6: 9 | L6: =SUM(D6:K6) -> 39 | M6: -
B7: 3 | C7: KEATH MARX | E7: 9 | G7: 9 | H7: 7 | L7: =SUM(D7:K7) -> 25 | M7: -
B8: 4 | C8: JEFF CHENERY | E8: 12 | L8: =SUM(D8:K8) -> 12 | M8: -
B9: 5 | C9: DONNA MARX | G9: 7 | L9: =SUM(D9:K9) -> 7 | M9: -
A12: AS | B12: 1 | C12: JEFF ROONEY | E12: 9 | F12: 12 | G12: 12 | H12: 12 | I12: 12 | K12: 12 | L12: =SUM(D12:K12) -> 69 | M12: =IF(COUNTIF(D12:K12,">0")>=5,(SUM(LARGE(D12:K12,{1,2,3,4,5,6}))),"Not Qualified") -> 69
B13: 2 | C13: ERIC ANDUZE | D13: 12 | E13: 12 | F13: 9 | H13: 9 | I13: 9 | J13: 12 | K13: 9 | L13: =SUM(D13:K13) -> 72 | M13: =IF(COUNTIF(D13:K13,">0")>=5,(SUM(LARGE(D13:K13,{1,2,3,4,5,6}))),"Not Qualified") -> 63
B14: 3 | C14: ALAN BRODERICK | D14: 9 | F14: 7 | L14: =SUM(D14:K14) -> 16 | M14: -
B15: 4 | C15: JOE CECELIC | G15: 9 | K15: 6 | L15: =SUM(D15:K15) -> 15 | M15: -
B16: 5 | C16: JAMES RODATUS | I16: 7 | L16: =SUM(D16:K16) -> 7 | M16: -
B17: 6 | C17: FREDERICK CAMRON | F17: 6 | L17: =SUM(D17:K17) -> 6 | M17: -
A20: CS | B20: 1 | C20: ROBERT BAUER | D20: 12 | F20: 12 | G20: 12 | H20: 12 | I20: 12 | K20: 9 | L20: =SUM(D20:K20) -> 69 | M20: =IF(COUNTIF(D20:K20,">0")>=5,(SUM(LARGE(D20:K20,{1,2,3,4,5,6}))),"Not Qualified") -> 69
B21: 2 | C21: ANDREW RICHARD | K21: 12 | L21: =SUM(D21:K21) -> 12 | M21: -
A24: DS | B24: 1 | C24: CURTIS STAPLES | F24: 12 | G24: 12 | J24: 9 | L24: =SUM(D24:K24) -> 33 | M24: -
B25: 2 | C25: STEVE DASHER | J25: 12 | K25: 12 | L25: =SUM(D25:K25) -> 24 | M25: -
B26: 3 | C26: WES MICHAELS | D26: 12 | L26: =SUM(D26:K26) -> 12 | M26: -
B27: 4 | C27: FRANKIE CAVAZOS | E27: 12 | L27: =SUM(D27:K27) -> 12 | M27: -
B28: 5 | C28: WILL LANGDON | D28: 9 | L28: =SUM(D28:K28) -> 9 | M28: -
A31: ES | B31: 1 | C31: ED RAYMUNDO | D31: 12 | F31: 12 | I31: 12 | J31: 12 | K31: 12 | L31: =SUM(D31:K31) -> 60 | M31: =IF(COUNTIF(D31:K31,">0")>=5,(SUM(LARGE(D31:K31,{1,2,3,4,5}))),"Not Qualified") -> 60
B32: 2 | C32: ROBB DAVIS | D32: 9 | G32: 12 | H32: 12 | I32: 9 | K32: 9 | L32: =SUM(D32:K32) -> 51 | M32: =IF(COUNTIF(D32:K32,">0")>=5,(SUM(LARGE(D32:K32,{1,2,3,4,5}))),"Not Qualified") -> 51
B33: 3 | C33: BIFF JENNINGS | F33: 7 | G33: 9 | H33: 9 | I33: 6 | J33: 9 | L33: =SUM(D33:K33) -> 40 | M33: =IF(COUNTIF(D33:K33,">0")>=5,(SUM(LARGE(D33:K33,{1,2,3,4,5}))),"Not Qualified") -> 40
B34: 4 | C34: AARON JENNINGS | F34: 9 | G34: 7 | H34: 7 | I34: 7 | J34: 7 | L34: =SUM(D34:K34) -> 37 | M34: =IF(COUNTIF(D34:K34,">0")>=5,(SUM(LARGE(D34:K34,{1,2,3,4,5}))),"Not Qualified") -> 37
B35: 5 | C35: WAYNE LEWIS | E35: 12 | F35: 6 | G35: 6 | I35: 5 | L35: =SUM(D35:K35) -> 29 | M35: -
A38: FS | B38: 1 | C38: MILLS ROBINSON | D38: 9 | F38: 12 | G38: 9 | H38: 12 | I38: 12 | J38: 12 | K38: 9 | L38: =SUM(D38:K38) -> 75 | M38: =IF(COUNTIF(D38:K38,">0")>=5,(SUM(LARGE(D38:K38,{1,2,3,4,5,6}))),"Not Qualified") -> 66
B39: 2 | C39: TERRY BAKER | D39: 12 | G39: 12 | K39: 12 | L39: =SUM(D39:K39) -> 36 | M39: -
B40: 3 | C40: DAVE REISCH | I40: 9 | L40: =SUM(D40:K40) -> 9 | M40: -
B41: 4 | C41: JAMES ROBINSON | K41: 7 | L41: 7 | M41: -
B42: 5 | C42: MARK HAAG | G42: 7 | L42: =SUM(D42:K42) -> 7 | M42: -
A45: GS | B45: 1 | C45: CAMERON MCCORMICK | E45: 12 | H45: 9 | J45: 12 | K45: 12 | L45: =SUM(D45:K45) -> 45 | M45: -
B46: 2 | C46: SCOTT HOPKINS | D46: 7 | H46: 12 | L46: =SUM(D46:K46) -> 19 | M46: -
B47: 3 | C47: TODD HOWES | G47: 12 | H47: 5 | L47: =SUM(D47:K47) -> 17 | M47: -
B48: 4 | C48: JIM HERLEY | D48: 12 | L48: =SUM(D48:K48) -> 12 | M48: -
B49: 5 | C49: BERNIE CHMIELEWSKI | D49: 9 | L49: =SUM(D49:K49) -> 9 | M49: -
B50: 6 | C50: BERNIE CHMIELEWSKI | H50: 7 | L50: =SUM(D50:K50) -> 7 | M50: -
B51: 7 | C51: DEREK MAYNARD | H51: 6 | L51: =SUM(D51:K51) -> 6 | M51: -
B52: 8 | C52: CAROL BASS | H52: 4 | L52: =SUM(D52:K52) -> 4 | M52: -
B53: 9 | C53: RAY HOPKINS | H53: 3 | L53: =SUM(D53:K53) -> 3 | M53: -
A56: HS | B56: 1 | C56: ROY ARMSTRONG | D56: 12 | F56: 12 | H56: 12 | I56: 12 | J56: 9 | K56: 12 | L56: =SUM(D56:K56) -> 69 | M56: =IF(COUNTIF(D56:K56,">0")>=5,(SUM(LARGE(D56:K56,{1,2,3,4,5}))),"Not Qualified") -> 60
B57: 2 | C57: ANDREW MONN | F57: 9 | H57: 9 | I57: 9 | L57: =SUM(D57:K57) -> 27 | M57: -
B58: 3 | C58: TERRY BAKER | J58: 12 | L58: =SUM(D58:K58) -> 12 | M58: -
B59: 4 | C59: STEVE SHELL | E59: 12 | L59: =SUM(D59:K59) -> 12 | M59: -
B60: 5 | C60: WILL PHELPS | K60: 9 | L60: 9 | M60: -
B61: 6 | C61: PAXTON O'TOOLE | K61: 7 | L61: 7 | M61: -
B62: 7 | C62: MICHAEL SCHNEKSER | J62: 7 | L62: =SUM(D62:K62) -> 7 | M62: -
B63: 8 | C63: JEFF SCHIDMT | J63: 6 | L63: =SUM(D63:K63) -> 6 | M63: -
A66: LAD | B66: 1 | C66: ANGELA WOOD | F66: 6 | G66: 7 | H66: 2 | I66: 7 | J66: 12 | K66: 12 | L66: =SUM(D66:K66) -> 46 | M66: =IF(COUNTIF(D66:K66,">0")>=5,(SUM(LARGE(D66:K66,{1,2,3,4,5,6}))),"Not Qualified") -> 46
B67: 2 | C67: LELANE LEMOND | D67: 7 | E67: 7 | F67: 4 | G67: 1 | H67: 4 | I67: 12 | J67: 7 | K67: 7 | L67: =SUM(D67:K67) -> 49 | M67: =IF(COUNTIF(D67:K67,">0")>=5,(SUM(LARGE(D67:K67,{1,2,3,4,5,6}))),"Not Qualified") -> 44
B68: 3 | C68: CINDY LAKIN | F68: 9 | G68: 3 | H68: 9 | I68: 9 | J68: 6 | K68: 5 | L68: =SUM(D68:K68) -> 41 | M68: =IF(COUNTIF(D68:K68,">0")>=5,(SUM(LARGE(D68:K68,{1,2,3,4,5,6}))),"Not Qualified") -> 41
B69: 4 | C69: MANDI GREGG | F69: 12 | G69: 9 | H69: 7 | I69: 6 | J69: 5 | L69: =SUM(D69:K69) -> 39 | M69: =IF(COUNTIF(D69:K69,">0")>=5,(SUM(LARGE(D69:K69,{1,2,3,4,5}))),"Not Qualified") -> 39
B70: 5 | C70: BECKY WINNER | D70: 9 | E70: 9 | F70: 5 | G70: 5 | H70: 5 | J70: 3 | K70: 4 | L70: =SUM(D70:K70) -> 40 | M70: =IF(COUNTIF(D70:K70,">0")>=5,(SUM(LARGE(D70:K70,{1,2,3,4,5,6}))),"Not Qualified") -> 37
B71: 6 | C71: SHANNON HALTOM | F71: 7 | G71: 6 | H71: 6 | I71: 5 | J71: 4 | L71: =SUM(D71:K71) -> 28 | M71: =IF(COUNTIF(D71:K71,">0")>=5,(SUM(LARGE(D71:K71,{1,2,3,4,5}))),"Not Qualified") -> 28
B72: 7 | C72: CANDACE CROWDER | D72: 5 | E72: 4 | F72: 3 | G72: 2 | H72: 3 | I72: 4 | J72: 2 | L72: =SUM(D72:K72) -> 23 | M72: =IF(COUNTIF(D72:K72,">0")>=5,(SUM(LARGE(D72:K72,{1,2,3,4,5,6}))),"Not Qualified") -> 21
B73: 8 | C73: DONNA MARX | E73: 12 | H73: 12 | L73: =SUM(D73:K73) -> 24 | M73: -
B74: 9 | C74: ELAINE SHELL | D74: 12 | F74: 2 | G74: 4 | L74: =SUM(D74:K74) -> 18 | M74: -
B75: 10 | C75: CECILE TURNBULL | J75: 9 | K75: 9 | L75: =SUM(D75:K75) -> 18 | M75: -
B76: 11 | C76: MARIBETH CUPPS | G76: 12 | L76: =SUM(D76:K76) -> 12 | M76: -