D3: PAX | E3: time | F3: index
J4: PAX | K4: time | L4: index
A5: 1 | B5: jeff chenrey | C5: sts | D5: 0.81599999999999995 | E5: 41.936999999999998 | F5: =PRODUCT(D5:E5) -> 34.220591999999996
H6: =IF(E5*E7=0,"No Driver",IF(F5<F7,B5,B7)) -> jeff chenrey | I6: =IF(E5*E7=0,"No class",IF(F5<F7,C5,C7)) -> sts | J6: =IF(E5*E7=0,"No Pax",IF(F5<F7,D5,D7)) -> 0.81599999999999995 | K6: 43.805 | L6: =PRODUCT(J6:K6) -> 35.744879999999995 | P6: PAX | Q6: time | R6: index
A7: 9 | B7: audie | C7: sts | D7: 0.81599999999999995 | E7: 44.619 | F7: =PRODUCT(D7:E7) -> 36.409103999999999
N8: =IF(K6*K10=0,"No Driver",IF(L6<L10,H6,H10)) -> jeff chenrey | O8: =IF(K6*K10=0,"No Class",IF(L6<L10,I6,I10)) -> sts | P8: =IF(K6*K10=0,"No PAX",IF(L6<L10,J6,J10)) -> 0.81599999999999995 | Q8: 41.292000000000002 | R8: =PRODUCT(P8:Q8) -> 33.694271999999998
A9: 5 | B9: les banyas | C9: cs | D9: 0.83099999999999996 | E9: 42.116999999999997 | F9: =PRODUCT(D9:E9) -> 34.999226999999998
H10: =IF(E9*E11=0,"No Driver",IF(F9<F11,B9,B11)) -> les banyas | I10: =IF(E9*E11=0,"No class",IF(F9<F11,C9,C11)) -> cs | J10: =IF(E9*E11=0,"No Pax",IF(F9<F11,D9,D11)) -> 0.83099999999999996 | K10: 46.694000000000003 | L10: =PRODUCT(J10:K10) -> 38.802714000000002 | V10: PAX | W10: time | X10: index
A11: 13 | B11: robb davis | C11: es | D11: 0.81699999999999995 | E11: 43.662999999999997 | F11: =PRODUCT(D11:E11) -> 35.672670999999994
T12: =IF(Q8*Q16=0,"No Driver",IF(R8<R16,N8,N16)) -> jeff chenrey | U12: =IF(Q8*Q16=0,"No class",IF(R8<R16,O8,O16)) -> sts | V12: =IF(Q8*Q16=0,"No Pax",IF(R8<R16,P8,P16)) -> 0.81599999999999995 | W12: 42.323999999999998 | X12: =PRODUCT(V12:W12) -> 34.536383999999998
A13: 3 | B13: martin kriz | C13: stu | D13: 0.83 | E13: 41.4 | F13: =PRODUCT(D13:E13) -> 34.361999999999995
H14: =IF(E13*E15=0,"No Driver",IF(F13<F15,B13,B15)) -> martin kriz | I14: =IF(E13*E15=0,"No class",IF(F13<F15,C13,C15)) -> stu | J14: =IF(E13*E15=0,"No Pax",IF(F13<F15,D13,D15)) -> 0.83 | K14: 41.838999999999999 | L14: =PRODUCT(J14:K14) -> 34.726369999999996
A15: 11 | B15: kenny sorenson | C15: esp | D15: 0.84099999999999997 | E15: 42.39 | F15: =PRODUCT(D15:E15) -> 35.649990000000003
N16: =IF(K14*K18=0,"No Driver",IF(L14<L18,H14,H18)) -> martin kriz | O16: =IF(K14*K18=0,"No Class",IF(L14<L18,I14,I18)) -> stu | P16: =IF(K14*K18=0,"No PAX",IF(L14<L18,J14,J18)) -> 0.83 | Q16: 40.95 | R16: =PRODUCT(P16:Q16) -> 33.988500000000002
A17: 7 | B17: rick carson | C17: sts | D17: 0.81599999999999995 | E17: 42.872 | F17: =PRODUCT(D17:E17) -> 34.983551999999996
H18: =IF(E17*E19=0,"No Driver",IF(F17<F19,B17,B19)) -> rick carson | I18: =IF(E17*E19=0,"No class",IF(F17<F19,C17,C19)) -> sts | J18: =IF(E17*E19=0,"No Pax",IF(F17<F19,D17,D19)) -> 0.81599999999999995 | K18: 44.298999999999999 | L18: =PRODUCT(J18:K18) -> 36.147983999999994
A19: 15 | B19: jason lisner | C19: bp | D19: 0.86599999999999999 | E19: 99.998999999999995 | F19: =PRODUCT(D19:E19) -> 86.599133999999992
Z20: =IF(W12*W28=0,"No Driver",IF(X12<X28,T12,T28)) -> jeff chenrey | AA20: =IF(W12*W28=0,"No class",IF(X12<X28,U12,U28)) -> sts | AB20: =IF(W12*W28=0,"No Pax",IF(X12<X28,V12,V28)) -> 0.81599999999999995 | AD20: =PRODUCT(AB20:AC20) -> 0.81599999999999995
A21: 2 | B21: brent carson | C21: sts | D21: 0.81599999999999995 | E21: 43.121000000000002 | F21: =PRODUCT(D21:E21) -> 35.186735999999996
H22: =IF(E21*E23=0,"No Driver",IF(F21<F23,B21,B23)) -> brent carson | I22: =IF(E21*E23=0,"No class",IF(F21<F23,C21,C23)) -> sts | J22: =IF(E21*E23=0,"No Pax",IF(F21<F23,D21,D23)) -> 0.81599999999999995 | K22: 42.683 | L22: =PRODUCT(J22:K22) -> 34.829327999999997
A23: 10 | B23: doug keiler | C23: dsp | D23: 0.84299999999999997 | E23: 41.792000000000002 | F23: =PRODUCT(D23:E23) -> 35.230656000000003
N24: =IF(K22*K26=0,"No Driver",IF(L22<L26,H22,H26)) -> brent carson | O24: =IF(K22*K26=0,"No Class",IF(L22<L26,I22,I26)) -> sts | P24: =IF(K22*K26=0,"No PAX",IF(L22<L26,J22,J26)) -> 0.81599999999999995 | Q24: 41.896000000000001 | R24: =PRODUCT(P24:Q24) -> 34.187135999999995
A25: 6 | B25: chris clinestx | C25: stx | D25: 0.82 | E25: 43.106000000000002 | F25: =PRODUCT(D25:E25) -> 35.346919999999997
H26: =IF(E25*E27=0,"No Driver",IF(F25<F27,B25,B27)) -> chris clinestx | I26: =IF(E25*E27=0,"No class",IF(F25<F27,C25,C27)) -> stx | J26: =IF(E25*E27=0,"No Pax",IF(F25<F27,D25,D27)) -> 0.82 | K26: 44.475999999999999 | L26: =PRODUCT(J26:K26) -> 36.470319999999994
A27: 14 | B27: jonathon | C27: as | D27: 0.84199999999999997 | E27: 42.223999999999997 | F27: =PRODUCT(D27:E27) -> 35.552607999999999
T28: =IF(Q24*Q32=0,"No Driver",IF(R24<R32,N24,N32)) -> brent carson | U28: =IF(Q24*Q32=0,"No class",IF(R24<R32,O24,O32)) -> sts | V28: =IF(Q24*Q32=0,"No Pax",IF(R24<R32,P24,P32)) -> 0.81599999999999995 | W28: 42.396999999999998 | X28: =PRODUCT(V28:W28) -> 34.595951999999997
A29: 4 | B29: charlie | C29: es | D29: 0.81699999999999995 | E29: 42.423000000000002 | F29: =PRODUCT(D29:E29) -> 34.659590999999999
H30: =IF(E29*E31=0,"No Driver",IF(F29<F31,B29,B31)) -> charlie | I30: =IF(E29*E31=0,"No class",IF(F29<F31,C29,C31)) -> es | J30: =IF(E29*E31=0,"No Pax",IF(F29<F31,D29,D31)) -> 0.81699999999999995 | K30: 43.975999999999999 | L30: =PRODUCT(J30:K30) -> 35.928391999999995
A31: 12 | B31: david martin | C31: stx | D31: 0.82 | E31: 43.545999999999999 | F31: =PRODUCT(D31:E31) -> 35.707719999999995
N32: =IF(K30*K34=0,"No Driver",IF(L30<L34,H30,H34)) -> charlie | O32: =IF(K30*K34=0,"No Class",IF(L30<L34,I30,I34)) -> es | P32: =IF(K30*K34=0,"No PAX",IF(L30<L34,J30,J34)) -> 0.81699999999999995 | Q32: 42.845999999999997 | R32: =PRODUCT(P32:Q32) -> 35.005181999999998
A33: 8 | B33: jadrice | C33: as | D33: 0.84199999999999997 | E33: 42.438000000000002 | F33: =PRODUCT(D33:E33) -> 35.732796
H34: =IF(E33*E35=0,"No Driver",IF(F33<F35,B33,B35)) -> jadrice | I34: =IF(E33*E35=0,"No class",IF(F33<F35,C33,C35)) -> as | J34: =IF(E33*E35=0,"No Pax",IF(F33<F35,D33,D35)) -> 0.84199999999999997 | K34: 43.933999999999997 | L34: =PRODUCT(J34:K34) -> 36.992427999999997
A35: 16 | B35: keath marx | C35: ss | D35: 0.85199999999999998 | E35: 42.744 | F35: =PRODUCT(D35:E35) -> 36.417887999999998