A1: PAX
D2: EVENT
D3: APR | E3: MAY | F3: JUN | G3: JUL | H3: AUG | I3: AUG | J3: OCT | K3: TOTAL | L3: Best 4 of 6
A4: AWARD | B4: POS | C4: DRIVER | D4: Cancelled | H4: Make up Day for April
A6: T | B6: 1 | C6: DAVID MARTIN | E6: 745 | F6: 695 | G6: 750 | H6: 730 | I6: 750 | J6: 750 | K6: =SUM(E6:J6) -> 4420 | L6: =IF(COUNTIF(E6:J6,">0")>=4,(SUM(LARGE(E6:J6,{1,2,3,4}))),"Not Qualified") -> 2995
A7: T | B7: 2 | C7: TOM BLEH | E7: 750 | F7: 685 | G7: 745 | H7: 750 | I7: 745 | J7: 745 | K7: =SUM(E7:J7) -> 4420 | L7: =IF(COUNTIF(E7:J7,">0")>=4,(SUM(LARGE(E7:J7,{1,2,3,4}))),"Not Qualified") -> 2990
A8: T | B8: 3 | C8: TERRY BAKER | E8: 740 | F8: 750 | G8: 740 | H8: 745 | I8: 735 | J8: 675 | K8: =SUM(E8:J8) -> 4385 | L8: =IF(COUNTIF(E8:J8,">0")>=4,(SUM(LARGE(E8:J8,{1,2,3,4}))),"Not Qualified") -> 2975
A9: T | B9: 4 | C9: SHAWN LAMBERT | E9: 735 | F9: 745 | G9: 735 | H9: 735 | I9: 715 | J9: 740 | K9: =SUM(E9:J9) -> 4405 | L9: =IF(COUNTIF(E9:J9,">0")>=4,(SUM(LARGE(E9:J9,{1,2,3,4}))),"Not Qualified") -> 2955
A10: T | B10: 5 | C10: DOUG KEILER | E10: 720 | F10: 675 | G10: 710 | H10: 740 | I10: 730 | J10: 725 | K10: =SUM(E10:J10) -> 4300 | L10: =IF(COUNTIF(E10:J10,">0")>=4,(SUM(LARGE(E10:J10,{1,2,3,4}))),"Not Qualified") -> 2915
A11: T | B11: 6 | C11: GIL SMITH | F11: 740 | G11: 725 | H11: 710 | I11: 725 | J11: 700 | K11: =SUM(E11:J11) -> 3600 | L11: =IF(COUNTIF(E11:J11,">0")>=4,(SUM(LARGE(E11:J11,{1,2,3,4}))),"Not Qualified") -> 2900
A12: T | B12: 7 | C12: MARC PORTANOVA | E12: 700 | G12: 715 | H12: 720 | I12: 740 | J12: 685 | K12: =SUM(E12:J12) -> 3560 | L12: =IF(COUNTIF(E12:J12,">0")>=4,(SUM(LARGE(E12:J12,{1,2,3,4}))),"Not Qualified") -> 2875
A13: T | B13: 8 | C13: JIM HALTOM | E13: 715 | F13: 720 | G13: 675 | I13: 710 | J13: 720 | K13: =SUM(E13:J13) -> 3540 | L13: =IF(COUNTIF(E13:J13,">0")>=4,(SUM(LARGE(E13:J13,{1,2,3,4}))),"Not Qualified") -> 2865
A14: T | B14: 9 | C14: ROGER GARRETT | E14: 670 | F14: 700 | G14: 705 | H14: 725 | I14: 720 | J14: 690 | K14: =SUM(E14:J14) -> 4210 | L14: =IF(COUNTIF(E14:J14,">0")>=4,(SUM(LARGE(E14:J14,{1,2,3,4}))),"Not Qualified") -> 2850
A15: T | B15: 10 | C15: JEFF CHENERY | E15: 725 | F15: 730 | G15: 695 | I15: 685 | J15: 640 | K15: =SUM(E15:J15) -> 3475 | L15: =IF(COUNTIF(E15:J15,">0")>=4,(SUM(LARGE(E15:J15,{1,2,3,4}))),"Not Qualified") -> 2835
B16: 11 | C16: BOBBY SMITH | E16: 710 | F16: 725 | G16: 730 | J16: 665 | K16: =SUM(E16:J16) -> 2830 | L16: =IF(COUNTIF(E16:J16,">0")>=4,(SUM(LARGE(E16:J16,{1,2,3,4}))),"Not Qualified") -> 2830
B17: 12 | C17: BILL BROCHU | E17: 615 | F17: 710 | G17: 700 | H17: 705 | I17: 700 | J17: 705 | K17: =SUM(E17:J17) -> 4135 | L17: =IF(COUNTIF(E17:J17,">0")>=4,(SUM(LARGE(E17:J17,{1,2,3,4}))),"Not Qualified") -> 2820
B18: 13 | C18: JASON LISNER | E18: 660 | F18: 475 | G18: 690 | H18: 670 | I18: 620 | J18: 730 | K18: =SUM(E18:J18) -> 3845 | L18: =IF(COUNTIF(E18:J18,">0")>=4,(SUM(LARGE(E18:J18,{1,2,3,4}))),"Not Qualified") -> 2750
B19: 14 | C19: ANDY TURNBULL | E19: 695 | F19: 715 | G19: 650 | I19: 675 | J19: 655 | K19: =SUM(E19:J19) -> 3390 | L19: =IF(COUNTIF(E19:J19,">0")>=4,(SUM(LARGE(E19:J19,{1,2,3,4}))),"Not Qualified") -> 2740
B20: 15 | C20: WES MICHAELS | E20: 630 | F20: 705 | H20: 695 | I20: 695 | J20: 645 | K20: =SUM(E20:J20) -> 3370 | L20: =IF(COUNTIF(E20:J20,">0")>=4,(SUM(LARGE(E20:J20,{1,2,3,4}))),"Not Qualified") -> 2740
B21: 16 | C21: GREG KOTESKI | E21: 680 | F21: 570 | G21: 635 | H21: 715 | I21: 705 | K21: =SUM(E21:J21) -> 3305 | L21: =IF(COUNTIF(E21:J21,">0")>=4,(SUM(LARGE(E21:J21,{1,2,3,4}))),"Not Qualified") -> 2735
B22: 17 | C22: ROBB DAVIS | E22: 655 | F22: 665 | G22: 665 | H22: 675 | I22: 600 | J22: 680 | K22: =SUM(E22:J22) -> 3940 | L22: =IF(COUNTIF(E22:J22,">0")>=4,(SUM(LARGE(E22:J22,{1,2,3,4}))),"Not Qualified") -> 2685
B23: 18 | C23: JIM EWING | E23: 570 | G23: 645 | H23: 665 | I23: 650 | J23: 715 | K23: =SUM(E23:J23) -> 3245 | L23: =IF(COUNTIF(E23:J23,">0")>=4,(SUM(LARGE(E23:J23,{1,2,3,4}))),"Not Qualified") -> 2675
B24: 19 | C24: CURTIS STAPLES | E24: 690 | F24: 670 | H24: 650 | I24: 655 | J24: 545 | K24: =SUM(E24:J24) -> 3210 | L24: =IF(COUNTIF(E24:J24,">0")>=4,(SUM(LARGE(E24:J24,{1,2,3,4}))),"Not Qualified") -> 2665
B25: 20 | C25: BERNIE CHMIELEWSKI | E25: 640 | F25: 635 | G25: 615 | H25: 700 | I25: 660 | J25: 610 | K25: =SUM(E25:J25) -> 3860 | L25: =IF(COUNTIF(E25:J25,">0")>=4,(SUM(LARGE(E25:J25,{1,2,3,4}))),"Not Qualified") -> 2635
B26: 21 | C26: DAVID BROCHU | E26: 620 | F26: 690 | G26: 625 | H26: 660 | I26: 595 | J26: 650 | K26: =SUM(E26:J26) -> 3840 | L26: =IF(COUNTIF(E26:J26,">0")>=4,(SUM(LARGE(E26:J26,{1,2,3,4}))),"Not Qualified") -> 2625
B27: 22 | C27: JIM ROBINSON | E27: 585 | F27: 535 | G27: 670 | H27: 680 | I27: 670 | J27: 580 | K27: =SUM(E27:J27) -> 3720 | L27: =IF(COUNTIF(E27:J27,">0")>=4,(SUM(LARGE(E27:J27,{1,2,3,4}))),"Not Qualified") -> 2605
B28: 23 | C28: MICHAEL TWIFORD | E28: 600 | F28: 645 | G28: 630 | H28: 610 | J28: 705 | K28: =SUM(E28:J28) -> 3190 | L28: =IF(COUNTIF(E28:J28,">0")>=4,(SUM(LARGE(E28:J28,{1,2,3,4}))),"Not Qualified") -> 2590
B29: 24 | C29: ROLAND WALLNER | E29: 555 | F29: 640 | I29: 680 | J29: 660 | K29: =SUM(E29:J29) -> 2535 | L29: =IF(COUNTIF(E29:J29,">0")>=4,(SUM(LARGE(E29:J29,{1,2,3,4}))),"Not Qualified") -> 2535
B30: 25 | C30: DUNCAN ELLIS | F30: 590 | G30: 610 | I30: 645 | J30: 630 | K30: =SUM(E30:J30) -> 2475 | L30: =IF(COUNTIF(E30:J30,">0")>=4,(SUM(LARGE(E30:J30,{1,2,3,4}))),"Not Qualified") -> 2475
B31: 26 | C31: JEFF ROONEY | E31: 590 | G31: 570 | H31: 685 | I31: 615 | J31: 570 | K31: =SUM(E31:J31) -> 3030 | L31: =IF(COUNTIF(E31:J31,">0")>=4,(SUM(LARGE(E31:J31,{1,2,3,4}))),"Not Qualified") -> 2460
B32: 27 | C32: BILL LAKIN | F32: 485 | G32: 585 | H32: 655 | I32: 665 | J32: 540 | K32: =SUM(E32:J32) -> 2930 | L32: =IF(COUNTIF(E32:J32,">0")>=4,(SUM(LARGE(E32:J32,{1,2,3,4}))),"Not Qualified") -> 2445
B33: 28 | C33: TONY WATSON | F33: 550 | G33: 575 | H33: 615 | I33: 625 | J33: 625 | K33: =SUM(E33:J33) -> 2990 | L33: =IF(COUNTIF(E33:J33,">0")>=4,(SUM(LARGE(E33:J33,{1,2,3,4}))),"Not Qualified") -> 2440
B34: 29 | C34: AUDREY CHENERY | E34: 610 | F34: 610 | G34: 605 | I34: 610 | K34: =SUM(E34:J34) -> 2435 | L34: =IF(COUNTIF(E34:J34,">0")>=4,(SUM(LARGE(E34:J34,{1,2,3,4}))),"Not Qualified") -> 2435
B35: 30 | C35: JIM SETZER | E35: 545 | F35: 655 | G35: 655 | J35: 565 | K35: =SUM(E35:J35) -> 2420 | L35: =IF(COUNTIF(E35:J35,">0")>=4,(SUM(LARGE(E35:J35,{1,2,3,4}))),"Not Qualified") -> 2420
B36: 31 | C36: TODD WAGNER | E36: 560 | F36: 620 | G36: 500 | H36: 640 | I36: 590 | K36: =SUM(E36:J36) -> 2910 | L36: =IF(COUNTIF(E36:J36,">0")>=4,(SUM(LARGE(E36:J36,{1,2,3,4}))),"Not Qualified") -> 2410
B37: 32 | C37: DUSTIN MERGI | E37: 575 | F37: 600 | G37: 590 | J37: 620 | K37: =SUM(E37:J37) -> 2385 | L37: =IF(COUNTIF(E37:J37,">0")>=4,(SUM(LARGE(E37:J37,{1,2,3,4}))),"Not Qualified") -> 2385
B38: 33 | C38: JIM HERLEY | E38: 540 | F38: 335 | G38: 495 | H38: 645 | I38: 635 | J38: 530 | K38: =SUM(E38:J38) -> 3180 | L38: =IF(COUNTIF(E38:J38,">0")>=4,(SUM(LARGE(E38:J38,{1,2,3,4}))),"Not Qualified") -> 2350
B39: 34 | C39: MICHAEL SCHNEKSER | E39: 550 | F39: 540 | G39: 415 | H39: 620 | I39: 570 | J39: 605 | K39: =SUM(E39:J39) -> 3300 | L39: =IF(COUNTIF(E39:J39,">0")>=4,(SUM(LARGE(E39:J39,{1,2,3,4}))),"Not Qualified") -> 2345
B40: 35 | C40: REX HARRIS | F40: 490 | G40: 600 | I40: 690 | J40: 560 | K40: =SUM(E40:J40) -> 2340 | L40: =IF(COUNTIF(E40:J40,">0")>=4,(SUM(LARGE(E40:J40,{1,2,3,4}))),"Not Qualified") -> 2340
B41: 36 | C41: ALAN STRATTON | E41: 580 | F41: 625 | G41: 565 | J41: 550 | K41: =SUM(E41:J41) -> 2320 | L41: =IF(COUNTIF(E41:J41,">0")>=4,(SUM(LARGE(E41:J41,{1,2,3,4}))),"Not Qualified") -> 2320
B42: 37 | C42: DAVE MCLAUGHLIN | E42: 515 | F42: 265 | G42: 580 | H42: 595 | I42: 565 | J42: 575 | K42: =SUM(E42:J42) -> 3095 | L42: =IF(COUNTIF(E42:J42,">0")>=4,(SUM(LARGE(E42:J42,{1,2,3,4}))),"Not Qualified") -> 2315
B43: 38 | C43: MICHAEL MOUNTAIN | E43: 465 | F43: 505 | G43: 510 | H43: 630 | I43: 580 | J43: 585 | K43: =SUM(E43:J43) -> 3275 | L43: =IF(COUNTIF(E43:J43,">0")>=4,(SUM(LARGE(E43:J43,{1,2,3,4}))),"Not Qualified") -> 2305
B44: 39 | C44: ROY ARMSTRONG | E44: 605 | F44: 585 | G44: 165 | H44: 565 | I44: 520 | J44: 345 | K44: =SUM(E44:J44) -> 2785 | L44: =IF(COUNTIF(E44:J44,">0")>=4,(SUM(LARGE(E44:J44,{1,2,3,4}))),"Not Qualified") -> 2275
B45: 40 | C45: BILL EAKER | E45: 535 | F45: 580 | G45: 450 | H45: 605 | I45: 525 | K45: =SUM(E45:J45) -> 2695 | L45: =IF(COUNTIF(E45:J45,">0")>=4,(SUM(LARGE(E45:J45,{1,2,3,4}))),"Not Qualified") -> 2245
B46: 41 | C46: MARC LISNER | E46: 290 | F46: 510 | G46: 535 | H46: 580 | I46: 585 | J46: 395 | K46: =SUM(E46:J46) -> 2895 | L46: =IF(COUNTIF(E46:J46,">0")>=4,(SUM(LARGE(E46:J46,{1,2,3,4}))),"Not Qualified") -> 2210
B47: 42 | C47: SCOTT HOPKINS | E47: 455 | F47: 410 | G47: 400 | H47: 625 | I47: 640 | J47: 475 | K47: =SUM(E47:J47) -> 3005 | L47: =IF(COUNTIF(E47:J47,">0")>=4,(SUM(LARGE(E47:J47,{1,2,3,4}))),"Not Qualified") -> 2195
B48: 43 | C48: JOHN CROWDER | E48: 495 | G48: 520 | H48: 575 | I48: 545 | J48: 555 | K48: =SUM(E48:J48) -> 2690 | L48: =IF(COUNTIF(E48:J48,">0")>=4,(SUM(LARGE(E48:J48,{1,2,3,4}))),"Not Qualified") -> 2195
B49: 44 | C49: DAVID SKITTLETHORP | G49: 210 | H49: 690 | I49: 630 | J49: 645 | K49: =SUM(E49:J49) -> 2175 | L49: =IF(COUNTIF(E49:J49,">0")>=4,(SUM(LARGE(E49:J49,{1,2,3,4}))),"Not Qualified") -> 2175
B50: 45 | C50: CAMERON MCCORMICK | E50: 510 | F50: 565 | G50: 470 | I50: 555 | J50: 520 | K50: =SUM(E50:J50) -> 2620 | L50: =IF(COUNTIF(E50:J50,">0")>=4,(SUM(LARGE(E50:J50,{1,2,3,4}))),"Not Qualified") -> 2150
B51: 46 | C51: STEVE SHELL | E51: 460 | F51: 480 | H51: 585 | I51: 535 | J51: 515 | K51: =SUM(E51:J51) -> 2575 | L51: =IF(COUNTIF(E51:J51,">0")>=4,(SUM(LARGE(E51:J51,{1,2,3,4}))),"Not Qualified") -> 2115
B52: 47 | C52: ERIC BONNETT | F52: 525 | G52: 455 | H52: 600 | J52: 535 | K52: =SUM(E52:J52) -> 2115 | L52: =IF(COUNTIF(E52:J52,">0")>=4,(SUM(LARGE(E52:J52,{1,2,3,4}))),"Not Qualified") -> 2115
B53: 48 | C53: STEVE DASHER | E53: 485 | F53: 430 | G53: 390 | H53: 590 | I53: 540 | J53: 485 | K53: =SUM(E53:J53) -> 2920 | L53: =IF(COUNTIF(E53:J53,">0")>=4,(SUM(LARGE(E53:J53,{1,2,3,4}))),"Not Qualified") -> 2100
B54: 49 | C54: CARL JUNEAU | E54: 450 | F54: 440 | G54: 545 | H54: 515 | I54: 550 | J54: 445 | K54: =SUM(E54:J54) -> 2945 | L54: =IF(COUNTIF(E54:J54,">0")>=4,(SUM(LARGE(E54:J54,{1,2,3,4}))),"Not Qualified") -> 2060
B55: 50 | C55: DON STRIFLER | E55: 490 | F55: 520 | G55: 440 | H55: 490 | I55: 515 | J55: 510 | K55: =SUM(E55:J55) -> 2965 | L55: =IF(COUNTIF(E55:J55,">0")>=4,(SUM(LARGE(E55:J55,{1,2,3,4}))),"Not Qualified") -> 2035
B56: 51 | C56: KEITH MAPLES | E56: 435 | F56: 465 | G56: 465 | H56: 530 | I56: 495 | J56: 450 | K56: =SUM(E56:J56) -> 2840 | L56: =IF(COUNTIF(E56:J56,">0")>=4,(SUM(LARGE(E56:J56,{1,2,3,4}))),"Not Qualified") -> 1955
B57: 52 | C57: MANDY GREGG | E57: 470 | F57: 385 | G57: 340 | H57: 520 | I57: 560 | K57: =SUM(E57:J57) -> 2275 | L57: =IF(COUNTIF(E57:J57,">0")>=4,(SUM(LARGE(E57:J57,{1,2,3,4}))),"Not Qualified") -> 1935
B58: 53 | C58: JOMMEL DE GUZMAN | E58: 505 | F58: 450 | G58: 485 | J58: 495 | K58: =SUM(E58:J58) -> 1935 | L58: =IF(COUNTIF(E58:J58,">0")>=4,(SUM(LARGE(E58:J58,{1,2,3,4}))),"Not Qualified") -> 1935
B59: 54 | C59: NEAL DAVIS | E59: 355 | G59: 335 | H59: 635 | I59: 605 | K59: =SUM(E59:J59) -> 1930 | L59: =IF(COUNTIF(E59:J59,">0")>=4,(SUM(LARGE(E59:J59,{1,2,3,4}))),"Not Qualified") -> 1930
B60: 55 | C60: JEFF JASMER | F60: 250 | G60: 405 | H60: 570 | I60: 450 | J60: 470 | K60: =SUM(E60:J60) -> 2145 | L60: =IF(COUNTIF(E60:J60,">0")>=4,(SUM(LARGE(E60:J60,{1,2,3,4}))),"Not Qualified") -> 1895
B61: 56 | C61: SEAN MCCONNELL | E61: 440 | F61: 415 | G61: 360 | H61: 540 | I61: 480 | J61: 390 | K61: =SUM(E61:J61) -> 2625 | L61: =IF(COUNTIF(E61:J61,">0")>=4,(SUM(LARGE(E61:J61,{1,2,3,4}))),"Not Qualified") -> 1875
B62: 57 | C62: ANTHONY GORGONE | E62: 310 | G62: 445 | H62: 545 | I62: 530 | K62: =SUM(E62:J62) -> 1830 | L62: =IF(COUNTIF(E62:J62,">0")>=4,(SUM(LARGE(E62:J62,{1,2,3,4}))),"Not Qualified") -> 1830
B63: 58 | C63: TERRY ZACH | E63: 405 | F63: 420 | G63: 350 | H63: 525 | I63: 475 | K63: =SUM(E63:J63) -> 2175 | L63: =IF(COUNTIF(E63:J63,">0")>=4,(SUM(LARGE(E63:J63,{1,2,3,4}))),"Not Qualified") -> 1825
B64: 59 | C64: KEITH KASMIRE | E64: 395 | F64: 380 | G64: 365 | H64: 550 | I64: 315 | J64: 490 | K64: =SUM(E64:J64) -> 2495 | L64: =IF(COUNTIF(E64:J64,">0")>=4,(SUM(LARGE(E64:J64,{1,2,3,4}))),"Not Qualified") -> 1815
B65: 60 | C65: GEORGANA TURNER | E65: 400 | F65: 455 | G65: 425 | J65: 505 | K65: =SUM(E65:J65) -> 1785 | L65: =IF(COUNTIF(E65:J65,">0")>=4,(SUM(LARGE(E65:J65,{1,2,3,4}))),"Not Qualified") -> 1785
B66: 61 | C66: MARIBETH CUPPS | E66: 100 | F66: 300 | G66: 380 | H66: 535 | I66: 415 | J66: 400 | K66: =SUM(E66:J66) -> 2130 | L66: =IF(COUNTIF(E66:J66,">0")>=4,(SUM(LARGE(E66:J66,{1,2,3,4}))),"Not Qualified") -> 1730
B67: 62 | C67: MICHAEL KEEFE | E67: 375 | G67: 370 | H67: 495 | I67: 445 | J67: 305 | K67: =SUM(E67:J67) -> 1990 | L67: =IF(COUNTIF(E67:J67,">0")>=4,(SUM(LARGE(E67:J67,{1,2,3,4}))),"Not Qualified") -> 1685
B68: 63 | C68: CLAYTON JOHNSON | E68: 315 | F68: 350 | H68: 555 | J68: 460 | K68: =SUM(E68:J68) -> 1680 | L68: =IF(COUNTIF(E68:J68,">0")>=4,(SUM(LARGE(E68:J68,{1,2,3,4}))),"Not Qualified") -> 1680
B69: 64 | C69: JOHN SETTLE | F69: 355 | G69: 300 | H69: 475 | I69: 465 | J69: 365 | K69: =SUM(E69:J69) -> 1960 | L69: =IF(COUNTIF(E69:J69,">0")>=4,(SUM(LARGE(E69:J69,{1,2,3,4}))),"Not Qualified") -> 1660
B70: 65 | C70: CALVIN SANDERS | E70: 410 | F70: 530 | I70: 410 | J70: 310 | K70: =SUM(E70:J70) -> 1660 | L70: =IF(COUNTIF(E70:J70,">0")>=4,(SUM(LARGE(E70:J70,{1,2,3,4}))),"Not Qualified") -> 1660
B71: 66 | C71: SHANNON HALTOM | E71: 425 | F71: 425 | G71: 330 | J71: 455 | K71: =SUM(E71:J71) -> 1635 | L71: =IF(COUNTIF(E71:J71,">0")>=4,(SUM(LARGE(E71:J71,{1,2,3,4}))),"Not Qualified") -> 1635
B72: 67 | C72: PHILLIP JUNEAU | G72: 305 | H72: 485 | I72: 490 | J72: 340 | K72: =SUM(E72:J72) -> 1620 | L72: =IF(COUNTIF(E72:J72,">0")>=4,(SUM(LARGE(E72:J72,{1,2,3,4}))),"Not Qualified") -> 1620
B73: 68 | C73: MICHAEL GAINTNER | E73: 325 | F73: 360 | I73: 485 | J73: 430 | K73: =SUM(E73:J73) -> 1600 | L73: =IF(COUNTIF(E73:J73,">0")>=4,(SUM(LARGE(E73:J73,{1,2,3,4}))),"Not Qualified") -> 1600
B74: 69 | C74: SHAUN DUGAN | E74: 370 | F74: 245 | G74: 185 | H74: 465 | I74: 510 | K74: =SUM(E74:J74) -> 1775 | L74: =IF(COUNTIF(E74:J74,">0")>=4,(SUM(LARGE(E74:J74,{1,2,3,4}))),"Not Qualified") -> 1590
B75: 70 | C75: PETER FLORANCE | E75: 420 | G75: 385 | I75: 370 | J75: 405 | K75: =SUM(E75:J75) -> 1580 | L75: =IF(COUNTIF(E75:J75,">0")>=4,(SUM(LARGE(E75:J75,{1,2,3,4}))),"Not Qualified") -> 1580
B76: 71 | C76: RICHARD NELSON | E76: 275 | H76: 415 | I76: 505 | J76: 380 | K76: =SUM(E76:J76) -> 1575 | L76: =IF(COUNTIF(E76:J76,">0")>=4,(SUM(LARGE(E76:J76,{1,2,3,4}))),"Not Qualified") -> 1575
B77: 72 | C77: TOM TYE | E77: 335 | F77: 210 | G77: 290 | H77: 450 | I77: 425 | J77: 335 | K77: =SUM(E77:J77) -> 2045 | L77: =IF(COUNTIF(E77:J77,">0")>=4,(SUM(LARGE(E77:J77,{1,2,3,4}))),"Not Qualified") -> 1545
B78: 73 | C78: JOE CECELIC | E78: 360 | F78: 370 | G78: 325 | H78: 430 | I78: 380 | J78: 285 | K78: =SUM(E78:J78) -> 2150 | L78: =IF(COUNTIF(E78:J78,">0")>=4,(SUM(LARGE(E78:J78,{1,2,3,4}))),"Not Qualified") -> 1540
B79: 74 | C79: BECKY WINNER | E79: 295 | F79: 280 | G79: 255 | H79: 510 | I79: 435 | J79: 280 | K79: =SUM(E79:J79) -> 2055 | L79: =IF(COUNTIF(E79:J79,">0")>=4,(SUM(LARGE(E79:J79,{1,2,3,4}))),"Not Qualified") -> 1520
B80: 75 | C80: KEITH EDWARDS | E80: 245 | F80: 205 | G80: 320 | H80: 435 | I80: 455 | J80: 300 | K80: =SUM(E80:J80) -> 1960 | L80: =IF(COUNTIF(E80:J80,">0")>=4,(SUM(LARGE(E80:J80,{1,2,3,4}))),"Not Qualified") -> 1510
B81: 76 | C81: LELANE LEMOND | E81: 345 | F81: 330 | G81: 220 | H81: 460 | I81: 310 | J81: 320 | K81: =SUM(E81:J81) -> 1985 | L81: =IF(COUNTIF(E81:J81,">0")>=4,(SUM(LARGE(E81:J81,{1,2,3,4}))),"Not Qualified") -> 1455
B82: 77 | C82: MILLS ROBINSON | E82: 260 | F82: 225 | G82: 200 | H82: 425 | I82: 395 | J82: 330 | K82: =SUM(E82:J82) -> 1835 | L82: =IF(COUNTIF(E82:J82,">0")>=4,(SUM(LARGE(E82:J82,{1,2,3,4}))),"Not Qualified") -> 1410
B83: 78 | C83: TJ FITZGERALD | E83: 430 | F83: 285 | G83: 230 | H83: 310 | I83: 270 | J83: 370 | K83: =SUM(E83:J83) -> 1895 | L83: =IF(COUNTIF(E83:J83,">0")>=4,(SUM(LARGE(E83:J83,{1,2,3,4}))),"Not Qualified") -> 1395
B84: 79 | C84: RAY HOPKINS | E84: 285 | F84: 190 | G84: 295 | H84: 470 | I84: 325 | J84: 290 | K84: =SUM(E84:J84) -> 1855 | L84: =IF(COUNTIF(E84:J84,">0")>=4,(SUM(LARGE(E84:J84,{1,2,3,4}))),"Not Qualified") -> 1380
B85: 80 | C85: BENJAMIN SMITH | E85: 115 | F85: 145 | H85: 400 | I85: 385 | J85: 425 | K85: =SUM(E85:J85) -> 1470 | L85: =IF(COUNTIF(E85:J85,">0")>=4,(SUM(LARGE(E85:J85,{1,2,3,4}))),"Not Qualified") -> 1355
B86: 81 | C86: WAYNE LEWIS | E86: 265 | F86: 305 | G86: 205 | H86: 420 | I86: 330 | J86: 235 | K86: =SUM(E86:J86) -> 1760 | L86: =IF(COUNTIF(E86:J86,">0")>=4,(SUM(LARGE(E86:J86,{1,2,3,4}))),"Not Qualified") -> 1320
B87: 82 | C87: RUSSELL TYE | F87: 100 | G87: 215 | H87: 445 | I87: 405 | J87: 250 | K87: =SUM(E87:J87) -> 1415 | L87: =IF(COUNTIF(E87:J87,">0")>=4,(SUM(LARGE(E87:J87,{1,2,3,4}))),"Not Qualified") -> 1315
B88: 83 | C88: DEREK OBI | F88: 320 | G88: 240 | I88: 360 | J88: 375 | K88: =SUM(E88:J88) -> 1295 | L88: =IF(COUNTIF(E88:J88,">0")>=4,(SUM(LARGE(E88:J88,{1,2,3,4}))),"Not Qualified") -> 1295
B89: 84 | C89: JULIA TYE | E89: 220 | F89: 220 | G89: 175 | H89: 440 | I89: 290 | J89: 325 | K89: =SUM(E89:J89) -> 1670 | L89: =IF(COUNTIF(E89:J89,">0")>=4,(SUM(LARGE(E89:J89,{1,2,3,4}))),"Not Qualified") -> 1275
B90: 85 | C90: ANGELA SCHMUHL | E90: 230 | F90: 135 | G90: 180 | H90: 455 | I90: 400 | K90: =SUM(E90:J90) -> 1400 | L90: =IF(COUNTIF(E90:J90,">0")>=4,(SUM(LARGE(E90:J90,{1,2,3,4}))),"Not Qualified") -> 1265
B91: 86 | C91: JASON MCCLURE | G91: 235 | H91: 395 | I91: 355 | J91: 215 | K91: =SUM(E91:J91) -> 1200 | L91: =IF(COUNTIF(E91:J91,">0")>=4,(SUM(LARGE(E91:J91,{1,2,3,4}))),"Not Qualified") -> 1200
B92: 87 | C92: ROBERT BAUER | E92: 140 | G92: 160 | H92: 385 | I92: 390 | J92: 260 | K92: =SUM(E92:J92) -> 1335 | L92: =IF(COUNTIF(E92:J92,">0")>=4,(SUM(LARGE(E92:J92,{1,2,3,4}))),"Not Qualified") -> 1195
B93: 88 | C93: FRANK INSLEY | E93: 500 | G93: 125 | H93: 315 | I93: 225 | K93: =SUM(E93:J93) -> 1165 | L93: =IF(COUNTIF(E93:J93,">0")>=4,(SUM(LARGE(E93:J93,{1,2,3,4}))),"Not Qualified") -> 1165
B94: 89 | C94: SHAWN GAMBILL | E94: 180 | F94: 230 | G94: 145 | H94: 380 | I94: 295 | J94: 240 | K94: =SUM(E94:J94) -> 1470 | L94: =IF(COUNTIF(E94:J94,">0")>=4,(SUM(LARGE(E94:J94,{1,2,3,4}))),"Not Qualified") -> 1145
B95: 90 | C95: CANDACE CROWDER | E95: 160 | G95: 155 | H95: 345 | I95: 300 | J95: 295 | K95: =SUM(E95:J95) -> 1255 | L95: =IF(COUNTIF(E95:J95,">0")>=4,(SUM(LARGE(E95:J95,{1,2,3,4}))),"Not Qualified") -> 1100
B96: 91 | C96: MANNY DESANTOS | E96: 255 | F96: 375 | G96: 115 | I96: 245 | J96: 225 | K96: =SUM(E96:J96) -> 1215 | L96: =IF(COUNTIF(E96:J96,">0")>=4,(SUM(LARGE(E96:J96,{1,2,3,4}))),"Not Qualified") -> 1100
B97: 92 | C97: RUSS PARHAM | E97: 170 | F97: 180 | G97: 315 | J97: 415 | K97: =SUM(E97:J97) -> 1080 | L97: =IF(COUNTIF(E97:J97,">0")>=4,(SUM(LARGE(E97:J97,{1,2,3,4}))),"Not Qualified") -> 1080
B98: 93 | C98: TODD HOWES | E98: 235 | F98: 125 | H98: 355 | I98: 265 | J98: 185 | K98: =SUM(E98:J98) -> 1165 | L98: =IF(COUNTIF(E98:J98,">0")>=4,(SUM(LARGE(E98:J98,{1,2,3,4}))),"Not Qualified") -> 1040
B99: 94 | C99: MICHAEL CACASE | E99: 185 | F99: 200 | H99: 370 | I99: 275 | K99: =SUM(E99:J99) -> 1030 | L99: =IF(COUNTIF(E99:J99,">0")>=4,(SUM(LARGE(E99:J99,{1,2,3,4}))),"Not Qualified") -> 1030
B100: 95 | C100: GREGG ROSSI | E100: 120 | G100: 135 | H100: 360 | I100: 255 | J100: 80 | K100: =SUM(E100:J100) -> 950 | L100: =IF(COUNTIF(E100:J100,">0")>=4,(SUM(LARGE(E100:J100,{1,2,3,4}))),"Not Qualified") -> 870
B101: 96 | C101: BARBARA ROBINSON | E101: 75 | F101: 110 | G101: 65 | H101: 330 | I101: 195 | J101: 150 | K101: =SUM(E101:J101) -> 925 | L101: =IF(COUNTIF(E101:J101,">0")>=4,(SUM(LARGE(E101:J101,{1,2,3,4}))),"Not Qualified") -> 785
B102: 97 | C102: ADAM SMALL | F102: 105 | G102: 130 | H102: 320 | I102: 215 | K102: =SUM(E102:J102) -> 770 | L102: =IF(COUNTIF(E102:J102,">0")>=4,(SUM(LARGE(E102:J102,{1,2,3,4}))),"Not Qualified") -> 770
B103: 98 | C103: RICH DELVICCHIO | E103: 110 | F103: 120 | G103: 60 | H103: 290 | I103: 210 | J103: 145 | K103: =SUM(E103:J103) -> 935 | L103: =IF(COUNTIF(E103:J103,">0")>=4,(SUM(LARGE(E103:J103,{1,2,3,4}))),"Not Qualified") -> 765
B104: 99 | C104: LEE WILLIAMS | E104: 225 | F104: 70 | G104: 190 | I104: 280 | K104: =SUM(E104:J104) -> 765 | L104: =IF(COUNTIF(E104:J104,">0")>=4,(SUM(LARGE(E104:J104,{1,2,3,4}))),"Not Qualified") -> 765
B105: 100 | C105: ALAN BRODERICK | F105: 75 | G105: 75 | H105: 340 | J105: 200 | K105: =SUM(E105:J105) -> 690 | L105: =IF(COUNTIF(E105:J105,">0")>=4,(SUM(LARGE(E105:J105,{1,2,3,4}))),"Not Qualified") -> 690
B106: 101 | C106: BILL SPRUILL | E106: 70 | F106: 60 | G106: 55 | H106: 260 | I106: 185 | J106: 140 | K106: =SUM(E106:J106) -> 770 | L106: =IF(COUNTIF(E106:J106,">0")>=4,(SUM(LARGE(E106:J106,{1,2,3,4}))),"Not Qualified") -> 655
B107: 102 | C107: ED RAYMUNDO | E107: 730 | F107: 660 | J107: 735 | K107: =SUM(E107:J107) -> 2125 | L107: =IF(COUNTIF(E107:J107,">0")>=4,(SUM(LARGE(E107:J107,{1,2,3,4}))),"Not Qualified") -> Not Qualified
B108: 103 | C108: KEATH MARX | E108: 665 | G108: 680 | J108: 695 | K108: =SUM(E108:J108) -> 2040 | L108: =IF(COUNTIF(E108:J108,">0")>=4,(SUM(LARGE(E108:J108,{1,2,3,4}))),"Not Qualified") -> Not Qualified
B109: 104 | C109: JUSTIN LOEHLIN | E109: 685 | F109: 555 | J109: 670 | K109: =SUM(E109:J109) -> 1910 | L109: =IF(COUNTIF(E109:J109,">0")>=4,(SUM(LARGE(E109:J109,{1,2,3,4}))),"Not Qualified") -> Not Qualified
B110: 105 | C110: DAVE CUTCHINS | F110: 575 | G110: 660 | J110: 635 | K110: =SUM(E110:J110) -> 1870 | L110: =IF(COUNTIF(E110:J110,">0")>=4,(SUM(LARGE(E110:J110,{1,2,3,4}))),"Not Qualified") -> Not Qualified
B111: 106 | C111: DONNA MARX | E111: 595 | G111: 595 | J111: 600 | K111: =SUM(E111:J111) -> 1790 | L111: =IF(COUNTIF(E111:J111,">0")>=4,(SUM(LARGE(E111:J111,{1,2,3,4}))),"Not Qualified") -> Not Qualified
B112: 107 | C112: COREY MAPLES | E112: 565 | F112: 560 | G112: 560 | K112: =SUM(E112:J112) -> 1685 | L112: =IF(COUNTIF(E112:J112,">0")>=4,(SUM(LARGE(E112:J112,{1,2,3,4}))),"Not Qualified") -> Not Qualified
B113: 108 | C113: CHRISTOPHER SAMULSKI | E113: 520 | F113: 605 | G113: 555 | K113: =SUM(E113:J113) -> 1680 | L113: =IF(COUNTIF(E113:J113,">0")>=4,(SUM(LARGE(E113:J113,{1,2,3,4}))),"Not Qualified") -> Not Qualified
B114: 109 | C114: RICK MARIANI | E114: 635 | F114: 460 | I114: 575 | K114: =SUM(E114:J114) -> 1670 | L114: =IF(COUNTIF(E114:J114,">0")>=4,(SUM(LARGE(E114:J114,{1,2,3,4}))),"Not Qualified") -> Not Qualified
B115: 110 | C115: JEFF TURNER | E115: 525 | F115: 500 | J115: 595 | K115: =SUM(E115:J115) -> 1620 | L115: =IF(COUNTIF(E115:J115,">0")>=4,(SUM(LARGE(E115:J115,{1,2,3,4}))),"Not Qualified") -> Not Qualified
B116: 111 | C116: MARK WOOD | E116: 445 | F116: 595 | G116: 550 | K116: =SUM(E116:J116) -> 1590 | L116: =IF(COUNTIF(E116:J116,">0")>=4,(SUM(LARGE(E116:J116,{1,2,3,4}))),"Not Qualified") -> Not Qualified
B117: 112 | C117: DONALD STRIFLER | K117: =SUM(E117:J117) -> 0 | L117: =IF(COUNTIF(E117:J117,">0")>=4,(SUM(LARGE(E117:J117,{1,2,3,4}))),"Not Qualified") -> Not Qualified
B118: 113 | C118: BRETT BAKER | E118: 480 | F118: 470 | G118: 540 | K118: =SUM(E118:J118) -> 1490 | L118: =IF(COUNTIF(E118:J118,">0")>=4,(SUM(LARGE(E118:J118,{1,2,3,4}))),"Not Qualified") -> Not Qualified
B119: 114 | C119: MICHAEL HARRIS | E119: 705 | F119: 735 | K119: =SUM(E119:J119) -> 1440 | L119: =IF(COUNTIF(E119:J119,">0")>=4,(SUM(LARGE(E119:J119,{1,2,3,4}))),"Not Qualified") -> Not Qualified
B120: 115 | C120: ERIC ANDUZE | E120: 365 | H120: 480 | J120: 590 | K120: =SUM(E120:J120) -> 1435 | L120: =IF(COUNTIF(E120:J120,">0")>=4,(SUM(LARGE(E120:J120,{1,2,3,4}))),"Not Qualified") -> Not Qualified
B121: 116 | C121: STAN VANN | F121: 680 | G121: 720 | K121: =SUM(E121:J121) -> 1400 | L121: =IF(COUNTIF(E121:J121,">0")>=4,(SUM(LARGE(E121:J121,{1,2,3,4}))),"Not Qualified") -> Not Qualified
B122: 117 | C122: ROBERT KIRKPATRICK | F122: 400 | G122: 475 | H122: 505 | K122: =SUM(E122:J122) -> 1380 | L122: =IF(COUNTIF(E122:J122,">0")>=4,(SUM(LARGE(E122:J122,{1,2,3,4}))),"Not Qualified") -> Not Qualified
B123: 118 | C123: MERRIE MALPASS | E123: 475 | F123: 445 | G123: 435 | K123: =SUM(E123:J123) -> 1355 | L123: =IF(COUNTIF(E123:J123,">0")>=4,(SUM(LARGE(E123:J123,{1,2,3,4}))),"Not Qualified") -> Not Qualified
B124: 119 | C124: CINDY LAKIN | F124: 390 | G124: 515 | I124: 430 | K124: =SUM(E124:J124) -> 1335 | L124: =IF(COUNTIF(E124:J124,">0")>=4,(SUM(LARGE(E124:J124,{1,2,3,4}))),"Not Qualified") -> Not Qualified
B125: 120 | C125: BRANDON CHARLESON | H125: 500 | I125: 335 | J125: 465 | K125: =SUM(E125:J125) -> 1300 | L125: =IF(COUNTIF(E125:J125,">0")>=4,(SUM(LARGE(E125:J125,{1,2,3,4}))),"Not Qualified") -> Not Qualified
B126: 121 | C126: JIM HARRIS | E126: 650 | F126: 650 | K126: =SUM(E126:J126) -> 1300 | L126: =IF(COUNTIF(E126:J126,">0")>=4,(SUM(LARGE(E126:J126,{1,2,3,4}))),"Not Qualified") -> Not Qualified
B127: 122 | C127: JAMES WILSON | E127: 625 | F127: 630 | K127: =SUM(E127:J127) -> 1255 | L127: =IF(COUNTIF(E127:J127,">0")>=4,(SUM(LARGE(E127:J127,{1,2,3,4}))),"Not Qualified") -> Not Qualified
B128: 123 | C128: MARK RHOADES | F128: 615 | G128: 640 | K128: =SUM(E128:J128) -> 1255 | L128: =IF(COUNTIF(E128:J128,">0")>=4,(SUM(LARGE(E128:J128,{1,2,3,4}))),"Not Qualified") -> Not Qualified
B129: 124 | C129: CECILE BURG | F129: 345 | G129: 395 | I129: 470 | K129: =SUM(E129:J129) -> 1210 | L129: =IF(COUNTIF(E129:J129,">0")>=4,(SUM(LARGE(E129:J129,{1,2,3,4}))),"Not Qualified") -> Not Qualified
B130: 125 | C130: BRIAN BORILLO | E130: 340 | H130: 375 | I130: 375 | K130: =SUM(E130:J130) -> 1090 | L130: =IF(COUNTIF(E130:J130,">0")>=4,(SUM(LARGE(E130:J130,{1,2,3,4}))),"Not Qualified") -> Not Qualified
B131: 126 | C131: TRAVIS BOYER | H131: 560 | I131: 500 | K131: =SUM(E131:J131) -> 1060 | L131: =IF(COUNTIF(E131:J131,">0")>=4,(SUM(LARGE(E131:J131,{1,2,3,4}))),"Not Qualified") -> Not Qualified
B132: 127 | C132: MICHAEL ARRIGO | G132: 530 | H132: 265 | I132: 200 | K132: =SUM(E132:J132) -> 995 | L132: =IF(COUNTIF(E132:J132,">0")>=4,(SUM(LARGE(E132:J132,{1,2,3,4}))),"Not Qualified") -> Not Qualified
B133: 128 | C133: DANIEL HILL | F133: 495 | G133: 410 | K133: =SUM(E133:J133) -> 905 | L133: =IF(COUNTIF(E133:J133,">0")>=4,(SUM(LARGE(E133:J133,{1,2,3,4}))),"Not Qualified") -> Not Qualified
B134: 129 | C134: JASON HAYNES | F134: 395 | G134: 490 | K134: =SUM(E134:J134) -> 885 | L134: =IF(COUNTIF(E134:J134,">0")>=4,(SUM(LARGE(E134:J134,{1,2,3,4}))),"Not Qualified") -> Not Qualified
B135: 131 | C135: AARON JENNINGS | E135: 190 | F135: 340 | I135: 340 | K135: =SUM(E135:J135) -> 870 | L135: =IF(COUNTIF(E135:J135,">0")>=4,(SUM(LARGE(E135:J135,{1,2,3,4}))),"Not Qualified") -> Not Qualified
B136: 132 | C136: PETER AQUINO | E136: 165 | I136: 345 | J136: 350 | K136: =SUM(E136:J136) -> 860 | L136: =IF(COUNTIF(E136:J136,">0")>=4,(SUM(LARGE(E136:J136,{1,2,3,4}))),"Not Qualified") -> Not Qualified
B137: 133 | C137: VINCENT CONTE | I137: 365 | J137: 435 | K137: =SUM(E137:J137) -> 800 | L137: =IF(COUNTIF(E137:J137,">0")>=4,(SUM(LARGE(E137:J137,{1,2,3,4}))),"Not Qualified") -> Not Qualified
B138: 134 | C138: MIKE PENSINGER | F138: 195 | G138: 280 | H138: 285 | K138: =SUM(E138:J138) -> 760 | L138: =IF(COUNTIF(E138:J138,">0")>=4,(SUM(LARGE(E138:J138,{1,2,3,4}))),"Not Qualified") -> Not Qualified
B139: 135 | C139: JASPER DE GUZMAN | E139: 390 | F139: 365 | K139: =SUM(E139:J139) -> 755 | L139: =IF(COUNTIF(E139:J139,">0")>=4,(SUM(LARGE(E139:J139,{1,2,3,4}))),"Not Qualified") -> Not Qualified
B140: 136 | C140: JAMES CAUDILL | H140: 295 | I140: 440 | K140: =SUM(E140:J140) -> 735 | L140: =IF(COUNTIF(E140:J140,">0")>=4,(SUM(LARGE(E140:J140,{1,2,3,4}))),"Not Qualified") -> Not Qualified
B141: 137 | C141: JOEL ANDRIOLA | E141: 300 | G141: 420 | K141: =SUM(E141:J141) -> 720 | L141: =IF(COUNTIF(E141:J141,">0")>=4,(SUM(LARGE(E141:J141,{1,2,3,4}))),"Not Qualified") -> Not Qualified
B142: 138 | C142: FRANK PINCKNEY | F142: 310 | G142: 195 | J142: 210 | K142: =SUM(E142:J142) -> 715 | L142: =IF(COUNTIF(E142:J142,">0")>=4,(SUM(LARGE(E142:J142,{1,2,3,4}))),"Not Qualified") -> Not Qualified
B143: 139 | C143: KAREN ANDRIOLA | E143: 320 | F143: 170 | G143: 225 | K143: =SUM(E143:J143) -> 715 | L143: =IF(COUNTIF(E143:J143,">0")>=4,(SUM(LARGE(E143:J143,{1,2,3,4}))),"Not Qualified") -> Not Qualified
B144: 140 | C144: LEE HASSIG | I144: 420 | J144: 265 | K144: =SUM(E144:J144) -> 685 | L144: =IF(COUNTIF(E144:J144,">0")>=4,(SUM(LARGE(E144:J144,{1,2,3,4}))),"Not Qualified") -> Not Qualified
B145: 141 | C145: RAY SCHUMIN | G145: 685 | K145: =SUM(E145:J145) -> 685 | L145: =IF(COUNTIF(E145:J145,">0")>=4,(SUM(LARGE(E145:J145,{1,2,3,4}))),"Not Qualified") -> Not Qualified
B146: 142 | C146: SCOTT FARRELL | H146: 405 | J146: 275 | K146: =SUM(E146:J146) -> 680 | L146: =IF(COUNTIF(E146:J146,">0")>=4,(SUM(LARGE(E146:J146,{1,2,3,4}))),"Not Qualified") -> Not Qualified
B147: 143 | C147: RANDY RIEWERTS | E147: 675 | K147: =SUM(E147:J147) -> 675 | L147: =IF(COUNTIF(E147:J147,">0")>=4,(SUM(LARGE(E147:J147,{1,2,3,4}))),"Not Qualified") -> Not Qualified
B148: 144 | C148: JAMES LIVARA | E148: 145 | F148: 165 | H148: 350 | K148: =SUM(E148:J148) -> 660 | L148: =IF(COUNTIF(E148:J148,">0")>=4,(SUM(LARGE(E148:J148,{1,2,3,4}))),"Not Qualified") -> Not Qualified
B149: 145 | C149: STEVE DEES | E149: 130 | G149: 140 | H149: 390 | K149: =SUM(E149:J149) -> 660 | L149: =IF(COUNTIF(E149:J149,">0")>=4,(SUM(LARGE(E149:J149,{1,2,3,4}))),"Not Qualified") -> Not Qualified
B150: 146 | C150: DANIEL GOHLKE | E150: 645 | K150: =SUM(E150:J150) -> 645 | L150: =IF(COUNTIF(E150:J150,">0")>=4,(SUM(LARGE(E150:J150,{1,2,3,4}))),"Not Qualified") -> Not Qualified
B151: 147 | C151: BLAKE THOMAS | E151: 175 | F151: 185 | G151: 270 | K151: =SUM(E151:J151) -> 630 | L151: =IF(COUNTIF(E151:J151,">0")>=4,(SUM(LARGE(E151:J151,{1,2,3,4}))),"Not Qualified") -> Not Qualified
B152: 148 | C152: DAVID CLEMENS | G152: 620 | K152: =SUM(E152:J152) -> 620 | L152: =IF(COUNTIF(E152:J152,">0")>=4,(SUM(LARGE(E152:J152,{1,2,3,4}))),"Not Qualified") -> Not Qualified
B153: 149 | C153: PETER KEILER | E153: 210 | F153: 405 | K153: =SUM(E153:J153) -> 615 | L153: =IF(COUNTIF(E153:J153,">0")>=4,(SUM(LARGE(E153:J153,{1,2,3,4}))),"Not Qualified") -> Not Qualified
B154: 150 | C154: DAVE REISCH | H154: 365 | J154: 230 | K154: =SUM(E154:J154) -> 595 | L154: =IF(COUNTIF(E154:J154,">0")>=4,(SUM(LARGE(E154:J154,{1,2,3,4}))),"Not Qualified") -> Not Qualified
B155: 151 | C155: KHARIIM FARRELL | G155: 265 | J155: 315 | K155: =SUM(E155:J155) -> 580 | L155: =IF(COUNTIF(E155:J155,">0")>=4,(SUM(LARGE(E155:J155,{1,2,3,4}))),"Not Qualified") -> Not Qualified
B156: 152 | C156: ANDREW GHOSN | F156: 290 | G156: 285 | K156: =SUM(E156:J156) -> 575 | L156: =IF(COUNTIF(E156:J156,">0")>=4,(SUM(LARGE(E156:J156,{1,2,3,4}))),"Not Qualified") -> Not Qualified
B157: 153 | C157: GREGG SCHARIN | H157: 335 | I157: 230 | K157: =SUM(E157:J157) -> 565 | L157: =IF(COUNTIF(E157:J157,">0")>=4,(SUM(LARGE(E157:J157,{1,2,3,4}))),"Not Qualified") -> Not Qualified
B158: 154 | C158: JACK MARESCA | E158: 330 | F158: 235 | K158: =SUM(E158:J158) -> 565 | L158: =IF(COUNTIF(E158:J158,">0")>=4,(SUM(LARGE(E158:J158,{1,2,3,4}))),"Not Qualified") -> Not Qualified
B159: 155 | C159: SHARON ROSSI | E159: 90 | H159: 270 | I159: 205 | K159: =SUM(E159:J159) -> 565 | L159: =IF(COUNTIF(E159:J159,">0")>=4,(SUM(LARGE(E159:J159,{1,2,3,4}))),"Not Qualified") -> Not Qualified
B160: 156 | C160: KELLY SHOUP | F160: 545 | K160: =SUM(E160:J160) -> 545 | L160: =IF(COUNTIF(E160:J160,">0")>=4,(SUM(LARGE(E160:J160,{1,2,3,4}))),"Not Qualified") -> Not Qualified
B161: 157 | C161: JIORJO LIVARA | E161: 125 | F161: 130 | H161: 280 | K161: =SUM(E161:J161) -> 535 | L161: =IF(COUNTIF(E161:J161,">0")>=4,(SUM(LARGE(E161:J161,{1,2,3,4}))),"Not Qualified") -> Not Qualified
B162: 158 | C162: MICHAEL MORRISETT | E162: 280 | F162: 255 | K162: =SUM(E162:J162) -> 535 | L162: =IF(COUNTIF(E162:J162,">0")>=4,(SUM(LARGE(E162:J162,{1,2,3,4}))),"Not Qualified") -> Not Qualified
B163: 159 | C163: CHRIS KANE | E163: 270 | F163: 260 | K163: =SUM(E163:J163) -> 530 | L163: =IF(COUNTIF(E163:J163,">0")>=4,(SUM(LARGE(E163:J163,{1,2,3,4}))),"Not Qualified") -> Not Qualified
B164: 160 | C164: NICK HARRIS | E164: 530 | K164: =SUM(E164:J164) -> 530 | L164: =IF(COUNTIF(E164:J164,">0")>=4,(SUM(LARGE(E164:J164,{1,2,3,4}))),"Not Qualified") -> Not Qualified
B165: 161 | C165: RUSTY HOPKINS | J165: 525 | K165: =SUM(E165:J165) -> 525 | L165: =IF(COUNTIF(E165:J165,">0")>=4,(SUM(LARGE(E165:J165,{1,2,3,4}))),"Not Qualified") -> Not Qualified
B166: 162 | C166: SCOTT KRZASTEK | G166: 525 | K166: =SUM(E166:J166) -> 525 | L166: =IF(COUNTIF(E166:J166,">0")>=4,(SUM(LARGE(E166:J166,{1,2,3,4}))),"Not Qualified") -> Not Qualified
B167: 164 | C167: JAMES MCIVER | F167: 515 | K167: =SUM(E167:J167) -> 515 | L167: =IF(COUNTIF(E167:J167,">0")>=4,(SUM(LARGE(E167:J167,{1,2,3,4}))),"Not Qualified") -> Not Qualified
B168: 165 | C168: MICHAEL SEAL | G168: 505 | K168: =SUM(E168:J168) -> 505 | L168: =IF(COUNTIF(E168:J168,">0")>=4,(SUM(LARGE(E168:J168,{1,2,3,4}))),"Not Qualified") -> Not Qualified
B169: 166 | C169: CHAD MADALONI | J169: 500 | K169: =SUM(E169:J169) -> 500 | L169: =IF(COUNTIF(E169:J169,">0")>=4,(SUM(LARGE(E169:J169,{1,2,3,4}))),"Not Qualified") -> Not Qualified
B170: 167 | C170: JACK DAWSON | E170: 240 | G170: 260 | K170: =SUM(E170:J170) -> 500 | L170: =IF(COUNTIF(E170:J170,">0")>=4,(SUM(LARGE(E170:J170,{1,2,3,4}))),"Not Qualified") -> Not Qualified
B171: 168 | C171: JOHN DEL CORSO | J171: 480 | K171: =SUM(E171:J171) -> 480 | L171: =IF(COUNTIF(E171:J171,">0")>=4,(SUM(LARGE(E171:J171,{1,2,3,4}))),"Not Qualified") -> Not Qualified
B172: 169 | C172: LYNN COMBS | G172: 480 | K172: =SUM(E172:J172) -> 480 | L172: =IF(COUNTIF(E172:J172,">0")>=4,(SUM(LARGE(E172:J172,{1,2,3,4}))),"Not Qualified") -> Not Qualified
B173: 170 | C173: ADAM ROSEN | H173: 305 | J173: 165 | K173: =SUM(E173:J173) -> 470 | L173: =IF(COUNTIF(E173:J173,">0")>=4,(SUM(LARGE(E173:J173,{1,2,3,4}))),"Not Qualified") -> Not Qualified
B174: 171 | C174: DERREK FLEMING | G174: 460 | K174: =SUM(E174:J174) -> 460 | L174: =IF(COUNTIF(E174:J174,">0")>=4,(SUM(LARGE(E174:J174,{1,2,3,4}))),"Not Qualified") -> Not Qualified
B175: 172 | C175: PETER FRENCH | I175: 460 | K175: =SUM(E175:J175) -> 460 | L175: =IF(COUNTIF(E175:J175,">0")>=4,(SUM(LARGE(E175:J175,{1,2,3,4}))),"Not Qualified") -> Not Qualified
B176: 173 | C176: ROB LOWE | J176: 440 | K176: =SUM(E176:J176) -> 440 | L176: =IF(COUNTIF(E176:J176,">0")>=4,(SUM(LARGE(E176:J176,{1,2,3,4}))),"Not Qualified") -> Not Qualified
B177: 174 | C177: SCOTT GARDNER | F177: 435 | K177: =SUM(E177:J177) -> 435 | L177: =IF(COUNTIF(E177:J177,">0")>=4,(SUM(LARGE(E177:J177,{1,2,3,4}))),"Not Qualified") -> Not Qualified
B178: 175 | C178: CORY BROWN | G178: 430 | K178: =SUM(E178:J178) -> 430 | L178: =IF(COUNTIF(E178:J178,">0")>=4,(SUM(LARGE(E178:J178,{1,2,3,4}))),"Not Qualified") -> Not Qualified
B179: 176 | C179: EDDIE TOVAR | E179: 105 | F179: 150 | G179: 170 | K179: =SUM(E179:J179) -> 425 | L179: =IF(COUNTIF(E179:J179,">0")>=4,(SUM(LARGE(E179:J179,{1,2,3,4}))),"Not Qualified") -> Not Qualified
B180: 177 | C180: THOMAS KNEIPP | G180: 105 | I180: 320 | K180: =SUM(E180:J180) -> 425 | L180: =IF(COUNTIF(E180:J180,">0")>=4,(SUM(LARGE(E180:J180,{1,2,3,4}))),"Not Qualified") -> Not Qualified
B181: 178 | C181: ANDREW CHISHOLM | J181: 420 | K181: =SUM(E181:J181) -> 420 | L181: =IF(COUNTIF(E181:J181,">0")>=4,(SUM(LARGE(E181:J181,{1,2,3,4}))),"Not Qualified") -> Not Qualified
B182: 179 | C182: SETH DOZIER | E182: 415 | K182: =SUM(E182:J182) -> 415 | L182: =IF(COUNTIF(E182:J182,">0")>=4,(SUM(LARGE(E182:J182,{1,2,3,4}))),"Not Qualified") -> Not Qualified
B183: 180 | C183: CHRIS STAPLES | H183: 410 | K183: =SUM(E183:J183) -> 410 | L183: =IF(COUNTIF(E183:J183,">0")>=4,(SUM(LARGE(E183:J183,{1,2,3,4}))),"Not Qualified") -> Not Qualified
B184: 181 | C184: ROB HALL | J184: 410 | K184: =SUM(E184:J184) -> 410 | L184: =IF(COUNTIF(E184:J184,">0")>=4,(SUM(LARGE(E184:J184,{1,2,3,4}))),"Not Qualified") -> Not Qualified
B185: 182 | C185: JOYCE SANDERS | I185: 235 | J185: 170 | K185: =SUM(E185:J185) -> 405 | L185: =IF(COUNTIF(E185:J185,">0")>=4,(SUM(LARGE(E185:J185,{1,2,3,4}))),"Not Qualified") -> Not Qualified
B186: 183 | C186: MARK RODGERS | E186: 385 | K186: =SUM(E186:J186) -> 385 | L186: =IF(COUNTIF(E186:J186,">0")>=4,(SUM(LARGE(E186:J186,{1,2,3,4}))),"Not Qualified") -> Not Qualified
B187: 184 | C187: MATTHEW KNIPPLE | J187: 385 | K187: =SUM(E187:J187) -> 385 | L187: =IF(COUNTIF(E187:J187,">0")>=4,(SUM(LARGE(E187:J187,{1,2,3,4}))),"Not Qualified") -> Not Qualified
B188: 185 | C188: KIM SETZER | E188: 380 | K188: =SUM(E188:J188) -> 380 | L188: =IF(COUNTIF(E188:J188,">0")>=4,(SUM(LARGE(E188:J188,{1,2,3,4}))),"Not Qualified") -> Not Qualified
B189: 186 | C189: LARRY TRANTHAM | G189: 375 | K189: =SUM(E189:J189) -> 375 | L189: =IF(COUNTIF(E189:J189,">0")>=4,(SUM(LARGE(E189:J189,{1,2,3,4}))),"Not Qualified") -> Not Qualified
B190: 187 | C190: CEASAR DELGADILLO | J190: 360 | K190: =SUM(E190:J190) -> 360 | L190: =IF(COUNTIF(E190:J190,">0")>=4,(SUM(LARGE(E190:J190,{1,2,3,4}))),"Not Qualified") -> Not Qualified
B191: 188 | C191: BENO RUBIN | J191: 355 | K191: =SUM(E191:J191) -> 355 | L191: =IF(COUNTIF(E191:J191,">0")>=4,(SUM(LARGE(E191:J191,{1,2,3,4}))),"Not Qualified") -> Not Qualified
B192: 189 | C192: JUSTIN MCMILLIAN | G192: 355 | K192: =SUM(E192:J192) -> 355 | L192: =IF(COUNTIF(E192:J192,">0")>=4,(SUM(LARGE(E192:J192,{1,2,3,4}))),"Not Qualified") -> Not Qualified
B193: 190 | C193: DEREK BAKER | E193: 350 | K193: =SUM(E193:J193) -> 350 | L193: =IF(COUNTIF(E193:J193,">0")>=4,(SUM(LARGE(E193:J193,{1,2,3,4}))),"Not Qualified") -> Not Qualified
B194: 191 | C194: LEE MATHIAS | I194: 350 | K194: =SUM(E194:J194) -> 350 | L194: =IF(COUNTIF(E194:J194,">0")>=4,(SUM(LARGE(E194:J194,{1,2,3,4}))),"Not Qualified") -> Not Qualified
B195: 192 | C195: DAVID COOKE | G195: 345 | K195: =SUM(E195:J195) -> 345 | L195: =IF(COUNTIF(E195:J195,">0")>=4,(SUM(LARGE(E195:J195,{1,2,3,4}))),"Not Qualified") -> Not Qualified
B196: 193 | C196: DANIEL KRAEMER | E196: 195 | F196: 140 | K196: =SUM(E196:J196) -> 335 | L196: =IF(COUNTIF(E196:J196,">0")>=4,(SUM(LARGE(E196:J196,{1,2,3,4}))),"Not Qualified") -> Not Qualified
B197: 194 | C197: BIFF JENNINGS | F197: 325 | K197: =SUM(E197:J197) -> 325 | L197: =IF(COUNTIF(E197:J197,">0")>=4,(SUM(LARGE(E197:J197,{1,2,3,4}))),"Not Qualified") -> Not Qualified
B198: 195 | C198: BRIAN HEATH | H198: 325 | K198: =SUM(E198:J198) -> 325 | L198: =IF(COUNTIF(E198:J198,">0")>=4,(SUM(LARGE(E198:J198,{1,2,3,4}))),"Not Qualified") -> Not Qualified
B199: 196 | C199: DAVID CORDER | F199: 315 | K199: =SUM(E199:J199) -> 315 | L199: =IF(COUNTIF(E199:J199,">0")>=4,(SUM(LARGE(E199:J199,{1,2,3,4}))),"Not Qualified") -> Not Qualified
B200: 197 | C200: DANIEL SHAW | E200: 155 | F200: 155 | K200: =SUM(E200:J200) -> 310 | L200: =IF(COUNTIF(E200:J200,">0")>=4,(SUM(LARGE(E200:J200,{1,2,3,4}))),"Not Qualified") -> Not Qualified
B201: 198 | C201: JANE COMBS | G201: 310 | K201: =SUM(E201:J201) -> 310 | L201: =IF(COUNTIF(E201:J201,">0")>=4,(SUM(LARGE(E201:J201,{1,2,3,4}))),"Not Qualified") -> Not Qualified
B202: 199 | C202: CESAR DELGADILLO | I202: 305 | K202: =SUM(E202:J202) -> 305 | L202: =IF(COUNTIF(E202:J202,">0")>=4,(SUM(LARGE(E202:J202,{1,2,3,4}))),"Not Qualified") -> Not Qualified
B203: 200 | C203: MARK DOVEL | F203: 215 | G203: 90 | K203: =SUM(E203:J203) -> 305 | L203: =IF(COUNTIF(E203:J203,">0")>=4,(SUM(LARGE(E203:J203,{1,2,3,4}))),"Not Qualified") -> Not Qualified
B204: 201 | C204: ROBERT RUSSEL | E204: 305 | K204: =SUM(E204:J204) -> 305 | L204: =IF(COUNTIF(E204:J204,">0")>=4,(SUM(LARGE(E204:J204,{1,2,3,4}))),"Not Qualified") -> Not Qualified
B205: 202 | C205: MYRA DINGMAN | H205: 300 | K205: =SUM(E205:J205) -> 300 | L205: =IF(COUNTIF(E205:J205,">0")>=4,(SUM(LARGE(E205:J205,{1,2,3,4}))),"Not Qualified") -> Not Qualified
B206: 203 | C206: JASON JAHNSEN | F206: 295 | K206: =SUM(E206:J206) -> 295 | L206: =IF(COUNTIF(E206:J206,">0")>=4,(SUM(LARGE(E206:J206,{1,2,3,4}))),"Not Qualified") -> Not Qualified
B207: 204 | C207: JIM CAWRSE | E207: 135 | F207: 160 | K207: =SUM(E207:J207) -> 295 | L207: =IF(COUNTIF(E207:J207,">0")>=4,(SUM(LARGE(E207:J207,{1,2,3,4}))),"Not Qualified") -> Not Qualified
B208: 205 | C208: ANTHONY BROEKEMA | I208: 285 | K208: =SUM(E208:J208) -> 285 | L208: =IF(COUNTIF(E208:J208,">0")>=4,(SUM(LARGE(E208:J208,{1,2,3,4}))),"Not Qualified") -> Not Qualified
B209: 206 | C209: DAVE HINDE | F209: 275 | K209: =SUM(E209:J209) -> 275 | L209: =IF(COUNTIF(E209:J209,">0")>=4,(SUM(LARGE(E209:J209,{1,2,3,4}))),"Not Qualified") -> Not Qualified
B210: 207 | C210: DAVID DAVIS | G210: 275 | K210: =SUM(E210:J210) -> 275 | L210: =IF(COUNTIF(E210:J210,">0")>=4,(SUM(LARGE(E210:J210,{1,2,3,4}))),"Not Qualified") -> Not Qualified
B211: 208 | C211: MICHAEL NEWCOMB | H211: 275 | K211: =SUM(E211:J211) -> 275 | L211: =IF(COUNTIF(E211:J211,">0")>=4,(SUM(LARGE(E211:J211,{1,2,3,4}))),"Not Qualified") -> Not Qualified
B212: 209 | C212: BRENT SHOUP | J212: 270 | K212: =SUM(E212:J212) -> 270 | L212: =IF(COUNTIF(E212:J212,">0")>=4,(SUM(LARGE(E212:J212,{1,2,3,4}))),"Not Qualified") -> Not Qualified
B213: 210 | C213: TERRY HARDEE | F213: 270 | K213: =SUM(E213:J213) -> 270 | L213: =IF(COUNTIF(E213:J213,">0")>=4,(SUM(LARGE(E213:J213,{1,2,3,4}))),"Not Qualified") -> Not Qualified
B214: 211 | C214: MARCUS ROCCHI | I214: 260 | K214: =SUM(E214:J214) -> 260 | L214: =IF(COUNTIF(E214:J214,">0")>=4,(SUM(LARGE(E214:J214,{1,2,3,4}))),"Not Qualified") -> Not Qualified
B215: 212 | C215: TOM KNEIPP | J215: 255 | K215: =SUM(E215:J215) -> 255 | L215: =IF(COUNTIF(E215:J215,">0")>=4,(SUM(LARGE(E215:J215,{1,2,3,4}))),"Not Qualified") -> Not Qualified
B216: 213 | C216: GARY BARNES | E216: 250 | K216: =SUM(E216:J216) -> 250 | L216: =IF(COUNTIF(E216:J216,">0")>=4,(SUM(LARGE(E216:J216,{1,2,3,4}))),"Not Qualified") -> Not Qualified
B217: 214 | C217: STEVE NEWTON | I217: 250 | K217: =SUM(E217:J217) -> 250 | L217: =IF(COUNTIF(E217:J217,">0")>=4,(SUM(LARGE(E217:J217,{1,2,3,4}))),"Not Qualified") -> Not Qualified
B218: 215 | C218: WILLIAM HATFIELD | G218: 250 | K218: =SUM(E218:J218) -> 250 | L218: =IF(COUNTIF(E218:J218,">0")>=4,(SUM(LARGE(E218:J218,{1,2,3,4}))),"Not Qualified") -> Not Qualified
B219: 216 | C219: BRYAN WATSON | G219: 245 | K219: =SUM(E219:J219) -> 245 | L219: =IF(COUNTIF(E219:J219,">0")>=4,(SUM(LARGE(E219:J219,{1,2,3,4}))),"Not Qualified") -> Not Qualified
B220: 217 | C220: CURTIS BURNETTE | J220: 245 | K220: =SUM(E220:J220) -> 245 | L220: =IF(COUNTIF(E220:J220,">0")>=4,(SUM(LARGE(E220:J220,{1,2,3,4}))),"Not Qualified") -> Not Qualified
B221: 218 | C221: CLINT WORRELL | F221: 240 | K221: =SUM(E221:J221) -> 240 | L221: =IF(COUNTIF(E221:J221,">0")>=4,(SUM(LARGE(E221:J221,{1,2,3,4}))),"Not Qualified") -> Not Qualified
B222: 219 | C222: JOHN MOLINELLI | I222: 240 | K222: =SUM(E222:J222) -> 240 | L222: =IF(COUNTIF(E222:J222,">0")>=4,(SUM(LARGE(E222:J222,{1,2,3,4}))),"Not Qualified") -> Not Qualified
B223: 220 | C223: PAT GERBUS | J223: 220 | K223: =SUM(E223:J223) -> 220 | L223: =IF(COUNTIF(E223:J223,">0")>=4,(SUM(LARGE(E223:J223,{1,2,3,4}))),"Not Qualified") -> Not Qualified
B224: 221 | C224: RON STIMBERT | I224: 220 | K224: =SUM(E224:J224) -> 220 | L224: =IF(COUNTIF(E224:J224,">0")>=4,(SUM(LARGE(E224:J224,{1,2,3,4}))),"Not Qualified") -> Not Qualified
B225: 222 | C225: COLLIN KREVONICK | E225: 215 | K225: =SUM(E225:J225) -> 215 | L225: =IF(COUNTIF(E225:J225,">0")>=4,(SUM(LARGE(E225:J225,{1,2,3,4}))),"Not Qualified") -> Not Qualified
B226: 223 | C226: GREG SCHAVIN | F226: 95 | G226: 120 | K226: =SUM(E226:J226) -> 215 | L226: =IF(COUNTIF(E226:J226,">0")>=4,(SUM(LARGE(E226:J226,{1,2,3,4}))),"Not Qualified") -> Not Qualified
B227: 224 | C227: BILL HATFIELD | E227: 205 | K227: =SUM(E227:J227) -> 205 | L227: =IF(COUNTIF(E227:J227,">0")>=4,(SUM(LARGE(E227:J227,{1,2,3,4}))),"Not Qualified") -> Not Qualified
B228: 225 | C228: JONATHAN LYONS | J228: 205 | K228: =SUM(E228:J228) -> 205 | L228: =IF(COUNTIF(E228:J228,">0")>=4,(SUM(LARGE(E228:J228,{1,2,3,4}))),"Not Qualified") -> Not Qualified
B229: 226 | C229: DUSTIN FOSTER | E229: 200 | K229: =SUM(E229:J229) -> 200 | L229: =IF(COUNTIF(E229:J229,">0")>=4,(SUM(LARGE(E229:J229,{1,2,3,4}))),"Not Qualified") -> Not Qualified
B230: 227 | C230: ELAINE SHELL | J230: 195 | K230: =SUM(E230:J230) -> 195 | L230: =IF(COUNTIF(E230:J230,">0")>=4,(SUM(LARGE(E230:J230,{1,2,3,4}))),"Not Qualified") -> Not Qualified
B231: 228 | C231: MATT MATHIAS | I231: 190 | K231: =SUM(E231:J231) -> 190 | L231: =IF(COUNTIF(E231:J231,">0")>=4,(SUM(LARGE(E231:J231,{1,2,3,4}))),"Not Qualified") -> Not Qualified
B232: 229 | C232: ZACH ZELLER | J232: 190 | K232: =SUM(E232:J232) -> 190 | L232: =IF(COUNTIF(E232:J232,">0")>=4,(SUM(LARGE(E232:J232,{1,2,3,4}))),"Not Qualified") -> Not Qualified
B233: 230 | C233: CHRISTOPHER SHAHSIAH | J233: 180 | K233: =SUM(E233:J233) -> 180 | L233: =IF(COUNTIF(E233:J233,">0")>=4,(SUM(LARGE(E233:J233,{1,2,3,4}))),"Not Qualified") -> Not Qualified
B234: 231 | C234: JAY HOPKINS | F234: 175 | K234: =SUM(E234:J234) -> 175 | L234: =IF(COUNTIF(E234:J234,">0")>=4,(SUM(LARGE(E234:J234,{1,2,3,4}))),"Not Qualified") -> Not Qualified
B235: 232 | C235: JOHN CARLTON | J235: 175 | K235: =SUM(E235:J235) -> 175 | L235: =IF(COUNTIF(E235:J235,">0")>=4,(SUM(LARGE(E235:J235,{1,2,3,4}))),"Not Qualified") -> Not Qualified
B236: 233 | C236: ANGELO SOTO | F236: 85 | G236: 80 | K236: =SUM(E236:J236) -> 165 | L236: =IF(COUNTIF(E236:J236,">0")>=4,(SUM(LARGE(E236:J236,{1,2,3,4}))),"Not Qualified") -> Not Qualified
B237: 234 | C237: ANDREW BELLEVILLE | J237: 160 | K237: =SUM(E237:J237) -> 160 | L237: =IF(COUNTIF(E237:J237,">0")>=4,(SUM(LARGE(E237:J237,{1,2,3,4}))),"Not Qualified") -> Not Qualified
B238: 235 | C238: JACK LITTLEJOHN | J238: 155 | K238: =SUM(E238:J238) -> 155 | L238: =IF(COUNTIF(E238:J238,">0")>=4,(SUM(LARGE(E238:J238,{1,2,3,4}))),"Not Qualified") -> Not Qualified
B239: 236 | C239: JASON CHEBETAR | G239: 150 | K239: =SUM(E239:J239) -> 150 | L239: =IF(COUNTIF(E239:J239,">0")>=4,(SUM(LARGE(E239:J239,{1,2,3,4}))),"Not Qualified") -> Not Qualified
B240: 237 | C240: JASON SINNARD | E240: 150 | K240: =SUM(E240:J240) -> 150 | L240: =IF(COUNTIF(E240:J240,">0")>=4,(SUM(LARGE(E240:J240,{1,2,3,4}))),"Not Qualified") -> Not Qualified
B241: 238 | C241: RICK MOELLER | J241: 135 | K241: =SUM(E241:J241) -> 135 | L241: =IF(COUNTIF(E241:J241,">0")>=4,(SUM(LARGE(E241:J241,{1,2,3,4}))),"Not Qualified") -> Not Qualified
B242: 239 | C242: DELRAY CORRY | J242: 130 | K242: =SUM(E242:J242) -> 130 | L242: =IF(COUNTIF(E242:J242,">0")>=4,(SUM(LARGE(E242:J242,{1,2,3,4}))),"Not Qualified") -> Not Qualified
B243: 240 | C243: BETH HUGHES | J243: 125 | K243: =SUM(E243:J243) -> 125 | L243: =IF(COUNTIF(E243:J243,">0")>=4,(SUM(LARGE(E243:J243,{1,2,3,4}))),"Not Qualified") -> Not Qualified
B244: 241 | C244: LAURIE WHITE | J244: 120 | K244: =SUM(E244:J244) -> 120 | L244: =IF(COUNTIF(E244:J244,">0")>=4,(SUM(LARGE(E244:J244,{1,2,3,4}))),"Not Qualified") -> Not Qualified
B245: 242 | C245: SZE HUI | F245: 115 | K245: =SUM(E245:J245) -> 115 | L245: =IF(COUNTIF(E245:J245,">0")>=4,(SUM(LARGE(E245:J245,{1,2,3,4}))),"Not Qualified") -> Not Qualified
B246: 243 | C246: TREY BLACK | G246: 110 | K246: =SUM(E246:J246) -> 110 | L246: =IF(COUNTIF(E246:J246,">0")>=4,(SUM(LARGE(E246:J246,{1,2,3,4}))),"Not Qualified") -> Not Qualified
B247: 244 | C247: CINDY BROWN | G247: 100 | K247: =SUM(E247:J247) -> 100 | L247: =IF(COUNTIF(E247:J247,">0")>=4,(SUM(LARGE(E247:J247,{1,2,3,4}))),"Not Qualified") -> Not Qualified
B248: 245 | C248: ERNIE TORRES | G248: 95 | K248: =SUM(E248:J248) -> 95 | L248: =IF(COUNTIF(E248:J248,">0")>=4,(SUM(LARGE(E248:J248,{1,2,3,4}))),"Not Qualified") -> Not Qualified
B249: 246 | C249: FRED BONI | E249: 95 | K249: =SUM(E249:J249) -> 95 | L249: =IF(COUNTIF(E249:J249,">0")>=4,(SUM(LARGE(E249:J249,{1,2,3,4}))),"Not Qualified") -> Not Qualified
B250: 247 | C250: JASON WADDY | F250: 90 | K250: =SUM(E250:J250) -> 90 | L250: =IF(COUNTIF(E250:J250,">0")>=4,(SUM(LARGE(E250:J250,{1,2,3,4}))),"Not Qualified") -> Not Qualified
B251: 248 | C251: RICKY GRANOZIO | G251: 85 | K251: =SUM(E251:J251) -> 85 | L251: =IF(COUNTIF(E251:J251,">0")>=4,(SUM(LARGE(E251:J251,{1,2,3,4}))),"Not Qualified") -> Not Qualified
B252: 249 | C252: VANESSA FOSTER | E252: 85 | K252: =SUM(E252:J252) -> 85 | L252: =IF(COUNTIF(E252:J252,">0")>=4,(SUM(LARGE(E252:J252,{1,2,3,4}))),"Not Qualified") -> Not Qualified
B253: 250 | C253: JONATHAN SPIKES | E253: 80 | K253: =SUM(E253:J253) -> 80 | L253: =IF(COUNTIF(E253:J253,">0")>=4,(SUM(LARGE(E253:J253,{1,2,3,4}))),"Not Qualified") -> Not Qualified
B254: 251 | C254: JULIE GREENE | G254: 70 | K254: =SUM(E254:J254) -> 70 | L254: =IF(COUNTIF(E254:J254,">0")>=4,(SUM(LARGE(E254:J254,{1,2,3,4}))),"Not Qualified") -> Not Qualified
B255: 252 | C255: DAWN COPSETTA | F255: 65 | K255: =SUM(E255:J255) -> 65 | L255: =IF(COUNTIF(E255:J255,">0")>=4,(SUM(LARGE(E255:J255,{1,2,3,4}))),"Not Qualified") -> Not Qualified
B256: 253 | C256: IVANA NEDELJKOVICH | G256: 50 | K256: =SUM(E256:J256) -> 50 | L256: =IF(COUNTIF(E256:J256,">0")>=4,(SUM(LARGE(E256:J256,{1,2,3,4}))),"Not Qualified") -> Not Qualified
B257: 254 | C257: RICHARD ROSSI | G257: 45 | K257: =SUM(E257:J257) -> 45 | L257: =IF(COUNTIF(E257:J257,">0")>=4,(SUM(LARGE(E257:J257,{1,2,3,4}))),"Not Qualified") -> Not Qualified
E259: EVENT
A260: CLASS | B260: AWARD | C260: POS | D260: DRIVER | E260: APR | F260: MAY | G260: JUN | H260: JUL | I260: AUG | J260: AUG | K260: OCT | L260: TOTAL | M260: Best 4 of 6
E261: Cancelled | I261: Make up Day for April
A263: SS | B263: T | C263: 1 | D263: MARC PORTANOVA | F263: 12 | H263: 9 | I263: 12 | J263: 12 | K263: 9 | L263: =SUM(E263:K263) -> 54 | M263: =IF(COUNTIF(E263:K263,">0")>=3,(SUM(LARGE(E263:K263,{1,2,3,4}))),"Not Qualified") -> 45
C264: 2 | D264: GIL SMITH | G264: 12 | H264: 12 | I264: 9 | J264: 9 | K264: 9 | L264: =SUM(E264:K264) -> 51 | M264: =IF(COUNTIF(E264:K264,">0")>=3,(SUM(LARGE(E264:K264,{1,2,3,4}))),"Not Qualified") -> 42
C265: 3 | D265: KEATH MARX | F265: 7 | H265: 7 | K265: 7 | L265: =SUM(E265:K265) -> 21 | M265: 21
C266: 4 | D266: JUSTIN LOEHLIN | F266: 9 | K266: 4 | L266: =SUM(E266:K266) -> 13 | M266: =IF(COUNTIF(E266:K266,">0")>=3,(SUM(LARGE(E266:K266,{1,2,3,4}))),"Not Qualified") -> Not Qualified
C267: 5 | D267: JASON LISNER | K267: 12 | L267: =SUM(E267:K267) -> 12 | M267: =IF(COUNTIF(E267:K267,">0")>=3,(SUM(LARGE(E267:K267,{1,2,3,4}))),"Not Qualified") -> Not Qualified
C268: 6 | D268: DAVID SKITTLETHORP | H268: 6 | L268: =SUM(E268:K268) -> 6 | M268: =IF(COUNTIF(E268:K268,">0")>=3,(SUM(LARGE(E268:K268,{1,2,3,4}))),"Not Qualified") -> Not Qualified
C269: 7 | D269: TERRY BAKER | K269: 5 | L269: =SUM(E269:K269) -> 5 | M269: =IF(COUNTIF(E269:K269,">0")>=3,(SUM(LARGE(E269:K269,{1,2,3,4}))),"Not Qualified") -> Not Qualified
A271: AS | D271: ERIC ANDUZE | K271: 12 | L271: =SUM(E271:K271) -> 12 | M271: =IF(COUNTIF(E271:K271,">0")>=3,(SUM(LARGE(E271:K271,{1,2,3,4}))),"Not Qualified") -> Not Qualified
A273: BS | C273: 1 | D273: GARY BARNES | F273: 12 | L273: =SUM(E273:K273) -> 12 | M273: =IF(COUNTIF(E273:K273,">0")>=3,(SUM(LARGE(E273:K273,{1,2,3,4}))),"Not Qualified") -> Not Qualified
C274: 2 | D274: MARC LISNER | G274: 12 | L274: =SUM(E274:K274) -> 12 | M274: =IF(COUNTIF(E274:K274,">0")>=3,(SUM(LARGE(E274:K274,{1,2,3,4}))),"Not Qualified") -> Not Qualified
C275: 3 | D275: FRANK PINCKNEY | G275: 9 | L275: =SUM(E275:K275) -> 9 | M275: =IF(COUNTIF(E275:K275,">0")>=3,(SUM(LARGE(E275:K275,{1,2,3,4}))),"Not Qualified") -> Not Qualified
A277: CS | B277: T | C277: 1 | D277: BERNIE CHMIELEWSKI | F277: 12 | G277: 12 | H277: 12 | I277: 12 | J277: 12 | K277: 12 | L277: =SUM(E277:K277) -> 72 | M277: =IF(COUNTIF(E277:K277,">0")>=3,(SUM(LARGE(E277:K277,{1,2,3,4}))),"Not Qualified") -> 48
C278: 2 | D278: JAMES WILSON | F278: 9 | G278: 9 | L278: =SUM(E278:K278) -> 18 | M278: =IF(COUNTIF(E278:K278,">0")>=3,(SUM(LARGE(E278:K278,{1,2,3,4}))),"Not Qualified") -> Not Qualified
C279: 3 | D279: MICHAEL SEAL | H279: 9 | L279: =SUM(E279:K279) -> 9 | M279: =IF(COUNTIF(E279:K279,">0")>=3,(SUM(LARGE(E279:K279,{1,2,3,4}))),"Not Qualified") -> Not Qualified
C280: 4 | D280: RUSTY HOPKINS | K280: 9 | L280: =SUM(E280:K280) -> 9 | M280: =IF(COUNTIF(E280:K280,">0")>=3,(SUM(LARGE(E280:K280,{1,2,3,4}))),"Not Qualified") -> Not Qualified
C281: 5 | D281: FRANK INSLEY | F281: 7 | L281: =SUM(E281:K281) -> 7 | M281: =IF(COUNTIF(E281:K281,">0")>=3,(SUM(LARGE(E281:K281,{1,2,3,4}))),"Not Qualified") -> Not Qualified
A283: DS | B283: T | C283: 1 | D283: WES MICHAELS | F283: 9 | G283: 12 | I283: 12 | J283: 12 | K283: 12 | L283: =SUM(E283:K283) -> 57 | M283: =IF(COUNTIF(E283:K283,">0")>=3,(SUM(LARGE(E283:K283,{1,2,3,4}))),"Not Qualified") -> 48
C284: 2 | D284: CURTIS STAPLES | F284: 12 | G284: 9 | L284: =SUM(E284:K284) -> 21 | M284: =IF(COUNTIF(E284:K284,">0")>=3,(SUM(LARGE(E284:K284,{1,2,3,4}))),"Not Qualified") -> Not Qualified
A286: ES | B286: T | C286: 1 | D286: ROBB DAVIS | F286: 9 | G286: 12 | H286: 12 | I286: 12 | J286: 12 | K286: 9 | L286: =SUM(E286:K286) -> 66 | M286: =IF(COUNTIF(E286:K286,">0")>=3,(SUM(LARGE(E286:K286,{1,2,3,4}))),"Not Qualified") -> 48
C287: 2 | D287: ED RAYMUNDO | F287: 12 | G287: 9 | K287: 12 | L287: =SUM(E287:K287) -> 33 | M287: 33
C288: 3 | D288: CLAYTON JOHNSON | F288: 7 | G288: 7 | I288: 9 | K288: 5 | L288: =SUM(E288:K288) -> 28 | M288: =IF(COUNTIF(E288:K288,">0")>=3,(SUM(LARGE(E288:K288,{1,2,3,4}))),"Not Qualified") -> 28
C289: 4 | D289: CHAD MADALONI | K289: 7 | L289: =SUM(E289:K289) -> 7 | M289: =IF(COUNTIF(E289:K289,">0")>=3,(SUM(LARGE(E289:K289,{1,2,3,4}))),"Not Qualified") -> Not Qualified
C290: 5 | D290: JOMMEL DE GUZMAN | K290: 6 | L290: =SUM(E290:K290) -> 6 | M290: =IF(COUNTIF(E290:K290,">0")>=3,(SUM(LARGE(E290:K290,{1,2,3,4}))),"Not Qualified") -> Not Qualified
A292: FS | B292: T | C292: 1 | D292: BILL EAKER | F292: 9 | G292: 12 | H292: 12 | I292: 12 | J292: 12 | L292: =SUM(E292:K292) -> 57 | M292: =IF(COUNTIF(E292:K292,">0")>=3,(SUM(LARGE(E292:K292,{1,2,3,4}))),"Not Qualified") -> 48
C293: 2 | D293: TODD HOWES | F293: 7 | G293: 9 | I293: 9 | J293: 9 | L293: =SUM(E293:K293) -> 34 | M293: =IF(COUNTIF(E293:K293,">0")>=3,(SUM(LARGE(E293:K293,{1,2,3,4}))),"Not Qualified") -> 34
C294: 3 | D294: RICK MARIANI | F294: 12 | L294: =SUM(E294:K294) -> 12 | M294: =IF(COUNTIF(E294:K294,">0")>=3,(SUM(LARGE(E294:K294,{1,2,3,4}))),"Not Qualified") -> Not Qualified
A296: GS | B296: T | C296: 1 | D296: JIM HERLEY | F296: 9 | G296: 7 | H296: 7 | I296: 12 | J296: 12 | K296: 12 | L296: =SUM(E296:K296) -> 59 | M296: =IF(COUNTIF(E296:K296,">0")>=3,(SUM(LARGE(E296:K296,{1,2,3,4}))),"Not Qualified") -> 45
C297: 2 | D297: MARK RHOADES | G297: 12 | H297: 9 | L297: =SUM(E297:K297) -> 21 | M297: =IF(COUNTIF(E297:K297,">0")>=3,(SUM(LARGE(E297:K297,{1,2,3,4}))),"Not Qualified") -> Not Qualified
C298: 3 | D298: DANIEL GOHLKE | F298: 12 | L298: =SUM(E298:K298) -> 12 | M298: =IF(COUNTIF(E298:K298,">0")>=3,(SUM(LARGE(E298:K298,{1,2,3,4}))),"Not Qualified") -> Not Qualified
C299: 4 | D299: RAY SCHUMIN | H299: 12 | L299: =SUM(E299:K299) -> 12 | M299: =IF(COUNTIF(E299:K299,">0")>=3,(SUM(LARGE(E299:K299,{1,2,3,4}))),"Not Qualified") -> Not Qualified
C300: 5 | D300: JUSTIN LOEHLIN | G300: 9 | L300: =SUM(E300:K300) -> 9 | M300: =IF(COUNTIF(E300:K300,">0")>=3,(SUM(LARGE(E300:K300,{1,2,3,4}))),"Not Qualified") -> Not Qualified
C301: 6 | D301: TODD HOWES | K301: 9 | L301: =SUM(E301:K301) -> 9 | M301: =IF(COUNTIF(E301:K301,">0")>=3,(SUM(LARGE(E301:K301,{1,2,3,4}))),"Not Qualified") -> Not Qualified
C302: 7 | D302: DAVE HINDE | G302: 6 | L302: =SUM(E302:K302) -> 6 | M302: =IF(COUNTIF(E302:K302,">0")>=3,(SUM(LARGE(E302:K302,{1,2,3,4}))),"Not Qualified") -> Not Qualified
C303: 8 | D303: DAVID COOKE | H303: 6 | L303: =SUM(E303:K303) -> 6 | M303: =IF(COUNTIF(E303:K303,">0")>=3,(SUM(LARGE(E303:K303,{1,2,3,4}))),"Not Qualified") -> Not Qualified
A305: HS | B305: T | C305: 1 | D305: ROY ARMSTRONG | H305: 12 | I305: 9 | J305: 9 | K305: 12 | L305: =SUM(E305:K305) -> 42 | M305: =IF(COUNTIF(E305:K305,">0")>=3,(SUM(LARGE(E305:K305,{1,2,3,4}))),"Not Qualified") -> 42
C306: 2 | D306: BILL SPRUILL | F306: 12 | H306: 7 | I306: 7 | K306: 9 | L306: =SUM(E306:K306) -> 35 | M306: =IF(COUNTIF(E306:K306,">0")>=3,(SUM(LARGE(E306:K306,{1,2,3,4}))),"Not Qualified") -> 35
C307: 3 | D307: JEFF ROONEY | I307: 12 | J307: 12 | L307: =SUM(E307:K307) -> 24 | M307: =IF(COUNTIF(E307:K307,">0")>=3,(SUM(LARGE(E307:K307,{1,2,3,4}))),"Not Qualified") -> Not Qualified
C308: 4 | D308: DAVID CORDER | G308: 12 | L308: =SUM(E308:K308) -> 12 | M308: =IF(COUNTIF(E308:K308,">0")>=3,(SUM(LARGE(E308:K308,{1,2,3,4}))),"Not Qualified") -> Not Qualified
A310: LAD | B310: T | C310: 1 | D310: AUDREY CHENERY | F310: 12 | G310: 12 | H310: 12 | J310: 12 | L310: =SUM(E310:K310) -> 48 | M310: =IF(COUNTIF(E310:K310,">0")>=3,(SUM(LARGE(E310:K310,{1,2,3,4}))),"Not Qualified") -> 48
B311: T | C311: 2 | D311: DONNA MARX | F311: 9 | H311: 9 | K311: 12 | L311: =SUM(E311:K311) -> 30 | M311: 30
B312: T | C312: 3 | D312: MANDY GREGG | F312: 6 | G312: 3 | H312: 2 | I312: 9 | J312: 9 | L312: =SUM(E312:K312) -> 29 | M312: =IF(COUNTIF(E312:K312,">0")>=3,(SUM(LARGE(E312:K312,{1,2,3,4}))),"Not Qualified") -> 27
B313: T | C313: 4 | D313: GEORGANA TURNER | F313: 4 | G313: 7 | H313: 5 | K313: 9 | L313: =SUM(E313:K313) -> 25 | M313: =IF(COUNTIF(E313:K313,">0")>=3,(SUM(LARGE(E313:K313,{1,2,3,4}))),"Not Qualified") -> 25
B314: T | C314: 5 | D314: MARIBETH CUPPS | F314: 1 | G314: 1 | H314: 3 | I314: 12 | J314: 4 | K314: 6 | L314: =SUM(E314:K314) -> 27 | M314: =IF(COUNTIF(E314:K314,">0")>=3,(SUM(LARGE(E314:K314,{1,2,3,4}))),"Not Qualified") -> 25
C315: 6 | D315: MERRIE MALPASS | F315: 7 | G315: 6 | H315: 6 | L315: =SUM(E315:K315) -> 19 | M315: 19
C316: 7 | D316: SHANNON HALTOM | F316: 5 | G316: 5 | H316: 1 | K316: 7 | L316: =SUM(E316:K316) -> 18 | M316: =IF(COUNTIF(E316:K316,">0")>=3,(SUM(LARGE(E316:K316,{1,2,3,4}))),"Not Qualified") -> 18
C317: 8 | D317: BECKY WINNER | F317: 1 | G317: 1 | H317: 1 | I317: 7 | J317: 6 | K317: 2 | L317: =SUM(E317:K317) -> 18 | M317: =IF(COUNTIF(E317:K317,">0")>=3,(SUM(LARGE(E317:K317,{1,2,3,4}))),"Not Qualified") -> 16
C318: 9 | D318: CINDY LAKIN | G318: 4 | H318: 7 | J318: 5 | L318: =SUM(E318:K318) -> 16 | M318: 16
C319: 10 | D319: LELANE LEMOND | F319: 2 | G319: 2 | H319: 1 | I319: 6 | J319: 2 | K319: 4 | L319: =SUM(E319:K319) -> 17 | M319: =IF(COUNTIF(E319:K319,">0")>=3,(SUM(LARGE(E319:K319,{1,2,3,4}))),"Not Qualified") -> 14
C320: 11 | D320: JULIA TYE | F320: 1 | G320: 1 | H320: 1 | I320: 4 | J320: 1 | K320: 5 | L320: =SUM(E320:K320) -> 13 | M320: =IF(COUNTIF(E320:K320,">0")>=3,(SUM(LARGE(E320:K320,{1,2,3,4}))),"Not Qualified") -> 11
C321: 12 | D321: ANGELA SCHMUHL | F321: 1 | G321: 1 | H321: 1 | I321: 5 | J321: 3 | L321: =SUM(E321:K321) -> 11 | M321: =IF(COUNTIF(E321:K321,">0")>=3,(SUM(LARGE(E321:K321,{1,2,3,4}))),"Not Qualified") -> 10
C322: 13 | D322: CANDACE CROWDER | F322: 1 | H322: 1 | I322: 3 | J322: 1 | K322: 3 | L322: =SUM(E322:K322) -> 9 | M322: =IF(COUNTIF(E322:K322,">0")>=3,(SUM(LARGE(E322:K322,{1,2,3,4}))),"Not Qualified") -> 8
C323: 14 | D323: BARBARA ROBINSON | F323: 1 | G323: 1 | H323: 1 | I323: 2 | J323: 1 | K323: 1 | L323: =SUM(E323:K323) -> 7 | M323: =IF(COUNTIF(E323:K323,">0")>=3,(SUM(LARGE(E323:K323,{1,2,3,4}))),"Not Qualified") -> 5
C324: 15 | D324: KAREN ANDRIOLA | F324: 1 | G324: 1 | H324: 1 | L324: =SUM(E324:K324) -> 3 | M324: 3
C325: 16 | D325: SHARON ROSSI | F325: 1 | I325: 1 | J325: 1 | L325: =SUM(E325:K325) -> 3 | M325: 3
C326: 17 | D326: CECILE BURG | H326: 4 | J326: 7 | L326: =SUM(E326:K326) -> 11 | M326: =IF(COUNTIF(E326:K326,">0")>=3,(SUM(LARGE(E326:K326,{1,2,3,4}))),"Not Qualified") -> Not Qualified
C327: 18 | D327: KELLY SHOUP | G327: 9 | L327: =SUM(E327:K327) -> 9 | M327: =IF(COUNTIF(E327:K327,">0")>=3,(SUM(LARGE(E327:K327,{1,2,3,4}))),"Not Qualified") -> Not Qualified
C328: 19 | D328: KIM SETZER | F328: 3 | L328: =SUM(E328:K328) -> 3 | M328: =IF(COUNTIF(E328:K328,">0")>=3,(SUM(LARGE(E328:K328,{1,2,3,4}))),"Not Qualified") -> Not Qualified
C329: 20 | D329: BETH HUGHES | K329: 1 | L329: =SUM(E329:K329) -> 1 | M329: =IF(COUNTIF(E329:K329,">0")>=3,(SUM(LARGE(E329:K329,{1,2,3,4}))),"Not Qualified") -> Not Qualified
C330: 21 | D330: CINDY BROWN | H330: 1 | L330: =SUM(E330:K330) -> 1 | M330: =IF(COUNTIF(E330:K330,">0")>=3,(SUM(LARGE(E330:K330,{1,2,3,4}))),"Not Qualified") -> Not Qualified
C331: 22 | D331: IVANA NEDELJKOVICH | H331: 1 | L331: =SUM(E331:K331) -> 1 | M331: =IF(COUNTIF(E331:K331,">0")>=3,(SUM(LARGE(E331:K331,{1,2,3,4}))),"Not Qualified") -> Not Qualified
C332: 23 | D332: JANE COMBS | H332: 1 | L332: =SUM(E332:K332) -> 1 | M332: =IF(COUNTIF(E332:K332,">0")>=3,(SUM(LARGE(E332:K332,{1,2,3,4}))),"Not Qualified") -> Not Qualified
C333: 24 | D333: LAURIE WHITE | K333: 1 | L333: =SUM(E333:K333) -> 1 | M333: =IF(COUNTIF(E333:K333,">0")>=3,(SUM(LARGE(E333:K333,{1,2,3,4}))),"Not Qualified") -> Not Qualified
C334: 25 | D334: ELAINE SHELL | K334: 1 | M334: =IF(COUNTIF(E334:K334,">0")>=3,(SUM(LARGE(E334:K334,{1,2,3,4}))),"Not Qualified") -> Not Qualified
E337: EVENT
A338: CLASS | B338: AWARD | C338: POS | D338: DRIVER | E338: APR | F338: MAY | G338: JUN | H338: JUL | I338: AUG | J338: AUG | K338: OCT | L338: TOTAL | M338: Best 5 of 6
E339: Cancelled | I339: Make up Day for April
A341: ASP | B341: T | C341: 1 | D341: ROGER GARRETT | F341: 9 | G341: 12 | H341: 12 | I341: 12 | J341: 12 | K341: 9 | L341: =SUM(F341:K341) -> 66 | M341: =IF(COUNTIF(F341:K341,">0")>=3,(SUM(LARGE(F341:K341,{1,2,3,4}))),"Not Qualified") -> 48
B342: T | C342: 2 | D342: GREG KOTESKI | F342: 12 | G342: 9 | H342: 9 | I342: 9 | J342: 9 | L342: =SUM(F342:K342) -> 48 | M342: =IF(COUNTIF(F342:K342,">0")>=3,(SUM(LARGE(F342:K342,{1,2,3,4}))),"Not Qualified") -> 39
C343: 3 | D343: REX HARRIS | G343: 6 | H343: 7 | J343: 7 | K343: 8 | L343: =SUM(F343:K343) -> 28 | M343: =IF(COUNTIF(F343:K343,">0")>=3,(SUM(LARGE(F343:K343,{1,2,3,4}))),"Not Qualified") -> 28
C344: 4 | D344: DAVID SKITTLETHORP | I344: 7 | J344: 6 | K344: 9 | L344: =SUM(F344:K344) -> 22 | M344: 22
C345: 5 | D345: MICHAEL TWIFORD | I345: 6 | K345: 12 | L345: =SUM(F345:K345) -> 18 | M345: =IF(COUNTIF(F345:K345,">0")>=3,(SUM(LARGE(F345:K345,{1,2,3,4}))),"Not Qualified") -> Not Qualified
C346: 6 | D346: JACK MARESCA | F346: 7 | G346: 5 | L346: =SUM(F346:K346) -> 12 | M346: =IF(COUNTIF(F346:K346,">0")>=3,(SUM(LARGE(F346:K346,{1,2,3,4}))),"Not Qualified") -> Not Qualified
C347: 7 | D347: DANIEL HILL | G347: 7 | H347: 4 | L347: =SUM(F347:K347) -> 11 | M347: =IF(COUNTIF(F347:K347,">0")>=3,(SUM(LARGE(F347:K347,{1,2,3,4}))),"Not Qualified") -> Not Qualified
C348: 8 | D348: TONY WATSON | K348: 7 | L348: =SUM(F348:K348) -> 7 | M348: =IF(COUNTIF(F348:K348,">0")>=3,(SUM(LARGE(F348:K348,{1,2,3,4}))),"Not Qualified") -> Not Qualified
C349: 9 | D349: BRETT WEBER | H349: 6 | L349: =SUM(F349:K349) -> 6 | M349: =IF(COUNTIF(F349:K349,">0")>=3,(SUM(LARGE(F349:K349,{1,2,3,4}))),"Not Qualified") -> Not Qualified
C350: 10 | D350: LYNN COMBS | H350: 5 | L350: =SUM(F350:K350) -> 5 | M350: =IF(COUNTIF(F350:K350,">0")>=3,(SUM(LARGE(F350:K350,{1,2,3,4}))),"Not Qualified") -> Not Qualified
A352: BSP | B352: T | C352: 1 | D352: BILL LAKIN | G352: 4 | H352: 7 | I352: 12 | J352: 12 | K352: 7 | L352: =SUM(F352:K352) -> 42 | M352: =IF(COUNTIF(F352:K352,">0")>=3,(SUM(LARGE(F352:K352,{1,2,3,4}))),"Not Qualified") -> 38
B353: T | C353: 2 | D353: JIM SETZER | F353: 7 | G353: 12 | H353: 9 | K353: 9 | L353: =SUM(F353:K353) -> 37 | M353: =IF(COUNTIF(F353:K353,">0")>=3,(SUM(LARGE(F353:K353,{1,2,3,4}))),"Not Qualified") -> 37
C354: 3 | D354: TODD WAGNER | F354: 9 | G354: 9 | H354: 5 | I354: 9 | J354: 7 | L354: =SUM(F354:K354) -> 39 | M354: =IF(COUNTIF(F354:K354,">0")>=3,(SUM(LARGE(F354:K354,{1,2,3,4}))),"Not Qualified") -> 34
C355: 4 | D355: TONY WATSON | G355: 7 | H355: 6 | I355: 7 | J355: 9 | L355: =SUM(F355:K355) -> 29 | M355: =IF(COUNTIF(F355:K355,">0")>=3,(SUM(LARGE(F355:K355,{1,2,3,4}))),"Not Qualified") -> 29
C356: 5 | D356: JASON LISNER | F356: 12 | G356: 3 | H356: 12 | L356: =SUM(F356:K356) -> 27 | M356: 27
C357: 6 | D357: DON STRIFLER | F357: 6 | G357: 5 | H357: 4 | I357: 6 | J357: 6 | K357: 6 | L357: =SUM(F357:K357) -> 33 | M357: =IF(COUNTIF(F357:K357,">0")>=3,(SUM(LARGE(F357:K357,{1,2,3,4}))),"Not Qualified") -> 24
C358: 7 | D358: BOBBY SMITH | K358: 12 | L358: =SUM(F358:K358) -> 12 | M358: =IF(COUNTIF(F358:K358,">0")>=3,(SUM(LARGE(F358:K358,{1,2,3,4}))),"Not Qualified") -> Not Qualified
C359: 8 | D359: BRETT BAKER | F359: 5 | G359: 2 | L359: =SUM(F359:K359) -> 7 | M359: =IF(COUNTIF(F359:K359,">0")>=3,(SUM(LARGE(F359:K359,{1,2,3,4}))),"Not Qualified") -> Not Qualified
C360: 9 | D360: JIM ROBINSON | G360: 6 | L360: =SUM(F360:K360) -> 6 | M360: =IF(COUNTIF(F360:K360,">0")>=3,(SUM(LARGE(F360:K360,{1,2,3,4}))),"Not Qualified") -> Not Qualified
C361: 10 | D361: ANDREW CHISHOLM | K361: 5 | L361: =SUM(F361:K361) -> 5 | M361: =IF(COUNTIF(F361:K361,">0")>=3,(SUM(LARGE(F361:K361,{1,2,3,4}))),"Not Qualified") -> Not Qualified
C362: 11 | D362: THOMAS KNEIPP | J362: 5 | L362: =SUM(F362:K362) -> 5 | M362: =IF(COUNTIF(F362:K362,">0")>=3,(SUM(LARGE(F362:K362,{1,2,3,4}))),"Not Qualified") -> Not Qualified
C363: 12 | D363: FRANK PINCKNEY | K363: 4 | L363: =SUM(F363:K363) -> 4 | M363: =IF(COUNTIF(F363:K363,">0")>=3,(SUM(LARGE(F363:K363,{1,2,3,4}))),"Not Qualified") -> Not Qualified
C364: 13 | D364: FRED BONI | F364: 4 | L364: =SUM(F364:K364) -> 4 | M364: =IF(COUNTIF(F364:K364,">0")>=3,(SUM(LARGE(F364:K364,{1,2,3,4}))),"Not Qualified") -> Not Qualified
C365: 14 | D365: JASON CHEBETAR | H365: 3 | L365: =SUM(F365:K365) -> 3 | M365: =IF(COUNTIF(F365:K365,">0")>=3,(SUM(LARGE(F365:K365,{1,2,3,4}))),"Not Qualified") -> Not Qualified
C366: 15 | D366: RICKY GRANOZIO | H366: 2 | L366: =SUM(F366:K366) -> 2 | M366: =IF(COUNTIF(F366:K366,">0")>=3,(SUM(LARGE(F366:K366,{1,2,3,4}))),"Not Qualified") -> Not Qualified
A368: CSP | B368: T | C368: 1 | D368: DAVID MARTIN | F368: 12 | G368: 6 | H368: 12 | I368: 9 | J368: 12 | K368: 12 | L368: =SUM(F368:K368) -> 63 | M368: =IF(COUNTIF(F368:K368,">0")>=3,(SUM(LARGE(F368:K368,{1,2,3,4}))),"Not Qualified") -> 48
B369: T | C369: 2 | D369: SHAWN LAMBERT | F369: 9 | G369: 12 | H369: 9 | I369: 12 | J369: 9 | K369: 9 | L369: =SUM(F369:K369) -> 60 | M369: =IF(COUNTIF(F369:K369,">0")>=3,(SUM(LARGE(F369:K369,{1,2,3,4}))),"Not Qualified") -> 42
B370: T | C370: 3 | D370: JIM HALTOM | F370: 7 | G370: 7 | H370: 7 | J370: 7 | K370: 7 | L370: =SUM(F370:K370) -> 35 | M370: =IF(COUNTIF(F370:K370,">0")>=3,(SUM(LARGE(F370:K370,{1,2,3,4}))),"Not Qualified") -> 28
C371: 4 | D371: JIM ROBINSON | F371: 4 | H371: 6 | I371: 7 | J371: 6 | K371: 6 | L371: =SUM(F371:K371) -> 29 | M371: =IF(COUNTIF(F371:K371,">0")>=3,(SUM(LARGE(F371:K371,{1,2,3,4}))),"Not Qualified") -> 25
C372: 5 | D372: KEITH EDWARDS | F372: 1 | G372: 1 | H372: 3 | I372: 6 | J372: 5 | K372: 5 | L372: =SUM(F372:K372) -> 21 | M372: =IF(COUNTIF(F372:K372,">0")>=3,(SUM(LARGE(F372:K372,{1,2,3,4}))),"Not Qualified") -> 19
C373: 6 | D373: CHRISTOPHER SAMULSKI | F373: 3 | G373: 4 | H373: 5 | L373: =SUM(F373:K373) -> 12 | M373: 12
C374: 7 | D374: JOMMEL DE GUZMAN | F374: 2 | G374: 1 | H374: 4 | L374: =SUM(F374:K374) -> 7 | M374: 7
C375: 8 | D375: MICHAEL HARRIS | F375: 6 | G375: 9 | L375: =SUM(F375:K375) -> 15 | M375: =IF(COUNTIF(F375:K375,">0")>=3,(SUM(LARGE(F375:K375,{1,2,3,4}))),"Not Qualified") -> Not Qualified
C376: 9 | D376: JIM HARRIS | F376: 5 | G376: 5 | L376: =SUM(F376:K376) -> 10 | M376: =IF(COUNTIF(F376:K376,">0")>=3,(SUM(LARGE(F376:K376,{1,2,3,4}))),"Not Qualified") -> Not Qualified
C377: 10 | D377: LEE HASSIG | J377: 4 | K377: 4 | L377: =SUM(F377:K377) -> 8 | M377: =IF(COUNTIF(F377:K377,">0")>=3,(SUM(LARGE(F377:K377,{1,2,3,4}))),"Not Qualified") -> Not Qualified
C378: 11 | D378: DUNCAN ELLIS | G378: 3 | L378: =SUM(F378:K378) -> 3 | M378: =IF(COUNTIF(F378:K378,">0")>=3,(SUM(LARGE(F378:K378,{1,2,3,4}))),"Not Qualified") -> Not Qualified
C379: 12 | D379: JASPER DE GUZMAN | F379: 1 | G379: 1 | L379: =SUM(F379:K379) -> 2 | M379: =IF(COUNTIF(F379:K379,">0")>=3,(SUM(LARGE(F379:K379,{1,2,3,4}))),"Not Qualified") -> Not Qualified
C380: 13 | D380: JIM CAWRSE | F380: 1 | G380: 1 | L380: =SUM(F380:K380) -> 2 | M380: =IF(COUNTIF(F380:K380,">0")>=3,(SUM(LARGE(F380:K380,{1,2,3,4}))),"Not Qualified") -> Not Qualified
C381: 14 | D381: RICK MARIANI | G381: 2 | L381: =SUM(F381:K381) -> 2 | M381: =IF(COUNTIF(F381:K381,">0")>=3,(SUM(LARGE(F381:K381,{1,2,3,4}))),"Not Qualified") -> Not Qualified
C382: 15 | D382: CALVIN SANDERS | F382: 1 | L382: =SUM(F382:K382) -> 1 | M382: =IF(COUNTIF(F382:K382,">0")>=3,(SUM(LARGE(F382:K382,{1,2,3,4}))),"Not Qualified") -> Not Qualified
A384: DSP | B384: T | C384: 1 | D384: TOM BLEH | F384: 12 | G384: 9 | H384: 12 | I384: 12 | J384: 12 | K384: 12 | L384: =SUM(F384:K384) -> 69 | M384: =IF(COUNTIF(F384:K384,">0")>=3,(SUM(LARGE(F384:K384,{1,2,3,4}))),"Not Qualified") -> 48
B385: T | C385: 2 | D385: TERRY BAKER | F385: 9 | G385: 12 | H385: 9 | I385: 9 | J385: 9 | L385: =SUM(F385:K385) -> 48 | M385: =IF(COUNTIF(F385:K385,">0")>=3,(SUM(LARGE(F385:K385,{1,2,3,4}))),"Not Qualified") -> 39
C386: 3 | D386: DOUG KEILER | F386: 7 | G386: 7 | H386: 7 | I386: 7 | J386: 7 | K386: 9 | L386: =SUM(F386:K386) -> 44 | M386: =IF(COUNTIF(F386:K386,">0")>=3,(SUM(LARGE(F386:K386,{1,2,3,4}))),"Not Qualified") -> 30
C387: 4 | D387: ROLAND WALLNER | F387: 6 | G387: 6 | J387: 6 | K387: 7 | L387: =SUM(F387:K387) -> 25 | M387: =IF(COUNTIF(F387:K387,">0")>=3,(SUM(LARGE(F387:K387,{1,2,3,4}))),"Not Qualified") -> 25
C388: 5 | D388: CURTIS STAPLES | I388: 6 | J388: 5 | K388: 6 | L388: =SUM(F388:K388) -> 17 | M388: 17
C389: 6 | D389: ANDREW GHOSN | G389: 5 | L389: =SUM(F389:K389) -> 5 | M389: =IF(COUNTIF(F389:K389,">0")>=3,(SUM(LARGE(F389:K389,{1,2,3,4}))),"Not Qualified") -> Not Qualified
C390: 7 | D390: ROB LOWE | K390: 5 | L390: =SUM(F390:K390) -> 5 | M390: =IF(COUNTIF(F390:K390,">0")>=3,(SUM(LARGE(F390:K390,{1,2,3,4}))),"Not Qualified") -> Not Qualified
C391: 8 | D391: RICK MARIANI | J391: 4 | L391: =SUM(F391:K391) -> 4 | M391: =IF(COUNTIF(F391:K391,">0")>=3,(SUM(LARGE(F391:K391,{1,2,3,4}))),"Not Qualified") -> Not Qualified
A393: ESP | B393: T | C393: 1 | D393: BILL BROCHU | F393: 12 | G393: 12 | H393: 12 | I393: 12 | J393: 12 | K393: 9 | L393: =SUM(F393:K393) -> 69 | M393: =IF(COUNTIF(F393:K393,">0")>=3,(SUM(LARGE(F393:K393,{1,2,3,4}))),"Not Qualified") -> 48
B394: T | C394: 2 | D394: JIM EWING | F394: 7 | H394: 9 | I394: 9 | J394: 9 | K394: 12 | L394: =SUM(F394:K394) -> 46 | M394: =IF(COUNTIF(F394:K394,">0")>=3,(SUM(LARGE(F394:K394,{1,2,3,4}))),"Not Qualified") -> 39
C395: 3 | D395: DUSTIN MERGI | F395: 9 | G395: 9 | H395: 7 | K395: 7 | L395: =SUM(F395:K395) -> 32 | M395: =IF(COUNTIF(F395:K395,">0")>=3,(SUM(LARGE(F395:K395,{1,2,3,4}))),"Not Qualified") -> 32
C396: 4 | D396: JOHN SETTLE | G396: 6 | H396: 4 | I396: 7 | J396: 7 | K396: 5 | L396: =SUM(F396:K396) -> 29 | M396: =IF(COUNTIF(F396:K396,">0")>=3,(SUM(LARGE(F396:K396,{1,2,3,4}))),"Not Qualified") -> 25
C397: 5 | D397: PETER FLORANCE | F397: 6 | H397: 6 | J397: 6 | K397: 6 | L397: =SUM(F397:K397) -> 24 | M397: =IF(COUNTIF(F397:K397,">0")>=3,(SUM(LARGE(F397:K397,{1,2,3,4}))),"Not Qualified") -> 24
C398: 6 | D398: MANNY DESANTOS | F398: 5 | G398: 7 | H398: 3 | J398: 5 | K398: 4 | L398: =SUM(F398:K398) -> 24 | M398: =IF(COUNTIF(F398:K398,">0")>=3,(SUM(LARGE(F398:K398,{1,2,3,4}))),"Not Qualified") -> 21
C399: 7 | D399: LARRY TRANTHAM | H399: 5 | L399: =SUM(F399:K399) -> 5 | M399: =IF(COUNTIF(F399:K399,">0")>=3,(SUM(LARGE(F399:K399,{1,2,3,4}))),"Not Qualified") -> Not Qualified
A401: FSP | B401: T | C401: 1 | D401: STEVE SHELL | F401: 9 | G401: 9 | I401: 12 | J401: 12 | K401: 12 | L401: =SUM(F401:K401) -> 54 | M401: =IF(COUNTIF(F401:K401,">0")>=3,(SUM(LARGE(F401:K401,{1,2,3,4}))),"Not Qualified") -> 45
C402: 2 | D402: ROY ARMSTRONG | F402: 12 | G402: 12 | L402: =SUM(F402:K402) -> 24 | M402: =IF(COUNTIF(F402:K402,">0")>=3,(SUM(LARGE(F402:K402,{1,2,3,4}))),"Not Qualified") -> Not Qualified
E404: EVENT
A405: CLASS | B405: AWARD | C405: POS | D405: DRIVER | E405: APR | F405: MAY | G405: JUN | H405: JUL | I405: AUG | J405: AUG | K405: OCT | L405: TOTAL | M405: Best 4 of 6
E406: Cancelled | I406: Make up Day for April
A408: AP | D408: NO ENTRIES | L408: =SUM(F408:K408) -> 0 | M408: =IF(COUNTIF(F408:K408,">0")>=3,(SUM(LARGE(F408:K408,{1,2,3,4}))),"Not Qualified") -> Not Qualified
A410: BP | C410: 1 | D410: MARC LISNER | F410: 12 | H410: 12 | L410: =SUM(F410:K410) -> 24 | M410: =IF(COUNTIF(F410:K410,">0")>=3,(SUM(LARGE(F410:K410,{1,2,3,4}))),"Not Qualified") -> Not Qualified
C411: 2 | D411: TRAVIS BOYER | I411: 12 | J411: 12 | L411: =SUM(F411:K411) -> 24 | M411: =IF(COUNTIF(F411:K411,">0")>=3,(SUM(LARGE(F411:K411,{1,2,3,4}))),"Not Qualified") -> Not Qualified
A413: CP | B413: T | C413: 1 | D413: ERIC BONNETT | G413: 12 | H413: 12 | I413: 12 | K413: 12 | L413: =SUM(F413:K413) -> 48 | M413: =IF(COUNTIF(F413:K413,">0")>=3,(SUM(LARGE(F413:K413,{1,2,3,4}))),"Not Qualified") -> 48
C414: 2 | D414: CALVIN SANDERS | J414: 12 | K414: 9 | L414: =SUM(F414:K414) -> 21 | M414: =IF(COUNTIF(F414:K414,">0")>=3,(SUM(LARGE(F414:K414,{1,2,3,4}))),"Not Qualified") -> Not Qualified
C415: 3 | D415: JOYCE SANDERS | J415: 9 | K415: 7 | L415: =SUM(F415:K415) -> 16 | M415: =IF(COUNTIF(F415:K415,">0")>=3,(SUM(LARGE(F415:K415,{1,2,3,4}))),"Not Qualified") -> Not Qualified
A417: DP | B417: T | C417: 1 | D417: JOE CECELIC | F417: 12 | G417: 12 | H417: 12 | I417: 12 | J417: 12 | K417: 12 | L417: =SUM(F417:K417) -> 72 | M417: =IF(COUNTIF(F417:K417,">0")>=3,(SUM(LARGE(F417:K417,{1,2,3,4}))),"Not Qualified") -> 48
A419: EP | C419: 1 | D419: NO ENTRIES | L419: =SUM(F419:K419) -> 0 | M419: =IF(COUNTIF(F419:K419,">0")>=3,(SUM(LARGE(F419:K419,{1,2,3,4}))),"Not Qualified") -> Not Qualified
A421: FP | B421: T | C421: 1 | D421: MARC LISNER | I421: 12 | J421: 12 | K421: 12 | L421: =SUM(F421:K421) -> 36 | M421: 36
A423: XP | C423: 1 | D423: JASON LISNER | I423: 12 | J423: 12 | L423: =SUM(F423:K423) -> 24 | M423: =IF(COUNTIF(F423:K423,">0")>=3,(SUM(LARGE(F423:K423,{1,2,3,4}))),"Not Qualified") -> Not Qualified
C424: 2 | D424: MICHAEL ARRIGO | I424: 9 | J424: 9 | L424: =SUM(F424:K424) -> 18 | M424: =IF(COUNTIF(F424:K424,">0")>=3,(SUM(LARGE(F424:K424,{1,2,3,4}))),"Not Qualified") -> Not Qualified
E426: EVENT
A427: CLASS | B427: AWARD | C427: POS | D427: DRIVER | E427: APR | F427: MAY | G427: JUN | H427: JUL | I427: AUG | J427: Aug | K427: OCT | L427: TOTAL | M427: Best 4 of 6
E428: Cancelled | I428: Make up Day for April
A430: AM | C430: 1 | D430: FRANK INSLEY | I430: 12 | J430: 12 | L430: =SUM(E430:K430) -> 24 | M430: =IF(COUNTIF(F430:K430,">0")>=3,(SUM(LARGE(F430:K430,{1,2,3,4}))),"Not Qualified") -> Not Qualified
A432: BM | C432: 1 | D432: FRANK INSLEY | H432: 12 | L432: =SUM(E432:K432) -> 12 | M432: =IF(COUNTIF(F432:K432,">0")>=3,(SUM(LARGE(F432:K432,{1,2,3,4}))),"Not Qualified") -> Not Qualified
A434: CM | B434: T | C434: 1 | D434: DAVE CUTCHINS | G434: 9 | H434: 9 | K434: 12 | L434: =SUM(E434:K434) -> 30 | M434: 30
C435: 2 | D435: STAN VANN | G435: 12 | H435: 12 | L435: =SUM(E435:K435) -> 24 | M435: =IF(COUNTIF(F435:K435,">0")>=3,(SUM(LARGE(F435:K435,{1,2,3,4}))),"Not Qualified") -> Not Qualified
A437: DM | D437: NO ENTRIES | M437: =IF(COUNTIF(F437:K437,">0")>=3,(SUM(LARGE(F437:K437,{1,2,3,4}))),"Not Qualified") -> Not Qualified
A439: EM | B439: T | C439: 1 | D439: BOBBY SMITH | F439: 12 | G439: 12 | H439: 12 | L439: =SUM(E439:K439) -> 36 | M439: 36
A441: FJ4 | D441: NO ENTRIES | M441: =IF(COUNTIF(F441:K441,">0")>=3,(SUM(LARGE(F441:K441,{1,2,3,4}))),"Not Qualified") -> Not Qualified
A443: F125 | C443: 1 | D443: ANDREW BELLEVILLE | K443: 12 | L443: =SUM(E443:K443) -> 12 | M443: =IF(COUNTIF(F443:K443,">0")>=3,(SUM(LARGE(F443:K443,{1,2,3,4}))),"Not Qualified") -> Not Qualified
E445: EVENT
A446: CLASS | B446: AWARD | C446: POS | D446: DRIVER | E446: Apr | F446: MAY | G446: JUN | H446: JUL | I446: AUG | J446: AUG | K446: Oct | L446: TOTAL | M446: Best 4 of 6
E447: Cancelled | I447: Make up Day for April
A449: SM | B449: T | C449: 1 | D449: DAVID BROCHU | F449: 12 | G449: 12 | H449: 9 | I449: 12 | J449: 7 | K449: 12 | L449: =SUM(F449:K449) -> 64 | M449: =IF(COUNTIF(E449:K449,">0")>=3,(SUM(LARGE(E449:K449,{1,2,3,4}))),"Not Qualified") -> 48
B450: T | C450: 2 | D450: MICHAEL TWIFORD | F450: 9 | G450: 9 | H450: 12 | L450: =SUM(F450:K450) -> 30 | M450: 30
B451: T | C451: 3 | D451: DUNCAN ELLIS | H451: 7 | J451: 12 | K451: 9 | L451: =SUM(F451:K451) -> 28 | M451: 28
B452: T | C452: 4 | D452: ALAN STRATTON | F452: 6 | G452: 7 | H452: 5 | K452: 6 | L452: =SUM(F452:K452) -> 24 | M452: =IF(COUNTIF(E452:K452,">0")>=3,(SUM(LARGE(E452:K452,{1,2,3,4}))),"Not Qualified") -> 24
B453: T | C453: 5 | D453: SEAN MCCONNELL | F453: 4 | G453: 4 | H453: 3 | I453: 7 | J453: 6 | K453: 2 | L453: =SUM(F453:K453) -> 26 | M453: =IF(COUNTIF(E453:K453,">0")>=3,(SUM(LARGE(E453:K453,{1,2,3,4}))),"Not Qualified") -> 21
C454: 6 | D454: NEAL DAVIS | F454: 2 | H454: 1 | I454: 9 | J454: 9 | L454: =SUM(F454:K454) -> 21 | M454: =IF(COUNTIF(E454:K454,">0")>=3,(SUM(LARGE(E454:K454,{1,2,3,4}))),"Not Qualified") -> 21
C455: 7 | D455: JEFF ROONEY | F455: 7 | H455: 6 | K455: 7 | L455: =SUM(F455:K455) -> 20 | M455: 20
C456: 8 | D456: TERRY ZACH | F456: 3 | G456: 5 | H456: 2 | I456: 6 | J456: 5 | L456: =SUM(F456:K456) -> 21 | M456: =IF(COUNTIF(E456:K456,">0")>=3,(SUM(LARGE(E456:K456,{1,2,3,4}))),"Not Qualified") -> 19
C457: 9 | D457: BENJAMIN SMITH | F457: 1 | G457: 1 | I457: 2 | J457: 4 | K457: 4 | L457: =SUM(F457:K457) -> 12 | M457: =IF(COUNTIF(E457:K457,">0")>=3,(SUM(LARGE(E457:K457,{1,2,3,4}))),"Not Qualified") -> 11
C458: 10 | D458: BRANDON CHARLESON | I458: 5 | J458: 1 | K458: 5 | L458: =SUM(F458:K458) -> 11 | M458: 11
C459: 11 | D459: JASON MCCLURE | H459: 1 | I459: 1 | J459: 3 | K459: 1 | L459: =SUM(F459:K459) -> 6 | M459: =IF(COUNTIF(E459:K459,">0")>=3,(SUM(LARGE(E459:K459,{1,2,3,4}))),"Not Qualified") -> 6
C460: 12 | D460: RUSS PARHAM | F460: 1 | G460: 1 | H460: 1 | K460: 3 | L460: =SUM(F460:K460) -> 6 | M460: =IF(COUNTIF(E460:K460,">0")>=3,(SUM(LARGE(E460:K460,{1,2,3,4}))),"Not Qualified") -> 6
C461: 13 | D461: SHAWN GAMBILL | F461: 1 | G461: 2 | H461: 1 | I461: 1 | J461: 1 | K461: 1 | L461: =SUM(F461:K461) -> 7 | M461: =IF(COUNTIF(E461:K461,">0")>=3,(SUM(LARGE(E461:K461,{1,2,3,4}))),"Not Qualified") -> 5
C462: 14 | D462: RICH DELVICCHIO | F462: 1 | I462: 1 | J462: 1 | K462: 1 | L462: =SUM(F462:K462) -> 4 | M462: =IF(COUNTIF(E462:K462,">0")>=3,(SUM(LARGE(E462:K462,{1,2,3,4}))),"Not Qualified") -> 4
C463: 15 | D463: PETER AQUINO | F463: 1 | J463: 2 | K463: 1 | L463: =SUM(F463:K463) -> 4 | M463: 4
C464: 16 | D464: JAMES MCIVER | G464: 6 | L464: =SUM(F464:K464) -> 6 | M464: =IF(COUNTIF(E464:K464,">0")>=3,(SUM(LARGE(E464:K464,{1,2,3,4}))),"Not Qualified") -> Not Qualified
C465: 17 | D465: NICK HARRIS | F465: 5 | L465: =SUM(F465:K465) -> 5 | M465: =IF(COUNTIF(E465:K465,">0")>=3,(SUM(LARGE(E465:K465,{1,2,3,4}))),"Not Qualified") -> Not Qualified
C466: 18 | D466: CHRIS STAPLES | I466: 4 | L466: =SUM(F466:K466) -> 4 | M466: =IF(COUNTIF(E466:K466,">0")>=3,(SUM(LARGE(E466:K466,{1,2,3,4}))),"Not Qualified") -> Not Qualified
C467: 19 | D467: DERREK FLEMING | H467: 4 | L467: =SUM(F467:K467) -> 4 | M467: =IF(COUNTIF(E467:K467,">0")>=3,(SUM(LARGE(E467:K467,{1,2,3,4}))),"Not Qualified") -> Not Qualified
C468: 20 | D468: SCOTT FARRELL | I468: 3 | K468: 1 | L468: =SUM(F468:K468) -> 4 | M468: =IF(COUNTIF(E468:K468,">0")>=3,(SUM(LARGE(E468:K468,{1,2,3,4}))),"Not Qualified") -> Not Qualified
C469: 21 | D469: PETER FRENCH | G469: 3 | L469: =SUM(F469:K469) -> 3 | M469: =IF(COUNTIF(E469:K469,">0")>=3,(SUM(LARGE(E469:K469,{1,2,3,4}))),"Not Qualified") -> Not Qualified
C470: 22 | D470: ADAM ROSEN | I470: 1 | K470: 1 | L470: =SUM(F470:K470) -> 2 | M470: =IF(COUNTIF(E470:K470,">0")>=3,(SUM(LARGE(E470:K470,{1,2,3,4}))),"Not Qualified") -> Not Qualified
C471: 23 | D471: ANGELO SOTO | G471: 1 | H471: 1 | L471: =SUM(F471:K471) -> 2 | M471: =IF(COUNTIF(E471:K471,">0")>=3,(SUM(LARGE(E471:K471,{1,2,3,4}))),"Not Qualified") -> Not Qualified
C472: 24 | D472: GREG SCHAVIN | G472: 1 | H472: 1 | L472: =SUM(F472:K472) -> 2 | M472: =IF(COUNTIF(E472:K472,">0")>=3,(SUM(LARGE(E472:K472,{1,2,3,4}))),"Not Qualified") -> Not Qualified
C473: 25 | D473: DEREK BAKER | F473: 1 | L473: =SUM(F473:K473) -> 1 | M473: =IF(COUNTIF(E473:K473,">0")>=3,(SUM(LARGE(E473:K473,{1,2,3,4}))),"Not Qualified") -> Not Qualified
C474: 26 | D474: DUSTIN FOSTER | F474: 1 | L474: =SUM(F474:K474) -> 1 | M474: =IF(COUNTIF(E474:K474,">0")>=3,(SUM(LARGE(E474:K474,{1,2,3,4}))),"Not Qualified") -> Not Qualified
C475: 27 | D475: JACK LITTLEJOHN | K475: 1 | L475: =SUM(F475:K475) -> 1 | M475: =IF(COUNTIF(E475:K475,">0")>=3,(SUM(LARGE(E475:K475,{1,2,3,4}))),"Not Qualified") -> Not Qualified
C476: 28 | D476: VANESSA FOSTER | F476: 1 | L476: =SUM(F476:K476) -> 1 | M476: =IF(COUNTIF(E476:K476,">0")>=3,(SUM(LARGE(E476:K476,{1,2,3,4}))),"Not Qualified") -> Not Qualified
A478: SM2 | B478: T | C478: 1 | D478: DAVE MCLAUGHLIN | F478: 12 | G478: 12 | H478: 9 | I478: 12 | J478: 12 | K478: 9 | L478: =SUM(F478:K478) -> 66 | M478: =IF(COUNTIF(E478:K478,">0")>=3,(SUM(LARGE(E478:K478,{1,2,3,4}))),"Not Qualified") -> 48
C479: 2 | D479: LEE WILLIAMS | F479: 9 | G479: 6 | H479: 7 | J479: 9 | L479: =SUM(F479:K479) -> 31 | M479: =IF(COUNTIF(E479:K479,">0")>=3,(SUM(LARGE(E479:K479,{1,2,3,4}))),"Not Qualified") -> 31
C480: 3 | D480: DANIEL SHAW | F480: 6 | G480: 9 | L480: =SUM(F480:K480) -> 15 | M480: =IF(COUNTIF(E480:K480,">0")>=3,(SUM(LARGE(E480:K480,{1,2,3,4}))),"Not Qualified") -> Not Qualified
C481: 4 | D481: David Clemmens | H481: 12 | L481: =SUM(F481:K481) -> 12 | M481: =IF(COUNTIF(E481:K481,">0")>=3,(SUM(LARGE(E481:K481,{1,2,3,4}))),"Not Qualified") -> Not Qualified
C482: 5 | D482: JEFF TURNER | K482: 12 | L482: =SUM(F482:K482) -> 12 | M482: =IF(COUNTIF(E482:K482,">0")>=3,(SUM(LARGE(E482:K482,{1,2,3,4}))),"Not Qualified") -> Not Qualified
C483: 6 | D483: BILL HATFIELD | F483: 7 | L483: =SUM(F483:K483) -> 7 | M483: =IF(COUNTIF(E483:K483,">0")>=3,(SUM(LARGE(E483:K483,{1,2,3,4}))),"Not Qualified") -> Not Qualified
C484: 7 | D484: JASON WADDY | G484: 7 | L484: =SUM(F484:K484) -> 7 | M484: =IF(COUNTIF(E484:K484,">0")>=3,(SUM(LARGE(E484:K484,{1,2,3,4}))),"Not Qualified") -> Not Qualified
D485: JASON SINNARD | F485: 5 | L485: =SUM(F485:K485) -> 5 | M485: =IF(COUNTIF(E485:K485,">0")>=3,(SUM(LARGE(E485:K485,{1,2,3,4}))),"Not Qualified") -> Not Qualified
L486: =SUM(F486:K486) -> 0
A487: STR | B487: T | C487: 1 | D487: MICHAEL MOUNTAIN | F487: 7 | G487: 9 | H487: 12 | I487: 12 | J487: 12 | K487: 12 | L487: =SUM(E487:K487) -> 64 | M487: =IF(COUNTIF(E487:K487,">0")>=3,(SUM(LARGE(E487:K487,{1,2,3,4}))),"Not Qualified") -> 48
B488: T | C488: 2 | D488: CAMERON MCCORMICK | F488: 12 | G488: 12 | H488: 7 | J488: 9 | K488: 9 | L488: =SUM(E488:K488) -> 49 | M488: =IF(COUNTIF(E488:K488,">0")>=3,(SUM(LARGE(E488:K488,{1,2,3,4}))),"Not Qualified") -> 42
B489: T | C489: 3 | D489: STEVE DASHER | F489: 9 | G489: 7 | H489: 5 | I489: 9 | J489: 7 | K489: 7 | L489: =SUM(E489:K489) -> 44 | M489: =IF(COUNTIF(E489:K489,">0")>=3,(SUM(LARGE(E489:K489,{1,2,3,4}))),"Not Qualified") -> 32
B490: T | C490: 4 | D490: JEFF JASMER | G490: 1 | H490: 6 | I490: 7 | J490: 4 | K490: 6 | L490: =SUM(E490:K490) -> 24 | M490: =IF(COUNTIF(E490:K490,">0")>=3,(SUM(LARGE(E490:K490,{1,2,3,4}))),"Not Qualified") -> 23
C491: 5 | D491: ROBERT KIRKPATRICK | G491: 6 | H491: 9 | I491: 6 | L491: =SUM(E491:K491) -> 21 | M491: 21
C492: 6 | D492: MICHAEL GAINTNER | F492: 3 | G492: 5 | J492: 6 | K492: 5 | L492: =SUM(E492:K492) -> 19 | M492: =IF(COUNTIF(E492:K492,">0")>=3,(SUM(LARGE(E492:K492,{1,2,3,4}))),"Not Qualified") -> 19
C493: 7 | D493: MICHAEL KEEFE | F493: 4 | H493: 4 | I493: 5 | J493: 3 | K493: 3 | L493: =SUM(E493:K493) -> 19 | M493: =IF(COUNTIF(E493:K493,">0")>=3,(SUM(LARGE(E493:K493,{1,2,3,4}))),"Not Qualified") -> 16
C494: 8 | D494: WAYNE LEWIS | F494: 1 | G494: 2 | H494: 1 | I494: 4 | J494: 1 | K494: 1 | L494: =SUM(E494:K494) -> 10 | M494: =IF(COUNTIF(E494:K494,">0")>=3,(SUM(LARGE(E494:K494,{1,2,3,4}))),"Not Qualified") -> 8
C495: 9 | D495: ROBERT BAUER | F495: 1 | H495: 1 | I495: 3 | J495: 2 | K495: 2 | L495: =SUM(E495:K495) -> 9 | M495: =IF(COUNTIF(E495:K495,">0")>=3,(SUM(LARGE(E495:K495,{1,2,3,4}))),"Not Qualified") -> 8
C496: 10 | D496: AARON JENNINGS | F496: 1 | G496: 4 | J496: 1 | L496: =SUM(E496:K496) -> 6 | M496: 6
C497: 11 | D497: MICHAEL CACASE | F497: 1 | G497: 1 | I497: 2 | J497: 1 | L497: =SUM(E497:K497) -> 5 | M497: =IF(COUNTIF(E497:K497,">0")>=3,(SUM(LARGE(E497:K497,{1,2,3,4}))),"Not Qualified") -> 5
C498: 12 | D498: SETH DOZIER | F498: 6 | L498: =SUM(E498:K498) -> 6 | M498: =IF(COUNTIF(E498:K498,">0")>=3,(SUM(LARGE(E498:K498,{1,2,3,4}))),"Not Qualified") -> Not Qualified
C499: 13 | D499: MARK RODGERS | F499: 5 | L499: =SUM(E499:K499) -> 5 | M499: =IF(COUNTIF(E499:K499,">0")>=3,(SUM(LARGE(E499:K499,{1,2,3,4}))),"Not Qualified") -> Not Qualified
C500: 14 | D500: PETER FRENCH | J500: 5 | L500: =SUM(E500:K500) -> 5 | M500: =IF(COUNTIF(E500:K500,">0")>=3,(SUM(LARGE(E500:K500,{1,2,3,4}))),"Not Qualified") -> Not Qualified
C501: 15 | D501: BENO RUBIN | K501: 4 | L501: =SUM(E501:K501) -> 4 | M501: =IF(COUNTIF(E501:K501,">0")>=3,(SUM(LARGE(E501:K501,{1,2,3,4}))),"Not Qualified") -> Not Qualified
C502: 16 | D502: ANDREW GHOSN | H502: 3 | L502: =SUM(E502:K502) -> 3 | M502: =IF(COUNTIF(E502:K502,">0")>=3,(SUM(LARGE(E502:K502,{1,2,3,4}))),"Not Qualified") -> Not Qualified
C503: 17 | D503: BIFF JENNINGS | G503: 3 | L503: =SUM(E503:K503) -> 3 | M503: =IF(COUNTIF(E503:K503,">0")>=3,(SUM(LARGE(E503:K503,{1,2,3,4}))),"Not Qualified") -> Not Qualified
C504: 18 | D504: BILL SPRUILL | G504: 1 | J504: 1 | L504: =SUM(E504:K504) -> 2 | M504: =IF(COUNTIF(E504:K504,">0")>=3,(SUM(LARGE(E504:K504,{1,2,3,4}))),"Not Qualified") -> Not Qualified
C505: 19 | D505: DAVID DAVIS | H505: 2 | L505: =SUM(E505:K505) -> 2 | M505: =IF(COUNTIF(E505:K505,">0")>=3,(SUM(LARGE(E505:K505,{1,2,3,4}))),"Not Qualified") -> Not Qualified
C506: 20 | D506: GREGG SCHARIN | I506: 1 | J506: 1 | L506: =SUM(E506:K506) -> 2 | M506: =IF(COUNTIF(E506:K506,">0")>=3,(SUM(LARGE(E506:K506,{1,2,3,4}))),"Not Qualified") -> Not Qualified
C507: 21 | D507: ROBERT RUSSEL | F507: 2 | L507: =SUM(E507:K507) -> 2 | M507: =IF(COUNTIF(E507:K507,">0")>=3,(SUM(LARGE(E507:K507,{1,2,3,4}))),"Not Qualified") -> Not Qualified
C508: 22 | D508: BRYAN WATSON | H508: 1 | L508: =SUM(E508:K508) -> 1 | M508: =IF(COUNTIF(E508:K508,">0")>=3,(SUM(LARGE(E508:K508,{1,2,3,4}))),"Not Qualified") -> Not Qualified
C509: 23 | D509: FRANK PINCKNEY | H509: 1 | L509: =SUM(E509:K509) -> 1 | M509: =IF(COUNTIF(E509:K509,">0")>=3,(SUM(LARGE(E509:K509,{1,2,3,4}))),"Not Qualified") -> Not Qualified
C510: 24 | D510: JAMES CAUDILL | I510: 1 | L510: =SUM(E510:K510) -> 1 | M510: =IF(COUNTIF(E510:K510,">0")>=3,(SUM(LARGE(E510:K510,{1,2,3,4}))),"Not Qualified") -> Not Qualified
C511: 25 | D511: JAMES LIVARA | I511: 1 | L511: =SUM(E511:K511) -> 1 | M511: =IF(COUNTIF(E511:K511,">0")>=3,(SUM(LARGE(E511:K511,{1,2,3,4}))),"Not Qualified") -> Not Qualified
C512: 26 | D512: JIORJO LIVARA | I512: 1 | L512: =SUM(E512:K512) -> 1 | M512: =IF(COUNTIF(E512:K512,">0")>=3,(SUM(LARGE(E512:K512,{1,2,3,4}))),"Not Qualified") -> Not Qualified
C513: 27 | D513: LEE MATHIAS | J513: 1 | L513: =SUM(E513:K513) -> 1 | M513: =IF(COUNTIF(E513:K513,">0")>=3,(SUM(LARGE(E513:K513,{1,2,3,4}))),"Not Qualified") -> Not Qualified
C514: 28 | D514: PETER KEILER | F514: 1 | L514: =SUM(E514:K514) -> 1 | M514: =IF(COUNTIF(E514:K514,">0")>=3,(SUM(LARGE(E514:K514,{1,2,3,4}))),"Not Qualified") -> Not Qualified
C515: 29 | D515: RON STIMBERT | J515: 1 | L515: =SUM(E515:K515) -> 1 | M515: =IF(COUNTIF(E515:K515,">0")>=3,(SUM(LARGE(E515:K515,{1,2,3,4}))),"Not Qualified") -> Not Qualified
A517: STS | B517: T | C517: 1 | D517: JEFF CHENERY | F517: 12 | G517: 12 | H517: 12 | J517: 12 | K517: 12 | L517: =SUM(E517:K517) -> 60 | M517: =IF(COUNTIF(E517:K517,">0")>=3,(SUM(LARGE(E517:K517,{1,2,3,4}))),"Not Qualified") -> 48
B518: T | C518: 2 | D518: JOHN CROWDER | F518: 7 | H518: 6 | I518: 12 | J518: 7 | K518: 9 | L518: =SUM(E518:K518) -> 41 | M518: =IF(COUNTIF(E518:K518,">0")>=3,(SUM(LARGE(E518:K518,{1,2,3,4}))),"Not Qualified") -> 35
C519: 3 | D519: CARL JUNEAU | F519: 6 | G519: 6 | H519: 7 | I519: 6 | J519: 9 | K519: 5 | L519: =SUM(E519:K519) -> 39 | M519: =IF(COUNTIF(E519:K519,">0")>=3,(SUM(LARGE(E519:K519,{1,2,3,4}))),"Not Qualified") -> 28
C520: 4 | D520: COREY MAPLES | F520: 9 | G520: 9 | H520: 9 | L520: =SUM(E520:K520) -> 27 | M520: 27
C521: 5 | D521: KEITH MAPLES | F521: 5 | G521: 7 | H521: 5 | I521: 7 | J521: 6 | K521: 6 | L521: =SUM(E521:K521) -> 36 | M521: =IF(COUNTIF(E521:K521,">0")>=3,(SUM(LARGE(E521:K521,{1,2,3,4}))),"Not Qualified") -> 26
C522: 6 | D522: KEITH KASMIRE | F522: 4 | G522: 5 | H522: 4 | I522: 9 | J522: 5 | K522: 7 | L522: =SUM(E522:K522) -> 34 | M522: =IF(COUNTIF(E522:K522,">0")>=3,(SUM(LARGE(E522:K522,{1,2,3,4}))),"Not Qualified") -> 26
C523: 7 | D523: CECILE BURG | G523: 4 | L523: =SUM(E523:K523) -> 4 | M523: =IF(COUNTIF(E523:K523,">0")>=3,(SUM(LARGE(E523:K523,{1,2,3,4}))),"Not Qualified") -> Not Qualified
C524: 8 | D524: MATTHEW KNIPPLE | K524: 4 | L524: =SUM(E524:K524) -> 4 | M524: =IF(COUNTIF(E524:K524,">0")>=3,(SUM(LARGE(E524:K524,{1,2,3,4}))),"Not Qualified") -> Not Qualified
C525: 9 | D525: BLAKE THOMAS | H525: 3 | L525: =SUM(E525:K525) -> 3 | M525: =IF(COUNTIF(E525:K525,">0")>=3,(SUM(LARGE(E525:K525,{1,2,3,4}))),"Not Qualified") -> Not Qualified
C526: 10 | D526: CEASAR DELGADILLO | K526: 3 | L526: =SUM(E526:K526) -> 3 | M526: =IF(COUNTIF(E526:K526,">0")>=3,(SUM(LARGE(E526:K526,{1,2,3,4}))),"Not Qualified") -> Not Qualified
C527: 11 | D527: EDDIE TOVAR | F527: 3 | L527: =SUM(E527:K527) -> 3 | M527: =IF(COUNTIF(E527:K527,">0")>=3,(SUM(LARGE(E527:K527,{1,2,3,4}))),"Not Qualified") -> Not Qualified
C528: 12 | D528: SZE HUI | G528: 3 | L528: =SUM(E528:K528) -> 3 | M528: =IF(COUNTIF(E528:K528,">0")>=3,(SUM(LARGE(E528:K528,{1,2,3,4}))),"Not Qualified") -> Not Qualified
A530: STS2 | C530: 1 | D530: DANIEL KRAEMER | F530: 12 | G530: 9 | L530: =SUM(E530:K530) -> 21 | M530: =IF(COUNTIF(E530:K530,">0")>=3,(SUM(LARGE(E530:K530,{1,2,3,4}))),"Not Qualified") -> Not Qualified
C531: 2 | D531: CALVIN SANDERS | G531: 12 | L531: =SUM(E531:K531) -> 12 | M531: =IF(COUNTIF(E531:K531,">0")>=3,(SUM(LARGE(E531:K531,{1,2,3,4}))),"Not Qualified") -> Not Qualified
C532: 3 | D532: MICHAEL ARRIGO | H532: 12 | L532: =SUM(E532:K532) -> 12 | M532: =IF(COUNTIF(E532:K532,">0")>=3,(SUM(LARGE(E532:K532,{1,2,3,4}))),"Not Qualified") -> Not Qualified
C533: 4 | D533: SCOTT KRZASTEK | H533: 9 | L533: =SUM(E533:K533) -> 9 | M533: =IF(COUNTIF(E533:K533,">0")>=3,(SUM(LARGE(E533:K533,{1,2,3,4}))),"Not Qualified") -> Not Qualified
C534: 5 | D534: CESAR DELGADILLO | J534: 12 | L534: =SUM(E534:K534) -> 12 | M534: =IF(COUNTIF(E534:K534,">0")>=3,(SUM(LARGE(E534:K534,{1,2,3,4}))),"Not Qualified") -> Not Qualified
A536: STX | B536: T | C536: 1 | D536: MICHAEL SCHNEKSER | F536: 12 | G536: 9 | H536: 7 | I536: 12 | J536: 12 | K536: 12 | L536: =SUM(E536:K536) -> 64 | M536: =IF(COUNTIF(E536:K536,">0")>=3,(SUM(LARGE(E536:K536,{1,2,3,4}))),"Not Qualified") -> 48
C537: 2 | D537: MARK WOOD | F537: 9 | G537: 12 | H537: 12 | L537: =SUM(E537:K537) -> 33 | M537: 33
C538: 3 | D538: MICHAEL MORRISETT | F538: 7 | G538: 6 | L538: =SUM(E538:K538) -> 13 | M538: =IF(COUNTIF(E538:K538,">0")>=3,(SUM(LARGE(E538:K538,{1,2,3,4}))),"Not Qualified") -> Not Qualified
C539: 4 | D539: CORY BROWN | H539: 9 | L539: =SUM(E539:K539) -> 9 | M539: =IF(COUNTIF(E539:K539,">0")>=3,(SUM(LARGE(E539:K539,{1,2,3,4}))),"Not Qualified") -> Not Qualified
C540: 5 | D540: SCOTT GARDNER | G540: 7 | L540: =SUM(E540:K540) -> 7 | M540: =IF(COUNTIF(E540:K540,">0")>=3,(SUM(LARGE(E540:K540,{1,2,3,4}))),"Not Qualified") -> Not Qualified
A542: STU | B542: T | C542: 1 | D542: ANDY TURNBULL | F542: 12 | G542: 12 | H542: 12 | J542: 12 | K542: 12 | L542: =SUM(E542:K542) -> 60 | M542: =IF(COUNTIF(E542:K542,">0")>=3,(SUM(LARGE(E542:K542,{1,2,3,4}))),"Not Qualified") -> 48
C543: 2 | D543: JAMES CAUDILL | J543: 9 | L543: =SUM(E543:K543) -> 9 | M543: =IF(COUNTIF(E543:K543,">0")>=3,(SUM(LARGE(E543:K543,{1,2,3,4}))),"Not Qualified") -> Not Qualified
A546: NOVICE Class
A548: AWARD | B548: POS | C548: DRIVER | D548: APR | E548: MAY | F548: JUN | G548: JUL | H548: AUG | I548: AUG | J548: OCT | K548: TOTAL | L548: Best 4 of 6
D549: Cancelled | H549: Make up Day for April
A550: T | B550: 1 | C550: SCOTT HOPKINS | E550: 12 | F550: 12 | G550: 7 | H550: 12 | I550: 12 | J550: 9 | K550: =SUM(E550:J550) -> 64 | L550: =IF(COUNTIF(E550:J550,">0")>=3,(SUM(LARGE(E550:J550,{1,2,3,4}))),"Not Qualified") -> 48
A551: T | B551: 2 | C551: ANTHONY GORGONE | E551: 4 | G551: 9 | H551: 9 | I551: 9 | K551: =SUM(E551:J551) -> 31 | L551: =IF(COUNTIF(E551:J551,">0")>=3,(SUM(LARGE(E551:J551,{1,2,3,4}))),"Not Qualified") -> 31
A552: T | B552: 3 | C552: PHILLIP JUNEAU | G552: 6 | H552: 7 | I552: 6 | J552: 2 | K552: =SUM(E552:J552) -> 21 | L552: =IF(COUNTIF(E552:J552,">0")>=3,(SUM(LARGE(E552:J552,{1,2,3,4}))),"Not Qualified") -> 21
A553: T | B553: 4 | C553: TOM TYE | E553: 5 | F553: 1 | G553: 4 | H553: 5 | I553: 5 | J553: 1 | K553: =SUM(E553:J553) -> 21 | L553: =IF(COUNTIF(E553:J553,">0")>=3,(SUM(LARGE(E553:J553,{1,2,3,4}))),"Not Qualified") -> 19
A554: T | B554: 5 | C554: TJ FITZGERALD | E554: 9 | F554: 5 | G554: 1 | H554: 1 | I554: 1 | J554: 3 | K554: =SUM(E554:J554) -> 20 | L554: =IF(COUNTIF(E554:J554,">0")>=3,(SUM(LARGE(E554:J554,{1,2,3,4}))),"Not Qualified") -> 18
B555: 6 | C555: RICHARD NELSON | E555: 2 | H555: 2 | I555: 7 | J555: 5 | K555: =SUM(E555:J555) -> 16 | L555: =IF(COUNTIF(E555:J555,">0")>=3,(SUM(LARGE(E555:J555,{1,2,3,4}))),"Not Qualified") -> 16
B556: 7 | C556: RAY HOPKINS | E556: 3 | F556: 1 | G556: 5 | H556: 6 | I556: 1 | J556: 1 | K556: =SUM(E556:J556) -> 17 | L556: =IF(COUNTIF(E556:J556,">0")>=3,(SUM(LARGE(E556:J556,{1,2,3,4}))),"Not Qualified") -> 15
B557: 8 | C557: DEREK OBI | F557: 7 | G557: 1 | I557: 1 | J557: 4 | K557: =SUM(E557:J557) -> 13 | L557: =IF(COUNTIF(E557:J557,">0")>=3,(SUM(LARGE(E557:J557,{1,2,3,4}))),"Not Qualified") -> 13
B558: 9 | C558: RUSSELL TYE | F558: 1 | G558: 1 | H558: 4 | I558: 4 | J558: 1 | K558: =SUM(E558:J558) -> 11 | L558: =IF(COUNTIF(E558:J558,">0")>=3,(SUM(LARGE(E558:J558,{1,2,3,4}))),"Not Qualified") -> 10
B559: 10 | C559: BRIAN BORILLO | E559: 6 | H559: 1 | I559: 2 | K559: =SUM(E559:J559) -> 9 | L559: 9
B560: 11 | C560: MILLS ROBINSON | E560: 1 | F560: 1 | G560: 1 | H560: 3 | I560: 3 | J560: 1 | K560: =SUM(E560:J560) -> 10 | L560: =IF(COUNTIF(E560:J560,">0")>=3,(SUM(LARGE(E560:J560,{1,2,3,4}))),"Not Qualified") -> 8
B561: 12 | C561: MIKE PENSINGER | F561: 1 | G561: 3 | H561: 1 | K561: =SUM(E561:J561) -> 5 | L561: 5
B562: 13 | C562: GREGG ROSSI | E562: 1 | F562: 1 | G562: 1 | H562: 1 | I562: 1 | K562: =SUM(E562:J562) -> 5 | L562: =IF(COUNTIF(E562:J562,">0")>=3,(SUM(LARGE(E562:J562,{1,2,3,4}))),"Not Qualified") -> 4
B563: 14 | C563: ADAM SMALL | F563: 1 | G563: 1 | H563: 1 | I563: 1 | K563: =SUM(E563:J563) -> 4 | L563: =IF(COUNTIF(E563:J563,">0")>=3,(SUM(LARGE(E563:J563,{1,2,3,4}))),"Not Qualified") -> 4
B564: 15 | C564: ALAN BRODERICK | F564: 1 | G564: 1 | H564: 1 | J564: 1 | K564: =SUM(E564:J564) -> 4 | L564: =IF(COUNTIF(E564:J564,">0")>=3,(SUM(LARGE(E564:J564,{1,2,3,4}))),"Not Qualified") -> 4
B565: 16 | C565: STEVE DEES | E565: 1 | G565: 1 | H565: 1 | K565: =SUM(E565:J565) -> 3 | L565: 3
B566: 17 | C566: JASON HAYNES | F566: 9 | G566: 12 | K566: =SUM(E566:J566) -> 21 | L566: =IF(COUNTIF(E566:J566,">0")>=3,(SUM(LARGE(E566:J566,{1,2,3,4}))),"Not Qualified") -> Not Qualified
B567: 18 | C567: JOHN DEL CORSO | J567: 12 | K567: =SUM(E567:J567) -> 12 | L567: =IF(COUNTIF(E567:J567,">0")>=3,(SUM(LARGE(E567:J567,{1,2,3,4}))),"Not Qualified") -> Not Qualified
B568: 19 | C568: VINCENT CONTE | I568: 1 | J568: 7 | K568: =SUM(E568:J568) -> 8 | L568: =IF(COUNTIF(E568:J568,">0")>=3,(SUM(LARGE(E568:J568,{1,2,3,4}))),"Not Qualified") -> Not Qualified
B569: 20 | C569: ERIC ANDUZE | E569: 7 | K569: =SUM(E569:J569) -> 7 | L569: =IF(COUNTIF(E569:J569,">0")>=3,(SUM(LARGE(E569:J569,{1,2,3,4}))),"Not Qualified") -> Not Qualified
B570: 21 | C570: JASON JAHNSEN | F570: 6 | K570: =SUM(E570:J570) -> 6 | L570: =IF(COUNTIF(E570:J570,">0")>=3,(SUM(LARGE(E570:J570,{1,2,3,4}))),"Not Qualified") -> Not Qualified
B571: 22 | C571: ROB HALL | J571: 6 | K571: =SUM(E571:J571) -> 6 | L571: =IF(COUNTIF(E571:J571,">0")>=3,(SUM(LARGE(E571:J571,{1,2,3,4}))),"Not Qualified") -> Not Qualified
B572: 23 | C572: CHRIS KANE | E572: 1 | F572: 3 | K572: =SUM(E572:J572) -> 4 | L572: =IF(COUNTIF(E572:J572,">0")>=3,(SUM(LARGE(E572:J572,{1,2,3,4}))),"Not Qualified") -> Not Qualified
B573: 24 | C573: TERRY HARDEE | F573: 4 | K573: =SUM(E573:J573) -> 4 | L573: =IF(COUNTIF(E573:J573,">0")>=3,(SUM(LARGE(E573:J573,{1,2,3,4}))),"Not Qualified") -> Not Qualified
B574: 25 | C574: KHARIIM FARRELL | G574: 2 | J574: 1 | K574: =SUM(E574:J574) -> 3 | L574: =IF(COUNTIF(E574:J574,">0")>=3,(SUM(LARGE(E574:J574,{1,2,3,4}))),"Not Qualified") -> Not Qualified
B575: 26 | C575: BLAKE THOMAS | E575: 1 | F575: 1 | K575: =SUM(E575:J575) -> 2 | L575: =IF(COUNTIF(E575:J575,">0")>=3,(SUM(LARGE(E575:J575,{1,2,3,4}))),"Not Qualified") -> Not Qualified
B576: 27 | C576: CLINT WORRELL | F576: 2 | K576: =SUM(E576:J576) -> 2 | L576: =IF(COUNTIF(E576:J576,">0")>=3,(SUM(LARGE(E576:J576,{1,2,3,4}))),"Not Qualified") -> Not Qualified
B577: 28 | C577: DAVE REISCH | H577: 1 | J577: 1 | K577: =SUM(E577:J577) -> 2 | L577: =IF(COUNTIF(E577:J577,">0")>=3,(SUM(LARGE(E577:J577,{1,2,3,4}))),"Not Qualified") -> Not Qualified
B578: 29 | C578: EDDIE TOVAR | F578: 1 | G578: 1 | K578: =SUM(E578:J578) -> 2 | L578: =IF(COUNTIF(E578:J578,">0")>=3,(SUM(LARGE(E578:J578,{1,2,3,4}))),"Not Qualified") -> Not Qualified
B579: 30 | C579: JACK DAWSON | E579: 1 | G579: 1 | K579: =SUM(E579:J579) -> 2 | L579: =IF(COUNTIF(E579:J579,">0")>=3,(SUM(LARGE(E579:J579,{1,2,3,4}))),"Not Qualified") -> Not Qualified
B580: 31 | C580: JAMES LIVARA | E580: 1 | F580: 1 | K580: =SUM(E580:J580) -> 2 | L580: =IF(COUNTIF(E580:J580,">0")>=3,(SUM(LARGE(E580:J580,{1,2,3,4}))),"Not Qualified") -> Not Qualified
B581: 32 | C581: JIORJO LIVARA | E581: 1 | F581: 1 | K581: =SUM(E581:J581) -> 2 | L581: =IF(COUNTIF(E581:J581,">0")>=3,(SUM(LARGE(E581:J581,{1,2,3,4}))),"Not Qualified") -> Not Qualified
B582: 33 | C582: MARK DOVEL | F582: 1 | G582: 1 | K582: =SUM(E582:J582) -> 2 | L582: =IF(COUNTIF(E582:J582,">0")>=3,(SUM(LARGE(E582:J582,{1,2,3,4}))),"Not Qualified") -> Not Qualified
B583: 34 | C583: BRENT SHOUP | J583: 1 | K583: =SUM(E583:J583) -> 1 | L583: =IF(COUNTIF(E583:J583,">0")>=3,(SUM(LARGE(E583:J583,{1,2,3,4}))),"Not Qualified") -> Not Qualified
B584: 35 | C584: BRIAN HEATH | H584: 1 | K584: =SUM(E584:J584) -> 1 | L584: =IF(COUNTIF(E584:J584,">0")>=3,(SUM(LARGE(E584:J584,{1,2,3,4}))),"Not Qualified") -> Not Qualified
B585: 36 | C585: CHRISTOPHER SHAHSIAH | J585: 1 | K585: =SUM(E585:J585) -> 1 | L585: =IF(COUNTIF(E585:J585,">0")>=3,(SUM(LARGE(E585:J585,{1,2,3,4}))),"Not Qualified") -> Not Qualified
B586: 37 | C586: COLLIN KREVONICK | E586: 1 | K586: =SUM(E586:J586) -> 1 | L586: =IF(COUNTIF(E586:J586,">0")>=3,(SUM(LARGE(E586:J586,{1,2,3,4}))),"Not Qualified") -> Not Qualified
B587: 38 | C587: CURTIS BURNETTE | J587: 1 | K587: =SUM(E587:J587) -> 1 | L587: =IF(COUNTIF(E587:J587,">0")>=3,(SUM(LARGE(E587:J587,{1,2,3,4}))),"Not Qualified") -> Not Qualified
B588: 39 | C588: DAWN COPSETTA | F588: 1 | K588: =SUM(E588:J588) -> 1 | L588: =IF(COUNTIF(E588:J588,">0")>=3,(SUM(LARGE(E588:J588,{1,2,3,4}))),"Not Qualified") -> Not Qualified
B589: 40 | C589: DELRAY CORRY | J589: 1 | K589: =SUM(E589:J589) -> 1 | L589: =IF(COUNTIF(E589:J589,">0")>=3,(SUM(LARGE(E589:J589,{1,2,3,4}))),"Not Qualified") -> Not Qualified
B590: 41 | C590: ERNIE TORRES | G590: 1 | K590: =SUM(E590:J590) -> 1 | L590: =IF(COUNTIF(E590:J590,">0")>=3,(SUM(LARGE(E590:J590,{1,2,3,4}))),"Not Qualified") -> Not Qualified
B591: 42 | C591: JAY HOPKINS | F591: 1 | K591: =SUM(E591:J591) -> 1 | L591: =IF(COUNTIF(E591:J591,">0")>=3,(SUM(LARGE(E591:J591,{1,2,3,4}))),"Not Qualified") -> Not Qualified
B592: 43 | C592: JOHN CARLTON | J592: 1 | K592: =SUM(E592:J592) -> 1 | L592: =IF(COUNTIF(E592:J592,">0")>=3,(SUM(LARGE(E592:J592,{1,2,3,4}))),"Not Qualified") -> Not Qualified
B593: 44 | C593: JOHN MOLINELLI | I593: 1 | K593: =SUM(E593:J593) -> 1 | L593: =IF(COUNTIF(E593:J593,">0")>=3,(SUM(LARGE(E593:J593,{1,2,3,4}))),"Not Qualified") -> Not Qualified
B594: 45 | C594: JONATHAN LYONS | J594: 1 | K594: =SUM(E594:J594) -> 1 | L594: =IF(COUNTIF(E594:J594,">0")>=3,(SUM(LARGE(E594:J594,{1,2,3,4}))),"Not Qualified") -> Not Qualified
B595: 46 | C595: JONATHAN SPIKES | E595: 1 | K595: =SUM(E595:J595) -> 1 | L595: =IF(COUNTIF(E595:J595,">0")>=3,(SUM(LARGE(E595:J595,{1,2,3,4}))),"Not Qualified") -> Not Qualified
B596: 47 | C596: JULIE GREENE | G596: 1 | K596: =SUM(E596:J596) -> 1 | L596: =IF(COUNTIF(E596:J596,">0")>=3,(SUM(LARGE(E596:J596,{1,2,3,4}))),"Not Qualified") -> Not Qualified
B597: 48 | C597: MARCUS ROCCHI | I597: 1 | K597: =SUM(E597:J597) -> 1 | L597: =IF(COUNTIF(E597:J597,">0")>=3,(SUM(LARGE(E597:J597,{1,2,3,4}))),"Not Qualified") -> Not Qualified
B598: 49 | C598: MATT MATHIAS | I598: 1 | K598: =SUM(E598:J598) -> 1 | L598: =IF(COUNTIF(E598:J598,">0")>=3,(SUM(LARGE(E598:J598,{1,2,3,4}))),"Not Qualified") -> Not Qualified
B599: 50 | C599: MICHAEL NEWCOMB | H599: 1 | K599: =SUM(E599:J599) -> 1 | L599: =IF(COUNTIF(E599:J599,">0")>=3,(SUM(LARGE(E599:J599,{1,2,3,4}))),"Not Qualified") -> Not Qualified
B600: 51 | C600: MYRA DINGMAN | H600: 1 | K600: =SUM(E600:J600) -> 1 | L600: =IF(COUNTIF(E600:J600,">0")>=3,(SUM(LARGE(E600:J600,{1,2,3,4}))),"Not Qualified") -> Not Qualified
B601: 52 | C601: PAT GERBUS | J601: 1 | K601: =SUM(E601:J601) -> 1 | L601: =IF(COUNTIF(E601:J601,">0")>=3,(SUM(LARGE(E601:J601,{1,2,3,4}))),"Not Qualified") -> Not Qualified
B602: 53 | C602: RICH DEL VECCHIO | G602: 1 | K602: =SUM(E602:J602) -> 1 | L602: =IF(COUNTIF(E602:J602,">0")>=3,(SUM(LARGE(E602:J602,{1,2,3,4}))),"Not Qualified") -> Not Qualified
B603: 54 | C603: RICHARD ROSSI | G603: 1 | K603: =SUM(E603:J603) -> 1 | L603: =IF(COUNTIF(E603:J603,">0")>=3,(SUM(LARGE(E603:J603,{1,2,3,4}))),"Not Qualified") -> Not Qualified
B604: 55 | C604: RICK MOELLER | J604: 1 | K604: =SUM(E604:J604) -> 1 | L604: =IF(COUNTIF(E604:J604,">0")>=3,(SUM(LARGE(E604:J604,{1,2,3,4}))),"Not Qualified") -> Not Qualified
B605: 56 | C605: STEVE NEWTON | I605: 1 | K605: =SUM(E605:J605) -> 1 | L605: =IF(COUNTIF(E605:J605,">0")>=3,(SUM(LARGE(E605:J605,{1,2,3,4}))),"Not Qualified") -> Not Qualified
B606: 57 | C606: THOMAS KNEIPP | G606: 1 | K606: =SUM(E606:J606) -> 1 | L606: =IF(COUNTIF(E606:J606,">0")>=3,(SUM(LARGE(E606:J606,{1,2,3,4}))),"Not Qualified") -> Not Qualified
B607: 58 | C607: TOM KNEIPP | J607: 1 | K607: =SUM(E607:J607) -> 1 | L607: =IF(COUNTIF(E607:J607,">0")>=3,(SUM(LARGE(E607:J607,{1,2,3,4}))),"Not Qualified") -> Not Qualified
B608: 59 | C608: TREY BLACK | G608: 1 | K608: =SUM(E608:J608) -> 1 | L608: =IF(COUNTIF(E608:J608,">0")>=3,(SUM(LARGE(E608:J608,{1,2,3,4}))),"Not Qualified") -> Not Qualified
B609: 60 | C609: WILLIAM HATFIELD | G609: 1 | K609: =SUM(E609:J609) -> 1 | L609: =IF(COUNTIF(E609:J609,">0")>=3,(SUM(LARGE(E609:J609,{1,2,3,4}))),"Not Qualified") -> Not Qualified
B610: 61 | C610: ZACH ZELLER | J610: 1 | K610: =SUM(E610:J610) -> 1 | L610: =IF(COUNTIF(E610:J610,">0")>=3,(SUM(LARGE(E610:J610,{1,2,3,4}))),"Not Qualified") -> Not Qualified