C1: EVENT
B2: DRIVER | C2: Joy Fund | D2: Winter 2 | E2: Winter 3 | F2: Winter 4 | G2: TOTAL | H2: Best 3 of 4
A3: POS
A5: 1 | B5: BILL BROCHU | C5: 580 | D5: 595 | E5: 625 | F5: 625 | G5: =SUM(C5:F5) -> 2425 | H5: =IF(COUNTIF(C5:F5,">0")>=3,(SUM(LARGE(C5:F5,{1,2,3}))),"0") -> 1845
A6: 2 | B6: DOUG KEILER | C6: 550 | D6: 605 | E6: 615 | F6: 610 | G6: =SUM(C6:F6) -> 2380 | H6: =IF(COUNTIF(C6:F6,">0")>=3,(SUM(LARGE(C6:F6,{1,2,3}))),"0") -> 1830
A7: 3 | B7: DAVID MARTIN | C7: 560 | D7: 615 | E7: 435 | F7: 620 | G7: =SUM(C7:F7) -> 2230 | H7: =IF(COUNTIF(C7:F7,">0")>=3,(SUM(LARGE(C7:F7,{1,2,3}))),"0") -> 1795
A8: 4 | B8: WES MICHAELS | C8: 515 | D8: 610 | E8: 575 | F8: 605 | G8: =SUM(C8:F8) -> 2305 | H8: =IF(COUNTIF(C8:F8,">0")>=3,(SUM(LARGE(C8:F8,{1,2,3}))),"0") -> 1790
A9: 5 | B9: RICK MARIANI | C9: 290 | D9: 620 | E9: 600 | F9: 570 | G9: =SUM(C9:F9) -> 2080 | H9: =IF(COUNTIF(C9:F9,">0")>=3,(SUM(LARGE(C9:F9,{1,2,3}))),"0") -> 1790
A10: 6 | B10: DAVID BROCHU | C10: 595 | D10: 590 | E10: 590 | F10: 595 | G10: =SUM(C10:F10) -> 2370 | H10: =IF(COUNTIF(C10:F10,">0")>=3,(SUM(LARGE(C10:F10,{1,2,3}))),"0") -> 1780
A11: 7 | B11: ROBB DAVIS | C11: 565 | D11: 575 | E11: 620 | F11: 545 | G11: =SUM(C11:F11) -> 2305 | H11: =IF(COUNTIF(C11:F11,">0")>=3,(SUM(LARGE(C11:F11,{1,2,3}))),"0") -> 1760
A12: 8 | B12: SHAWN LAMBERT | C12: 535 | E12: 610 | F12: 615 | G12: =SUM(C12:F12) -> 1760 | H12: =IF(COUNTIF(C12:F12,">0")>=3,(SUM(LARGE(C12:F12,{1,2,3}))),"0") -> 1760
A13: 9 | B13: JIM SETZER | D13: 625 | E13: 545 | F13: 585 | G13: =SUM(C13:F13) -> 1755 | H13: =IF(COUNTIF(C13:F13,">0")>=3,(SUM(LARGE(C13:F13,{1,2,3}))),"0") -> 1755
A14: 10 | B14: MICHAEL MOUNTAIN | D14: 570 | E14: 595 | F14: 555 | G14: =SUM(C14:F14) -> 1720 | H14: =IF(COUNTIF(C14:F14,">0")>=3,(SUM(LARGE(C14:F14,{1,2,3}))),"0") -> 1720
A15: 11 | B15: BOBBY SMITH | C15: 585 | D15: 600 | E15: 520 | F15: 485 | G15: =SUM(C15:F15) -> 2190 | H15: =IF(COUNTIF(C15:F15,">0")>=3,(SUM(LARGE(C15:F15,{1,2,3}))),"0") -> 1705
A16: 12 | B16: JIM HALTOM | C16: 575 | D16: 440 | E16: 605 | F16: 510 | G16: =SUM(C16:F16) -> 2130 | H16: =IF(COUNTIF(C16:F16,">0")>=3,(SUM(LARGE(C16:F16,{1,2,3}))),"0") -> 1690
A17: 13 | B17: JAY CUMMING | C17: 525 | D17: 410 | E17: 560 | F17: 575 | G17: =SUM(C17:F17) -> 2070 | H17: =IF(COUNTIF(C17:F17,">0")>=3,(SUM(LARGE(C17:F17,{1,2,3}))),"0") -> 1660
A18: 14 | B18: MICHAEL SCHNEKSER | D18: 550 | E18: 570 | F18: 540 | G18: =SUM(C18:F18) -> 1660 | H18: =IF(COUNTIF(C18:F18,">0")>=3,(SUM(LARGE(C18:F18,{1,2,3}))),"0") -> 1660
A19: 15 | B19: JIM ROBINSON | C19: 490 | D19: 540 | E19: 335 | F19: 600 | G19: =SUM(C19:F19) -> 1965 | H19: =IF(COUNTIF(C19:F19,">0")>=3,(SUM(LARGE(C19:F19,{1,2,3}))),"0") -> 1630
A20: 16 | B20: COREY MAPLES | C20: 415 | D20: 520 | E20: 565 | F20: 530 | G20: =SUM(C20:F20) -> 2030 | H20: =IF(COUNTIF(C20:F20,">0")>=3,(SUM(LARGE(C20:F20,{1,2,3}))),"0") -> 1615
A21: 17 | B21: MARC LISNER | C21: 460 | D21: 545 | E21: 550 | F21: 480 | G21: =SUM(C21:F21) -> 2035 | H21: =IF(COUNTIF(C21:F21,">0")>=3,(SUM(LARGE(C21:F21,{1,2,3}))),"0") -> 1575
A22: 18 | B22: JOHN CROWDER | C22: 390 | D22: 525 | E22: 515 | F22: 515 | G22: =SUM(C22:F22) -> 1945 | H22: =IF(COUNTIF(C22:F22,">0")>=3,(SUM(LARGE(C22:F22,{1,2,3}))),"0") -> 1555
A23: 19 | B23: ERIC BONNETT | C23: 480 | D23: 535 | E23: 540 | G23: =SUM(C23:F23) -> 1555 | H23: =IF(COUNTIF(C23:F23,">0")>=3,(SUM(LARGE(C23:F23,{1,2,3}))),"0") -> 1555
A24: 20 | B24: STEVE SHELL | C24: 475 | E24: 580 | F24: 495 | G24: =SUM(C24:F24) -> 1550 | H24: =IF(COUNTIF(C24:F24,">0")>=3,(SUM(LARGE(C24:F24,{1,2,3}))),"0") -> 1550
A25: 21 | B25: JIM HERLEY | C25: 485 | D25: 495 | E25: 490 | F25: 560 | G25: =SUM(C25:F25) -> 2030 | H25: =IF(COUNTIF(C25:F25,">0")>=3,(SUM(LARGE(C25:F25,{1,2,3}))),"0") -> 1545
A26: 22 | B26: PETER FRENCH | D26: 565 | E26: 555 | F26: 410 | G26: =SUM(C26:F26) -> 1530 | H26: =IF(COUNTIF(C26:F26,">0")>=3,(SUM(LARGE(C26:F26,{1,2,3}))),"0") -> 1530
A27: 23 | B27: BERNARD CHMIELEWSKI | C27: 395 | D27: 555 | E27: 470 | F27: 465 | G27: =SUM(C27:F27) -> 1885 | H27: =IF(COUNTIF(C27:F27,">0")>=3,(SUM(LARGE(C27:F27,{1,2,3}))),"0") -> 1490
A28: 24 | B28: SCOTT GARDNER | C28: 330 | D28: 530 | E28: 505 | F28: 440 | G28: =SUM(C28:F28) -> 1805 | H28: =IF(COUNTIF(C28:F28,">0")>=3,(SUM(LARGE(C28:F28,{1,2,3}))),"0") -> 1475
A29: 25 | B29: JASON LISNER | C29: 370 | D29: 580 | E29: 280 | F29: 500 | G29: =SUM(C29:F29) -> 1730 | H29: =IF(COUNTIF(C29:F29,">0")>=3,(SUM(LARGE(C29:F29,{1,2,3}))),"0") -> 1450
A30: 26 | B30: MICHAEL GAINTNER | C30: 325 | D30: 505 | E30: 475 | F30: 455 | G30: =SUM(C30:F30) -> 1760 | H30: =IF(COUNTIF(C30:F30,">0")>=3,(SUM(LARGE(C30:F30,{1,2,3}))),"0") -> 1435
A31: 27 | B31: KEITH MAPLES | C31: 195 | D31: 405 | E31: 485 | F31: 535 | G31: =SUM(C31:F31) -> 1620 | H31: =IF(COUNTIF(C31:F31,">0")>=3,(SUM(LARGE(C31:F31,{1,2,3}))),"0") -> 1425
A32: 28 | B32: MERRIE MALPASS | C32: 250 | D32: 515 | E32: 465 | F32: 430 | G32: =SUM(C32:F32) -> 1660 | H32: =IF(COUNTIF(C32:F32,">0")>=3,(SUM(LARGE(C32:F32,{1,2,3}))),"0") -> 1410
A33: 29 | B33: STEVE DASHER | D33: 490 | E33: 510 | F33: 405 | G33: =SUM(C33:F33) -> 1405 | H33: =IF(COUNTIF(C33:F33,">0")>=3,(SUM(LARGE(C33:F33,{1,2,3}))),"0") -> 1405
A34: 30 | B34: JEFF JASMER | C34: 365 | D34: 500 | E34: 480 | F34: 420 | G34: =SUM(C34:F34) -> 1765 | H34: =IF(COUNTIF(C34:F34,">0")>=3,(SUM(LARGE(C34:F34,{1,2,3}))),"0") -> 1400
A35: 31 | B35: CARL JUNEAU | C35: 380 | E35: 495 | F35: 505 | G35: =SUM(C35:F35) -> 1380 | H35: =IF(COUNTIF(C35:F35,">0")>=3,(SUM(LARGE(C35:F35,{1,2,3}))),"0") -> 1380
A36: 32 | B36: SEAN MCCONNELL | C36: 440 | D36: 485 | E36: 450 | F36: 335 | G36: =SUM(C36:F36) -> 1710 | H36: =IF(COUNTIF(C36:F36,">0")>=3,(SUM(LARGE(C36:F36,{1,2,3}))),"0") -> 1375
A37: 33 | B37: DAVE MCLAUGHLIN | C37: 455 | E37: 405 | F37: 400 | G37: =SUM(C37:F37) -> 1260 | H37: =IF(COUNTIF(C37:F37,">0")>=3,(SUM(LARGE(C37:F37,{1,2,3}))),"0") -> 1260
A38: 34 | B38: JOMMEL DEGUZMAN | C38: 345 | D38: 400 | E38: 370 | F38: 460 | G38: =SUM(C38:F38) -> 1575 | H38: =IF(COUNTIF(C38:F38,">0")>=3,(SUM(LARGE(C38:F38,{1,2,3}))),"0") -> 1230
A39: 35 | B39: BRUCE AUSINK | C39: 335 | D39: 465 | E39: 390 | F39: 365 | G39: =SUM(C39:F39) -> 1555 | H39: =IF(COUNTIF(C39:F39,">0")>=3,(SUM(LARGE(C39:F39,{1,2,3}))),"0") -> 1220
A40: 36 | B40: CRAIG KIMBERLY | C40: 215 | D40: 455 | E40: 530 | G40: =SUM(C40:F40) -> 1200 | H40: =IF(COUNTIF(C40:F40,">0")>=3,(SUM(LARGE(C40:F40,{1,2,3}))),"0") -> 1200
A41: 37 | B41: BRANDON CHARLESON | C41: 355 | D41: 415 | F41: 425 | G41: =SUM(C41:F41) -> 1195 | H41: =IF(COUNTIF(C41:F41,">0")>=3,(SUM(LARGE(C41:F41,{1,2,3}))),"0") -> 1195
A42: 38 | B42: ROBERT KIRKPATRICK | C42: 405 | D42: 360 | E42: 400 | G42: =SUM(C42:F42) -> 1165 | H42: =IF(COUNTIF(C42:F42,">0")>=3,(SUM(LARGE(C42:F42,{1,2,3}))),"0") -> 1165
A43: 39 | B43: LELANE ARNESON | C43: 310 | D43: 380 | E43: 415 | F43: 360 | G43: =SUM(C43:F43) -> 1465 | H43: =IF(COUNTIF(C43:F43,">0")>=3,(SUM(LARGE(C43:F43,{1,2,3}))),"0") -> 1155
A44: 40 | B44: SETH DOZIER | C44: 210 | D44: 560 | E44: 365 | G44: =SUM(C44:F44) -> 1135 | H44: =IF(COUNTIF(C44:F44,">0")>=3,(SUM(LARGE(C44:F44,{1,2,3}))),"0") -> 1135
A45: 41 | B45: DAVID CORDER | D45: 470 | E45: 345 | F45: 320 | G45: =SUM(C45:F45) -> 1135 | H45: =IF(COUNTIF(C45:F45,">0")>=3,(SUM(LARGE(C45:F45,{1,2,3}))),"0") -> 1135
A46: 42 | B46: JOHN SETTLE | C46: 180 | D46: 395 | E46: 380 | F46: 330 | G46: =SUM(C46:F46) -> 1285 | H46: =IF(COUNTIF(C46:F46,">0")>=3,(SUM(LARGE(C46:F46,{1,2,3}))),"0") -> 1105
A47: 43 | B47: DOUGLAS ARCIDINO | C47: 265 | E47: 420 | F47: 415 | G47: =SUM(C47:F47) -> 1100 | H47: =IF(COUNTIF(C47:F47,">0")>=3,(SUM(LARGE(C47:F47,{1,2,3}))),"0") -> 1100
A48: 44 | B48: KEITH KASMIRE | C48: 350 | D48: 345 | E48: 350 | F48: 390 | G48: =SUM(C48:F48) -> 1435 | H48: =IF(COUNTIF(C48:F48,">0")>=3,(SUM(LARGE(C48:F48,{1,2,3}))),"0") -> 1090
A49: 45 | B49: JEREMIAH MILO | C49: 75 | D49: 295 | E49: 385 | F49: 340 | G49: =SUM(C49:F49) -> 1095 | H49: =IF(COUNTIF(C49:F49,">0")>=3,(SUM(LARGE(C49:F49,{1,2,3}))),"0") -> 1020
A50: 46 | B50: ADAM ROSEN | C50: 220 | D50: 475 | F50: 325 | G50: =SUM(C50:F50) -> 1020 | H50: =IF(COUNTIF(C50:F50,">0")>=3,(SUM(LARGE(C50:F50,{1,2,3}))),"0") -> 1020
A51: 47 | B51: CANDACE CROWDER | C51: 110 | D51: 365 | E51: 340 | F51: 280 | G51: =SUM(C51:F51) -> 1095 | H51: =IF(COUNTIF(C51:F51,">0")>=3,(SUM(LARGE(C51:F51,{1,2,3}))),"0") -> 985
A52: 48 | B52: TONY CESPEDES | D52: 355 | E52: 285 | F52: 285 | G52: =SUM(C52:F52) -> 925 | H52: =IF(COUNTIF(C52:F52,">0")>=3,(SUM(LARGE(C52:F52,{1,2,3}))),"0") -> 925
A53: 49 | B53: SHANNON HALTOM | D53: 325 | E53: 310 | F53: 245 | G53: =SUM(C53:F53) -> 880 | H53: =IF(COUNTIF(C53:F53,">0")>=3,(SUM(LARGE(C53:F53,{1,2,3}))),"0") -> 880
A54: 50 | B54: BECKY WINNER | D54: 270 | E54: 260 | F54: 295 | G54: =SUM(C54:F54) -> 825 | H54: =IF(COUNTIF(C54:F54,">0")>=3,(SUM(LARGE(C54:F54,{1,2,3}))),"0") -> 825
A55: 51 | B55: BARBARA ROBINSON | C55: 115 | D55: 335 | E55: 235 | F55: 225 | G55: =SUM(C55:F55) -> 910 | H55: =IF(COUNTIF(C55:F55,">0")>=3,(SUM(LARGE(C55:F55,{1,2,3}))),"0") -> 795
A56: 52 | B56: JOE CECELIC | C56: 140 | D56: 340 | E56: 315 | G56: =SUM(C56:F56) -> 795 | H56: =IF(COUNTIF(C56:F56,">0")>=3,(SUM(LARGE(C56:F56,{1,2,3}))),"0") -> 795
A57: 53 | B57: JASPER DE GUZMAN | C57: 120 | D57: 320 | E57: 300 | G57: =SUM(C57:F57) -> 740 | H57: =IF(COUNTIF(C57:F57,">0")>=3,(SUM(LARGE(C57:F57,{1,2,3}))),"0") -> 740
A58: 54 | B58: KEITH EDWARDS | C58: 125 | E58: 290 | F58: 315 | G58: =SUM(C58:F58) -> 730 | H58: =IF(COUNTIF(C58:F58,">0")>=3,(SUM(LARGE(C58:F58,{1,2,3}))),"0") -> 730
A59: 55 | B59: TOM TYE | C59: 30 | D59: 315 | F59: 305 | G59: =SUM(C59:F59) -> 650 | H59: =IF(COUNTIF(C59:F59,">0")>=3,(SUM(LARGE(C59:F59,{1,2,3}))),"0") -> 650
A60: 56 | B60: DAVE CUTCHINS | C60: 495 | F60: 590 | G60: =SUM(C60:F60) -> 1085 | H60: =IF(COUNTIF(C60:F60,">0")>=3,(SUM(LARGE(C60:F60,{1,2,3}))),"0") -> 0
A61: 57 | B61: JEFF ROONEY | C61: 520 | F61: 520 | G61: =SUM(C61:F61) -> 1040 | H61: =IF(COUNTIF(C61:F61,">0")>=3,(SUM(LARGE(C61:F61,{1,2,3}))),"0") -> 0
A62: 58 | B62: FRANK INSLEY | C62: 540 | F62: 445 | G62: =SUM(C62:F62) -> 985 | H62: =IF(COUNTIF(C62:F62,">0")>=3,(SUM(LARGE(C62:F62,{1,2,3}))),"0") -> 0
A63: 59 | B63: WIL LANGDON | E63: 500 | F63: 475 | G63: =SUM(C63:F63) -> 975 | H63: =IF(COUNTIF(C63:F63,">0")>=3,(SUM(LARGE(C63:F63,{1,2,3}))),"0") -> 0
A64: 60 | B64: MARK WOOD | C64: 430 | F64: 525 | G64: =SUM(C64:F64) -> 955 | H64: =IF(COUNTIF(C64:F64,">0")>=3,(SUM(LARGE(C64:F64,{1,2,3}))),"0") -> 0
A65: 61 | B65: WAYNE LEWIS | E65: 525 | F65: 350 | G65: =SUM(C65:F65) -> 875 | H65: =IF(COUNTIF(C65:F65,">0")>=3,(SUM(LARGE(C65:F65,{1,2,3}))),"0") -> 0
A66: 62 | B66: PHILLIP AQUINO | D66: 480 | F66: 380 | G66: =SUM(C66:F66) -> 860 | H66: =IF(COUNTIF(C66:F66,">0")>=3,(SUM(LARGE(C66:F66,{1,2,3}))),"0") -> 0
A67: 63 | B67: BILL EAKER | C67: 245 | F67: 565 | G67: =SUM(C67:F67) -> 810 | H67: =IF(COUNTIF(C67:F67,">0")>=3,(SUM(LARGE(C67:F67,{1,2,3}))),"0") -> 0
A68: 64 | B68: JIM HARRIS | C68: 420 | F68: 375 | G68: =SUM(C68:F68) -> 795 | H68: =IF(COUNTIF(C68:F68,">0")>=3,(SUM(LARGE(C68:F68,{1,2,3}))),"0") -> 0
A69: 65 | B69: MIKE TWIFORD | C69: 270 | D69: 510 | G69: =SUM(C69:F69) -> 780 | H69: =IF(COUNTIF(C69:F69,">0")>=3,(SUM(LARGE(C69:F69,{1,2,3}))),"0") -> 0
A70: 66 | B70: PETER AQUINO | E70: 360 | F70: 355 | G70: =SUM(C70:F70) -> 715 | H70: =IF(COUNTIF(C70:F70,">0")>=3,(SUM(LARGE(C70:F70,{1,2,3}))),"0") -> 0
A71: 67 | B71: EMRYS SCOTT-MURRELL | D71: 385 | E71: 320 | G71: =SUM(C71:F71) -> 705 | H71: =IF(COUNTIF(C71:F71,">0")>=3,(SUM(LARGE(C71:F71,{1,2,3}))),"0") -> 0
A72: 68 | B72: ERIC ANDUZE | E72: 325 | F72: 370 | G72: =SUM(C72:F72) -> 695 | H72: =IF(COUNTIF(C72:F72,">0")>=3,(SUM(LARGE(C72:F72,{1,2,3}))),"0") -> 0
A73: 69 | B73: PETER FLORANCE | C73: 240 | F73: 395 | G73: =SUM(C73:F73) -> 635 | H73: =IF(COUNTIF(C73:F73,">0")>=3,(SUM(LARGE(C73:F73,{1,2,3}))),"0") -> 0
A74: 70 | B74: MARIBETH CUPPS | C74: 320 | F74: 310 | G74: =SUM(C74:F74) -> 630 | H74: =IF(COUNTIF(C74:F74,">0")>=3,(SUM(LARGE(C74:F74,{1,2,3}))),"0") -> 0
A75: 71 | B75: ROD MCGEORGE | C75: 625 | G75: =SUM(C75:F75) -> 625 | H75: =IF(COUNTIF(C75:F75,">0")>=3,(SUM(LARGE(C75:F75,{1,2,3}))),"0") -> 0
A76: 72 | B76: MIKE JOHNSON | C76: 620 | G76: =SUM(C76:F76) -> 620 | H76: =IF(COUNTIF(C76:F76,">0")>=3,(SUM(LARGE(C76:F76,{1,2,3}))),"0") -> 0
A77: 73 | B77: SAM STRANO | C77: 615 | G77: =SUM(C77:F77) -> 615 | H77: =IF(COUNTIF(C77:F77,">0")>=3,(SUM(LARGE(C77:F77,{1,2,3}))),"0") -> 0
A78: 74 | B78: THOMAS BLEH | C78: 610 | G78: =SUM(C78:F78) -> 610 | H78: =IF(COUNTIF(C78:F78,">0")>=3,(SUM(LARGE(C78:F78,{1,2,3}))),"0") -> 0
A79: 75 | B79: ALEX SHCHIPKOV | C79: 605 | G79: =SUM(C79:F79) -> 605 | H79: =IF(COUNTIF(C79:F79,">0")>=3,(SUM(LARGE(C79:F79,{1,2,3}))),"0") -> 0
A80: 76 | B80: TERRY BAKER | C80: 600 | G80: =SUM(C80:F80) -> 600 | H80: =IF(COUNTIF(C80:F80,">0")>=3,(SUM(LARGE(C80:F80,{1,2,3}))),"0") -> 0
A81: 77 | B81: GIL SMITH | C81: 590 | G81: =SUM(C81:F81) -> 590 | H81: =IF(COUNTIF(C81:F81,">0")>=3,(SUM(LARGE(C81:F81,{1,2,3}))),"0") -> 0
A82: 78 | B82: STEVEN TERONDE | D82: 585 | G82: =SUM(C82:F82) -> 585 | H82: =IF(COUNTIF(C82:F82,">0")>=3,(SUM(LARGE(C82:F82,{1,2,3}))),"0") -> 0
A83: 79 | B83: JIM EWING | E83: 585 | G83: =SUM(C83:F83) -> 585 | H83: =IF(COUNTIF(C83:F83,">0")>=3,(SUM(LARGE(C83:F83,{1,2,3}))),"0") -> 0
A84: 80 | B84: LAWRENCE CHAPPE | C84: 275 | D84: 300 | G84: =SUM(C84:F84) -> 575 | H84: =IF(COUNTIF(C84:F84,">0")>=3,(SUM(LARGE(C84:F84,{1,2,3}))),"0") -> 0
A85: 81 | B85: ANGELA SCHMUHL | E85: 305 | F85: 270 | G85: =SUM(C85:F85) -> 575 | H85: =IF(COUNTIF(C85:F85,">0")>=3,(SUM(LARGE(C85:F85,{1,2,3}))),"0") -> 0
A86: 82 | B86: BOB BROCHU | C86: 570 | G86: =SUM(C86:F86) -> 570 | H86: =IF(COUNTIF(C86:F86,">0")>=3,(SUM(LARGE(C86:F86,{1,2,3}))),"0") -> 0
A87: 83 | B87: LES BANYAS | C87: 555 | G87: =SUM(C87:F87) -> 555 | H87: =IF(COUNTIF(C87:F87,">0")>=3,(SUM(LARGE(C87:F87,{1,2,3}))),"0") -> 0
A88: 84 | B88: GARY BARNES | C88: 165 | D88: 390 | G88: =SUM(C88:F88) -> 555 | H88: =IF(COUNTIF(C88:F88,">0")>=3,(SUM(LARGE(C88:F88,{1,2,3}))),"0") -> 0
A89: 85 | B89: RICHARD NELSON | C89: 170 | D89: 375 | G89: =SUM(C89:F89) -> 545 | H89: =IF(COUNTIF(C89:F89,">0")>=3,(SUM(LARGE(C89:F89,{1,2,3}))),"0") -> 0
A90: 86 | B90: AJ BELLEVILLE | C90: 545 | G90: =SUM(C90:F90) -> 545 | H90: =IF(COUNTIF(C90:F90,">0")>=3,(SUM(LARGE(C90:F90,{1,2,3}))),"0") -> 0
A91: 87 | B91: ROBERT SMITHSON | E91: 535 | G91: =SUM(C91:F91) -> 535 | H91: =IF(COUNTIF(C91:F91,">0")>=3,(SUM(LARGE(C91:F91,{1,2,3}))),"0") -> 0
A92: 88 | B92: JAMES MCIVER | C92: 530 | G92: =SUM(C92:F92) -> 530 | H92: =IF(COUNTIF(C92:F92,">0")>=3,(SUM(LARGE(C92:F92,{1,2,3}))),"0") -> 0
A93: 89 | B93: ALAN STRATTON | C93: 510 | G93: =SUM(C93:F93) -> 510 | H93: =IF(COUNTIF(C93:F93,">0")>=3,(SUM(LARGE(C93:F93,{1,2,3}))),"0") -> 0
A94: 90 | B94: TODD WAGNER | C94: 505 | G94: =SUM(C94:F94) -> 505 | H94: =IF(COUNTIF(C94:F94,">0")>=3,(SUM(LARGE(C94:F94,{1,2,3}))),"0") -> 0
A95: 91 | B95: ROY ARMSTRONG | C95: 500 | G95: =SUM(C95:F95) -> 500 | H95: =IF(COUNTIF(C95:F95,">0")>=3,(SUM(LARGE(C95:F95,{1,2,3}))),"0") -> 0
A96: 92 | B96: GREGG ROSSI | E96: 255 | F96: 240 | G96: =SUM(C96:F96) -> 495 | H96: =IF(COUNTIF(C96:F96,">0")>=3,(SUM(LARGE(C96:F96,{1,2,3}))),"0") -> 0
A97: 93 | B97: JUSTIN MCKENNA | C97: 160 | D97: 330 | G97: =SUM(C97:F97) -> 490 | H97: =IF(COUNTIF(C97:F97,">0")>=3,(SUM(LARGE(C97:F97,{1,2,3}))),"0") -> 0
A98: 94 | B98: JULIA TYE | D98: 275 | F98: 205 | G98: =SUM(C98:F98) -> 480 | H98: =IF(COUNTIF(C98:F98,">0")>=3,(SUM(LARGE(C98:F98,{1,2,3}))),"0") -> 0
A99: 95 | B99: CALVIN SANDERS | C99: 230 | E99: 250 | G99: =SUM(C99:F99) -> 480 | H99: =IF(COUNTIF(C99:F99,">0")>=3,(SUM(LARGE(C99:F99,{1,2,3}))),"0") -> 0
A100: 96 | B100: DALE BLANKENSHIP | C100: 470 | G100: =SUM(C100:F100) -> 470 | H100: =IF(COUNTIF(C100:F100,">0")>=3,(SUM(LARGE(C100:F100,{1,2,3}))),"0") -> 0
A101: 97 | B101: CURTIS STAPLES | C101: 465 | G101: =SUM(C101:F101) -> 465 | H101: =IF(COUNTIF(C101:F101,">0")>=3,(SUM(LARGE(C101:F101,{1,2,3}))),"0") -> 0
A102: 98 | B102: LARRY ALLAMONG | E102: 460 | G102: =SUM(C102:F102) -> 460 | H102: =IF(COUNTIF(C102:F102,">0")>=3,(SUM(LARGE(C102:F102,{1,2,3}))),"0") -> 0
A103: 99 | B103: DOUG ARCIDINO | D103: 460 | G103: =SUM(C103:F103) -> 460 | H103: =IF(COUNTIF(C103:F103,">0")>=3,(SUM(LARGE(C103:F103,{1,2,3}))),"0") -> 0
A104: 100 | B104: DEREK FLEMMING | E104: 455 | G104: =SUM(C104:F104) -> 455 | H104: =IF(COUNTIF(C104:F104,">0")>=3,(SUM(LARGE(C104:F104,{1,2,3}))),"0") -> 0
A105: 101 | B105: BRAD POCOCK | D105: 450 | G105: =SUM(C105:F105) -> 450 | H105: =IF(COUNTIF(C105:F105,">0")>=3,(SUM(LARGE(C105:F105,{1,2,3}))),"0") -> 0
A106: 102 | B106: BOBBY DUNCAN | C106: 450 | G106: =SUM(C106:F106) -> 450 | H106: =IF(COUNTIF(C106:F106,">0")>=3,(SUM(LARGE(C106:F106,{1,2,3}))),"0") -> 0
A107: 103 | B107: TERRY ZACH | C107: 190 | F107: 255 | G107: =SUM(C107:F107) -> 445 | H107: =IF(COUNTIF(C107:F107,">0")>=3,(SUM(LARGE(C107:F107,{1,2,3}))),"0") -> 0
A108: 104 | B108: JEFFREY CURTIS | C108: 445 | G108: =SUM(C108:F108) -> 445 | H108: =IF(COUNTIF(C108:F108,">0")>=3,(SUM(LARGE(C108:F108,{1,2,3}))),"0") -> 0
A109: 105 | B109: JAY BOHME | D109: 445 | G109: =SUM(C109:F109) -> 445 | H109: =IF(COUNTIF(C109:F109,">0")>=3,(SUM(LARGE(C109:F109,{1,2,3}))),"0") -> 0
A110: 106 | B110: BRENDON HINES | E110: 445 | G110: =SUM(C110:F110) -> 445 | H110: =IF(COUNTIF(C110:F110,">0")>=3,(SUM(LARGE(C110:F110,{1,2,3}))),"0") -> 0
A111: 107 | B111: CHRISTOPHER BAXTER | E111: 440 | G111: =SUM(C111:F111) -> 440 | H111: =IF(COUNTIF(C111:F111,">0")>=3,(SUM(LARGE(C111:F111,{1,2,3}))),"0") -> 0
A112: 108 | B112: XAVIER CALDERON | C112: 435 | G112: =SUM(C112:F112) -> 435 | H112: =IF(COUNTIF(C112:F112,">0")>=3,(SUM(LARGE(C112:F112,{1,2,3}))),"0") -> 0
A113: 109 | B113: MIKE COBB | D113: 435 | G113: =SUM(C113:F113) -> 435 | H113: =IF(COUNTIF(C113:F113,">0")>=3,(SUM(LARGE(C113:F113,{1,2,3}))),"0") -> 0
A114: 110 | B114: JARED LANTZY | E114: 430 | G114: =SUM(C114:F114) -> 430 | H114: =IF(COUNTIF(C114:F114,">0")>=3,(SUM(LARGE(C114:F114,{1,2,3}))),"0") -> 0
A115: 111 | B115: CESAR DEL GADIO | D115: 430 | G115: =SUM(C115:F115) -> 430 | H115: =IF(COUNTIF(C115:F115,">0")>=3,(SUM(LARGE(C115:F115,{1,2,3}))),"0") -> 0
A116: 112 | B116: SHARON ROSSI | E116: 215 | F116: 210 | G116: =SUM(C116:F116) -> 425 | H116: =IF(COUNTIF(C116:F116,">0")>=3,(SUM(LARGE(C116:F116,{1,2,3}))),"0") -> 0
A117: 113 | B117: ROBERT RUSSEL | D117: 425 | G117: =SUM(C117:F117) -> 425 | H117: =IF(COUNTIF(C117:F117,">0")>=3,(SUM(LARGE(C117:F117,{1,2,3}))),"0") -> 0
A118: 114 | B118: MICHAEL LINGARD | E118: 425 | G118: =SUM(C118:F118) -> 425 | H118: =IF(COUNTIF(C118:F118,">0")>=3,(SUM(LARGE(C118:F118,{1,2,3}))),"0") -> 0
A119: 115 | B119: AMANDA GREG | C119: 425 | G119: =SUM(C119:F119) -> 425 | H119: =IF(COUNTIF(C119:F119,">0")>=3,(SUM(LARGE(C119:F119,{1,2,3}))),"0") -> 0
A120: 116 | B120: BENO RUBIN | D120: 420 | G120: =SUM(C120:F120) -> 420 | H120: =IF(COUNTIF(C120:F120,">0")>=3,(SUM(LARGE(C120:F120,{1,2,3}))),"0") -> 0
A121: 117 | B121: RUSSELL BROWN | E121: 410 | G121: =SUM(C121:F121) -> 410 | H121: =IF(COUNTIF(C121:F121,">0")>=3,(SUM(LARGE(C121:F121,{1,2,3}))),"0") -> 0
A122: 118 | B122: ANDREW CHISHOLM | C122: 410 | G122: =SUM(C122:F122) -> 410 | H122: =IF(COUNTIF(C122:F122,">0")>=3,(SUM(LARGE(C122:F122,{1,2,3}))),"0") -> 0
A123: 119 | B123: JAVIER ROSA | C123: 400 | G123: =SUM(C123:F123) -> 400 | H123: =IF(COUNTIF(C123:F123,">0")>=3,(SUM(LARGE(C123:F123,{1,2,3}))),"0") -> 0
A124: 120 | B124: MICHAEL WHITE | E124: 395 | G124: =SUM(C124:F124) -> 395 | H124: =IF(COUNTIF(C124:F124,">0")>=3,(SUM(LARGE(C124:F124,{1,2,3}))),"0") -> 0
A125: 121 | B125: BRYAN TRIPLETT | C125: 385 | G125: =SUM(C125:F125) -> 385 | H125: =IF(COUNTIF(C125:F125,">0")>=3,(SUM(LARGE(C125:F125,{1,2,3}))),"0") -> 0
A126: 122 | B126: RICK MARSTELLAR | E126: 375 | G126: =SUM(C126:F126) -> 375 | H126: =IF(COUNTIF(C126:F126,">0")>=3,(SUM(LARGE(C126:F126,{1,2,3}))),"0") -> 0
A127: 123 | B127: GRAY MILTER | C127: 375 | G127: =SUM(C127:F127) -> 375 | H127: =IF(COUNTIF(C127:F127,">0")>=3,(SUM(LARGE(C127:F127,{1,2,3}))),"0") -> 0
A128: 124 | B128: PETER KEILER | D128: 370 | G128: =SUM(C128:F128) -> 370 | H128: =IF(COUNTIF(C128:F128,">0")>=3,(SUM(LARGE(C128:F128,{1,2,3}))),"0") -> 0
A129: 125 | B129: STEPHEN POWELL | C129: 360 | G129: =SUM(C129:F129) -> 360 | H129: =IF(COUNTIF(C129:F129,">0")>=3,(SUM(LARGE(C129:F129,{1,2,3}))),"0") -> 0
A130: 126 | B130: ANDREW GHOSN | E130: 355 | G130: =SUM(C130:F130) -> 355 | H130: =IF(COUNTIF(C130:F130,">0")>=3,(SUM(LARGE(C130:F130,{1,2,3}))),"0") -> 0
A131: 127 | B131: CODY SMITH | D131: 350 | G131: =SUM(C131:F131) -> 350 | H131: =IF(COUNTIF(C131:F131,">0")>=3,(SUM(LARGE(C131:F131,{1,2,3}))),"0") -> 0
A132: 128 | B132: RUSSELL TYE | C132: 65 | F132: 275 | G132: =SUM(C132:F132) -> 340 | H132: =IF(COUNTIF(C132:F132,">0")>=3,(SUM(LARGE(C132:F132,{1,2,3}))),"0") -> 0
A133: 129 | B133: MATTHEW KNIPPLE | C133: 340 | G133: =SUM(C133:F133) -> 340 | H133: =IF(COUNTIF(C133:F133,">0")>=3,(SUM(LARGE(C133:F133,{1,2,3}))),"0") -> 0
A134: 130 | B134: LOREN SCOTT | E134: 330 | G134: =SUM(C134:F134) -> 330 | H134: =IF(COUNTIF(C134:F134,">0")>=3,(SUM(LARGE(C134:F134,{1,2,3}))),"0") -> 0
A135: 131 | B135: KAREN ANDRIOLA | C135: 315 | G135: =SUM(C135:F135) -> 315 | H135: =IF(COUNTIF(C135:F135,">0")>=3,(SUM(LARGE(C135:F135,{1,2,3}))),"0") -> 0
A136: 132 | B136: MICHAEL SCHAFFER | D136: 310 | G136: =SUM(C136:F136) -> 310 | H136: =IF(COUNTIF(C136:F136,">0")>=3,(SUM(LARGE(C136:F136,{1,2,3}))),"0") -> 0
A137: 133 | B137: SIDNEI BARRONIO | D137: 305 | G137: =SUM(C137:F137) -> 305 | H137: =IF(COUNTIF(C137:F137,">0")>=3,(SUM(LARGE(C137:F137,{1,2,3}))),"0") -> 0
A138: 134 | B138: JASON HUNT | C138: 305 | G138: =SUM(C138:F138) -> 305 | H138: =IF(COUNTIF(C138:F138,">0")>=3,(SUM(LARGE(C138:F138,{1,2,3}))),"0") -> 0
A139: 135 | B139: TONY ACKER | C139: 300 | G139: =SUM(C139:F139) -> 300 | H139: =IF(COUNTIF(C139:F139,">0")>=3,(SUM(LARGE(C139:F139,{1,2,3}))),"0") -> 0
A140: 136 | B140: SEAN WARNER | C140: 295 | G140: =SUM(C140:F140) -> 295 | H140: =IF(COUNTIF(C140:F140,">0")>=3,(SUM(LARGE(C140:F140,{1,2,3}))),"0") -> 0
A141: 137 | B141: MIKE PAYNE | E141: 295 | G141: =SUM(C141:F141) -> 295 | H141: =IF(COUNTIF(C141:F141,">0")>=3,(SUM(LARGE(C141:F141,{1,2,3}))),"0") -> 0
A142: 138 | B142: DON WRIGHT | D142: 290 | G142: =SUM(C142:F142) -> 290 | H142: =IF(COUNTIF(C142:F142,">0")>=3,(SUM(LARGE(C142:F142,{1,2,3}))),"0") -> 0
A143: 139 | B143: JACK DAWSON | C143: 85 | F143: 200 | G143: =SUM(C143:F143) -> 285 | H143: =IF(COUNTIF(C143:F143,">0")>=3,(SUM(LARGE(C143:F143,{1,2,3}))),"0") -> 0
A144: 140 | B144: CHRISTOPHER SAMULSKI | C144: 285 | G144: =SUM(C144:F144) -> 285 | H144: =IF(COUNTIF(C144:F144,">0")>=3,(SUM(LARGE(C144:F144,{1,2,3}))),"0") -> 0
A145: 141 | B145: CARLO GALINATO | D145: 285 | G145: =SUM(C145:F145) -> 285 | H145: =IF(COUNTIF(C145:F145,">0")>=3,(SUM(LARGE(C145:F145,{1,2,3}))),"0") -> 0
A146: 142 | B146: KALVIN FRANK | D146: 280 | G146: =SUM(C146:F146) -> 280 | H146: =IF(COUNTIF(C146:F146,">0")>=3,(SUM(LARGE(C146:F146,{1,2,3}))),"0") -> 0
A147: 143 | B147: DONALD STRIFLER | C147: 280 | G147: =SUM(C147:F147) -> 280 | H147: =IF(COUNTIF(C147:F147,">0")>=3,(SUM(LARGE(C147:F147,{1,2,3}))),"0") -> 0
A148: 144 | B148: STEPHEN KNOOP | E148: 275 | G148: =SUM(C148:F148) -> 275 | H148: =IF(COUNTIF(C148:F148,">0")>=3,(SUM(LARGE(C148:F148,{1,2,3}))),"0") -> 0
A149: 145 | B149: LARRY MILO | E149: 270 | G149: =SUM(C149:F149) -> 270 | H149: =IF(COUNTIF(C149:F149,">0")>=3,(SUM(LARGE(C149:F149,{1,2,3}))),"0") -> 0
A150: 146 | B150: GEORGE LOEF | E150: 265 | G150: =SUM(C150:F150) -> 265 | H150: =IF(COUNTIF(C150:F150,">0")>=3,(SUM(LARGE(C150:F150,{1,2,3}))),"0") -> 0
A151: 147 | B151: CLAY JOHNSON | C151: 260 | G151: =SUM(C151:F151) -> 260 | H151: =IF(COUNTIF(C151:F151,">0")>=3,(SUM(LARGE(C151:F151,{1,2,3}))),"0") -> 0
A152: 148 | B152: TARIQ KHAN | C152: 255 | G152: =SUM(C152:F152) -> 255 | H152: =IF(COUNTIF(C152:F152,">0")>=3,(SUM(LARGE(C152:F152,{1,2,3}))),"0") -> 0
A153: 149 | B153: MICHAEL ARRIGO | E153: 245 | G153: =SUM(C153:F153) -> 245 | H153: =IF(COUNTIF(C153:F153,">0")>=3,(SUM(LARGE(C153:F153,{1,2,3}))),"0") -> 0
A154: 150 | B154: REESE SMITH | E154: 240 | G154: =SUM(C154:F154) -> 240 | H154: =IF(COUNTIF(C154:F154,">0")>=3,(SUM(LARGE(C154:F154,{1,2,3}))),"0") -> 0
A155: 151 | B155: SCOTT FARRELL | C155: 235 | G155: =SUM(C155:F155) -> 235 | H155: =IF(COUNTIF(C155:F155,">0")>=3,(SUM(LARGE(C155:F155,{1,2,3}))),"0") -> 0
A156: 152 | B156: GORDON PEELE | E156: 230 | G156: =SUM(C156:F156) -> 230 | H156: =IF(COUNTIF(C156:F156,">0")>=3,(SUM(LARGE(C156:F156,{1,2,3}))),"0") -> 0
A157: 153 | B157: TODD HOWES | E157: 225 | G157: =SUM(C157:F157) -> 225 | H157: =IF(COUNTIF(C157:F157,">0")>=3,(SUM(LARGE(C157:F157,{1,2,3}))),"0") -> 0
A158: 154 | B158: ERNIE TORRES | C158: 225 | G158: =SUM(C158:F158) -> 225 | H158: =IF(COUNTIF(C158:F158,">0")>=3,(SUM(LARGE(C158:F158,{1,2,3}))),"0") -> 0
A159: 155 | B159: BRIAN GAGNER | E159: 220 | G159: =SUM(C159:F159) -> 220 | H159: =IF(COUNTIF(C159:F159,">0")>=3,(SUM(LARGE(C159:F159,{1,2,3}))),"0") -> 0
A160: 156 | B160: PHIL SMALL | E160: 210 | G160: =SUM(C160:F160) -> 210 | H160: =IF(COUNTIF(C160:F160,">0")>=3,(SUM(LARGE(C160:F160,{1,2,3}))),"0") -> 0
A161: 157 | B161: SCOT MCALOON | C161: 205 | G161: =SUM(C161:F161) -> 205 | H161: =IF(COUNTIF(C161:F161,">0")>=3,(SUM(LARGE(C161:F161,{1,2,3}))),"0") -> 0
A162: 158 | B162: NOAL YARNES | C162: 200 | G162: =SUM(C162:F162) -> 200 | H162: =IF(COUNTIF(C162:F162,">0")>=3,(SUM(LARGE(C162:F162,{1,2,3}))),"0") -> 0
A163: 159 | B163: LEE WILLIAMS | C163: 185 | G163: =SUM(C163:F163) -> 185 | H163: =IF(COUNTIF(C163:F163,">0")>=3,(SUM(LARGE(C163:F163,{1,2,3}))),"0") -> 0
A164: 160 | B164: PHILIP BAILEY | C164: 175 | G164: =SUM(C164:F164) -> 175 | H164: =IF(COUNTIF(C164:F164,">0")>=3,(SUM(LARGE(C164:F164,{1,2,3}))),"0") -> 0
A165: 161 | B165: MIKE PENSINGER | C165: 155 | G165: =SUM(C165:F165) -> 155 | H165: =IF(COUNTIF(C165:F165,">0")>=3,(SUM(LARGE(C165:F165,{1,2,3}))),"0") -> 0
A166: 162 | B166: ROBERT DRENNAN | C166: 150 | G166: =SUM(C166:F166) -> 150 | H166: =IF(COUNTIF(C166:F166,">0")>=3,(SUM(LARGE(C166:F166,{1,2,3}))),"0") -> 0
A167: 163 | B167: JOEL ANDRIOLA | C167: 145 | G167: =SUM(C167:F167) -> 145 | H167: =IF(COUNTIF(C167:F167,">0")>=3,(SUM(LARGE(C167:F167,{1,2,3}))),"0") -> 0
A168: 164 | B168: BRANDON HEY | C168: 135 | G168: =SUM(C168:F168) -> 135 | H168: =IF(COUNTIF(C168:F168,">0")>=3,(SUM(LARGE(C168:F168,{1,2,3}))),"0") -> 0
A169: 165 | B169: MIKE MARIANI | C169: 130 | G169: =SUM(C169:F169) -> 130 | H169: =IF(COUNTIF(C169:F169,">0")>=3,(SUM(LARGE(C169:F169,{1,2,3}))),"0") -> 0
A170: 166 | B170: SHERRI STRIFLER | C170: 105 | G170: =SUM(C170:F170) -> 105 | H170: =IF(COUNTIF(C170:F170,">0")>=3,(SUM(LARGE(C170:F170,{1,2,3}))),"0") -> 0
A171: 167 | B171: BRUCE TURLINGTON | C171: 100 | G171: =SUM(C171:F171) -> 100 | H171: =IF(COUNTIF(C171:F171,">0")>=3,(SUM(LARGE(C171:F171,{1,2,3}))),"0") -> 0
A172: 168 | B172: JONATHAN DIZON | C172: 95 | G172: =SUM(C172:F172) -> 95 | H172: =IF(COUNTIF(C172:F172,">0")>=3,(SUM(LARGE(C172:F172,{1,2,3}))),"0") -> 0
A173: 169 | B173: BRIAN FARLEY | C173: 90 | G173: =SUM(C173:F173) -> 90 | H173: =IF(COUNTIF(C173:F173,">0")>=3,(SUM(LARGE(C173:F173,{1,2,3}))),"0") -> 0
A174: 170 | B174: MIKE SHIMANDLE | C174: 80 | G174: =SUM(C174:F174) -> 80 | H174: =IF(COUNTIF(C174:F174,">0")>=3,(SUM(LARGE(C174:F174,{1,2,3}))),"0") -> 0
A175: 171 | B175: ROBERT MCBRIDE | C175: 70 | G175: =SUM(C175:F175) -> 70 | H175: =IF(COUNTIF(C175:F175,">0")>=3,(SUM(LARGE(C175:F175,{1,2,3}))),"0") -> 0
A176: 172 | B176: JOYCE SANDERS | C176: 60 | G176: =SUM(C176:F176) -> 60 | H176: =IF(COUNTIF(C176:F176,">0")>=3,(SUM(LARGE(C176:F176,{1,2,3}))),"0") -> 0
A177: 173 | B177: DAN SCIOLINO | C177: 55 | G177: =SUM(C177:F177) -> 55 | H177: =IF(COUNTIF(C177:F177,">0")>=3,(SUM(LARGE(C177:F177,{1,2,3}))),"0") -> 0
A178: 174 | B178: MIKE PETERSON | C178: 50 | G178: =SUM(C178:F178) -> 50 | H178: =IF(COUNTIF(C178:F178,">0")>=3,(SUM(LARGE(C178:F178,{1,2,3}))),"0") -> 0
A179: 175 | B179: AMY ALLMAND | C179: 45 | G179: =SUM(C179:F179) -> 45 | H179: =IF(COUNTIF(C179:F179,">0")>=3,(SUM(LARGE(C179:F179,{1,2,3}))),"0") -> 0
A180: 176 | B180: GUY PRIEST | C180: 40 | G180: =SUM(C180:F180) -> 40 | H180: =IF(COUNTIF(C180:F180,">0")>=3,(SUM(LARGE(C180:F180,{1,2,3}))),"0") -> 0
A181: 177 | B181: LARRY TRANTHAM | C181: 35 | G181: =SUM(C181:F181) -> 35 | H181: =IF(COUNTIF(C181:F181,">0")>=3,(SUM(LARGE(C181:F181,{1,2,3}))),"0") -> 0
A182: 178 | B182: ART HEY | C182: 25 | G182: =SUM(C182:F182) -> 25 | H182: =IF(COUNTIF(C182:F182,">0")>=3,(SUM(LARGE(C182:F182,{1,2,3}))),"0") -> 0
A183: 179 | B183: RYAN MCGOVERN | F183: 470 | H183: =IF(COUNTIF(C183:F183,">0")>=3,(SUM(LARGE(C183:F183,{1,2,3}))),"0") -> 0
A184: 180 | B184: RYAN CANDARI | F184: 230 | H184: =IF(COUNTIF(C184:F184,">0")>=3,(SUM(LARGE(C184:F184,{1,2,3}))),"0") -> 0
A185: 181 | B185: MICHAEL HARRIS | F185: 385 | H185: =IF(COUNTIF(C185:F185,">0")>=3,(SUM(LARGE(C185:F185,{1,2,3}))),"0") -> 0
A186: 182 | B186: MARK RHOADES | F186: 580 | H186: =IF(COUNTIF(C186:F186,">0")>=3,(SUM(LARGE(C186:F186,{1,2,3}))),"0") -> 0
A187: 183 | B187: MARK HUSBAND | F187: 435 | H187: =IF(COUNTIF(C187:F187,">0")>=3,(SUM(LARGE(C187:F187,{1,2,3}))),"0") -> 0
A188: 184 | B188: MARIBETH CUPPS | H188: =IF(COUNTIF(C188:F188,">0")>=3,(SUM(LARGE(C188:F188,{1,2,3}))),"0") -> 0
A189: 185 | B189: MANNY DESANTOS | F189: 260 | H189: =IF(COUNTIF(C189:F189,">0")>=3,(SUM(LARGE(C189:F189,{1,2,3}))),"0") -> 0
A190: 186 | B190: LUKASZ SOSNIAK | F190: 290 | H190: =IF(COUNTIF(C190:F190,">0")>=3,(SUM(LARGE(C190:F190,{1,2,3}))),"0") -> 0
A191: 187 | B191: KEVIN REAGAN | F191: 235 | H191: =IF(COUNTIF(C191:F191,">0")>=3,(SUM(LARGE(C191:F191,{1,2,3}))),"0") -> 0
A192: 188 | B192: JUSTIN MATHEWS | F192: 345 | H192: =IF(COUNTIF(C192:F192,">0")>=3,(SUM(LARGE(C192:F192,{1,2,3}))),"0") -> 0
A193: 189 | B193: JOSH CANADA | F193: 300 | H193: =IF(COUNTIF(C193:F193,">0")>=3,(SUM(LARGE(C193:F193,{1,2,3}))),"0") -> 0
A194: 190 | B194: JAMES PLANT | F194: 195 | H194: =IF(COUNTIF(C194:F194,">0")>=3,(SUM(LARGE(C194:F194,{1,2,3}))),"0") -> 0
A195: 191 | B195: JAMES LIVARA | F195: 215 | H195: =IF(COUNTIF(C195:F195,">0")>=3,(SUM(LARGE(C195:F195,{1,2,3}))),"0") -> 0
A196: 192 | B196: GREG SMITH | F196: 265 | H196: =IF(COUNTIF(C196:F196,">0")>=3,(SUM(LARGE(C196:F196,{1,2,3}))),"0") -> 0
A197: 193 | B197: DAVID COOK | F197: 490 | H197: =IF(COUNTIF(C197:F197,">0")>=3,(SUM(LARGE(C197:F197,{1,2,3}))),"0") -> 0
A198: 194 | B198: DAN KRAEMER | F198: 250 | H198: =IF(COUNTIF(C198:F198,">0")>=3,(SUM(LARGE(C198:F198,{1,2,3}))),"0") -> 0
A199: 195 | B199: DAN HILL | F199: 450 | H199: =IF(COUNTIF(C199:F199,">0")>=3,(SUM(LARGE(C199:F199,{1,2,3}))),"0") -> 0
A200: 196 | B200: CAMERON MCCORMICK | F200: 550 | H200: =IF(COUNTIF(C200:F200,">0")>=3,(SUM(LARGE(C200:F200,{1,2,3}))),"0") -> 0
A201: 197 | B201: AUSTIN VAN SLOTEN | F201: 220 | H201: =IF(COUNTIF(C201:F201,">0")>=3,(SUM(LARGE(C201:F201,{1,2,3}))),"0") -> 0