C1: EVENT
A2: POS | B2: DRIVER | C2: Joy Fund | D2: Winter 2 | E2: Winter 3 | F2: Winter 4 | G2: TOTAL | H2: Best 3 of 4
A4: 1 | B4: STEVE DASHER | D4: 12 | E4: 12 | F4: 12 | G4: =SUM(C4:F4) -> 36 | H4: =IF(COUNTIF(C4:F4,">0")>=3,(SUM(LARGE(C4:F4,{1,2,3}))),"Not Qualified") -> 36
A5: 2 | B5: JEREMIAH MILO | C5: 1 | D5: 1 | E5: 9 | F5: 7 | G5: =SUM(C5:F5) -> 18 | H5: =IF(COUNTIF(C5:F5,">0")>=3,(SUM(LARGE(C5:F5,{1,2,3}))),"Not Qualified") -> 17
A6: 3 | B6: TOM TYE | C6: 1 | D6: 3 | F6: 6 | G6: =SUM(C6:F6) -> 10 | H6: =IF(COUNTIF(C6:F6,">0")>=3,(SUM(LARGE(C6:F6,{1,2,3}))),"Not Qualified") -> 10
A7: 4 | B7: ERIC ANDUZE | E7: 6 | F7: 9 | G7: =SUM(C7:F7) -> 15 | H7: =IF(COUNTIF(C7:F7,">0")>=3,(SUM(LARGE(C7:F7,{1,2,3}))),"Not Qualified") -> Not Qualified
A8: 5 | B8: SEAN WARNER | C8: 12 | G8: =SUM(C8:F8) -> 12 | H8: =IF(COUNTIF(C8:F8,">0")>=3,(SUM(LARGE(C8:F8,{1,2,3}))),"Not Qualified") -> Not Qualified
A9: 6 | B9: PHILLIP AQUINO | D9: 9 | G9: =SUM(C9:F9) -> 9 | H9: =IF(COUNTIF(C9:F9,">0")>=3,(SUM(LARGE(C9:F9,{1,2,3}))),"Not Qualified") -> Not Qualified
A10: 7 | B10: ERNIE TORRES | C10: 9 | G10: =SUM(C10:F10) -> 9 | H10: =IF(COUNTIF(C10:F10,">0")>=3,(SUM(LARGE(C10:F10,{1,2,3}))),"Not Qualified") -> Not Qualified
A11: 8 | B11: RICHARD NELSON | C11: 4 | D11: 4 | G11: =SUM(C11:F11) -> 8 | H11: =IF(COUNTIF(C11:F11,">0")>=3,(SUM(LARGE(C11:F11,{1,2,3}))),"Not Qualified") -> Not Qualified
A12: 9 | B12: GARY BARNES | C12: 3 | D12: 5 | G12: =SUM(C12:F12) -> 8 | H12: =IF(COUNTIF(C12:F12,">0")>=3,(SUM(LARGE(C12:F12,{1,2,3}))),"Not Qualified") -> Not Qualified
A13: 10 | B13: ANGELA SCHMUHL | E13: 5 | F13: 3 | G13: =SUM(C13:F13) -> 8 | H13: =IF(COUNTIF(C13:F13,">0")>=3,(SUM(LARGE(C13:F13,{1,2,3}))),"Not Qualified") -> Not Qualified
A14: 11 | B14: SETH DOZIER | C14: 7 | G14: =SUM(C14:F14) -> 7 | H14: =IF(COUNTIF(C14:F14,">0")>=3,(SUM(LARGE(C14:F14,{1,2,3}))),"Not Qualified") -> Not Qualified
A15: 12 | B15: RICK MARSTELLAR | E15: 7 | G15: =SUM(C15:F15) -> 7 | H15: =IF(COUNTIF(C15:F15,">0")>=3,(SUM(LARGE(C15:F15,{1,2,3}))),"Not Qualified") -> Not Qualified
A16: 13 | B16: JAY BOHME | D16: 7 | G16: =SUM(C16:F16) -> 7 | H16: =IF(COUNTIF(C16:F16,">0")>=3,(SUM(LARGE(C16:F16,{1,2,3}))),"Not Qualified") -> Not Qualified
A17: 14 | B17: MIKE COBB | D17: 6 | G17: =SUM(C17:F17) -> 6 | H17: =IF(COUNTIF(C17:F17,">0")>=3,(SUM(LARGE(C17:F17,{1,2,3}))),"Not Qualified") -> Not Qualified
A18: 15 | B18: LEE WILLIAMS | C18: 6 | G18: =SUM(C18:F18) -> 6 | H18: =IF(COUNTIF(C18:F18,">0")>=3,(SUM(LARGE(C18:F18,{1,2,3}))),"Not Qualified") -> Not Qualified
A19: 16 | B19: RUSSELL TYE | C19: 1 | F19: 4 | G19: =SUM(C19:F19) -> 5 | H19: =IF(COUNTIF(C19:F19,">0")>=3,(SUM(LARGE(C19:F19,{1,2,3}))),"Not Qualified") -> Not Qualified
A20: 17 | B20: PHILIP BAILEY | C20: 5 | G20: =SUM(C20:F20) -> 5 | H20: =IF(COUNTIF(C20:F20,">0")>=3,(SUM(LARGE(C20:F20,{1,2,3}))),"Not Qualified") -> Not Qualified
A21: 18 | B21: LUKASZ SOSNIAK | F21: 5 | G21: =SUM(C21:F21) -> 5 | H21: =IF(COUNTIF(C21:F21,">0")>=3,(SUM(LARGE(C21:F21,{1,2,3}))),"Not Qualified") -> Not Qualified
A22: 19 | B22: MIKE PAYNE | E22: 4 | G22: =SUM(C22:F22) -> 4 | H22: =IF(COUNTIF(C22:F22,">0")>=3,(SUM(LARGE(C22:F22,{1,2,3}))),"Not Qualified") -> Not Qualified
A23: 20 | B23: STEPHEN KNOOP | E23: 3 | G23: =SUM(C23:F23) -> 3 | H23: =IF(COUNTIF(C23:F23,">0")>=3,(SUM(LARGE(C23:F23,{1,2,3}))),"Not Qualified") -> Not Qualified
A24: 21 | B24: SIDNEI BARRONIO | D24: 2 | G24: =SUM(C24:F24) -> 2 | H24: =IF(COUNTIF(C24:F24,">0")>=3,(SUM(LARGE(C24:F24,{1,2,3}))),"Not Qualified") -> Not Qualified
A25: 22 | B25: LARRY MILO | E25: 2 | G25: =SUM(C25:F25) -> 2 | H25: =IF(COUNTIF(C25:F25,">0")>=3,(SUM(LARGE(C25:F25,{1,2,3}))),"Not Qualified") -> Not Qualified
A26: 23 | B26: JUSTIN MCKENNA | C26: 2 | G26: =SUM(C26:F26) -> 2 | H26: =IF(COUNTIF(C26:F26,">0")>=3,(SUM(LARGE(C26:F26,{1,2,3}))),"Not Qualified") -> Not Qualified
A27: 24 | B27: GREGG ROSSI | E27: 1 | F27: 1 | G27: =SUM(C27:F27) -> 2 | H27: =IF(COUNTIF(C27:F27,">0")>=3,(SUM(LARGE(C27:F27,{1,2,3}))),"Not Qualified") -> Not Qualified
A28: 25 | B28: DAN KRAEMER | F28: 2 | G28: =SUM(C28:F28) -> 2 | H28: =IF(COUNTIF(C28:F28,">0")>=3,(SUM(LARGE(C28:F28,{1,2,3}))),"Not Qualified") -> Not Qualified
A29: 26 | B29: ROBERT MCBRIDE | C29: 1 | G29: =SUM(C29:F29) -> 1 | H29: =IF(COUNTIF(C29:F29,">0")>=3,(SUM(LARGE(C29:F29,{1,2,3}))),"Not Qualified") -> Not Qualified
A30: 27 | B30: PHIL SMALL | E30: 1 | G30: =SUM(C30:F30) -> 1 | H30: =IF(COUNTIF(C30:F30,">0")>=3,(SUM(LARGE(C30:F30,{1,2,3}))),"Not Qualified") -> Not Qualified
A31: 28 | B31: MIKE PETERSON | C31: 1 | G31: =SUM(C31:F31) -> 1 | H31: =IF(COUNTIF(C31:F31,">0")>=3,(SUM(LARGE(C31:F31,{1,2,3}))),"Not Qualified") -> Not Qualified
A32: 29 | B32: MIKE PENSINGER | C32: 1 | G32: =SUM(C32:F32) -> 1 | H32: =IF(COUNTIF(C32:F32,">0")>=3,(SUM(LARGE(C32:F32,{1,2,3}))),"Not Qualified") -> Not Qualified
A33: 30 | B33: MIKE MARIANI | C33: 1 | G33: =SUM(C33:F33) -> 1 | H33: =IF(COUNTIF(C33:F33,">0")>=3,(SUM(LARGE(C33:F33,{1,2,3}))),"Not Qualified") -> Not Qualified
A34: 31 | B34: LARRY TRANTHAM | C34: 1 | G34: =SUM(C34:F34) -> 1 | H34: =IF(COUNTIF(C34:F34,">0")>=3,(SUM(LARGE(C34:F34,{1,2,3}))),"Not Qualified") -> Not Qualified
A35: 32 | B35: KALVIN FRANK | D35: 1 | G35: =SUM(C35:F35) -> 1 | H35: =IF(COUNTIF(C35:F35,">0")>=3,(SUM(LARGE(C35:F35,{1,2,3}))),"Not Qualified") -> Not Qualified
A36: 33 | B36: JONATHAN DIZON | C36: 1 | G36: =SUM(C36:F36) -> 1 | H36: =IF(COUNTIF(C36:F36,">0")>=3,(SUM(LARGE(C36:F36,{1,2,3}))),"Not Qualified") -> Not Qualified
A37: 34 | B37: GUY PRIEST | C37: 1 | G37: =SUM(C37:F37) -> 1 | H37: =IF(COUNTIF(C37:F37,">0")>=3,(SUM(LARGE(C37:F37,{1,2,3}))),"Not Qualified") -> Not Qualified
A38: 35 | B38: GORDON PEELE | E38: 1 | G38: =SUM(C38:F38) -> 1 | H38: =IF(COUNTIF(C38:F38,">0")>=3,(SUM(LARGE(C38:F38,{1,2,3}))),"Not Qualified") -> Not Qualified
A39: 36 | B39: GEORGE LOEF | E39: 1 | G39: =SUM(C39:F39) -> 1 | H39: =IF(COUNTIF(C39:F39,">0")>=3,(SUM(LARGE(C39:F39,{1,2,3}))),"Not Qualified") -> Not Qualified
A40: 37 | B40: DON WRIGHT | D40: 1 | G40: =SUM(C40:F40) -> 1 | H40: =IF(COUNTIF(C40:F40,">0")>=3,(SUM(LARGE(C40:F40,{1,2,3}))),"Not Qualified") -> Not Qualified
A41: 38 | B41: DAN SCIOLINO | C41: 1 | G41: =SUM(C41:F41) -> 1 | H41: =IF(COUNTIF(C41:F41,">0")>=3,(SUM(LARGE(C41:F41,{1,2,3}))),"Not Qualified") -> Not Qualified
A42: 39 | B42: BRIAN FARLEY | C42: 1 | G42: =SUM(C42:F42) -> 1 | H42: =IF(COUNTIF(C42:F42,">0")>=3,(SUM(LARGE(C42:F42,{1,2,3}))),"Not Qualified") -> Not Qualified
A43: 40 | B43: ART HEY | C43: 1 | G43: =SUM(C43:F43) -> 1 | H43: =IF(COUNTIF(C43:F43,">0")>=3,(SUM(LARGE(C43:F43,{1,2,3}))),"Not Qualified") -> Not Qualified
A44: 41 | B44: AMY ALLMAND | C44: 1 | G44: =SUM(C44:F44) -> 1 | H44: =IF(COUNTIF(C44:F44,">0")>=3,(SUM(LARGE(C44:F44,{1,2,3}))),"Not Qualified") -> Not Qualified
A45: 42 | B45: JACK DAWSON | F45: 1 | G45: =SUM(C45:F45) -> 1 | H45: =IF(COUNTIF(C45:F45,">0")>=3,(SUM(LARGE(C45:F45,{1,2,3}))),"Not Qualified") -> Not Qualified