D1: EVENT
A2: CLASS | B2: POS | C2: DRIVER | D2: Joy Fund | E2: Winter 2 | F2: Winter 3 | G2: Winter 4 | H2: TOTAL | I2: Best 3 of 4
A4: AP | C4: NO ENTRIES
A6: BP | C6: NO ENTRIES
A8: CP
B9: 1 | C9: ERIC BONNETT | D9: 12 | E9: 12 | F9: 12 | H9: =SUM(D9:G9) -> 36 | I9: =IF(COUNTIF(D9:G9,">0")>=3,(SUM(LARGE(D9:G9,{1,2,3}))),"NO QUALIFY") -> 36
B10: 2 | C10: CALVIN SANDERS | D10: 9 | H10: =SUM(D10:G10) -> 9 | I10: Not Qualified
B11: 3 | C11: BRUCE TURLINGTON | D11: 7 | H11: =SUM(D11:G11) -> 7 | I11: Not Qualified
B12: 4 | C12: JOYCE SANDERS | D12: 6 | H12: =SUM(D12:G12) -> 6 | I12: Not Qualified
A14: DP | C14: NO ENTRIES
A16: EP
B17: 1 | C17: JOE CECELIC | D17: 12 | E17: 12 | F17: 12 | H17: =SUM(D17:G17) -> 36 | I17: =IF(COUNTIF(D17:G17,">0")>=3,(SUM(LARGE(D17:G17,{1,2,3}))),"NO QUALIFY") -> 36
A19: FP
B20: 1 | C20: MARC LISNER | D20: 12 | H20: =SUM(D20:G20) -> 12 | I20: Not Qualified
B21: 2 | C21: JEFFREY CURTIS | D21: 9 | H21: =SUM(D21:G21) -> 9 | I21: Not Qualified
B22: 3 | C22: JASON LISNER | D22: 7 | H22: =SUM(D22:G22) -> 7 | I22: Not Qualified
A24: XP
B25: 1 | C25: AUSTIN VAN SLOTEN | G25: 12 | H25: 12 | I25: Not Qualified