D1: EVENT
A2: CLASS | B2: POS | C2: DRIVER | D2: Joy Fund | E2: Winter 2 | F2: Winter 3 | G2: Winter 4 | H2: TOTAL | I2: Best 3 of 4
A4: ASP
B5: 1 | C5: ROD MCGEORGE | D5: 12 | H5: =SUM(D5:G5) -> 12 | I5: =IF(COUNTIF(D5:G5,">0")>=3,(SUM(LARGE(D5:G5,{1,2,3}))),"Not Qualified") -> Not Qualified
B6: 2 | C6: DAN HILL | G6: 12 | H6: =SUM(D6:G6) -> 12 | I6: =IF(COUNTIF(D6:G6,">0")>=3,(SUM(LARGE(D6:G6,{1,2,3}))),"Not Qualified") -> Not Qualified
B7: 3 | C7: MIKE JOHNSON | D7: 9 | H7: =SUM(D7:G7) -> 9 | I7: =IF(COUNTIF(D7:G7,">0")>=3,(SUM(LARGE(D7:G7,{1,2,3}))),"Not Qualified") -> Not Qualified
B8: 4 | C8: SAM STRANO | D8: 7 | H8: =SUM(D8:G8) -> 7 | I8: =IF(COUNTIF(D8:G8,">0")>=3,(SUM(LARGE(D8:G8,{1,2,3}))),"Not Qualified") -> Not Qualified
B9: 5 | C9: ANDREW CHISHOLM | D9: 6 | H9: =SUM(D9:G9) -> 6 | I9: =IF(COUNTIF(D9:G9,">0")>=3,(SUM(LARGE(D9:G9,{1,2,3}))),"Not Qualified") -> Not Qualified
B10: 6 | C10: MIKE TWIFORD | D10: 5 | H10: =SUM(D10:G10) -> 5 | I10: =IF(COUNTIF(D10:G10,">0")>=3,(SUM(LARGE(D10:G10,{1,2,3}))),"Not Qualified") -> Not Qualified
B11: 7 | C11: JOEL ANDRIOLA | D11: 4 | H11: =SUM(D11:G11) -> 4 | I11: =IF(COUNTIF(D11:G11,">0")>=3,(SUM(LARGE(D11:G11,{1,2,3}))),"Not Qualified") -> Not Qualified
A13: BSP
B14: 1 | C14: JIM SETZER | E14: 12 | F14: 12 | G14: 12 | H14: =SUM(D14:G14) -> 36 | I14: =IF(COUNTIF(D14:G14,">0")>=3,(SUM(LARGE(D14:G14,{1,2,3}))),"Not Qualified") -> 36
B15: 2 | C15: JIM ROBINSON | D15: 6 | E15: 9 | F15: 9 | H15: =SUM(D15:G15) -> 24 | I15: =IF(COUNTIF(D15:G15,">0")>=3,(SUM(LARGE(D15:G15,{1,2,3}))),"Not Qualified") -> 24
B16: 3 | C16: JIM HALTOM | D16: 12 | H16: =SUM(D16:G16) -> 12 | I16: =IF(COUNTIF(D16:G16,">0")>=3,(SUM(LARGE(D16:G16,{1,2,3}))),"Not Qualified") -> Not Qualified
B17: 4 | C17: JEFF ROONEY | D17: 9 | H17: =SUM(D17:G17) -> 9 | I17: =IF(COUNTIF(D17:G17,">0")>=3,(SUM(LARGE(D17:G17,{1,2,3}))),"Not Qualified") -> Not Qualified
B18: 5 | C18: GREG SMITH | G18: 9 | H18: =SUM(D18:G18) -> 9 | I18: =IF(COUNTIF(D18:G18,">0")>=3,(SUM(LARGE(D18:G18,{1,2,3}))),"Not Qualified") -> Not Qualified
B19: 6 | C19: TODD WAGNER | D19: 7 | H19: =SUM(D19:G19) -> 7 | I19: =IF(COUNTIF(D19:G19,">0")>=3,(SUM(LARGE(D19:G19,{1,2,3}))),"Not Qualified") -> Not Qualified
B20: 7 | C20: MICHAEL SCHAFFER | E20: 7 | H20: =SUM(D20:G20) -> 7 | I20: =IF(COUNTIF(D20:G20,">0")>=3,(SUM(LARGE(D20:G20,{1,2,3}))),"Not Qualified") -> Not Qualified
B21: 8 | C21: TONY ACKER | D21: 5 | H21: =SUM(D21:G21) -> 5 | I21: =IF(COUNTIF(D21:G21,">0")>=3,(SUM(LARGE(D21:G21,{1,2,3}))),"Not Qualified") -> Not Qualified
B22: 9 | C22: DONALD STRIFLER | D22: 4 | H22: =SUM(D22:G22) -> 4 | I22: =IF(COUNTIF(D22:G22,">0")>=3,(SUM(LARGE(D22:G22,{1,2,3}))),"Not Qualified") -> Not Qualified
A24: CSP
B25: 1 | C25: JIM HALTOM | E25: 12 | F25: 9 | G25: 5 | H25: =SUM(D25:G25) -> 26 | I25: =IF(COUNTIF(D25:G25,">0")>=3,(SUM(LARGE(D25:G25,{1,2,3}))),"Not Qualified") -> 26
B26: 2 | C26: JAY CUMMING | D26: 9 | E26: 7 | F26: 7 | G26: 6 | H26: =SUM(D26:G26) -> 29 | I26: =IF(COUNTIF(D26:G26,">0")>=3,(SUM(LARGE(D26:G26,{1,2,3}))),"Not Qualified") -> 23
B27: 3 | C27: KEITH EDWARDS | D27: 7 | F27: 5 | G27: 3 | H27: =SUM(D27:G27) -> 15 | I27: =IF(COUNTIF(D27:G27,">0")>=3,(SUM(LARGE(D27:G27,{1,2,3}))),"Not Qualified") -> 15
B28: 4 | C28: SHAWN LAMBERT | F28: 12 | G28: 9 | H28: =SUM(D28:G28) -> 21 | I28: =IF(COUNTIF(D28:G28,">0")>=3,(SUM(LARGE(D28:G28,{1,2,3}))),"Not Qualified") -> Not Qualified
B29: 5 | C29: DAVID MARTIN | F29: 6 | G29: 12 | H29: =SUM(D29:G29) -> 18 | I29: =IF(COUNTIF(D29:G29,">0")>=3,(SUM(LARGE(D29:G29,{1,2,3}))),"Not Qualified") -> Not Qualified
B30: 6 | C30: AJ BELLEVILLE | D30: 12 | H30: =SUM(D30:G30) -> 12 | I30: =IF(COUNTIF(D30:G30,">0")>=3,(SUM(LARGE(D30:G30,{1,2,3}))),"Not Qualified") -> Not Qualified
B31: 7 | C31: BENO RUBIN | E31: 9 | H31: =SUM(D31:G31) -> 9 | I31: =IF(COUNTIF(D31:G31,">0")>=3,(SUM(LARGE(D31:G31,{1,2,3}))),"Not Qualified") -> Not Qualified
B32: 8 | C32: JIM ROBINSON | G32: 7 | H32: =SUM(D32:G32) -> 7 | I32: =IF(COUNTIF(D32:G32,">0")>=3,(SUM(LARGE(D32:G32,{1,2,3}))),"Not Qualified") -> Not Qualified
B33: 9 | C33: LAWRENCE CHAPPE | E33: 6 | H33: =SUM(D33:G33) -> 6 | I33: =IF(COUNTIF(D33:G33,">0")>=3,(SUM(LARGE(D33:G33,{1,2,3}))),"Not Qualified") -> Not Qualified
B34: 10 | C34: MICHAEL ARRIGO | F34: 4 | H34: =SUM(D34:G34) -> 4 | I34: =IF(COUNTIF(D34:G34,">0")>=3,(SUM(LARGE(D34:G34,{1,2,3}))),"Not Qualified") -> Not Qualified
B35: 11 | C35: JOMMEL DE GUZMAN | G35: 4 | H35: =SUM(D35:G35) -> 4 | I35: =IF(COUNTIF(D35:G35,">0")>=3,(SUM(LARGE(D35:G35,{1,2,3}))),"Not Qualified") -> Not Qualified
B36: 12 | C36: TONY CESPEDES | G36: 2 | H36: =SUM(D36:G36) -> 2 | I36: =IF(COUNTIF(D36:G36,">0")>=3,(SUM(LARGE(D36:G36,{1,2,3}))),"Not Qualified") -> Not Qualified
B37: 13 | C37: JAMES PLANT | G37: 1 | H37: =SUM(D37:G37) -> 1 | I37: =IF(COUNTIF(D37:G37,">0")>=3,(SUM(LARGE(D37:G37,{1,2,3}))),"Not Qualified") -> Not Qualified
A40: DSP
B41: 1 | C41: DAVID BROCHU | D41: 6 | E41: 12 | F41: 12 | H41: =SUM(D41:G41) -> 30 | I41: =IF(COUNTIF(D41:G41,">0")>=3,(SUM(LARGE(D41:G41,{1,2,3}))),"Not Qualified") -> 30
B42: 2 | C42: DOUGLAS ARCIDINO | D42: 1 | E42: 7 | F42: 9 | G42: 12 | H42: =SUM(D42:G42) -> 29 | I42: =IF(COUNTIF(D42:G42,">0")>=3,(SUM(LARGE(D42:G42,{1,2,3}))),"Not Qualified") -> 28
B43: 3 | C43: THOMAS BLEH | D43: 12 | H43: =SUM(D43:G43) -> 12 | I43: =IF(COUNTIF(D43:G43,">0")>=3,(SUM(LARGE(D43:G43,{1,2,3}))),"Not Qualified") -> Not Qualified
B44: 4 | C44: ALEX SHCHIPKOV | D44: 9 | H44: =SUM(D44:G44) -> 9 | I44: =IF(COUNTIF(D44:G44,">0")>=3,(SUM(LARGE(D44:G44,{1,2,3}))),"Not Qualified") -> Not Qualified
B45: 5 | C45: MIKE TWIFORD | E45: 9 | H45: =SUM(D45:G45) -> 9 | I45: =IF(COUNTIF(D45:G45,">0")>=3,(SUM(LARGE(D45:G45,{1,2,3}))),"Not Qualified") -> Not Qualified
B46: 6 | C46: TERRY BAKER | D46: 7 | H46: =SUM(D46:G46) -> 7 | I46: =IF(COUNTIF(D46:G46,">0")>=3,(SUM(LARGE(D46:G46,{1,2,3}))),"Not Qualified") -> Not Qualified
B47: 7 | C47: RUSSELL BROWN | F47: 7 | H47: =SUM(D47:G47) -> 7 | I47: =IF(COUNTIF(D47:G47,">0")>=3,(SUM(LARGE(D47:G47,{1,2,3}))),"Not Qualified") -> Not Qualified
B48: 8 | C48: MICHAEL WHITE | F48: 6 | H48: =SUM(D48:G48) -> 6 | I48: =IF(COUNTIF(D48:G48,">0")>=3,(SUM(LARGE(D48:G48,{1,2,3}))),"Not Qualified") -> Not Qualified
B49: 9 | C49: DAVID MARTIN | D49: 5 | H49: =SUM(D49:G49) -> 5 | I49: =IF(COUNTIF(D49:G49,">0")>=3,(SUM(LARGE(D49:G49,{1,2,3}))),"Not Qualified") -> Not Qualified
B50: 10 | C50: ANDREW GHOSN | F50: 5 | H50: =SUM(D50:G50) -> 5 | I50: =IF(COUNTIF(D50:G50,">0")>=3,(SUM(LARGE(D50:G50,{1,2,3}))),"Not Qualified") -> Not Qualified
B51: 11 | C51: DOUG KEILER | D51: 4 | H51: =SUM(D51:G51) -> 4 | I51: =IF(COUNTIF(D51:G51,">0")>=3,(SUM(LARGE(D51:G51,{1,2,3}))),"Not Qualified") -> Not Qualified
B52: 12 | C52: CURTIS STAPLES | D52: 3 | H52: =SUM(D52:G52) -> 3 | I52: =IF(COUNTIF(D52:G52,">0")>=3,(SUM(LARGE(D52:G52,{1,2,3}))),"Not Qualified") -> Not Qualified
B53: 13 | C53: BRYAN TRIPLETT | D53: 2 | H53: =SUM(D53:G53) -> 2 | I53: =IF(COUNTIF(D53:G53,">0")>=3,(SUM(LARGE(D53:G53,{1,2,3}))),"Not Qualified") -> Not Qualified
B54: 14 | C54: JUSTIN MATHEWS | G54: 9 | I54: =IF(COUNTIF(D54:G54,">0")>=3,(SUM(LARGE(D54:G54,{1,2,3}))),"Not Qualified") -> Not Qualified
A56: ESP
B57: 1 | C57: BILL BROCHU | D57: 12 | E57: 12 | F57: 12 | G57: 12 | H57: =SUM(D57:G57) -> 48 | I57: =IF(COUNTIF(D57:G57,">0")>=3,(SUM(LARGE(D57:G57,{1,2,3}))),"Not Qualified") -> 36
B58: 2 | C58: JOHN SETTLE | D58: 4 | E58: 9 | F58: 7 | G58: 6 | H58: =SUM(D58:G58) -> 26 | I58: =IF(COUNTIF(D58:G58,">0")>=3,(SUM(LARGE(D58:G58,{1,2,3}))),"Not Qualified") -> 22
B59: 3 | C59: PETER FLORANCE | D59: 5 | G59: 7 | H59: =SUM(D59:G59) -> 12 | I59: =IF(COUNTIF(D59:G59,">0")>=3,(SUM(LARGE(D59:G59,{1,2,3}))),"Not Qualified") -> Not Qualified
B60: 4 | C60: DALE BLANKENSHIP | D60: 9 | H60: =SUM(D60:G60) -> 9 | I60: =IF(COUNTIF(D60:G60,">0")>=3,(SUM(LARGE(D60:G60,{1,2,3}))),"Not Qualified") -> Not Qualified
B61: 5 | C61: JIM EWING | F61: 9 | H61: =SUM(D61:G61) -> 9 | I61: =IF(COUNTIF(D61:G61,">0")>=3,(SUM(LARGE(D61:G61,{1,2,3}))),"Not Qualified") -> Not Qualified
B62: 6 | C62: DAVID BROCHU | G62: 9 | H62: =SUM(D62:G62) -> 9 | I62: =IF(COUNTIF(D62:G62,">0")>=3,(SUM(LARGE(D62:G62,{1,2,3}))),"Not Qualified") -> Not Qualified
B63: 7 | C63: BOBBY DUNCAN | D63: 7 | H63: =SUM(D63:G63) -> 7 | I63: =IF(COUNTIF(D63:G63,">0")>=3,(SUM(LARGE(D63:G63,{1,2,3}))),"Not Qualified") -> Not Qualified
B64: 8 | C64: STEPHEN POWELL | D64: 6 | H64: =SUM(D64:G64) -> 6 | I64: =IF(COUNTIF(D64:G64,">0")>=3,(SUM(LARGE(D64:G64,{1,2,3}))),"Not Qualified") -> Not Qualified
B65: 9 | C65: MANNY DESANTOS | G65: 5 | H65: =SUM(D65:G65) -> 5 | I65: =IF(COUNTIF(D65:G65,">0")>=3,(SUM(LARGE(D65:G65,{1,2,3}))),"Not Qualified") -> Not Qualified
A67: FSP
B68: 1 | C68: ROY ARMSTRONG | D68: 12 | H68: =SUM(D68:G68) -> 12 | I68: =IF(COUNTIF(D68:G68,">0")>=3,(SUM(LARGE(D68:G68,{1,2,3}))),"Not Qualified") -> Not Qualified
B69: 2 | C69: LARRY ALLAMONG | F69: 12 | H69: =SUM(D69:G69) -> 12 | I69: =IF(COUNTIF(D69:G69,">0")>=3,(SUM(LARGE(D69:G69,{1,2,3}))),"Not Qualified") -> Not Qualified
B70: 3 | C70: STEVE SHELL | D70: 9 | H70: =SUM(D70:G70) -> 9 | I70: =IF(COUNTIF(D70:G70,">0")>=3,(SUM(LARGE(D70:G70,{1,2,3}))),"Not Qualified") -> Not Qualified
B71: 4 | C71: SCOTT FARRELL | D71: 7 | H71: =SUM(D71:G71) -> 7 | I71: =IF(COUNTIF(D71:G71,">0")>=3,(SUM(LARGE(D71:G71,{1,2,3}))),"Not Qualified") -> Not Qualified