D1: EVENT
A2: CLASS | B2: POS | C2: DRIVER | D2: Joy Fund | E2: Winter 2 | F2: Winter 3 | G2: Winter 4 | H2: TOTAL | I2: Best 3 of 4
A5: SM
B6: 1 | C6: PETER FRENCH | E6: 12 | F6: 12 | G6: 7 | H6: =SUM(D6:G6) -> 31 | I6: =IF(COUNTIF(D6:G6,">0")>=3,(SUM(LARGE(D6:G6,{1,2,3}))),"Not Qualified") -> 31
B7: 2 | C7: BRANDON CHARLESON | D7: 7 | E7: 9 | G7: 9 | H7: =SUM(D7:G7) -> 25 | I7: =IF(COUNTIF(D7:G7,">0")>=3,(SUM(LARGE(D7:G7,{1,2,3}))),"Not Qualified") -> 25
B8: 3 | C8: JAMES MCIVER | D8: 12 | H8: =SUM(D8:G8) -> 12 | I8: =IF(COUNTIF(D8:G8,">0")>=3,(SUM(LARGE(D8:G8,{1,2,3}))),"Not Qualified") -> Not Qualified
B9: 4 | C9: TERRY ZACH | D9: 6 | G9: 5 | H9: =SUM(D9:G9) -> 11 | I9: =IF(COUNTIF(D9:G9,">0")>=3,(SUM(LARGE(D9:G9,{1,2,3}))),"Not Qualified") -> Not Qualified
B10: 5 | C10: PETER AQUINO | F10: 5 | G10: 6 | H10: =SUM(D10:G10) -> 11 | I10: =IF(COUNTIF(D10:G10,">0")>=3,(SUM(LARGE(D10:G10,{1,2,3}))),"Not Qualified") -> Not Qualified
B11: 6 | C11: GRAY MILTER | D11: 9 | H11: =SUM(D11:G11) -> 9 | I11: =IF(COUNTIF(D11:G11,">0")>=3,(SUM(LARGE(D11:G11,{1,2,3}))),"Not Qualified") -> Not Qualified
B12: 7 | C12: ROBERT SMITHSON | F12: 9 | H12: =SUM(D12:G12) -> 9 | I12: =IF(COUNTIF(D12:G12,">0")>=3,(SUM(LARGE(D12:G12,{1,2,3}))),"Not Qualified") -> Not Qualified
B13: 8 | C13: DEREK FLEMMING | F13: 7 | H13: =SUM(D13:G13) -> 7 | I13: =IF(COUNTIF(D13:G13,">0")>=3,(SUM(LARGE(D13:G13,{1,2,3}))),"Not Qualified") -> Not Qualified
B14: 9 | C14: CHRISTOPHER BAXTER | F14: 6 | H14: =SUM(D14:G14) -> 6 | I14: =IF(COUNTIF(D14:G14,">0")>=3,(SUM(LARGE(D14:G14,{1,2,3}))),"Not Qualified") -> Not Qualified
B15: 10 | C15: JEFF ROONEY | G15: 5 | H15: =SUM(D15:G15) -> 5 | I15: =IF(COUNTIF(D15:G15,">0")>=3,(SUM(LARGE(D15:G15,{1,2,3}))),"Not Qualified") -> Not Qualified
B16: 11 | C16: LOREN SCOTT | F16: 4 | H16: =SUM(D16:G16) -> 4 | I16: =IF(COUNTIF(D16:G16,">0")>=3,(SUM(LARGE(D16:G16,{1,2,3}))),"Not Qualified") -> Not Qualified
B17: 12 | C17: REESE SMITH | F17: 3 | H17: =SUM(D17:G17) -> 3 | I17: =IF(COUNTIF(D17:G17,">0")>=3,(SUM(LARGE(D17:G17,{1,2,3}))),"Not Qualified") -> Not Qualified
B18: 13 | C18: BRIAN GAGNER | F18: 2 | H18: =SUM(D18:G18) -> 2 | I18: =IF(COUNTIF(D18:G18,">0")>=3,(SUM(LARGE(D18:G18,{1,2,3}))),"Not Qualified") -> Not Qualified
A20: SM2
B21: 1 | C21: DAVE MCLAUGHLIN | D21: 7 | F21: 12 | G21: 12 | H21: =SUM(D21:G21) -> 31 | I21: =IF(COUNTIF(D21:G21,">0")>=3,(SUM(LARGE(D21:G21,{1,2,3}))),"Not Qualified") -> 31
B22: 2 | C22: BRUCE AUSINK | D22: 9 | F22: 9 | G22: 9 | H22: =SUM(D22:G22) -> 27 | I22: =IF(COUNTIF(D22:G22,">0")>=3,(SUM(LARGE(D22:G22,{1,2,3}))),"Not Qualified") -> 27
B23: 3 | C23: SHAWN LAMBERT | D23: 12 | H23: =SUM(D23:G23) -> 12 | I23: =IF(COUNTIF(D23:G23,">0")>=3,(SUM(LARGE(D23:G23,{1,2,3}))),"Not Qualified") -> Not Qualified
B24: 4 | C24: CARLO GALINATO | E24: 12 | H24: =SUM(D24:G24) -> 12 | I24: =IF(COUNTIF(D24:G24,">0")>=3,(SUM(LARGE(D24:G24,{1,2,3}))),"Not Qualified") -> Not Qualified
B25: 5 | C25: MIKE SHIMANDLE | D25: 7 | H25: =SUM(D25:G25) -> 7 | I25: =IF(COUNTIF(D25:G25,">0")>=3,(SUM(LARGE(D25:G25,{1,2,3}))),"Not Qualified") -> Not Qualified
A27: STR
B28: 1 | C28: MICHAEL MOUNTAIN | E28: 9 | F28: 12 | G28: 12 | H28: =SUM(D28:G28) -> 33 | I28: =IF(COUNTIF(D28:G28,">0")>=3,(SUM(LARGE(D28:G28,{1,2,3}))),"Not Qualified") -> 33
B29: 2 | C29: BERNARD CHMIELEWSKI | D29: 5 | E29: 6 | F29: 4 | G29: 6 | H29: =SUM(D29:G29) -> 21 | I29: =IF(COUNTIF(D29:G29,">0")>=3,(SUM(LARGE(D29:G29,{1,2,3}))),"Not Qualified") -> 17
B30: 3 | C30: SCOTT GARDNER | D30: 2 | E30: 5 | F30: 7 | G30: 4 | H30: =SUM(D30:G30) -> 18 | I30: =IF(COUNTIF(D30:G30,">0")>=3,(SUM(LARGE(D30:G30,{1,2,3}))),"Not Qualified") -> 16
B31: 4 | C31: SEAN MCCONNELL | D31: 9 | E31: 2 | F31: 3 | G31: 1 | H31: =SUM(D31:G31) -> 15 | I31: =IF(COUNTIF(D31:G31,">0")>=3,(SUM(LARGE(D31:G31,{1,2,3}))),"Not Qualified") -> 14
B32: 5 | C32: MICHAEL GAINTNER | E32: 4 | F32: 5 | G32: 5 | H32: =SUM(D32:G32) -> 14 | I32: =IF(COUNTIF(D32:G32,">0")>=3,(SUM(LARGE(D32:G32,{1,2,3}))),"Not Qualified") -> 14
B33: 6 | C33: JEFF JASMER | D33: 4 | E33: 3 | F33: 6 | G33: 3 | H33: =SUM(D33:G33) -> 16 | I33: =IF(COUNTIF(D33:G33,">0")>=3,(SUM(LARGE(D33:G33,{1,2,3}))),"Not Qualified") -> 13
B34: 7 | C34: ROBERT KIRKPATRICK | D34: 6 | E34: 1 | F34: 1 | H34: =SUM(D34:G34) -> 8 | I34: =IF(COUNTIF(D34:G34,">0")>=3,(SUM(LARGE(D34:G34,{1,2,3}))),"Not Qualified") -> 8
B35: 8 | C35: JOMMEL DEGUZMAN | D35: 3 | E35: 1 | F35: 1 | H35: =SUM(D35:G35) -> 5 | I35: =IF(COUNTIF(D35:G35,">0")>=3,(SUM(LARGE(D35:G35,{1,2,3}))),"Not Qualified") -> 5
B36: 9 | C36: BOBBY SMITH | F36: 9 | G36: 7 | H36: =SUM(D36:G36) -> 16 | I36: =IF(COUNTIF(D36:G36,">0")>=3,(SUM(LARGE(D36:G36,{1,2,3}))),"Not Qualified") -> Not Qualified
B37: 10 | C37: DAVID MARTIN | E37: 12 | H37: =SUM(D37:G37) -> 12 | I37: =IF(COUNTIF(D37:G37,">0")>=3,(SUM(LARGE(D37:G37,{1,2,3}))),"Not Qualified") -> Not Qualified
B38: 11 | C38: ALAN STRATTON | D38: 12 | H38: =SUM(D38:G38) -> 12 | I38: =IF(COUNTIF(D38:G38,">0")>=3,(SUM(LARGE(D38:G38,{1,2,3}))),"Not Qualified") -> Not Qualified
B39: 12 | C39: SETH DOZIER | E39: 7 | F39: 1 | H39: =SUM(D39:G39) -> 8 | I39: =IF(COUNTIF(D39:G39,">0")>=3,(SUM(LARGE(D39:G39,{1,2,3}))),"Not Qualified") -> Not Qualified
B40: 13 | C40: XAVIER CALDERON | D40: 7 | H40: =SUM(D40:G40) -> 7 | I40: =IF(COUNTIF(D40:G40,">0")>=3,(SUM(LARGE(D40:G40,{1,2,3}))),"Not Qualified") -> Not Qualified
B41: 14 | C41: TONY CESPEDES | E41: 1 | F41: 1 | H41: =SUM(D41:G41) -> 2 | I41: =IF(COUNTIF(D41:G41,">0")>=3,(SUM(LARGE(D41:G41,{1,2,3}))),"Not Qualified") -> Not Qualified
B42: 15 | C42: JARED LANTZY | F42: 2 | H42: =SUM(D42:G42) -> 2 | I42: =IF(COUNTIF(D42:G42,">0")>=3,(SUM(LARGE(D42:G42,{1,2,3}))),"Not Qualified") -> Not Qualified
B43: 16 | C43: SCOT MCALOON | D43: 1 | H43: =SUM(D43:G43) -> 1 | I43: =IF(COUNTIF(D43:G43,">0")>=3,(SUM(LARGE(D43:G43,{1,2,3}))),"Not Qualified") -> Not Qualified
B44: 17 | C44: ROBERT DRENNAN | D44: 1 | H44: =SUM(D44:G44) -> 1 | I44: =IF(COUNTIF(D44:G44,">0")>=3,(SUM(LARGE(D44:G44,{1,2,3}))),"Not Qualified") -> Not Qualified
B45: 18 | C45: NOAL YARNES | D45: 1 | H45: =SUM(D45:G45) -> 1 | I45: =IF(COUNTIF(D45:G45,">0")>=3,(SUM(LARGE(D45:G45,{1,2,3}))),"Not Qualified") -> Not Qualified
B46: 19 | C46: LAWRENCE CHAPPE | D46: 1 | H46: =SUM(D46:G46) -> 1 | I46: =IF(COUNTIF(D46:G46,">0")>=3,(SUM(LARGE(D46:G46,{1,2,3}))),"Not Qualified") -> Not Qualified
B47: 20 | C47: JUSTIN MCKENNA | E47: 1 | H47: =SUM(D47:G47) -> 1 | I47: =IF(COUNTIF(D47:G47,">0")>=3,(SUM(LARGE(D47:G47,{1,2,3}))),"Not Qualified") -> Not Qualified
B48: 21 | C48: JACK DAWSON | D48: 1 | H48: =SUM(D48:G48) -> 1 | I48: =IF(COUNTIF(D48:G48,">0")>=3,(SUM(LARGE(D48:G48,{1,2,3}))),"Not Qualified") -> Not Qualified
B49: 22 | C49: CLAY JOHNSON | D49: 1 | H49: =SUM(D49:G49) -> 1 | I49: =IF(COUNTIF(D49:G49,">0")>=3,(SUM(LARGE(D49:G49,{1,2,3}))),"Not Qualified") -> Not Qualified
B50: 23 | C50: CHRISTOPHER SAMULSKI | D50: 1 | H50: =SUM(D50:G50) -> 1 | I50: =IF(COUNTIF(D50:G50,">0")>=3,(SUM(LARGE(D50:G50,{1,2,3}))),"Not Qualified") -> Not Qualified
B51: 24 | C51: BRUCE AUSINK | E51: 1 | H51: =SUM(D51:G51) -> 1 | I51: =IF(COUNTIF(D51:G51,">0")>=3,(SUM(LARGE(D51:G51,{1,2,3}))),"Not Qualified") -> Not Qualified
B52: 25 | C52: WAYNE LEWIS | G52: 1 | I52: =IF(COUNTIF(D52:G52,">0")>=3,(SUM(LARGE(D52:G52,{1,2,3}))),"Not Qualified") -> Not Qualified
B53: 26 | C53: MICHAEL HARRIS | G53: 2 | I53: =IF(COUNTIF(D53:G53,">0")>=3,(SUM(LARGE(D53:G53,{1,2,3}))),"Not Qualified") -> Not Qualified
B54: 27 | C54: JOSH CANADA | G54: 1 | I54: =IF(COUNTIF(D54:G54,">0")>=3,(SUM(LARGE(D54:G54,{1,2,3}))),"Not Qualified") -> Not Qualified
B55: 28 | C55: JIM HARRIS | G55: 1 | I55: =IF(COUNTIF(D55:G55,">0")>=3,(SUM(LARGE(D55:G55,{1,2,3}))),"Not Qualified") -> Not Qualified
B56: 29 | C56: JAMES LIVARA | G56: 1 | I56: =IF(COUNTIF(D56:G56,">0")>=3,(SUM(LARGE(D56:G56,{1,2,3}))),"Not Qualified") -> Not Qualified
B57: 30 | C57: CAMERON MCCORMICK | G57: 9 | I57: =IF(COUNTIF(D57:G57,">0")>=3,(SUM(LARGE(D57:G57,{1,2,3}))),"Not Qualified") -> Not Qualified
A60: STS
B61: 1 | C61: COREY MAPLES | D61: 12 | E61: 9 | F61: 12 | G61: 9 | H61: =SUM(D61:G61) -> 42 | I61: =IF(COUNTIF(D61:G61,">0")>=3,(SUM(LARGE(D61:G61,{1,2,3}))),"Not Qualified") -> 33
B62: 2 | C62: JOHN CROWDER | D62: 9 | E62: 12 | F62: 9 | G62: 7 | H62: =SUM(D62:G62) -> 37 | I62: =IF(COUNTIF(D62:G62,">0")>=3,(SUM(LARGE(D62:G62,{1,2,3}))),"Not Qualified") -> 30
B63: 3 | C63: KEITH MAPLES | D63: 2 | E63: 4 | F63: 6 | G63: 12 | H63: =SUM(D63:G63) -> 24 | I63: =IF(COUNTIF(D63:G63,">0")>=3,(SUM(LARGE(D63:G63,{1,2,3}))),"Not Qualified") -> 22
B64: 4 | C64: CARL JUNEAU | D64: 7 | F64: 7 | G64: 6 | H64: =SUM(D64:G64) -> 20 | I64: =IF(COUNTIF(D64:G64,">0")>=3,(SUM(LARGE(D64:G64,{1,2,3}))),"Not Qualified") -> 20
B65: 5 | C65: KEITH KASMIRE | D65: 6 | E65: 2 | F65: 4 | G65: 4 | H65: =SUM(D65:G65) -> 16 | I65: =IF(COUNTIF(D65:G65,">0")>=3,(SUM(LARGE(D65:G65,{1,2,3}))),"Not Qualified") -> 14
B66: 6 | C66: ADAM ROSEN | D66: 3 | E66: 7 | G66: 3 | H66: =SUM(D66:G66) -> 13 | I66: =IF(COUNTIF(D66:G66,">0")>=3,(SUM(LARGE(D66:G66,{1,2,3}))),"Not Qualified") -> 13
B67: 7 | C67: JASPER DE GUZMAN | D67: 1 | E67: 1 | F67: 3 | H67: =SUM(D67:G67) -> 5 | I67: =IF(COUNTIF(D67:G67,">0")>=3,(SUM(LARGE(D67:G67,{1,2,3}))),"Not Qualified") -> 5
B68: 8 | C68: BRAD POCOCK | E68: 6 | H68: =SUM(D68:G68) -> 6 | I68: =IF(COUNTIF(D68:G68,">0")>=3,(SUM(LARGE(D68:G68,{1,2,3}))),"Not Qualified") -> Not Qualified
B69: 9 | C69: MATTHEW KNIPPLE | D69: 5 | H69: =SUM(D69:G69) -> 5 | I69: =IF(COUNTIF(D69:G69,">0")>=3,(SUM(LARGE(D69:G69,{1,2,3}))),"Not Qualified") -> Not Qualified
B70: 10 | C70: CESAR DEL GADIO | E70: 5 | H70: =SUM(D70:G70) -> 5 | I70: =IF(COUNTIF(D70:G70,">0")>=3,(SUM(LARGE(D70:G70,{1,2,3}))),"Not Qualified") -> Not Qualified
B71: 11 | C71: WILL LANGDON | G71: 5 | H71: =SUM(D71:G71) -> 5 | I71: =IF(COUNTIF(D71:G71,">0")>=3,(SUM(LARGE(D71:G71,{1,2,3}))),"Not Qualified") -> Not Qualified
B72: 12 | C72: JASON HUNT | D72: 4 | H72: =SUM(D72:G72) -> 4 | I72: =IF(COUNTIF(D72:G72,">0")>=3,(SUM(LARGE(D72:G72,{1,2,3}))),"Not Qualified") -> Not Qualified
B73: 13 | C73: CODY SMITH | E73: 3 | H73: =SUM(D73:G73) -> 3 | I73: =IF(COUNTIF(D73:G73,">0")>=3,(SUM(LARGE(D73:G73,{1,2,3}))),"Not Qualified") -> Not Qualified
A75: STS2
B76: 1 | C76: JIM HARRIS | D76: 12 | H76: =SUM(D76:G76) -> 12 | I76: =IF(COUNTIF(D76:G76,">0")>=3,(SUM(LARGE(D76:G76,{1,2,3}))),"Not Qualified") -> Not Qualified
B77: 2 | C77: WAYNE LEWIS | F77: 12 | H77: =SUM(D77:G77) -> 12 | I77: =IF(COUNTIF(D77:G77,">0")>=3,(SUM(LARGE(D77:G77,{1,2,3}))),"Not Qualified") -> Not Qualified
B78: 3 | C78: PHILLIP AQUINO | G78: 12 | H78: =SUM(D78:G78) -> 12 | I78: =IF(COUNTIF(D78:G78,">0")>=3,(SUM(LARGE(D78:G78,{1,2,3}))),"Not Qualified") -> Not Qualified
B79: 4 | C79: BILL EAKER | D79: 9 | H79: =SUM(D79:G79) -> 9 | I79: =IF(COUNTIF(D79:G79,">0")>=3,(SUM(LARGE(D79:G79,{1,2,3}))),"Not Qualified") -> Not Qualified
B80: 5 | C80: CALVIN SANDERS | F80: 9 | H80: =SUM(D80:G80) -> 9 | I80: =IF(COUNTIF(D80:G80,">0")>=3,(SUM(LARGE(D80:G80,{1,2,3}))),"Not Qualified") -> Not Qualified
B81: 6 | C81: RYAN CANDARI | G81: 9 | H81: =SUM(D81:G81) -> 9 | I81: =IF(COUNTIF(D81:G81,">0")>=3,(SUM(LARGE(D81:G81,{1,2,3}))),"Not Qualified") -> Not Qualified
A83: STX
B84: 1 | C84: DOUG KIELER | E84: 12 | F84: 12 | G84: 12 | H84: =SUM(D84:G84) -> 36 | I84: =IF(COUNTIF(D84:G84,">0")>=3,(SUM(LARGE(D84:G84,{1,2,3}))),"Not Qualified") -> 36
B85: 2 | C85: MICHAEL SCHNEKSER | E85: 9 | F85: 9 | G85: 9 | H85: =SUM(D85:G85) -> 27 | I85: =IF(COUNTIF(D85:G85,">0")>=3,(SUM(LARGE(D85:G85,{1,2,3}))),"Not Qualified") -> 27
B86: 3 | C86: CRAIG KIMBERLY | D86: 7 | E86: 7 | F86: 7 | H86: =SUM(D86:G86) -> 21 | I86: =IF(COUNTIF(D86:G86,">0")>=3,(SUM(LARGE(D86:G86,{1,2,3}))),"Not Qualified") -> 21
B87: 4 | C87: MARK WOOD | D87: 12 | G87: 7 | H87: =SUM(D87:G87) -> 19 | I87: =IF(COUNTIF(D87:G87,">0")>=3,(SUM(LARGE(D87:G87,{1,2,3}))),"Not Qualified") -> Not Qualified
B88: 5 | C88: EMRYS SCOTT-MURRELL | E88: 6 | F88: 6 | H88: =SUM(D88:G88) -> 12 | I88: =IF(COUNTIF(D88:G88,">0")>=3,(SUM(LARGE(D88:G88,{1,2,3}))),"Not Qualified") -> Not Qualified
B89: 6 | C89: TARIQ KHAN | D89: 9 | H89: =SUM(D89:G89) -> 9 | I89: =IF(COUNTIF(D89:G89,">0")>=3,(SUM(LARGE(D89:G89,{1,2,3}))),"Not Qualified") -> Not Qualified
A91: STU
B92: 1 | C92: STEVEN TERONDE | E92: 12 | H92: =SUM(D92:G92) -> 12 | I92: =IF(COUNTIF(D92:G92,">0")>=3,(SUM(LARGE(D92:G92,{1,2,3}))),"Not Qualified") -> Not Qualified