D1: EVENT
A2: CLASS | B2: POS | C2: DRIVER | D2: Joy Fund | E2: Winter 2 | F2: Winter 3 | G2: Winter 4 | H2: TOTAL | I2: Best 3 of 4
A4: SS
B5: 1 | C5: GIL SMITH | D5: 12 | H5: =SUM(D5:G5) -> 12 | I5: =IF(COUNTIF(D5:G5,">0")>=3,(SUM(LARGE(D5:G5,{1,2,3}))),"Not Qualified") -> Not Qualified
A7: AS
C8: NO ENTRIES
A10: BS
B11: 1 | C11: MARC LISNER | E11: 9 | F11: 12 | G11: 9 | H11: =SUM(D11:G11) -> 30 | I11: =IF(COUNTIF(D11:G11,">0")>=3,(SUM(LARGE(D11:G11,{1,2,3}))),"Not Qualified") -> 30
B12: 2 | C12: JASON LISNER | E12: 12 | G12: 12 | H12: =SUM(D12:G12) -> 24 | I12: =IF(COUNTIF(D12:G12,">0")>=3,(SUM(LARGE(D12:G12,{1,2,3}))),"Not Qualified") -> Not Qualified
B13: 3 | C13: BRENDON HINES | F13: 9 | H13: =SUM(D13:G13) -> 9 | I13: =IF(COUNTIF(D13:G13,">0")>=3,(SUM(LARGE(D13:G13,{1,2,3}))),"Not Qualified") -> Not Qualified
I14: =IF(COUNTIF(D14:G14,">0")>=3,(SUM(LARGE(D14:G14,{1,2,3}))),"Not Qualified") -> Not Qualified
A15: CS | I15: =IF(COUNTIF(D15:G15,">0")>=3,(SUM(LARGE(D15:G15,{1,2,3}))),"Not Qualified") -> Not Qualified
B16: 1 | C16: LES BANYAS | D16: 12 | H16: =SUM(D16:G16) -> 12 | I16: =IF(COUNTIF(D16:G16,">0")>=3,(SUM(LARGE(D16:G16,{1,2,3}))),"Not Qualified") -> Not Qualified
B17: 2 | C17: FRANK INSLEY | G17: 12 | H17: =SUM(D17:G17) -> 12 | I17: =IF(COUNTIF(D17:G17,">0")>=3,(SUM(LARGE(D17:G17,{1,2,3}))),"Not Qualified") -> Not Qualified
A19: DS
B20: 1 | C20: WES MICHAELS | D20: 12 | E20: 12 | F20: 12 | G20: 12 | H20: =SUM(D20:G20) -> 48 | I20: =IF(COUNTIF(D20:G20,">0")>=3,(SUM(LARGE(D20:G20,{1,2,3}))),"Not Qualified") -> 36
B21: 2 | C21: MICHAEL GAINTNER | D21: 9 | H21: =SUM(D21:G21) -> 9 | I21: =IF(COUNTIF(D21:G21,">0")>=3,(SUM(LARGE(D21:G21,{1,2,3}))),"Not Qualified") -> Not Qualified
B22: 3 | C22: RYAN MCGOVERN | G22: 9 | H22: =SUM(D22:G22) -> 9 | I22: =IF(COUNTIF(D22:G22,">0")>=3,(SUM(LARGE(D22:G22,{1,2,3}))),"Not Qualified") -> Not Qualified
A24: ES
B25: 1 | C25: ROBB DAVIS | D25: 12 | E25: 12 | F25: 12 | G25: 12 | H25: =SUM(D25:G25) -> 48 | I25: =IF(COUNTIF(D25:G25,">0")>=3,(SUM(LARGE(D25:G25,{1,2,3}))),"Not Qualified") -> 36
B26: 2 | C26: FRANK INSLEY | D26: 9 | H26: =SUM(D26:G26) -> 9 | I26: =IF(COUNTIF(D26:G26,">0")>=3,(SUM(LARGE(D26:G26,{1,2,3}))),"Not Qualified") -> Not Qualified
A28: FS
B29: 1 | C29: RICK MARIANI | E29: 12 | F29: 12 | G29: 12 | H29: =SUM(D29:G29) -> 36 | I29: =IF(COUNTIF(D29:G29,">0")>=3,(SUM(LARGE(D29:G29,{1,2,3}))),"Not Qualified") -> 36
B30: 2 | C30: BRANDON HEY | D30: 12 | H30: =SUM(D30:G30) -> 12 | I30: =IF(COUNTIF(D30:G30,">0")>=3,(SUM(LARGE(D30:G30,{1,2,3}))),"Not Qualified") -> Not Qualified
B31: 3 | C31: RICK MARIANI | G31: 12 | H31: =SUM(D31:G31) -> 12 | I31: =IF(COUNTIF(D31:G31,">0")>=3,(SUM(LARGE(D31:G31,{1,2,3}))),"Not Qualified") -> Not Qualified
B32: 4 | C32: TODD HOWES | F32: 9 | H32: =SUM(D32:G32) -> 9 | I32: =IF(COUNTIF(D32:G32,">0")>=3,(SUM(LARGE(D32:G32,{1,2,3}))),"Not Qualified") -> Not Qualified
B33: 5 | C33: BILL EAKER | G33: 9 | H33: =SUM(D33:G33) -> 9 | I33: =IF(COUNTIF(D33:G33,">0")>=3,(SUM(LARGE(D33:G33,{1,2,3}))),"Not Qualified") -> Not Qualified
B34: 6 | C34: KEVIN REAGAN | G34: 7 | H34: =SUM(D34:G34) -> 7 | I34: =IF(COUNTIF(D34:G34,">0")>=3,(SUM(LARGE(D34:G34,{1,2,3}))),"Not Qualified") -> Not Qualified
A36: GS
B37: 1 | C37: JIM HERLEY | D37: 12 | E37: 12 | F37: 9 | G37: 9 | H37: =SUM(D37:G37) -> 42 | I37: =IF(COUNTIF(D37:G37,">0")>=3,(SUM(LARGE(D37:G37,{1,2,3}))),"Not Qualified") -> 33
B38: 2 | C38: WIL LANGDON | F38: 12 | H38: =SUM(D38:G38) -> 12 | I38: =IF(COUNTIF(D38:G38,">0")>=3,(SUM(LARGE(D38:G38,{1,2,3}))),"Not Qualified") -> Not Qualified
B39: 3 | C39: MARK RHOADES | G39: 12 | H39: =SUM(D39:G39) -> 12 | I39: =IF(COUNTIF(D39:G39,">0")>=3,(SUM(LARGE(D39:G39,{1,2,3}))),"Not Qualified") -> Not Qualified
B40: 4 | C40: JAVIER ROSA | D40: 9 | H40: =SUM(D40:G40) -> 9 | I40: =IF(COUNTIF(D40:G40,">0")>=3,(SUM(LARGE(D40:G40,{1,2,3}))),"Not Qualified") -> Not Qualified
B41: 5 | C41: ROBERT RUSSEL | E41: 9 | H41: =SUM(D41:G41) -> 9 | I41: =IF(COUNTIF(D41:G41,">0")>=3,(SUM(LARGE(D41:G41,{1,2,3}))),"Not Qualified") -> Not Qualified
B42: 6 | C42: PETER KEILER | E42: 7 | H42: =SUM(D42:G42) -> 7 | I42: =IF(COUNTIF(D42:G42,">0")>=3,(SUM(LARGE(D42:G42,{1,2,3}))),"Not Qualified") -> Not Qualified
B43: 7 | C43: DAVID COOK | G43: 7 | H43: =SUM(D43:G43) -> 7 | I43: =IF(COUNTIF(D43:G43,">0")>=3,(SUM(LARGE(D43:G43,{1,2,3}))),"Not Qualified") -> Not Qualified
B44: 8 | C44: MARK HUSBAND | G44: 6 | H44: =SUM(D44:G44) -> 6 | I44: =IF(COUNTIF(D44:G44,">0")>=3,(SUM(LARGE(D44:G44,{1,2,3}))),"Not Qualified") -> Not Qualified
A46: HS
B47: 1 | C47: STEVE SHELL | F47: 12 | G47: 12 | H47: =SUM(D47:G47) -> 24 | I47: =IF(COUNTIF(D47:G47,">0")>=3,(SUM(LARGE(D47:G47,{1,2,3}))),"Not Qualified") -> Not Qualified
B48: 2 | C48: DAVID CORDER | F48: 9 | G48: 9 | H48: =SUM(D48:G48) -> 18 | I48: =IF(COUNTIF(D48:G48,">0")>=3,(SUM(LARGE(D48:G48,{1,2,3}))),"Not Qualified") -> Not Qualified
B49: 3 | C49: BOB BROCHU | D49: 12 | H49: =SUM(D49:G49) -> 12 | I49: =IF(COUNTIF(D49:G49,">0")>=3,(SUM(LARGE(D49:G49,{1,2,3}))),"Not Qualified") -> Not Qualified
A51: LAD
B52: 1 | C52: MERRIE MALPASS | D52: 5 | E52: 12 | F52: 12 | G52: 12 | H52: =SUM(D52:G52) -> 41 | I52: =IF(COUNTIF(D52:G52,">0")>=3,(SUM(LARGE(D52:G52,{1,2,3}))),"Not Qualified") -> 36
B53: 2 | C53: LELANE ARNESON | D53: 6 | E53: 9 | F53: 9 | G53: 9 | H53: =SUM(D53:G53) -> 33 | I53: =IF(COUNTIF(D53:G53,">0")>=3,(SUM(LARGE(D53:G53,{1,2,3}))),"Not Qualified") -> 27
B54: 3 | C54: CANDACE CROWDER | D54: 3 | E54: 7 | F54: 7 | G54: 5 | H54: =SUM(D54:G54) -> 22 | I54: =IF(COUNTIF(D54:G54,">0")>=3,(SUM(LARGE(D54:G54,{1,2,3}))),"Not Qualified") -> 19
B55: 4 | C55: SHANNON HALTOM | E55: 5 | F55: 6 | G55: 4 | H55: =SUM(D55:G55) -> 15 | I55: =IF(COUNTIF(D55:G55,">0")>=3,(SUM(LARGE(D55:G55,{1,2,3}))),"Not Qualified") -> 15
B56: 5 | C56: BARBARA ROBINSON | D56: 4 | E56: 6 | F56: 4 | G56: 3 | H56: =SUM(D56:G56) -> 17 | I56: =IF(COUNTIF(D56:G56,">0")>=3,(SUM(LARGE(D56:G56,{1,2,3}))),"Not Qualified") -> 14
B57: 6 | C57: BECKY WINNER | E57: 3 | F57: 5 | G57: 6 | H57: =SUM(D57:G57) -> 14 | I57: =IF(COUNTIF(D57:G57,">0")>=3,(SUM(LARGE(D57:G57,{1,2,3}))),"Not Qualified") -> 14
B58: 7 | C58: MARIBETH CUPPS | D58: 9 | G58: 7 | H58: =SUM(D58:G58) -> 16 | I58: =IF(COUNTIF(D58:G58,">0")>=3,(SUM(LARGE(D58:G58,{1,2,3}))),"Not Qualified") -> Not Qualified
B59: 8 | C59: AMANDA GREG | D59: 12 | H59: =SUM(D59:G59) -> 12 | I59: =IF(COUNTIF(D59:G59,">0")>=3,(SUM(LARGE(D59:G59,{1,2,3}))),"Not Qualified") -> Not Qualified
B60: 9 | C60: KAREN ANDRIOLA | D60: 7 | H60: =SUM(D60:G60) -> 7 | I60: =IF(COUNTIF(D60:G60,">0")>=3,(SUM(LARGE(D60:G60,{1,2,3}))),"Not Qualified") -> Not Qualified
B61: 10 | C61: SHARON ROSSI | F61: 3 | G61: 2 | H61: =SUM(D61:G61) -> 5 | I61: =IF(COUNTIF(D61:G61,">0")>=3,(SUM(LARGE(D61:G61,{1,2,3}))),"Not Qualified") -> Not Qualified
B62: 11 | C62: JULIA TYE | E62: 4 | G62: 1 | H62: =SUM(D62:G62) -> 5 | I62: =IF(COUNTIF(D62:G62,">0")>=3,(SUM(LARGE(D62:G62,{1,2,3}))),"Not Qualified") -> Not Qualified
B63: 12 | C63: SHERRI STRIFLER | D63: 2 | H63: =SUM(D63:G63) -> 2 | I63: =IF(COUNTIF(D63:G63,">0")>=3,(SUM(LARGE(D63:G63,{1,2,3}))),"Not Qualified") -> Not Qualified